Id,Title,Description,Contributor,Mentor,Organization,Archive,Github
1, GRASS GIS module for Sentinel-2 cloud and shadow detection ,"Optical sensors are unable to penetrate clouds leading to related incorrect reflectance values. Unlike
Landsat images, Sentinel 2 datasets do not...", Roberta Fagandini ," Mentor  Roberto Marzocchi, Moritz Lennert ", Organization  OSGeo ,/archive/2018/projects/6151540461010944,https://lists.osgeo.org/pipermail/soc/2018-August/004177.html
2, OAuth Module Enhancements and SMART Apps Support ,"Enhance the OAuth2 module by migrating to annotation-based configuration, integrating the EHR launch flow for SMART applications, add support for...", Prabodh Kotasthane ," Mentor  Harsha Kumara, Sanatt Abrol ", Organization  OpenMRS ,/archive/2018/projects/6157606162792448,https://pkatgithub.github.io/GSoC-2018-Final-Evaluations/
3, Design network agnostic communication protocol ,My goal is to design a new protocol for qaul.net. The current protocol is very heavily coupled to olsr which is used for all networking tasks. To..., Katharina Sabel , Mentor  Math Jud , Organization  freifunk ,/archive/2018/projects/6160409165824000,https://blog.freifunk.net/2018/08/13/gsoc-2018-qaul-net-changes-and-experiences-final-report/
4, Proposal-Draft: Calendar Visualization and Filtering ,"Kibana Visualize app needs a new calendar visualization similar to Kibana heatmap, which provides single-day or multi-day events markings in varying...", Aaron Zhao ," Mentor  Daniel Schneiter, Tim Roes, Thomas Neirynck ", Organization  Elastic ,/archive/2018/projects/6162528463749120,https://github.com/aaronoah/kibana_calendar_vis
5, Convert interactive rebase to C ,"git is a modular source control management software, and all of its subcommands are programs on their own. A lot of them are written in C, but a...", Alban Gruin ," Mentor  Stefan Beller, Christian Couder ", Organization  Git ,/archive/2018/projects/6165469845258240,https://github.com/agrn/gsoc2018
6, Proposal to implement Bayesian Covariance Estimation for Kalman Filter based Digital Carrier Synchronization in GNSS-SDR ,"This document, submitted to the GNSS-SDR open-source software defined radio project as part of the 2018 Google Summer of Code (GSoC) program,...", Gerald LaMountain ," Mentor  Carles Fernandez-Prades, Jordi Vilà-Valls ", Organization  GNSS-SDR ,/archive/2018/projects/6167449959399424,http://geraldlamountain.com/gsoc2018/
7, Markov Logic Networks in Python: PracMLN ,"Markov Logic Networks (MLNs) are a generalisation of first-order logic and probabilistic graphical models, thus forming a powerful mechanism of...", Kaivalya Rawal , Mentor  Daniel Nyga , Organization  Institute for Artificial Intelligence ,/archive/2018/projects/6173228569460736,https://kaivalyar.github.io/gsoc18-pracmln/posts/final-gsoc-report/
8, Introducing modern JS features and tools ,"The javascript code is written in ES5 exposing many of the variables and functions globally and the package manager is not used for the modules.
So I...", Piyush Vijay ," Mentor  Maurício Meneghini Fauth, Deven Bansod ", Organization  phpMyAdmin ,/archive/2018/projects/6176165119131648,https://medium.com/@piyush3079/gsoc-final-blog-for-code-submission-6ca7181f9d9e
9, Advance features in daru-view ,"Daru-view aims to create interactive plots and tables in Ruby using various adapters available like GoogleCharts, HighCharts, Nyaplot and DataTables....", Prakriti Gupta ," Mentor  Shekhar Prasad Rajak, Athitya Kumar ", Organization  Ruby Science Foundation ,/archive/2018/projects/6176799834767360,https://32teethglitter.wordpress.com/2018/08/07/work-product-gsoc-2018/
10, TSCN exporter for Blender ,Currently dedicated asset formats (such as collada  and glTF) is used as an exchange to import 3D asset from modeling software into Godot engine...., Jiacheng Lu ," Mentor  Juan Linietsky, sdfgeoff ", Organization  Godot Engine ,/archive/2018/projects/6178246299222016,https://gist.github.com/Jason0214/4f2cb74f8659315bd254d94246958d28
11, API extensions and fixes for the p5 backend ,"Last year, as a project under the Google Summer of Code, I created
  p5 --- a native Python implementation of the Processing
  API. The goal then was...", Abhik Pal , Mentor  Manindra Moharana , Organization  The Processing Foundation ,/archive/2018/projects/6178505339437056,https://p5.readthedocs.io/en/latest/releasenotes/0.5.0.html
12, Improving p5.js WebGL/3D mode ,The project aims to implement missing primitives in p5.js WebGL mode., Adil Rabbani , Mentor  Stalgia Grigg , Organization  The Processing Foundation ,/archive/2018/projects/6179338831527936,https://adilrabbani.github.io/blogposts/SummerWithProcessing.html
13, Improvement and Extension of Data Transforms in Vega-Lite ,Implementation of some of the useful transforms from Vega currently not present in Vega-Lite, Souvik Sen , Mentor  Kanit Wongsuphasawat , Organization  The Vega Visualization Tools by the UW Interactive Data Lab ,/archive/2018/projects/6181132517244928,https://gist.github.com/invokesus/b8990be8c78a0c0d93b1e757edd3e198
14, Event Recording Feature ,"At present, Terasology has a very limited amount of types of automated
testing, which includes standard unit tests, environment-based tests and some...", Iaron da Costa Araújo ," Mentor  Cervator, Arav Singhal, Daniel H, Aresh Mishra ", Organization  MovingBlocks ,/archive/2018/projects/4962146240692224,https://iaronaraujo.wixsite.com/meusite/blog/google-summer-of-code-2018-final-report
15, Improve Test Coverage and Test Performance ,"This project focuses to improve yt's test framework. At present, yt's Python code coverage is only 25% (unit and answer testing) and the test runtime...", Abhishek  Singh ," Mentor  Kacper Kowalik, Nathan Goldbaum, Colin Marc ", Organization  NumFOCUS ,/archive/2018/projects/4966182234882048,https://gist.github.com/git-abhishek/3bcccb4de59afcf53f499785ffa981d5
16, Neural Networks for Similarity Learning ,"Reseachers and Industry experts alike turn to gensim for easy-to-pick up and production ready code. Recently, Deep Learning techniques have taken the...", Aneesh Yogesh Joshi ," Mentor  Mandar Deshpande-1, Ivan Menshikh ", Organization  NumFOCUS ,/archive/2018/projects/4967403280662528,https://github.com/aneesh-joshi/Similarity-Learning-Evaluation-Scripts
17, Adding Type Annotations to Ruby Syntax ,"I would like to add type annotations to Ruby, per the ideas list. These annotations will serve as documentation and hopefully a way to implement...", nicholaslyang , Mentor  Tony Arcieri , Organization  Ruby ,/archive/2018/projects/4968218317815808,https://github.com/ruby/ruby/compare/trunk...NicholasLYang:type-annotations
18, Modernizing the Java PathFinder Build Workflow: Migrating from Ant to Gradle ,"Developers often perform recurrent tasks during the development process such as testing, managing external libraries, generating API documentation,...", Jeanderson Candido ," Mentor  Willem Visser, Cyrille Artho ", Organization  The Java Pathfinder Team ,/archive/2018/projects/4968904304623616,https://github.com/javapathfinder/jpf-core/wiki/Gradle-Support-on-JPF
19, Makie.jl – GSoC 2018 Proposal ,"Makie.jl is a new plotting library for Julia, providing an interface for GLVisualize, with emphasis on interactivity and speed. The current...", Anthony Wang ," Mentor  Mike Innes, Simon Danisch, Christopher Rackauckas ", Organization  NumFOCUS ,/archive/2018/projects/4971135942787072,https://anthony-wang.github.io/gsoc_blog/gsoc/julia/makie/final/progress/report/2018/08/08/final-update.html
20, Implementing blackholing in Gatekeeper ,This project is mainly focused on implementing and testing the RHHH algorithm interfaced with Cold Filter that will be used to quickly and..., Prashant Kumar Prajapati , Mentor  Qiaobin Fu , Organization  Boston University / XIA ,/archive/2018/projects/4973616219291648,https://gist.github.com/gogapp/ccf6222acc9e154c095eee941cc6051a
21, Score Comparison Tool for MuseScore ,The main goal of the proposed project is creation of a tool integrated into MuseScore which will allow users to compare their scores to see..., Dmitri Ovodok ," Mentor  Peter Jonas (shoogle), Anatoly Osokin ", Organization  MuseScore ,/archive/2018/projects/4974437766004736,https://musescore.org/en/node/275235/
22, Transcript Comparisons ,"In Comparative Genomics we compare an unknown gene with some other known genes, for better inference of biological properties of that unknown gene....", Nabil Ibtehaz ," Mentor  Fergal Martin, Kostas Billis "," Organization  Genes, Genomes and Variation ",/archive/2018/projects/4976103340900352,https://github.com/EnsemblGSOC/nabil-gsoc-2018
23, Apply for the project of Ruby huge memory machine ,"Currently, several problems are known when Ruby program runs under a high memory workload, including slow rates for allocating memory and program...", Yimin Zhao , Mentor  Koichi Sasada , Organization  Ruby ,/archive/2018/projects/4981627071496192,https://github.com/Tacinight/ruby-gsoc-2018
24, Working Demo with Usage Docs for the Mex Module ,The aim of this project is to write a working Demo for the Matlab Mex modules present in Scilab. The Matlab MEX-Files is an API which is a wrapper on..., Siddhartha Gairola ," Mentor  Clément <davidcl> DAVID, Dhruv Khattar ", Organization  Scilab ,/archive/2018/projects/4984602812743680,https://wiki.scilab.org/Working%20Demo%20with%20Usage%20Docs%20for%20the%20Mex%20Module
25, Comments for Responses ,"The project enhances the current implementation of the comment feature.
Features to consider:

Ability for respondents to add comments for their own...", Nidhi Gupta ," Mentor  John Yong, Lu Lechuan ", Organization  TEAMMATES @ National University of Singapore ,/archive/2018/projects/4991899291090944,https://github.com/TEAMMATES/gsoc-2018/blob/master/Nidhi_Gupta/progress.md
26, FPGA-realtime focus peaking ,The proposal describes detail description for the design of real time focus peaking kernel in VHDL for FPGA. It covers all aspects of the image..., Rahul Vyas , Mentor  Bertl , Organization  Apertus Association ,/archive/2018/projects/4996254656364544,https://medium.com/@rahul.vinus/google-summer-of-code-2018-c65625c65f97
27, Setting up of Activity Server and WikiPort (Activity Migration) ,"Documentation tools have become modern, lighter, easier to use with the use of Sphinx, Github pages/wiki, Mkdocs and many more similar frameworks and...", vipulgupta2048 ," Mentor  Carlos Mauro Cardenas, Abdul ", Organization  Sugar Labs ,/archive/2018/projects/4997424095428608,https://github.com/vipulgupta2048/SugarPort
28, WebAssembly Studio ,The goal of this project is to significantly increase test coverage and test quality in the WebAssembly Studio project. This will make it easier to..., Olle Lauri Boström , Mentor  Yury Delendik , Organization  Mozilla ,/archive/2018/projects/4998480388947968,https://medium.com/@ollelauribostr/google-summer-of-code-2018-final-report-49c6dd512ac9
29, Speech-to-Text with Translation ,"Speech-to-Text with Translation

Extension for encapsulating the json-messages in a separate container in a message stanza
Abstract translation...", pvgupta24 ," Mentor  Nik Vaessen, Boris Grozev ", Organization  Jitsi ,/archive/2018/projects/5002587652751360,https://pvgupta24.github.io/2018/08/12/gsoc18-overview/
30, CarbonFootPrint-Mobile ,CarbonFootprint Mobile is currently a react native application based on famous browser extension carbonfootprint that raises environmental awareness..., prudhvi reddy ," Mentor  Anuj Gupta, Amit Kanwar, Bruno Woltzenlogel Paleo ", Organization  AOSSIE - Australian Open Source Software Innovation and Education ,/archive/2018/projects/5003402689904640,https://gitlab.com/aossie/CarbonFootprint-Mobile/blob/master/doc/GSoC/2018/PrudhviReddy.md
31, GSoC Proposal for Stardroid (Google Sky Maps) ,The aim of the project is to build the STARDROID Application from scratch; calibrating it properly to acquire the ability of working with different..., Raghav Puri ," Mentor  Amit Kanwar, Bruno Woltzenlogel Paleo, Chirag Arora ", Organization  AOSSIE - Australian Open Source Software Innovation and Education ,/archive/2018/projects/5005937190371328,https://gist.github.com/raghavpuri31/c6f4367b80aed355d054c0282fbc764f
32, Convert all PCI drivers attachments to be table driven and mark with PNP_INFO ,This project is being undertaken under the mentorship of FreeBSD organization. The goal of the project is to convert all the PCI drivers attachments..., Lakhan Kamireddy ," Mentor  Chuck Tuffli, Warner Losh ", Organization  FreeBSD ,/archive/2018/projects/5006254145536000,https://wiki.freebsd.org/SummerOfCode2018Projects/ConvertPCIdriverAttachmentsToTables
33, Neovim .NET API Client and Visual Studio Extension ,The Neovim text editor offers a comprehensive API that allows its functionality to be extended by plugins and integrated into other applications. The..., Brock Mammen , Mentor  justinmk , Organization  Neovim ,/archive/2018/projects/5007950254964736,https://github.com/neovim/neovim/issues/8337#issuecomment-412862089
34, Interrupt-based drivers in Céu-Arduino for microcontrollers ,"The project consists of developing new interrupt-based drivers for microcontrollers, e.g.:
ADC
SPI and I2C buses
EEPROM
Real-time clock
Some...", M Naveen Kumar , Mentor  Francisco Sant'Anna , Organization  LabLua ,/archive/2018/projects/5008401494966272,https://github.com/mnaveenkumar2009/GSoC-2018
35, Extend Visualization - Focus in UI ,DIPY aims at building scifi-like 3D and 2D user interfaces. Dipy.viz provides many visualization capabilities. The goal of the project is to improve..., Karandeep Singh Juneja ," Mentor  David Reagan, Ranv33r ", Organization  Python Software Foundation ,/archive/2018/projects/5008588057608192,https://blogs.python-gsoc.org/karandeep-singh-juneja/2018/08/13/summary-and-final-submission/
36, EusLisp more Common ,Adding Common Lisp functionalities to EusLisp and improving existing ones, Éricles Lima , Mentor  Yuki Furuta , Organization  JSK Robotics Laboratory / The University of Tokyo ,/archive/2018/projects/5009622138093568,https://ericlesaquiles.github.io/euslisp/2018/08/12/End-of-GSoC-Project.html
37, Implementation of AccECN and ECN++ in ns-3 ,Reducing Internet Transport Latency is an interesting research topic and has gained significant attention in the recent past. Some of the promising..., WenYing Dai ," Mentor  Mohit P. Tahiliani, Dizhi Zhou ", Organization  The ns-3 Network Simulator Project ,/archive/2018/projects/5009854200545280,https://ecnpp-accecn-gsoc-2018.github.io/
38, Hi Haddock ,"A long-standing issue with Haskell’s documentation tool Haddock is
that it needs to effectively re-perform a large part of the...", Simon Jakobi ," Mentor  Herbert Valerio Riedel, Alex Biehl ", Organization  Haskell.org ,/archive/2018/projects/5011474275631104,https://sjakobi.github.io/blog/2018/08/14/hi-haddock-3/
39, Click To Dial Popup Window for the Linux Desktop ,"Application pops up when a user clicks on a tel: link in an application such as Firefox, Chrome, Evolution. Pop-up window displays the phone number...", Sanjay Prajapat ," Mentor  Thomas Levine, Keith Larrimore ", Organization  Debian Project ,/archive/2018/projects/5011661106708480,https://salsa.debian.org/snippets/122
40, Improve Fedora Android App - UI/UX Research and Design ,Revamp the interface design according to the community standards and craft a better user experience for the Fedora Community application., Abhishek Sharma , Mentor  Kanika Murarka , Organization  Fedora Project ,/archive/2018/projects/5013336076845056,https://communityblog.fedoraproject.org/final-gsoc-report-fedora-app-abhishek-sharma/
41, Integrate NextCloud for Apache Airavata's Data Transfer Use Cases ,The goal of this project is to design and implement a Nextcloud module and replace the existing transfer of the files from the client applications..., Karan Kotabagi ," Mentor  Suresh Marru, Sachin Kariyattin ", Organization  Apache Software Foundation ,/archive/2018/projects/5025640554168320,https://github.com/karankotz/Apache-airavata-nextcloud-/wiki
42, Modern Speak and Spell using PocketBeagle ,"This project is basically to rebrain the previous Speak and Spell by Texas Instruments, and generate open source code for it . This is a Linux...", Anirban Banik ," Mentor  welsh, ZeekHuge, Hunyue Yau, Anuj Deshpande, Andrew Henderson ", Organization  BeagleBoard.org Foundation ,/archive/2018/projects/5031706255949824,https://github.com/AnirbanBanik1998/Modern_Speak_and_Spell/wiki
43, Improving the GHC code generator ,This project attempts to improve the native code generator of GHC by adding support for Intel AVX and SSE SIMD instructions. This support would..., Abhiroop Sarkar ," Mentor  carter schonwald, Ben Gamari ", Organization  Haskell.org ,/archive/2018/projects/5034051576528896,https://gist.github.com/Abhiroop/9a2600f24f8139b7fc0742a2b4585bb3
44, GatsbyJS Integration with Plone ,Gatsby is a blazing fast static site generator for React. The idea is to develop a gatsby-source plugin that pulls the whole content tree from the..., Ajay NS ," Mentor  Timo Stollenwerk, Paul Roeland, Andrea Cecchi, Asko Soukka ", Organization  Plone ,/archive/2018/projects/5034509258981376,https://gist.github.com/ajayns/ab620303bd605e89579b548aac858f19
45, Static code analysis in Kodi's addon-check tool ,One of the major features of Kodi is that it is very extensible. Anyone can create a new addon adding/modifying any functionality that they want. The..., Mehtab Zafar , Mentor  Kolja Lampe , Organization  XBMC Foundation ,/archive/2018/projects/5036628556906496,https://docs.google.com/document/d/1rLDqPOeHQEg0D-gaVsHUTJIQq20QTLyGGDuaL3qgUnQ/edit?usp=sharing
46, Google Assistant Action for CarbonFootPrint ,Google Assistant Action for the Project CarbonFootPrint opens doors to conversational access to the rich emission data provisioned by this project...., Varun Chitre ," Mentor  Vaibhav Sharma, Bruno Woltzenlogel Paleo, Chirag Arora ", Organization  AOSSIE - Australian Open Source Software Innovation and Education ,/archive/2018/projects/5039569938415616,https://medium.com/@varun.chitre15/gsoc-2018-google-assistant-action-for-carbonfootprint-with-aossie-fce5d109ecc7
47, Develop a Transaction-Level Verilog Component Library ,"Transaction-Level Verilog (TL-Verilog) is an emerging language extension to System Verilog, Has the ability to define flexible reusable components. ...", Ahmed Salman ," Mentor  Stefan Wallentowitz, Steven Hoover ", Organization  Free and Open Source Silicon Foundation ,/archive/2018/projects/5041550052556800,https://eahmedsalman.github.io/GSOC.html
48, DRAKVUF - Stealthiness Improvement ,DRAKVUF (https://drakvuf.com) is an agent-less and virtualization based black-box binary analysis system. It allows users to analyze any binaries and..., Stewart Sentanoe ," Mentor  Tamas K Lengyel, vpb ", Organization  The Honeynet Project ,/archive/2018/projects/5050265212289024,https://ssentanoe.blogspot.com/2018/06/humble-experience-of-gsoc-2018.html
49, p5.js : Improvements for I/O methods ,"p5.js has multiple methods for I/O handling. I propose to work on Improving the file I/O methods by identifying, documenting and finding solutions...", Tanvi Kumar , Mentor  Alice Chung , Organization  The Processing Foundation ,/archive/2018/projects/5050899927924736,https://github.com/processing/p5.js/blob/master/developer_docs/project_wrapups/tanvi_gsoc_2018.md
50, Easy BIDS: Starter Kit for Brain Imaging Data Structure ,Neuroimaging scans can be costly in both time and money to acquire. This creates a barrier for many underfunded researchers without access to the..., Patrick Park , Mentor  Kirstie Whitaker , Organization  INCF ,/archive/2018/projects/5052346392379392,https://github.com/INCF/BIDS-Starter-Kit/blob/0c941110ddee3c9912079e68694698a4a03c0b48/reports/Google-2018-report.md
