pr_id,pr_title,pr_body,is_merged,pr_number,pr_url,pr_html_url,pr_state,additions,deletions,pr_changed_files,pr_commits_count,pr_comments_count,pr_review_comments_count,pr_labels_count,pr_assignees_count,pr_labels,pr_created_at,pr_closed_at,time_taken,time_delta,pr_review_comments,pr_commits,contributor,contributor_id,contributor_email,contributor_type,contributions,contributor_public_repos,contributor_private_repos,contributor_followings,contributor_followers
418941680,sse4.2: added the implementation for mm_cmpestra,"sse4.2: added the implementation for mm_cmpestra

I have created this PR from a new branch as old branch's commit history became very messy.
The implementation is same as old branch.
I am trying to add tests in such a way that each block(case) of code is tested for 2 different values of imm8 and also for both size=8 and size=16 variants.
So for cmpestra there would be 14 cases as written in a comment in the tests file.
I have named the test cases functions to indicate which block of code they would be surely testing.
I have only implemented 4/14 for now, I will implement the rest after getting feedback.
I can also merge different cases in one big test function but I think it looks cleaner this way, if anything needs to be changed please inform me.
Thank You
PS: I am using generator code :)",False,295,https://api.github.com/repos/simd-everywhere/simde/pulls/295,https://github.com/simd-everywhere/simde/pull/295,open,268,0,2,2,22,10,0,0,[],2020-05-16 09:30:38+00:00,,0.0,,"[{'comment_id': 426149276, 'comment_body': 'Either the native aliases script needs to not match on trailing `[A-Za-z0-9_]` or this function could be renamed `simde_x_mm_cmpestra_8_` to avoid the issue', 'comment_created': datetime.datetime(2020, 5, 16, 12, 27, 2, tzinfo=datetime.timezone.utc), 'commenter': 'mr-c', 'type': 'User'}, {'comment_id': 426172905, 'comment_body': ""The former I think.  I'll take a look at the native aliases renamer.\r\n\r\nMeanwhile, I think a better solution would be to use `simde_mm_cmpestra()` in the tests; it's the public API we're interested in testing anyways.  They can still be in test separate functions, _mm_cmpestra will delegate to the right function based on imm8.\r\n\r\nThe trailing _ indicates that it's a private API; _x is for public SIMDe extensions, so I think the name should stay."", 'comment_created': datetime.datetime(2020, 5, 16, 17, 23, 34, tzinfo=datetime.timezone.utc), 'commenter': 'nemequ', 'type': 'User'}, {'comment_id': 426173609, 'comment_body': 'You can just do\r\n\r\n```c\r\ncase SIMDE_SIDD_CMP_EQUAL_ANY:\r\ncase SIMDE_SIDD_CMP_RANGES:\r\n  bitvalue = 0;\r\n  break;\r\n```\r\n\r\nSorry I missed this in the last round :(', 'comment_created': datetime.datetime(2020, 5, 16, 17, 33, 20, tzinfo=datetime.timezone.utc), 'commenter': 'nemequ', 'type': 'User'}, {'comment_id': 426228786, 'comment_body': 'I found the bug, cmp_op should be 0x0c instead of 0x06.', 'comment_created': datetime.datetime(2020, 5, 17, 7, 37, 14, tzinfo=datetime.timezone.utc), 'commenter': 'masterchef2209', 'type': 'User'}, {'comment_id': 428336388, 'comment_body': '@nemequ what should I do here, if I have to use 2 operators inside this loop?', 'comment_created': datetime.datetime(2020, 5, 20, 22, 9, 59, tzinfo=datetime.timezone.utc), 'commenter': 'masterchef2209', 'type': 'User'}, {'comment_id': 428358634, 'comment_body': ""You can't have two reductions on the same variable.\r\n\r\nThat said, I don't see why you need this; `int_res_1` is initialized to 0 (all bits unset), so you shouldn't need to unset the bits here.  You only need to handle the case where the bits should be set but aren't."", 'comment_created': datetime.datetime(2020, 5, 20, 23, 11, 39, tzinfo=datetime.timezone.utc), 'commenter': 'nemequ', 'type': 'User'}, {'comment_id': 428545154, 'comment_body': 'Seems that `SIMDE_BUG_CLANG_45959` is not used in this PR?', 'comment_created': datetime.datetime(2020, 5, 21, 9, 28, 2, tzinfo=datetime.timezone.utc), 'commenter': 'mr-c', 'type': 'User'}, {'comment_id': 428612457, 'comment_body': '        `HEDLEY_DIAGNOSTIC_PUSH\r\n        #if defined(SIMDE_BUG_CLANG_45959)\r\n          #pragma clang diagnostic ignored ""-Wsign-conversion""\r\n        #endif\r\n        SIMDE_VECTORIZE_REDUCTION(&:int_res_1)\r\n        for(int j = 0 ; j <= (upper_bound-i) ; j++){\r\n          int_res_1 &=  (((bool_res_.i8[k] >> j) & 1 ) << i) ;\r\n          k += 1;\r\n        }\r\n        HEDLEY_DIAGNOSTIC_POP`\r\nIt is used in this part of code(Line 171), is something wrong here?', 'comment_created': datetime.datetime(2020, 5, 21, 12, 8, 24, tzinfo=datetime.timezone.utc), 'commenter': 'masterchef2209', 'type': 'User'}, {'comment_id': 428645107, 'comment_body': ""my mistake! I did a search at https://github.com/nemequ/simde/pull/295/files but maybe the whole page hadn't loaded"", 'comment_created': datetime.datetime(2020, 5, 21, 13, 18, 19, tzinfo=datetime.timezone.utc), 'commenter': 'mr-c', 'type': 'User'}, {'comment_id': 540273113, 'comment_body': '```suggestion\r\nstatic int\r\ntest_simde_mm_cmpestra_ranges_8(SIMDE_MUNIT_TEST_ARGS) {\r\n```', 'comment_created': datetime.datetime(2020, 12, 10, 15, 42, 17, tzinfo=datetime.timezone.utc), 'commenter': 'mr-c', 'type': 'User'}]","[{'commit_sha': 'bb7a25c2d2d037bc717d6e5650e638b34147a70d', 'committer_username': 'masterchef2209', 'committer_name': 'Hidayat Khan', 'committer_email': 'huk2209@gmail.com', 'commit_date': datetime.datetime(2017, 4, 23, 11, 44, 51, tzinfo=datetime.timezone.utc)}, {'commit_sha': '9eef8d91b9e0f3350d8d77b9d0c529bf54c59e71', 'committer_username': 'mr-c', 'committer_name': 'Michael R. Crusoe', 'committer_email': None, 'commit_date': datetime.datetime(2012, 1, 14, 21, 46, 42, tzinfo=datetime.timezone.utc)}]",Hidayat Khan,27916352,huk2209@gmail.com,User,,39,,292,77

Project_ID,Name,Full_name,Language,Forks,Stars,Watchers,contributors,commits,issues,branches,PRs_count,contributor pullrequests
