pr_id,pr_title,pr_body,is_merged,pr_number,pr_url,pr_html_url,pr_state,additions,deletions,pr_changed_files,pr_commits_count,pr_comments_count,pr_review_comments_count,pr_labels_count,pr_assignees_count,pr_labels,pr_created_at,pr_closed_at,time_taken,time_delta,pr_review_comments,pr_commits,contributor,contributor_id,contributor_email,contributor_type,contributions,contributor_public_repos,contributor_private_repos,contributor_followings,contributor_followers
678787880,JAMES-3516 Allow setting threadId through MessageFactory::createMessage params,"After adding threadId property to SimpleMailboxMessage, we can enable setting threadId through MessageFactory::createMessage params",True,514,https://api.github.com/repos/apache/james-project/pulls/514,https://github.com/apache/james-project/pull/514,closed,184,70,29,3,2,0,0,0,[],2021-06-28 07:33:43+00:00,2021-07-02 01:59:47+00:00,325564.0,"3 days, 18:26:04",[],"[{'commit_sha': '158ddf838817b760e8ecb22be8cf92ff5c182749', 'committer_username': 'quantranhong1999', 'committer_name': 'Trần Hồng Quân', 'committer_email': None, 'commit_date': datetime.datetime(2019, 9, 11, 2, 56, 31, tzinfo=datetime.timezone.utc)}, {'commit_sha': '40d3396b9e7322c23d16264e203b070dcc5bd0d0', 'committer_username': 'quantranhong1999', 'committer_name': 'Trần Hồng Quân', 'committer_email': None, 'commit_date': datetime.datetime(2019, 9, 11, 2, 56, 31, tzinfo=datetime.timezone.utc)}, {'commit_sha': '206eac968f83520024198807cfbb406e4137acfa', 'committer_username': 'quantranhong1999', 'committer_name': 'Trần Hồng Quân', 'committer_email': None, 'commit_date': datetime.datetime(2019, 9, 11, 2, 56, 31, tzinfo=datetime.timezone.utc)}]",Trần Hồng Quân,55171818,,User,,46,,5,2
679744930,JAMES-3516 Plug threadIdGuessingAlgorithm to MessageManager,"I have some questions:
- Am I supporting threadId for other protocols beside JMAP also? I am interacting with how James store threadId generally.
- Should we have CassandraThreadIdGuessingAlgorithm and InMemoryThreadIdGuessingAlgorithm... separately in the future?",True,515,https://api.github.com/repos/apache/james-project/pulls/515,https://github.com/apache/james-project/pull/515,closed,207,55,28,4,6,11,0,0,[],2021-06-29 09:05:54+00:00,2021-07-08 08:47:10+00:00,776476.0,"8 days, 23:41:16","[{'comment_id': 660437287, 'comment_body': 'I think you need a hint there...\r\n\r\nMaximalBodyDescriptor do held a list of fields CF this debugging session:\r\n\r\n![Screenshot from 2021-06-29 16-17-11](https://user-images.githubusercontent.com/6928740/123771846-95fe7300-d8f5-11eb-841a-b0fb0aa600ae.png)\r\n\r\nWe can contribute a `MaximalBodyDescriptor::getFiled(String name)` method in mime4J ?\r\n\r\nThen we would likely be able to do threadId guessing easily in `StoreMessageManager::appendMessage` (the one with the big try catch...) Then we can pass the threadId as a parameter to other methods just like properties...', 'comment_created': datetime.datetime(2021, 6, 29, 9, 21, 18, tzinfo=datetime.timezone.utc), 'commenter': 'chibenwa', 'type': 'User'}, {'comment_id': 660439882, 'comment_body': 'Likely even better (and less hacky) in parseProperties there is a header isntance we do not use...\r\n\r\n```\r\nprivate PropertyBuilder parseProperties(BodyOffsetInputStream bIn) throws IOException, MimeException {\r\n        // Disable line length... This should be handled by the smtp server\r\n        // component and not the parser itself\r\n        // https://issues.apache.org/jira/browse/IMAP-122\r\n        final MimeTokenStream parser = getParser(bIn);\r\n        final HeaderImpl fields = readHeader(parser);\r\n        \r\n        // All we need for threadId guessing <3\r\n        fields.getFields(""Message-Id"")\r\n        \r\n        final MaximalBodyDescriptor descriptor = (MaximalBodyDescriptor) parser.getBodyDescriptor();\r\n        final MediaType mediaType = getMediaType(descriptor);\r\n        final PropertyBuilder propertyBuilder = getPropertyBuilder(descriptor, mediaType.mediaType, mediaType.subType);\r\n        setTextualLinesCount(parser, mediaType.mediaType, propertyBuilder);\r\n        return propertyBuilder;\r\n    }\r\n ```\r\n \r\n That method can then return an object combining properties and threadId....', 'comment_created': datetime.datetime(2021, 6, 29, 9, 24, 37, tzinfo=datetime.timezone.utc), 'commenter': 'chibenwa', 'type': 'User'}, {'comment_id': 660484180, 'comment_body': 'How about using this header instance to get headers fields needed for ThreadIdGuessingAlgorithm, and still place ThreadIdGuessingAlgorithm at MessageStorer::appendMessageToStore as I am doing now? Because I think threadId should go with messageId. Otherwise we should move messageIdFactory.generate out of MessageStorer::appendMessageToStore.', 'comment_created': datetime.datetime(2021, 6, 29, 10, 24, 55, tzinfo=datetime.timezone.utc), 'commenter': 'quantranhong1999', 'type': 'User'}, {'comment_id': 660647641, 'comment_body': 'This sounds like a good proposal to me ;-)', 'comment_created': datetime.datetime(2021, 6, 29, 14, 0, 45, tzinfo=datetime.timezone.utc), 'commenter': 'chibenwa', 'type': 'User'}, {'comment_id': 661177746, 'comment_body': 'Optional IMO', 'comment_created': datetime.datetime(2021, 6, 30, 6, 49, 31, tzinfo=datetime.timezone.utc), 'commenter': 'chibenwa', 'type': 'User'}, {'comment_id': 661177934, 'comment_body': 'We should IMO accept messages without MimeMessageId', 'comment_created': datetime.datetime(2021, 6, 30, 6, 49, 52, tzinfo=datetime.timezone.utc), 'commenter': 'chibenwa', 'type': 'User'}, {'comment_id': 661178182, 'comment_body': 'Idem, what if for any reason a message do not have a subject?', 'comment_created': datetime.datetime(2021, 6, 30, 6, 50, 18, tzinfo=datetime.timezone.utc), 'commenter': 'chibenwa', 'type': 'User'}, {'comment_id': 661178734, 'comment_body': 'Use Optional.ofNullable(...).map(...)', 'comment_created': datetime.datetime(2021, 6, 30, 6, 51, 21, tzinfo=datetime.timezone.utc), 'commenter': 'chibenwa', 'type': 'User'}, {'comment_id': 661178958, 'comment_body': 'Guavate.toImmutableList()', 'comment_created': datetime.datetime(2021, 6, 30, 6, 51, 43, tzinfo=datetime.timezone.utc), 'commenter': 'chibenwa', 'type': 'User'}, {'comment_id': 661180844, 'comment_body': '`UnstructuredFieldImpl::getValue`\r\n\r\n(We need to handle possible encoded characters IMO cf HeaderCollectionTest::getHeadersShouldDecodeValues)', 'comment_created': datetime.datetime(2021, 6, 30, 6, 54, 55, tzinfo=datetime.timezone.utc), 'commenter': 'chibenwa', 'type': 'User'}, {'comment_id': 661913863, 'comment_body': 'We do not need to parse the field if it is already a `UnstructuredFieldImpl`', 'comment_created': datetime.datetime(2021, 7, 1, 1, 40, 42, tzinfo=datetime.timezone.utc), 'commenter': 'chibenwa', 'type': 'User'}]","[{'commit_sha': 'da3545498f258f846c363279962b86ea1d635676', 'committer_username': 'quantranhong1999', 'committer_name': 'Trần Hồng Quân', 'committer_email': None, 'commit_date': datetime.datetime(2019, 9, 11, 2, 56, 31, tzinfo=datetime.timezone.utc)}, {'commit_sha': '47752e7fd42d24dc02a814ad1a1224e78b6596c0', 'committer_username': 'quantranhong1999', 'committer_name': 'Trần Hồng Quân', 'committer_email': None, 'commit_date': datetime.datetime(2019, 9, 11, 2, 56, 31, tzinfo=datetime.timezone.utc)}, {'commit_sha': '3dfb11e21951b62e7dbf1762a48170b5a48339b2', 'committer_username': 'quantranhong1999', 'committer_name': 'Trần Hồng Quân', 'committer_email': None, 'commit_date': datetime.datetime(2019, 9, 11, 2, 56, 31, tzinfo=datetime.timezone.utc)}, {'commit_sha': 'c06f85c03da97caf1c5d35fe8a03ff5e9631aeb6', 'committer_username': 'quantranhong1999', 'committer_name': 'Trần Hồng Quân', 'committer_email': None, 'commit_date': datetime.datetime(2019, 9, 11, 2, 56, 31, tzinfo=datetime.timezone.utc)}]",Trần Hồng Quân,55171818,,User,,46,,5,2
683589829,JAMES-3516 Implement SearchThreadIdGuessingAlgorithm,"Purpose: Experiment guessing threadId by doing search. Good to experiment but bad for production.

I changed a piece of code in buildSearchQuery. We did compare one to one corresponding field. We should compare many fields.

```
An identical message id [@!RFC5322] appears in both messages in any of the Message-Id, In-Reply-To, and References header fields.
```",True,529,https://api.github.com/repos/apache/james-project/pulls/529,https://github.com/apache/james-project/pull/529,closed,405,43,22,5,9,9,0,0,[],2021-07-05 10:47:16+00:00,2021-07-13 09:17:20+00:00,685804.0,"7 days, 22:30:04","[{'comment_id': 663984411, 'comment_body': ""This is a new interface, let's just have the reactive version!"", 'comment_created': datetime.datetime(2021, 7, 5, 14, 45, 50, tzinfo=datetime.timezone.utc), 'commenter': 'chibenwa', 'type': 'User'}, {'comment_id': 663985549, 'comment_body': 'Can we extract a junit 5 contract off this?\r\n\r\nLocate the junit 5 contract in mailbox/store.', 'comment_created': datetime.datetime(2021, 7, 5, 14, 47, 34, tzinfo=datetime.timezone.utc), 'commenter': 'chibenwa', 'type': 'User'}, {'comment_id': 664022277, 'comment_body': 'So is this what you mean:\r\n- bind SearchThreadIdGuessingAlgorithm to MemoryMailboxModule\r\n- move this test to mailbox/store and extract Cassandra and InMemory version of this?', 'comment_created': datetime.datetime(2021, 7, 5, 15, 48, 50, tzinfo=datetime.timezone.utc), 'commenter': 'quantranhong1999', 'type': 'User'}, {'comment_id': 664166525, 'comment_body': 'No... \r\n\r\nI mean have this test suite as an interface, and default methods (we call that a contract). The test then implements the contract and tells which implementation to use. The contract is in mailbox/store but the test can be in mailbox/scanning-search without issues.', 'comment_created': datetime.datetime(2021, 7, 6, 0, 33, 21, tzinfo=datetime.timezone.utc), 'commenter': 'chibenwa', 'type': 'User'}, {'comment_id': 664342410, 'comment_body': '`AbstractThreadIdGuessingAlgorithmTest` => `ThreadIdGuessingAlgorithmContract`', 'comment_created': datetime.datetime(2021, 7, 6, 8, 23, 32, tzinfo=datetime.timezone.utc), 'commenter': 'chibenwa', 'type': 'User'}, {'comment_id': 664362659, 'comment_body': 'Maybe you could have a look to parametrized tests to be making this more readable?', 'comment_created': datetime.datetime(2021, 7, 6, 8, 49, 6, tzinfo=datetime.timezone.utc), 'commenter': 'chibenwa', 'type': 'User'}, {'comment_id': 665019724, 'comment_body': 'Put the parameter methods just above the tests they are related to IMO', 'comment_created': datetime.datetime(2021, 7, 7, 3, 51, 21, tzinfo=datetime.timezone.utc), 'commenter': 'chibenwa', 'type': 'User'}, {'comment_id': 667621640, 'comment_body': ""I don't see anywhere to call it, is it necessary?"", 'comment_created': datetime.datetime(2021, 7, 12, 4, 49, 25, tzinfo=datetime.timezone.utc), 'commenter': 'vttranlina', 'type': 'User'}, {'comment_id': 667650550, 'comment_body': ""No direct call, but yes it's necessary. It can be understood as implicit test data thanks to @ParameterizedTest @MethodSource annotations.\r\nhttps://www.baeldung.com/parameterized-tests-junit-5 part 4.6 "", 'comment_created': datetime.datetime(2021, 7, 12, 6, 13, 35, tzinfo=datetime.timezone.utc), 'commenter': 'quantranhong1999', 'type': 'User'}]","[{'commit_sha': '047166ac2327b2e1bdbe4de79755dea0320d56f0', 'committer_username': 'quantranhong1999', 'committer_name': 'Trần Hồng Quân', 'committer_email': None, 'commit_date': datetime.datetime(2019, 9, 11, 2, 56, 31, tzinfo=datetime.timezone.utc)}, {'commit_sha': '89b9e2047cb1f13a8316fd99cf8443c93d6b454d', 'committer_username': 'quantranhong1999', 'committer_name': 'Trần Hồng Quân', 'committer_email': None, 'commit_date': datetime.datetime(2019, 9, 11, 2, 56, 31, tzinfo=datetime.timezone.utc)}, {'commit_sha': 'fa683e3b15b256f8953dfb43c2d6c93c11f12928', 'committer_username': 'quantranhong1999', 'committer_name': 'Trần Hồng Quân', 'committer_email': None, 'commit_date': datetime.datetime(2019, 9, 11, 2, 56, 31, tzinfo=datetime.timezone.utc)}, {'commit_sha': '4d84b68bb486c118e9273953a2ace9b3f4cd618c', 'committer_username': 'quantranhong1999', 'committer_name': 'Trần Hồng Quân', 'committer_email': None, 'commit_date': datetime.datetime(2019, 9, 11, 2, 56, 31, tzinfo=datetime.timezone.utc)}, {'commit_sha': '4d2ebd21bfd37cecdb29a8f21f5e5ac0db73c975', 'committer_username': 'quantranhong1999', 'committer_name': 'Trần Hồng Quân', 'committer_email': None, 'commit_date': datetime.datetime(2019, 9, 11, 2, 56, 31, tzinfo=datetime.timezone.utc)}]",Trần Hồng Quân,55171818,,User,,46,,5,2
686473665,JAMES-3516 Implement MailboxManager::getThread API and plug it into JMAP Thread/get,WIP: Plug getThread API into JMAP Thread/get,True,534,https://api.github.com/repos/apache/james-project/pulls/534,https://github.com/apache/james-project/pull/534,closed,738,75,15,3,6,24,0,0,[],2021-07-09 04:08:46+00:00,2021-07-23 09:31:46+00:00,1228980.0,"14 days, 5:23:00","[{'comment_id': 666727870, 'comment_body': 'Use Publisher instead of Mono / Flux in TLD API\r\n\r\nThis allows subcomponents to not be dependant of the reactive technology...', 'comment_created': datetime.datetime(2021, 7, 9, 7, 18, 40, tzinfo=datetime.timezone.utc), 'commenter': 'chibenwa', 'type': 'User'}, {'comment_id': 666728442, 'comment_body': 'No tests for this method?', 'comment_created': datetime.datetime(2021, 7, 9, 7, 19, 49, tzinfo=datetime.timezone.utc), 'commenter': 'chibenwa', 'type': 'User'}, {'comment_id': 666729700, 'comment_body': 'TODO (Another PR)\r\n\r\nPush this to the search engine.\r\n\r\nHow: \r\n\r\n`SearchQuery::withThreadId` and implement it for scanning search, lucene search as well as ElasticSearch.', 'comment_created': datetime.datetime(2021, 7, 9, 7, 21, 55, tzinfo=datetime.timezone.utc), 'commenter': 'chibenwa', 'type': 'User'}, {'comment_id': 666796310, 'comment_body': 'IMO we are testing ThreadIdGuessingAlgorithm in an inconvenient way. We depend on guice to resolve the loop of SearchThreadIdGuessingAlgorithm and MailboxManager, so we can test this from HTTP level. But we are having problems when testing ThreadIdGuessingAlgorithm APIs from the lower level (testing resource based on loop constructors). \r\n\r\nMy proposal solutions:\r\n- In the lower level tests: Using MessageMapper to save our custom messages with custom threadId (But we missed some actual guessing threadId)\r\nOR\r\n- SearchThreadIdGuessingAlgorithm depends on MailboxManger no more.\r\n\r\nPersonally, I would like to do something like inbox.appendMessage, and then getThread directly.\r\nWhat do you think?', 'comment_created': datetime.datetime(2021, 7, 9, 9, 6, 17, tzinfo=datetime.timezone.utc), 'commenter': 'quantranhong1999', 'type': 'User'}, {'comment_id': 667054227, 'comment_body': 'Or...\r\n\r\nYou can implement MailboxManager  by doing directly the search without calling the guessing algorithm?', 'comment_created': datetime.datetime(2021, 7, 9, 15, 57, 27, tzinfo=datetime.timezone.utc), 'commenter': 'chibenwa', 'type': 'User'}, {'comment_id': 667277582, 'comment_body': 'At the moment, we just use searching for InMemory, we still need NaiveThreadIdGuessingAlgorithm for Cassandra and OpenJPA. And I would like to package related ThreadId APIs in ThreadIdGuessingAlgorithm.\r\n\r\nWhat about recoding MailboxManager::search in SearchThreadIdGuessingAlgorithm? (a little duplicated though, but solve above problem)', 'comment_created': datetime.datetime(2021, 7, 10, 2, 35, 8, tzinfo=datetime.timezone.utc), 'commenter': 'quantranhong1999', 'type': 'User'}, {'comment_id': 667313100, 'comment_body': 'No code duplication is not a solution.', 'comment_created': datetime.datetime(2021, 7, 10, 8, 54, 45, tzinfo=datetime.timezone.utc), 'commenter': 'chibenwa', 'type': 'User'}, {'comment_id': 668582750, 'comment_body': 'Returns the list of MessageId of messages belonging to that Thread', 'comment_created': datetime.datetime(2021, 7, 13, 9, 18, 35, tzinfo=datetime.timezone.utc), 'commenter': 'chibenwa', 'type': 'User'}, {'comment_id': 668583266, 'comment_body': '* @return  the list of MessageId of messages belonging to that Thread', 'comment_created': datetime.datetime(2021, 7, 13, 9, 19, 14, tzinfo=datetime.timezone.utc), 'commenter': 'chibenwa', 'type': 'User'}, {'comment_id': 668586553, 'comment_body': 'Methods with publishers should not throw.\r\n\r\nThey should return publisher that eventually completes with an error (`Flux.error`)\r\n\r\nThe error is returned when blocking the publisher not while generating the publisher.', 'comment_created': datetime.datetime(2021, 7, 13, 9, 23, 21, tzinfo=datetime.timezone.utc), 'commenter': 'chibenwa', 'type': 'User'}, {'comment_id': 668586853, 'comment_body': 'IMO that string method is likely not needed...', 'comment_created': datetime.datetime(2021, 7, 13, 9, 23, 46, tzinfo=datetime.timezone.utc), 'commenter': 'chibenwa', 'type': 'User'}, {'comment_id': 668587064, 'comment_body': 'private?', 'comment_created': datetime.datetime(2021, 7, 13, 9, 24, 3, tzinfo=datetime.timezone.utc), 'commenter': 'chibenwa', 'type': 'User'}, {'comment_id': 668590043, 'comment_body': '.switchIfEmpty(Mono.error(() -> new ThreadNotFoundException(threadId)));', 'comment_created': datetime.datetime(2021, 7, 13, 9, 27, 41, tzinfo=datetime.timezone.utc), 'commenter': 'chibenwa', 'type': 'User'}, {'comment_id': 668590583, 'comment_body': 'Indent', 'comment_created': datetime.datetime(2021, 7, 13, 9, 28, 22, tzinfo=datetime.timezone.utc), 'commenter': 'chibenwa', 'type': 'User'}, {'comment_id': 668590965, 'comment_body': 'Use guava ImmutableList.of()', 'comment_created': datetime.datetime(2021, 7, 13, 9, 28, 51, tzinfo=datetime.timezone.utc), 'commenter': 'chibenwa', 'type': 'User'}, {'comment_id': 668592275, 'comment_body': 'One mail in a tread?\r\n\r\nmail 1, mail 3 in thread 1\r\nmail 2 in thread 2\r\n\r\nget thread 1 -> mail 1 + mail 3 (not related emails are not returned)', 'comment_created': datetime.datetime(2021, 7, 13, 9, 30, 25, tzinfo=datetime.timezone.utc), 'commenter': 'chibenwa', 'type': 'User'}, {'comment_id': 668594269, 'comment_body': 'Unused :D', 'comment_created': datetime.datetime(2021, 7, 13, 9, 32, 51, tzinfo=datetime.timezone.utc), 'commenter': 'chibenwa', 'type': 'User'}, {'comment_id': 668595156, 'comment_body': ""First message don't need the `In-Reply-To` field :D"", 'comment_created': datetime.datetime(2021, 7, 13, 9, 34, 5, tzinfo=datetime.timezone.utc), 'commenter': 'chibenwa', 'type': 'User'}, {'comment_id': 668597634, 'comment_body': ' - In-Reply-To references messsage1 but different subject -> NOMATCH\r\n - REFERENCES -> match\r\n  -Maybe 1-2 other fonctional tests.', 'comment_created': datetime.datetime(2021, 7, 13, 9, 37, 23, tzinfo=datetime.timezone.utc), 'commenter': 'chibenwa', 'type': 'User'}, {'comment_id': 668598009, 'comment_body': 'Oups you changed that license format', 'comment_created': datetime.datetime(2021, 7, 13, 9, 37, 51, tzinfo=datetime.timezone.utc), 'commenter': 'chibenwa', 'type': 'User'}, {'comment_id': 668602558, 'comment_body': 'Please introduce a ThreadId.Factory class here (ThreadId.Factory would of course call the MessageId.Factory)\r\n\r\nThis reduces temporal coupling...', 'comment_created': datetime.datetime(2021, 7, 13, 9, 43, 32, tzinfo=datetime.timezone.utc), 'commenter': 'chibenwa', 'type': 'User'}, {'comment_id': 670362934, 'comment_body': 'This method depends on MailboxManager::search which throws MailboxException. I guess there is nothing I can do with that.', 'comment_created': datetime.datetime(2021, 7, 15, 11, 6, 55, tzinfo=datetime.timezone.utc), 'commenter': 'quantranhong1999', 'type': 'User'}, {'comment_id': 671074105, 'comment_body': ""I think those search methods were not reactive before and that throws stayed in the api interface. You can remove it I think. If you look at the current implementations of MailboxManager, they don't seem to throw it either"", 'comment_created': datetime.datetime(2021, 7, 16, 8, 42, 44, tzinfo=datetime.timezone.utc), 'commenter': 'Arsnael', 'type': 'User'}, {'comment_id': 671077577, 'comment_body': 'And yes there is other publisher methods still doing this too... we should clean up a bit :)', 'comment_created': datetime.datetime(2021, 7, 16, 8, 48, 9, tzinfo=datetime.timezone.utc), 'commenter': 'Arsnael', 'type': 'User'}]","[{'commit_sha': '21fbd8f8ac850136db08dc451113a5e6bdd41932', 'committer_username': 'quantranhong1999', 'committer_name': 'Trần Hồng Quân', 'committer_email': None, 'commit_date': datetime.datetime(2019, 9, 11, 2, 56, 31, tzinfo=datetime.timezone.utc)}, {'commit_sha': 'd1c5fee564e0abcbe953325c178f4100176436c4', 'committer_username': 'quantranhong1999', 'committer_name': 'Trần Hồng Quân', 'committer_email': None, 'commit_date': datetime.datetime(2019, 9, 11, 2, 56, 31, tzinfo=datetime.timezone.utc)}, {'commit_sha': '67dfbec0a8f807faa6230cddd6d7edee1b9fdb2d', 'committer_username': 'quantranhong1999', 'committer_name': 'Trần Hồng Quân', 'committer_email': None, 'commit_date': datetime.datetime(2019, 9, 11, 2, 56, 31, tzinfo=datetime.timezone.utc)}]",Trần Hồng Quân,55171818,,User,,46,,5,2
689803254,JAMES-3516 Enable threadId search query for MessageSearchIndex,"WIP: add threadId to ES document schema
Next: complete ES part, then ScanningSearch and Lucene",True,539,https://api.github.com/repos/apache/james-project/pulls/539,https://github.com/apache/james-project/pull/539,closed,374,2,23,5,1,9,0,0,[],2021-07-14 10:54:47+00:00,2021-07-19 02:52:21+00:00,403054.0,"4 days, 15:57:34","[{'comment_id': 669624521, 'comment_body': 'Should we strong type this?\r\n\r\n(ThreadId?)', 'comment_created': datetime.datetime(2021, 7, 14, 13, 39, 41, tzinfo=datetime.timezone.utc), 'commenter': 'chibenwa', 'type': 'User'}, {'comment_id': 670313680, 'comment_body': 'We can get the mapper factory that backs the storeMailboxManager instead IMO', 'comment_created': datetime.datetime(2021, 7, 15, 9, 52, 55, tzinfo=datetime.timezone.utc), 'commenter': 'chibenwa', 'type': 'User'}, {'comment_id': 670315510, 'comment_body': 'I prefer us to have an `abstract MessageId generateMessageId()` method than this whole MapperProvider stuff to be honnest.', 'comment_created': datetime.datetime(2021, 7, 15, 9, 55, 24, tzinfo=datetime.timezone.utc), 'commenter': 'chibenwa', 'type': 'User'}, {'comment_id': 670317834, 'comment_body': ""GIVEN that this class can rely on the `scanning thread id guessing algorithm` (as InMemoryIntegrationResources should anyway),\r\n\r\nCan't we instead append messages to the main storeMailboxManager that happen to share (or not share) the `In-Reply-To` ?\r\n\r\nThis would remove all of the mapper dark magic, make us more feature oriented and also make this testing code more bullet proof.\r\n\r\nMy 2 cents."", 'comment_created': datetime.datetime(2021, 7, 15, 9, 58, 36, tzinfo=datetime.timezone.utc), 'commenter': 'chibenwa', 'type': 'User'}, {'comment_id': 670352787, 'comment_body': ""I know that. But how we solve that is an issue now.\r\nOnce we satisfy with the scanning threadId guessing algorithm then we can apply that to CassandraModule, JPA module, InmemoryModule by moving ThreadIdGuessingAlgorithm APIs to MailboxManager. That's will solve the constructor loop.\r\n\r\nIs this scanning with ElasticSearch good enough for production? Until then we maybe can move on."", 'comment_created': datetime.datetime(2021, 7, 15, 10, 50, 33, tzinfo=datetime.timezone.utc), 'commenter': 'quantranhong1999', 'type': 'User'}, {'comment_id': 670365380, 'comment_body': ""If it's not yet. I guess we can come back and remove these message mapper dark magic later?"", 'comment_created': datetime.datetime(2021, 7, 15, 11, 10, 46, tzinfo=datetime.timezone.utc), 'commenter': 'quantranhong1999', 'type': 'User'}, {'comment_id': 670907272, 'comment_body': 'Why this FQDN?', 'comment_created': datetime.datetime(2021, 7, 16, 1, 40, 49, tzinfo=datetime.timezone.utc), 'commenter': 'chibenwa', 'type': 'User'}, {'comment_id': 670907421, 'comment_body': 'We likely do not need this to be stored', 'comment_created': datetime.datetime(2021, 7, 16, 1, 41, 17, tzinfo=datetime.timezone.utc), 'commenter': 'chibenwa', 'type': 'User'}, {'comment_id': 670908279, 'comment_body': 'Fair', 'comment_created': datetime.datetime(2021, 7, 16, 1, 44, 17, tzinfo=datetime.timezone.utc), 'commenter': 'chibenwa', 'type': 'User'}]","[{'commit_sha': '8bbc3ddf134dfd72482626d4150acfc81dd235a1', 'committer_username': 'quantranhong1999', 'committer_name': 'Trần Hồng Quân', 'committer_email': None, 'commit_date': datetime.datetime(2019, 9, 11, 2, 56, 31, tzinfo=datetime.timezone.utc)}, {'commit_sha': '97f6e69d2e06cf11691a0420019b63338dbcc910', 'committer_username': 'quantranhong1999', 'committer_name': 'Trần Hồng Quân', 'committer_email': None, 'commit_date': datetime.datetime(2019, 9, 11, 2, 56, 31, tzinfo=datetime.timezone.utc)}, {'commit_sha': '1e2ce87f566478fa47a55bd71da7c9d7624fc481', 'committer_username': 'quantranhong1999', 'committer_name': 'Trần Hồng Quân', 'committer_email': None, 'commit_date': datetime.datetime(2019, 9, 11, 2, 56, 31, tzinfo=datetime.timezone.utc)}, {'commit_sha': '978749812fb5e447173572f106e3e0d2bcfc1324', 'committer_username': 'quantranhong1999', 'committer_name': 'Trần Hồng Quân', 'committer_email': None, 'commit_date': datetime.datetime(2019, 9, 11, 2, 56, 31, tzinfo=datetime.timezone.utc)}, {'commit_sha': '41c4c21b48d1ecd2594d3e1ab65c1c4a599b75e8', 'committer_username': 'quantranhong1999', 'committer_name': 'Trần Hồng Quân', 'committer_email': None, 'commit_date': datetime.datetime(2019, 9, 11, 2, 56, 31, tzinfo=datetime.timezone.utc)}]",Trần Hồng Quân,55171818,,User,,46,,5,2
