pr_id,pr_title,pr_body,is_merged,pr_number,pr_url,pr_html_url,pr_state,additions,deletions,pr_changed_files,pr_commits_count,pr_comments_count,pr_review_comments_count,pr_labels_count,pr_assignees_count,pr_labels,pr_created_at,pr_closed_at,time_taken,time_delta,pr_review_comments,pr_commits,contributor,contributor_id,contributor_email,contributor_type,contributions,contributor_public_repos,contributor_private_repos,contributor_followings,contributor_followers
649772902,"JAMES-3516 Add threadId property to MessageResult POJO, MailboxMessage POJO","We don't have threadId guessing algorithm yet, so now threadId property is naive implemented equals MessageId.
I think I should have put threadId property to some Implemented MailboxMessage constructor/ builder. However I not sure which Message model JMAP is using... ",True,446,https://api.github.com/repos/apache/james-project/pulls/446,https://github.com/apache/james-project/pull/446,closed,131,1,10,5,8,8,1,0,[{'name': 'waiting merge'}],2021-05-21 08:29:47+00:00,2021-05-25 08:58:19+00:00,347312.0,"4 days, 0:28:32","[{'comment_id': 636775432, 'comment_body': 'I would not be surprised that this breaks if you try to really access it... Did you see the implementations of MessageId for memory and Cassandra?', 'comment_created': datetime.datetime(2021, 5, 21, 9, 29, 7, tzinfo=datetime.timezone.utc), 'commenter': 'Arsnael', 'type': 'User'}, {'comment_id': 636775621, 'comment_body': 'idem', 'comment_created': datetime.datetime(2021, 5, 21, 9, 29, 25, tzinfo=datetime.timezone.utc), 'commenter': 'Arsnael', 'type': 'User'}, {'comment_id': 636776345, 'comment_body': ""I'm not convinced about this... I will think about it. "", 'comment_created': datetime.datetime(2021, 5, 21, 9, 30, 25, tzinfo=datetime.timezone.utc), 'commenter': 'Arsnael', 'type': 'User'}, {'comment_id': 636860185, 'comment_body': 'Please favor composition.\r\n\r\nI would suggest:\r\n\r\n```\r\npublic class ThreadId {\r\n   private final MessageId baseMessageId;\r\n}\r\n```', 'comment_created': datetime.datetime(2021, 5, 21, 11, 56, 19, tzinfo=datetime.timezone.utc), 'commenter': 'chibenwa', 'type': 'User'}, {'comment_id': 636860644, 'comment_body': 'Put these methods before equals, toString, hashcode.', 'comment_created': datetime.datetime(2021, 5, 21, 11, 57, 8, tzinfo=datetime.timezone.utc), 'commenter': 'chibenwa', 'type': 'User'}, {'comment_id': 636870561, 'comment_body': 'You then should built a ThreadId that wraps the messageId.', 'comment_created': datetime.datetime(2021, 5, 21, 12, 14, 42, tzinfo=datetime.timezone.utc), 'commenter': 'chibenwa', 'type': 'User'}, {'comment_id': 636871080, 'comment_body': 'It may worth writing tests for this in SimpleMailboxMessageTest ?', 'comment_created': datetime.datetime(2021, 5, 21, 12, 15, 42, tzinfo=datetime.timezone.utc), 'commenter': 'chibenwa', 'type': 'User'}, {'comment_id': 636871395, 'comment_body': 'Can we try in MailboxManagerTest to access the threadId of a message?', 'comment_created': datetime.datetime(2021, 5, 21, 12, 16, 10, tzinfo=datetime.timezone.utc), 'commenter': 'chibenwa', 'type': 'User'}]","[{'commit_sha': '7123192e560cb2ad9785577d80d73f8e0f12e8ca', 'committer_username': 'quantranhong1999', 'committer_name': 'Trần Hồng Quân', 'committer_email': None, 'commit_date': datetime.datetime(2019, 9, 11, 2, 56, 31, tzinfo=datetime.timezone.utc)}, {'commit_sha': '602cc1a02fe3a19f148a03ef3e6bac6fd8b80fd1', 'committer_username': 'quantranhong1999', 'committer_name': 'Trần Hồng Quân', 'committer_email': None, 'commit_date': datetime.datetime(2019, 9, 11, 2, 56, 31, tzinfo=datetime.timezone.utc)}, {'commit_sha': 'e29d783ee3b7e17e2026d92f500f81993b8d4a45', 'committer_username': 'quantranhong1999', 'committer_name': 'Trần Hồng Quân', 'committer_email': None, 'commit_date': datetime.datetime(2019, 9, 11, 2, 56, 31, tzinfo=datetime.timezone.utc)}, {'commit_sha': 'c0dfac54d64d5def4f1d8aaef3a0b29ea227a9db', 'committer_username': 'quantranhong1999', 'committer_name': 'Trần Hồng Quân', 'committer_email': None, 'commit_date': datetime.datetime(2019, 9, 11, 2, 56, 31, tzinfo=datetime.timezone.utc)}, {'commit_sha': '8d0fb5860956efad10581b917763440384b14abb', 'committer_username': 'quantranhong1999', 'committer_name': 'Trần Hồng Quân', 'committer_email': None, 'commit_date': datetime.datetime(2019, 9, 11, 2, 56, 31, tzinfo=datetime.timezone.utc)}]",Trần Hồng Quân,55171818,,User,,46,,5,2
654500306,JAMES-3516 Using the MessageResult::getThreadId property at the JMAP level,Using the MessageResult::getThreadId property at the JMAP level - in Email/get + Email/import,True,458,https://api.github.com/repos/apache/james-project/pulls/458,https://github.com/apache/james-project/pull/458,closed,26,9,3,2,0,2,0,0,[],2021-05-27 05:04:01+00:00,2021-05-29 04:41:59+00:00,171478.0,"1 day, 23:37:58","[{'comment_id': 640290783, 'comment_body': 'We should not expose at the JMAP level `getBaseMessageId` which is an implementation detail.\r\n\r\nWe should have a `ThreadId::serialize` method IMO', 'comment_created': datetime.datetime(2021, 5, 27, 5, 9, 17, tzinfo=datetime.timezone.utc), 'commenter': 'chibenwa', 'type': 'User'}, {'comment_id': 640294881, 'comment_body': 'Can we have at least one unit test for this method?', 'comment_created': datetime.datetime(2021, 5, 27, 5, 21, 10, tzinfo=datetime.timezone.utc), 'commenter': 'chibenwa', 'type': 'User'}]","[{'commit_sha': '9a1a7fb1eec1487e4f3d58663de022b15f5d51b3', 'committer_username': 'quantranhong1999', 'committer_name': 'Trần Hồng Quân', 'committer_email': None, 'commit_date': datetime.datetime(2019, 9, 11, 2, 56, 31, tzinfo=datetime.timezone.utc)}, {'commit_sha': 'db1d30ebd68d695c6fa9f5d2f9ff910528e469d8', 'committer_username': 'quantranhong1999', 'committer_name': 'Trần Hồng Quân', 'committer_email': None, 'commit_date': datetime.datetime(2019, 9, 11, 2, 56, 31, tzinfo=datetime.timezone.utc)}]",Trần Hồng Quân,55171818,,User,,46,,5,2
655919499,JAMES-3516 Exposing AppendResult::getThreadId allow advertising the threadId as part of Email/set and Email/Import results,,True,460,https://api.github.com/repos/apache/james-project/pulls/460,https://github.com/apache/james-project/pull/460,closed,258,43,25,2,6,8,0,0,[],2021-05-28 06:36:26+00:00,2021-06-05 02:57:39+00:00,678073.0,"7 days, 20:21:13","[{'comment_id': 641337354, 'comment_body': 'This feels wrong.\r\n\r\n1. We can have a factory method for ThreadId to make things more explicit:\r\n\r\n```\r\nthis.threadId = ThreadId.forBaseMessageId(id.getMessageId());\r\n```\r\n\r\n2. We are leaking some business decisions all around our data model.\r\n\r\n`new ThreadId(id.getMessageId())` is a decision that I would love to see taken only once.\r\n\r\nThis means we need to cary over the threadId along in the data model. We need to\r\n\r\n - Have a constructor parameter for `threadId` here in `AppendResult`\r\n  - Cary the threadId parameter over in `MessageMetaData` POJO.', 'comment_created': datetime.datetime(2021, 5, 28, 7, 39, 20, tzinfo=datetime.timezone.utc), 'commenter': 'chibenwa', 'type': 'User'}, {'comment_id': 641337821, 'comment_body': 'We do not keep threadId into account for equals & hashCode?\r\n\r\nIs that POJO equalsVerifer tested?\r\n\r\nCan you fix it?', 'comment_created': datetime.datetime(2021, 5, 28, 7, 40, 12, tzinfo=datetime.timezone.utc), 'commenter': 'chibenwa', 'type': 'User'}, {'comment_id': 641338486, 'comment_body': 'I would prefer:\r\n\r\n```\r\nThreadId.fromJava(appendResult.getThreadId)\r\n```', 'comment_created': datetime.datetime(2021, 5, 28, 7, 41, 21, tzinfo=datetime.timezone.utc), 'commenter': 'chibenwa', 'type': 'User'}, {'comment_id': 641474315, 'comment_body': 'This is a breaking change. We need to handle the old format.\r\n\r\nPlease add the test.', 'comment_created': datetime.datetime(2021, 5, 28, 11, 23, 1, tzinfo=datetime.timezone.utc), 'commenter': 'chibenwa', 'type': 'User'}, {'comment_id': 641474380, 'comment_body': '\r\n\r\nThis is a breaking change. We need to handle the old format.\r\n\r\nPlease add the test.\r\n', 'comment_created': datetime.datetime(2021, 5, 28, 11, 23, 8, tzinfo=datetime.timezone.utc), 'commenter': 'chibenwa', 'type': 'User'}, {'comment_id': 642206317, 'comment_body': 'getThreadIdElseFallbackToOldFormat => retrieveThreadId ?', 'comment_created': datetime.datetime(2021, 5, 31, 4, 44, 39, tzinfo=datetime.timezone.utc), 'commenter': 'chibenwa', 'type': 'User'}, {'comment_id': 642207968, 'comment_body': 'Maybe it could be nice in serialization test to have a different value for messgeId and threadId, to show that it is supported?', 'comment_created': datetime.datetime(2021, 5, 31, 4, 51, 2, tzinfo=datetime.timezone.utc), 'commenter': 'chibenwa', 'type': 'User'}, {'comment_id': 642208128, 'comment_body': ""Idem, can't we have distinct values?"", 'comment_created': datetime.datetime(2021, 5, 31, 4, 51, 45, tzinfo=datetime.timezone.utc), 'commenter': 'chibenwa', 'type': 'User'}]","[{'commit_sha': 'bcc26a8791c136b83d87ffae44f5a1363768c0a5', 'committer_username': 'quantranhong1999', 'committer_name': 'Trần Hồng Quân', 'committer_email': None, 'commit_date': datetime.datetime(2019, 9, 11, 2, 56, 31, tzinfo=datetime.timezone.utc)}, {'commit_sha': 'e7b6c9ce54da2b568a8f803eec24aa39394b198b', 'committer_username': 'quantranhong1999', 'committer_name': 'Trần Hồng Quân', 'committer_email': None, 'commit_date': datetime.datetime(2019, 9, 11, 2, 56, 31, tzinfo=datetime.timezone.utc)}]",Trần Hồng Quân,55171818,,User,,46,,5,2
663162066,JAMES-3516 Implement naive ThreadIdGuessingAlgorithm,"Just a few ideas want to show to you, not really some proper code yet.
My idea is enabling setThreadId in MailboxMessage (just like MoqSeq). 
Then in MessageStorer we can use message.setThreadId(with ThreadId from ThreadIdGuessingAlgorithm)
```
MailboxMessage message = messageFactory.createMessage(messageId, mailbox, internalDate, size, bodyStartOctet, content, flags, propertyBuilder, attachments);
threadId = ThreadIdManager.setThreadId(MailboxMessage message,...);
message.setThreadId(threadId);
return Mono.from(messageMapper.addReactive(mailbox, message))
    .map(metadata -> Pair.of(metadata, Optional.of(attachments)));
```",True,481,https://api.github.com/repos/apache/james-project/pulls/481,https://github.com/apache/james-project/pull/481,closed,247,0,6,2,9,24,1,0,[{'name': 'waiting merge'}],2021-06-07 04:46:02+00:00,2021-06-16 04:11:47+00:00,775545.0,"8 days, 23:25:45","[{'comment_id': 646299876, 'comment_body': 'Do we take the mime message as an input? If I remember correctly MailboxMessage already has a ThreadId allocated to it...\r\n\r\nThreadId guessing needs to happen before.\r\n\r\nPlease consider...\r\n\r\n - The subject (string)\r\n - The references ( `List<String>` ) including `In-Reply-To`\r\n - The `MimeMessageId (`String`)\r\n - The James mailbox   `MessageId`\r\n \r\nhttps://jmap.io/spec-mail.html#threads\r\n\r\n```\r\nThe exact algorithm for determining whether two Emails belong to the same Thread is not mandated in this spec to allow for compatibility with different existing systems. For new implementations, it is suggested that two messages belong in the same Thread if both of the following conditions apply:\r\n\r\n    An identical message id [@!RFC5322] appears in both messages in any of the Message-Id, In-Reply-To, and References header fields.\r\n    After stripping automatically added prefixes such as “Fwd:”, “Re:”, “[List-Tag]”, etc., and ignoring white space, the subjects are the same. This avoids the situation where a person replies to an old message as a convenient way of finding the right recipient to send to but changes the subject and starts a new conversation.\r\n\r\n```', 'comment_created': datetime.datetime(2021, 6, 7, 6, 21, 10, tzinfo=datetime.timezone.utc), 'commenter': 'chibenwa', 'type': 'User'}, {'comment_id': 646300280, 'comment_body': ""I don't see what is specific for memory here just yet."", 'comment_created': datetime.datetime(2021, 6, 7, 6, 22, 6, tzinfo=datetime.timezone.utc), 'commenter': 'chibenwa', 'type': 'User'}, {'comment_id': 646300440, 'comment_body': ""We don't need a manager just yet."", 'comment_created': datetime.datetime(2021, 6, 7, 6, 22, 27, tzinfo=datetime.timezone.utc), 'commenter': 'chibenwa', 'type': 'User'}, {'comment_id': 646300747, 'comment_body': 'I think only the ThreadIdGuessingAlgorithm makes sense and that we can drop ThreadIdManager.', 'comment_created': datetime.datetime(2021, 6, 7, 6, 23, 10, tzinfo=datetime.timezone.utc), 'commenter': 'chibenwa', 'type': 'User'}, {'comment_id': 646301120, 'comment_body': 'No I would definitly prefer to have threadId final and add the required onstructor parameters!', 'comment_created': datetime.datetime(2021, 6, 7, 6, 24, 3, tzinfo=datetime.timezone.utc), 'commenter': 'chibenwa', 'type': 'User'}, {'comment_id': 648847760, 'comment_body': 'Why do we need this getter?', 'comment_created': datetime.datetime(2021, 6, 10, 4, 52, 1, tzinfo=datetime.timezone.utc), 'commenter': 'chibenwa', 'type': 'User'}, {'comment_id': 648847886, 'comment_body': 'Where do we use this field?', 'comment_created': datetime.datetime(2021, 6, 10, 4, 52, 19, tzinfo=datetime.timezone.utc), 'commenter': 'chibenwa', 'type': 'User'}, {'comment_id': 648848771, 'comment_body': '```suggestion\r\n    ThreadId getThreadId(MessageId messageId, List<References> references, Subject subject);\r\n```\r\n\r\nWith\r\n\r\n```\r\npublic class Reference {\r\n    private final String value;\r\n    \r\n    // ...\r\n}\r\n```\r\n\r\nand \r\n\r\n```\r\npublic class Subject {\r\n    private final String value;\r\n    \r\n    // ...\r\n}\r\n```\r\n\r\nWhere references aggegates the In-Reply-To // References header fields.', 'comment_created': datetime.datetime(2021, 6, 10, 4, 54, 44, tzinfo=datetime.timezone.utc), 'commenter': 'chibenwa', 'type': 'User'}, {'comment_id': 648850201, 'comment_body': 'Ok it looks like I understand wrong about naive implementation level. I will working on this.', 'comment_created': datetime.datetime(2021, 6, 10, 4, 58, 53, tzinfo=datetime.timezone.utc), 'commenter': 'quantranhong1999', 'type': 'User'}, {'comment_id': 648853524, 'comment_body': 'NaiveThreadIdGuessingAlgorithm', 'comment_created': datetime.datetime(2021, 6, 10, 5, 9, 41, tzinfo=datetime.timezone.utc), 'commenter': 'chibenwa', 'type': 'User'}, {'comment_id': 650638829, 'comment_body': 'I disagree with two methods. We should have  methods, several implementation.', 'comment_created': datetime.datetime(2021, 6, 14, 4, 11, 8, tzinfo=datetime.timezone.utc), 'commenter': 'chibenwa', 'type': 'User'}, {'comment_id': 650638920, 'comment_body': 'The fact of being naive is an implementation detail that do not have its place in an interface.', 'comment_created': datetime.datetime(2021, 6, 14, 4, 11, 35, tzinfo=datetime.timezone.utc), 'commenter': 'chibenwa', 'type': 'User'}, {'comment_id': 650639192, 'comment_body': 'Technically it should be `BaseSubject`: `After stripping automatically added prefixes such as “Fwd:”, “Re:”, “[List-Tag]”, etc., and ignoring white space, the subjects are the same. This avoids the situation where a person replies to an old message as a convenient way of finding the right recipient to send to but changes the subject and starts a new conversation.`', 'comment_created': datetime.datetime(2021, 6, 14, 4, 12, 55, tzinfo=datetime.timezone.utc), 'commenter': 'chibenwa', 'type': 'User'}, {'comment_id': 650641574, 'comment_body': 'Why we should not let guessThreadId algorithm handle the stripping subject job also?', 'comment_created': datetime.datetime(2021, 6, 14, 4, 24, 34, tzinfo=datetime.timezone.utc), 'commenter': 'quantranhong1999', 'type': 'User'}, {'comment_id': 650642102, 'comment_body': 'As you want. Your proposal makes sense.', 'comment_created': datetime.datetime(2021, 6, 14, 4, 27, 3, tzinfo=datetime.timezone.utc), 'commenter': 'chibenwa', 'type': 'User'}, {'comment_id': 650643087, 'comment_body': ""We could write a stripping method in ThreadIdGuessing impl and use it one for all (for input' subject and other searched mails' subjects)"", 'comment_created': datetime.datetime(2021, 6, 14, 4, 31, 44, tzinfo=datetime.timezone.utc), 'commenter': 'quantranhong1999', 'type': 'User'}, {'comment_id': 650643546, 'comment_body': 'We already have code doing just that: `SearchUtil::getBaseSubject`... Though some more tests could be welcome, we can likely reuse it.', 'comment_created': datetime.datetime(2021, 6, 14, 4, 34, 1, tzinfo=datetime.timezone.utc), 'commenter': 'chibenwa', 'type': 'User'}, {'comment_id': 650648261, 'comment_body': 'I liked the ThreadIdGuessingAlgorithm terminology <3', 'comment_created': datetime.datetime(2021, 6, 14, 4, 55, 9, tzinfo=datetime.timezone.utc), 'commenter': 'chibenwa', 'type': 'User'}, {'comment_id': 650745613, 'comment_body': ""Don't we throw a `NotImplementedException` in those cases usually?"", 'comment_created': datetime.datetime(2021, 6, 14, 8, 29, 22, tzinfo=datetime.timezone.utc), 'commenter': 'Arsnael', 'type': 'User'}, {'comment_id': 650765841, 'comment_body': 'We should implement the naive algorithm `new ThreadId(baseMessageId)` stuff....', 'comment_created': datetime.datetime(2021, 6, 14, 8, 57, 12, tzinfo=datetime.timezone.utc), 'commenter': 'chibenwa', 'type': 'User'}, {'comment_id': 650790999, 'comment_body': ""This supposes to be the not naive implementation method without baseMessageId in params.\r\nI don't understand Benoit's point yet.."", 'comment_created': datetime.datetime(2021, 6, 14, 9, 31, 59, tzinfo=datetime.timezone.utc), 'commenter': 'quantranhong1999', 'type': 'User'}, {'comment_id': 650811215, 'comment_body': 'Naive and real implementation should have the same interface.\r\n\r\nWe can add parameters if needed.', 'comment_created': datetime.datetime(2021, 6, 14, 10, 0, 29, tzinfo=datetime.timezone.utc), 'commenter': 'chibenwa', 'type': 'User'}, {'comment_id': 650856958, 'comment_body': 'In the future when we already have the real implementation, can we delete the NaiveImpl and unnecessary basedMessageId param?', 'comment_created': datetime.datetime(2021, 6, 14, 11, 15, 29, tzinfo=datetime.timezone.utc), 'commenter': 'quantranhong1999', 'type': 'User'}, {'comment_id': 650865403, 'comment_body': 'Yes I think so...', 'comment_created': datetime.datetime(2021, 6, 14, 11, 30, 4, tzinfo=datetime.timezone.utc), 'commenter': 'chibenwa', 'type': 'User'}]","[{'commit_sha': '0ed14901304a8ea387850620f4a427536b447362', 'committer_username': 'quantranhong1999', 'committer_name': 'Trần Hồng Quân', 'committer_email': None, 'commit_date': datetime.datetime(2019, 9, 11, 2, 56, 31, tzinfo=datetime.timezone.utc)}, {'commit_sha': '464133e764e310907507ba0e304f219b82b1dc34', 'committer_username': 'quantranhong1999', 'committer_name': 'Trần Hồng Quân', 'committer_email': None, 'commit_date': datetime.datetime(2019, 9, 11, 2, 56, 31, tzinfo=datetime.timezone.utc)}]",Trần Hồng Quân,55171818,,User,,46,,5,2
674215240,JAMES-3516 Add threadId column to cassandra tables,"WIP: Added threadId column to messageIdTable and imapUidTable. 
I think I should add threadId to ComposedMessageIdWithMetaData class.

I have some questions:
- What is the meaning of these two tables' name? From my view, it looks like rather mailbox message table.
- What is IMAP Uid?
- I see table messageV2 storing message metadata. Should we add threadId to this table too?",True,504,https://api.github.com/repos/apache/james-project/pulls/504,https://github.com/apache/james-project/pull/504,closed,242,39,25,4,5,16,0,0,[],2021-06-21 04:51:27+00:00,2021-06-28 10:29:30+00:00,625083.0,"7 days, 5:38:03","[{'comment_id': 656090528, 'comment_body': ""We should give the commands on Cassandra to perform for that I believe. But I consider that you probably don't know them.\r\n\r\nI will try to support you on this part when I have a bit of time.\r\n\r\nI think we need to modify the proper section in the new doc with Antora too :)"", 'comment_created': datetime.datetime(2021, 6, 22, 10, 31, 4, tzinfo=datetime.timezone.utc), 'commenter': 'Arsnael', 'type': 'User'}, {'comment_id': 656093590, 'comment_body': 'Maybe I would have added that constant in `CassandraMessageIds` and then import it here and in CassandraMessageIdTable instead', 'comment_created': datetime.datetime(2021, 6, 22, 10, 35, 48, tzinfo=datetime.timezone.utc), 'commenter': 'Arsnael', 'type': 'User'}, {'comment_id': 656273593, 'comment_body': ""We already defined threadId in AppendResult(separately from ComposedMessageId) and MessageMetaData class. IMO it's not suitable if we put threadId into ComposedMessageId or CassandraMessageIds constrants also."", 'comment_created': datetime.datetime(2021, 6, 22, 14, 24, 24, tzinfo=datetime.timezone.utc), 'commenter': 'quantranhong1999', 'type': 'User'}, {'comment_id': 656971819, 'comment_body': 'Please handle the null case to allow a smooth upgrade', 'comment_created': datetime.datetime(2021, 6, 23, 10, 37, 46, tzinfo=datetime.timezone.utc), 'commenter': 'chibenwa', 'type': 'User'}, {'comment_id': 656971949, 'comment_body': 'Please handle the null case to allow a smooth upgrade', 'comment_created': datetime.datetime(2021, 6, 23, 10, 37, 59, tzinfo=datetime.timezone.utc), 'commenter': 'chibenwa', 'type': 'User'}, {'comment_id': 656972507, 'comment_body': ""```suggestion\r\n### Adding threadId collumn to message metadata tables\r\n```\r\n\r\nThere's no v11 as we did not define any upgrade task."", 'comment_created': datetime.datetime(2021, 6, 23, 10, 38, 53, tzinfo=datetime.timezone.utc), 'commenter': 'chibenwa', 'type': 'User'}, {'comment_id': 656973133, 'comment_body': ""Wrong. There's no upgrades to do here.\r\n\r\nHowever we need to document how to create the threadId collumn on existing tables (ALTER TABLE ...)"", 'comment_created': datetime.datetime(2021, 6, 23, 10, 39, 55, tzinfo=datetime.timezone.utc), 'commenter': 'chibenwa', 'type': 'User'}, {'comment_id': 656973208, 'comment_body': 'Nope.', 'comment_created': datetime.datetime(2021, 6, 23, 10, 40, 4, tzinfo=datetime.timezone.utc), 'commenter': 'chibenwa', 'type': 'User'}, {'comment_id': 656973620, 'comment_body': '```suggestion\r\n    <subsection name=""Adding threadId collumn to message metadata table"">\r\n```', 'comment_created': datetime.datetime(2021, 6, 23, 10, 40, 44, tzinfo=datetime.timezone.utc), 'commenter': 'chibenwa', 'type': 'User'}, {'comment_id': 657597655, 'comment_body': ""It's more the other way around right? You should update the cassandra tables first before upgrading James?"", 'comment_created': datetime.datetime(2021, 6, 24, 3, 25, 49, tzinfo=datetime.timezone.utc), 'commenter': 'Arsnael', 'type': 'User'}, {'comment_id': 657598550, 'comment_body': 'By using cqlsh: https://cassandra.apache.org/doc/latest/tools/cqlsh.html\r\n\r\nData manipulation with CQL: https://cassandra.apache.org/doc/latest/cql/dml.html# -> for finding your commands', 'comment_created': datetime.datetime(2021, 6, 24, 3, 28, 58, tzinfo=datetime.timezone.utc), 'commenter': 'Arsnael', 'type': 'User'}, {'comment_id': 657602366, 'comment_body': 'Yes.', 'comment_created': datetime.datetime(2021, 6, 24, 3, 42, 19, tzinfo=datetime.timezone.utc), 'commenter': 'chibenwa', 'type': 'User'}, {'comment_id': 657666634, 'comment_body': 'I would prefer the parameters to be `Row row, MessageId messageId` so that we do not read the messageId twice...', 'comment_created': datetime.datetime(2021, 6, 24, 6, 39, 56, tzinfo=datetime.timezone.utc), 'commenter': 'chibenwa', 'type': 'User'}, {'comment_id': 657666828, 'comment_body': ""I'd like we do not read THREAD_ID_LOWERCASE twice"", 'comment_created': datetime.datetime(2021, 6, 24, 6, 40, 20, tzinfo=datetime.timezone.utc), 'commenter': 'chibenwa', 'type': 'User'}, {'comment_id': 657666911, 'comment_body': 'idem', 'comment_created': datetime.datetime(2021, 6, 24, 6, 40, 29, tzinfo=datetime.timezone.utc), 'commenter': 'chibenwa', 'type': 'User'}, {'comment_id': 657666961, 'comment_body': 'idem', 'comment_created': datetime.datetime(2021, 6, 24, 6, 40, 37, tzinfo=datetime.timezone.utc), 'commenter': 'chibenwa', 'type': 'User'}]","[{'commit_sha': '6ad0cecc3567545f47392742d1b6f5e9b49f7220', 'committer_username': 'quantranhong1999', 'committer_name': 'Trần Hồng Quân', 'committer_email': None, 'commit_date': datetime.datetime(2019, 9, 11, 2, 56, 31, tzinfo=datetime.timezone.utc)}, {'commit_sha': 'e1802ffa6017a29c8f74f31fe9534a8d87c27ad4', 'committer_username': 'quantranhong1999', 'committer_name': 'Trần Hồng Quân', 'committer_email': None, 'commit_date': datetime.datetime(2019, 9, 11, 2, 56, 31, tzinfo=datetime.timezone.utc)}, {'commit_sha': 'ab75bd404488c95ace3f23308b1032496f0ba1b2', 'committer_username': 'quantranhong1999', 'committer_name': 'Trần Hồng Quân', 'committer_email': None, 'commit_date': datetime.datetime(2019, 9, 11, 2, 56, 31, tzinfo=datetime.timezone.utc)}, {'commit_sha': '27020a2b5961dcb79f073a22e07d20f67c091f81', 'committer_username': 'quantranhong1999', 'committer_name': 'Trần Hồng Quân', 'committer_email': None, 'commit_date': datetime.datetime(2019, 9, 11, 2, 56, 31, tzinfo=datetime.timezone.utc)}]",Trần Hồng Quân,55171818,,User,,46,,5,2
