pr_id,pr_title,pr_body,is_merged,pr_number,pr_url,pr_html_url,pr_state,additions,deletions,pr_changed_files,pr_commits_count,pr_comments_count,pr_review_comments_count,pr_labels_count,pr_assignees_count,pr_labels,pr_created_at,pr_closed_at,time_taken,time_delta,pr_review_comments,pr_commits,contributor,contributor_id,contributor_email,contributor_type,contributions,contributor_public_repos,contributor_private_repos,contributor_followings,contributor_followers
659948514,AC_PrecLand: NFC: Refactor PrecLand EKF code,"This refactors the EKF we use in PrecLand and adds a bunch of comments so that it's a little easier to understand what is happening. I have also included some derivations that can be used to get the equations..
This is NFC at the moment.

Also, half the terms in the huge macros calculations (which were auto-generated) would end up cancelling each other out and can be greatly simplified... I have done that here.
This is tested in SITL to make sure there is no functional change",True,17632,https://api.github.com/repos/ArduPilot/ardupilot/pulls/17632,https://github.com/ArduPilot/ardupilot/pull/17632,closed,106,54,2,1,3,1,3,0,"[{'name': 'Enhancement'}, {'name': 'Copter'}, {'name': 'GSoC'}]",2021-06-02 10:44:27+00:00,2021-07-05 06:21:27+00:00,2835420.0,"32 days, 19:37:00","[{'comment_id': 643844838, 'comment_body': ""Removed this function entirely because we aren't fusing velocities yet.. will bring it back if and when we do that.."", 'comment_created': datetime.datetime(2021, 6, 2, 10, 52, 8, tzinfo=datetime.timezone.utc), 'commenter': 'rishabsingh3003', 'type': 'User'}]","[{'commit_sha': '10c560002cec26a9f9a0d95eb63ab29d3a31ca35', 'committer_username': 'rishabsingh3003', 'committer_name': 'Rishabh Singh', 'committer_email': 'f20171602@hyderabad.bits-pilani.ac.in', 'commit_date': datetime.datetime(2018, 3, 1, 20, 17, 10, tzinfo=datetime.timezone.utc)}]",Rishabh Singh,36970042,f20171602@hyderabad.bits-pilani.ac.in,User,,17,,6,80
662556744,AC_PrecLand: Minor bug fixes and changes,"Most of these are minor bug fixes or slight optimizations.

1. This provides a fixed time period (2 secs for now) after the camera first detects the landing target, and we start using it (in EKF mode). This would allow the EKF to settle down its predictions. We can perhaps extend this to raw mode but I don't see anything good coming out of that.
2. Minor optimization with using rotate_xy instead of a full-blown matrix multiplication without checking for 0 rotation.
3. Include cam z offset while calculating height from rangefinders ",True,17667,https://api.github.com/repos/ArduPilot/ardupilot/pulls/17667,https://github.com/ArduPilot/ardupilot/pull/17667,closed,65,23,2,3,1,4,4,0,"[{'name': 'BUG'}, {'name': 'Enhancement'}, {'name': 'Library'}, {'name': 'GSoC'}]",2021-06-05 18:53:05+00:00,2021-06-14 06:59:52+00:00,734807.0,"8 days, 12:06:47","[{'comment_id': 648052614, 'comment_body': 'we should put a comment above this declaration of ""check_estimator_init_timeout()"" and also above the implementation in the .cpp file.', 'comment_created': datetime.datetime(2021, 6, 9, 7, 46, 58, tzinfo=datetime.timezone.utc), 'commenter': 'rmackay9', 'type': 'User'}, {'comment_id': 648053556, 'comment_body': 'let\'s put a comment to the right of this declaration, ""// EKF initialisation requries this many milliseconds of good sensor data""', 'comment_created': datetime.datetime(2021, 6, 9, 7, 48, 13, tzinfo=datetime.timezone.utc), 'commenter': 'rmackay9', 'type': 'User'}, {'comment_id': 648058645, 'comment_body': 'this seems fine but given total freedom I would make target_acquired() a const function and set the _target_acquired in the ""run_estimator"" method instead.', 'comment_created': datetime.datetime(2021, 6, 9, 7, 54, 57, tzinfo=datetime.timezone.utc), 'commenter': 'rmackay9', 'type': 'User'}, {'comment_id': 648073515, 'comment_body': 'Better make those static const inside the class. That will limit the usage scope to the class. Here with those kind of generic name define there is a risk of collision with other lib.', 'comment_created': datetime.datetime(2021, 6, 9, 8, 15, tzinfo=datetime.timezone.utc), 'commenter': 'khancyr', 'type': 'User'}]","[{'commit_sha': '3a5822c4dcdcec679fdb1236f630d0707e55d17f', 'committer_username': 'rishabsingh3003', 'committer_name': 'Rishabh Singh', 'committer_email': 'f20171602@hyderabad.bits-pilani.ac.in', 'commit_date': datetime.datetime(2018, 3, 1, 20, 17, 10, tzinfo=datetime.timezone.utc)}, {'commit_sha': 'd37c587d4f18e25463f9c19e2bee629a0f7190aa', 'committer_username': 'rishabsingh3003', 'committer_name': 'Rishabh Singh', 'committer_email': 'f20171602@hyderabad.bits-pilani.ac.in', 'commit_date': datetime.datetime(2018, 3, 1, 20, 17, 10, tzinfo=datetime.timezone.utc)}, {'commit_sha': 'f54ab5ba8bcd2312736900fafface7880798da22', 'committer_username': 'rishabsingh3003', 'committer_name': 'Rishabh Singh', 'committer_email': 'f20171602@hyderabad.bits-pilani.ac.in', 'commit_date': datetime.datetime(2018, 3, 1, 20, 17, 10, tzinfo=datetime.timezone.utc)}]",Rishabh Singh,36970042,f20171602@hyderabad.bits-pilani.ac.in,User,,17,,6,80
663018074,AC_PrecLand: Add low pass filter to PrecLand output,"This is a small improvement that adds a low pass filter to smoothen the output (both position and velocity) of the PrecLand lib.

In the graph below you can see on the left a raw output of the position.x, and on the right, a low-pass filtered version. This comes from a simulated noisy landing target stream:
![image](https://user-images.githubusercontent.com/36970042/120935310-bdf81d80-c71f-11eb-9ea2-1febb6e257a9.png)
",False,17679,https://api.github.com/repos/ArduPilot/ardupilot/pulls/17679,https://github.com/ArduPilot/ardupilot/pull/17679,open,31,2,2,1,2,0,3,0,"[{'name': 'Enhancement'}, {'name': 'Library'}, {'name': 'GSoC'}]",2021-06-06 18:07:51+00:00,,0.0,,[],"[{'commit_sha': 'a6570f9e99983543aaf1ad6c69abbd565abe7db3', 'committer_username': 'rishabsingh3003', 'committer_name': 'Rishabh Singh', 'committer_email': 'f20171602@hyderabad.bits-pilani.ac.in', 'commit_date': datetime.datetime(2018, 3, 1, 20, 17, 10, tzinfo=datetime.timezone.utc)}]",Rishabh Singh,36970042,f20171602@hyderabad.bits-pilani.ac.in,User,,17,,6,80
674790593,Prec Land: Fuse estimated velocity into main EKF3,"This PR is a WIP, and aims to do the following:
1. Remove velocity override from Pos Control
2. Fuse velocity estimated from the position of the landing target into main EKF, to make main EKF velocity estimates better ",False,17828,https://api.github.com/repos/ArduPilot/ardupilot/pulls/17828,https://github.com/ArduPilot/ardupilot/pull/17828,open,144,28,15,5,0,0,4,0,"[{'name': 'Enhancement'}, {'name': 'Copter'}, {'name': 'EKF'}, {'name': 'GSoC'}]",2021-06-21 18:44:39+00:00,,0.0,,[],"[{'commit_sha': 'f0569a649431e0ce1a70b8189f65f0c46f4e9f17', 'committer_username': 'rishabsingh3003', 'committer_name': 'Rishabh Singh', 'committer_email': 'f20171602@hyderabad.bits-pilani.ac.in', 'commit_date': datetime.datetime(2018, 3, 1, 20, 17, 10, tzinfo=datetime.timezone.utc)}, {'commit_sha': '380d1c883265e0a06346db872ccb5327c174ab10', 'committer_username': 'rishabsingh3003', 'committer_name': 'Rishabh Singh', 'committer_email': 'f20171602@hyderabad.bits-pilani.ac.in', 'commit_date': datetime.datetime(2018, 3, 1, 20, 17, 10, tzinfo=datetime.timezone.utc)}, {'commit_sha': '77dd8f407e61fdf4eb56825f6cedeb8addbc5714', 'committer_username': 'rishabsingh3003', 'committer_name': 'Rishabh Singh', 'committer_email': 'f20171602@hyderabad.bits-pilani.ac.in', 'commit_date': datetime.datetime(2018, 3, 1, 20, 17, 10, tzinfo=datetime.timezone.utc)}, {'commit_sha': '448ba0315784829694140dd139b3382c8a62879c', 'committer_username': 'rishabsingh3003', 'committer_name': 'Rishabh Singh', 'committer_email': 'f20171602@hyderabad.bits-pilani.ac.in', 'commit_date': datetime.datetime(2018, 3, 1, 20, 17, 10, tzinfo=datetime.timezone.utc)}, {'commit_sha': '6a0eb192cbe7ad014968bd5d28d276f42588aa7b', 'committer_username': 'rishabsingh3003', 'committer_name': 'Rishabh Singh', 'committer_email': 'f20171602@hyderabad.bits-pilani.ac.in', 'commit_date': datetime.datetime(2018, 3, 1, 20, 17, 10, tzinfo=datetime.timezone.utc)}]",Rishabh Singh,36970042,f20171602@hyderabad.bits-pilani.ac.in,User,,17,,6,80
696543949,"Copter: Move ""land_run_horizontal_control()"" to use position controller only","This uses the new Position Controller methods for landing instead of relying on loiter
Also removed direct injection of velocity into position controller ",False,18111,https://api.github.com/repos/ArduPilot/ardupilot/pulls/18111,https://github.com/ArduPilot/ardupilot/pull/18111,closed,86,55,9,3,4,2,2,0,"[{'name': 'Copter'}, {'name': 'NeedsTesting'}]",2021-07-25 18:21:46+00:00,2021-09-05 20:11:23+00:00,3635377.0,"42 days, 1:49:37","[{'comment_id': 690064224, 'comment_body': ""```suggestion\r\n                const Vector2f &current_pos = inertial_nav.get_position().xy();\r\n```\r\n\r\nIt's dark magic.\r\n"", 'comment_created': datetime.datetime(2021, 8, 17, 6, 12, 56, tzinfo=datetime.timezone.utc), 'commenter': 'peterbarker', 'type': 'User'}, {'comment_id': 690065765, 'comment_body': 'Should use `AP_Enum<EstimatorType>` instead of `AP_Int8` as a type for `_estimator_type`\r\n\r\nPre-existing\r\n', 'comment_created': datetime.datetime(2021, 8, 17, 6, 16, 12, tzinfo=datetime.timezone.utc), 'commenter': 'peterbarker', 'type': 'User'}]","[{'commit_sha': '573be11a6bbf04a429dbd9bf9d015fd9c02e2024', 'committer_username': 'rishabsingh3003', 'committer_name': 'Rishabh Singh', 'committer_email': 'f20171602@hyderabad.bits-pilani.ac.in', 'commit_date': datetime.datetime(2018, 3, 1, 20, 17, 10, tzinfo=datetime.timezone.utc)}, {'commit_sha': '2a5ec7f751d0f462a0c33e38f9dbbaf52e32fe31', 'committer_username': 'rishabsingh3003', 'committer_name': 'Rishabh Singh', 'committer_email': 'f20171602@hyderabad.bits-pilani.ac.in', 'commit_date': datetime.datetime(2018, 3, 1, 20, 17, 10, tzinfo=datetime.timezone.utc)}, {'commit_sha': '95472b0adaf21443313a9e25efe6cce1697b5763', 'committer_username': 'rishabsingh3003', 'committer_name': 'Rishabh Singh', 'committer_email': 'f20171602@hyderabad.bits-pilani.ac.in', 'commit_date': datetime.datetime(2018, 3, 1, 20, 17, 10, tzinfo=datetime.timezone.utc)}]",Rishabh Singh,36970042,f20171602@hyderabad.bits-pilani.ac.in,User,,17,,6,80
