pr_id,pr_title,pr_body,is_merged,pr_number,pr_url,pr_html_url,pr_state,additions,deletions,pr_changed_files,pr_commits_count,pr_comments_count,pr_review_comments_count,pr_labels_count,pr_assignees_count,pr_labels,pr_created_at,pr_closed_at,time_taken,time_delta,pr_review_comments,pr_commits,contributor,contributor_id,contributor_email,contributor_type,contributions,contributor_public_repos,contributor_private_repos,contributor_followings,contributor_followers
683232182,AC_PrecLand/Copter: PrecLand state machine,"This is an early draft of a state machine that allows us to retry prec landing, as well as initiate, fail-safe measures in case we can't land on target.

This is another implementation of: https://github.com/ArduPilot/ardupilot/pull/17480 . A lot of the ideas were picked from that PR.
The major difference in this PR is that it entirely uses Position Controller only, and does not rely on WP controller. 

The basic workflow of the PR is:
1. Status of the Landing target is grabbed from AC_PrecLand (is it visible/lost/recently lost/out of range)
2. Depending on the strictness the user wants (set by PLND_STRICT), we decide if we want to retry landing or do a failsafe measure
3. If we have had a landing target sighting nearby before the target was lost, we will go towards the landing target at a height it was detected at. This is called a ""landing retry"" and can only be done a finite number of times (as set by the user).
4. If we have no idea where the landing target might be, failsafe measures are triggered.
5. Failsafe again depends on what the strictness of the landing is. If very strict, the copter will hover there till the user takes over. If it isn't strict, then it's just going to land vertically.",True,17930,https://api.github.com/repos/ArduPilot/ardupilot/pulls/17930,https://github.com/ArduPilot/ardupilot/pull/17930,closed,750,15,10,3,11,96,3,0,"[{'name': 'Copter'}, {'name': 'Library'}, {'name': 'WikiNeeded'}]",2021-07-04 20:26:23+00:00,2021-08-23 06:00:57+00:00,4268074.0,"49 days, 9:34:34","[{'comment_id': 663556392, 'comment_body': 'getters should be const functions !', 'comment_created': datetime.datetime(2021, 7, 4, 21, 3, 28, tzinfo=datetime.timezone.utc), 'commenter': 'khancyr', 'type': 'User'}, {'comment_id': 663556527, 'comment_body': 'why this second copy ?', 'comment_created': datetime.datetime(2021, 7, 4, 21, 5, 10, tzinfo=datetime.timezone.utc), 'commenter': 'khancyr', 'type': 'User'}, {'comment_id': 663556935, 'comment_body': ""Hum, I got the same issue in my implementation ... This can be very long depending the descend speed. we may need some sort of checker to unsure that we won't crash before timeout "", 'comment_created': datetime.datetime(2021, 7, 4, 21, 9, 14, tzinfo=datetime.timezone.utc), 'commenter': 'khancyr', 'type': 'User'}, {'comment_id': 663557261, 'comment_body': 'this is a lot of duplicate. I think it should be better that we work out some new logic into the rally point to be able to enforce a land on a rally point setted by the precland library', 'comment_created': datetime.datetime(2021, 7, 4, 21, 12, 48, tzinfo=datetime.timezone.utc), 'commenter': 'khancyr', 'type': 'User'}, {'comment_id': 663559613, 'comment_body': ""the whole adding should be enclose by the #if to don't include it unnecessary"", 'comment_created': datetime.datetime(2021, 7, 4, 21, 36, 25, tzinfo=datetime.timezone.utc), 'commenter': 'khancyr', 'type': 'User'}, {'comment_id': 663559814, 'comment_body': 'ms > s ?', 'comment_created': datetime.datetime(2021, 7, 4, 21, 38, 11, tzinfo=datetime.timezone.utc), 'commenter': 'khancyr', 'type': 'User'}, {'comment_id': 663559954, 'comment_body': 'and both new variable seems unused ?', 'comment_created': datetime.datetime(2021, 7, 4, 21, 40, 8, tzinfo=datetime.timezone.utc), 'commenter': 'khancyr', 'type': 'User'}, {'comment_id': 666655554, 'comment_body': '```suggestion\r\n    const Vector3f thrust_vector { loiter_nav->get_thrust_vector() };\r\n```', 'comment_created': datetime.datetime(2021, 7, 9, 4, 3, 38, tzinfo=datetime.timezone.utc), 'commenter': 'peterbarker', 'type': 'User'}, {'comment_id': 666655806, 'comment_body': '```suggestion\r\n        void do_target_lost_actions();\r\n```\r\n\r\n(verb+noun rather than just noun)\r\n\r\n(I reckon we should canonicalise in our code on `run` or `do` BTW :-) )\r\n', 'comment_created': datetime.datetime(2021, 7, 9, 4, 4, 39, tzinfo=datetime.timezone.utc), 'commenter': 'peterbarker', 'type': 'User'}, {'comment_id': 666656166, 'comment_body': ""We don't usually have underscores in these\r\n"", 'comment_created': datetime.datetime(2021, 7, 9, 4, 6, 10, tzinfo=datetime.timezone.utc), 'commenter': 'peterbarker', 'type': 'User'}, {'comment_id': 666656565, 'comment_body': '```suggestion\r\n        enum class RetryLandingState : uint8_t {\r\n            INIT = 0,\r\n            IN_PROGRESS,\r\n            COMPLETE\r\n        };\r\n```\r\n\r\nWould be nice to get a more complete description of these states - maybe just a sort `// foo` comment after each state\r\n', 'comment_created': datetime.datetime(2021, 7, 9, 4, 7, 44, tzinfo=datetime.timezone.utc), 'commenter': 'peterbarker', 'type': 'User'}, {'comment_id': 666656677, 'comment_body': '```suggestion\r\n        RetryLanding retry_state;  // Current action being done in the Landing retry state machine\r\n```', 'comment_created': datetime.datetime(2021, 7, 9, 4, 8, 6, tzinfo=datetime.timezone.utc), 'commenter': 'peterbarker', 'type': 'User'}, {'comment_id': 666656749, 'comment_body': 'mode or since last reset?\r\n', 'comment_created': datetime.datetime(2021, 7, 9, 4, 8, 18, tzinfo=datetime.timezone.utc), 'commenter': 'peterbarker', 'type': 'User'}, {'comment_id': 666657632, 'comment_body': '```suggestion\r\n    void run_land_controllers(bool pause_descent = false) {\r\n```', 'comment_created': datetime.datetime(2021, 7, 9, 4, 11, 28, tzinfo=datetime.timezone.utc), 'commenter': 'peterbarker', 'type': 'User'}, {'comment_id': 666657804, 'comment_body': ""Didn't you just create a method to do this? :-)\r\n\r\nSimilarly elsewhere.\r\n"", 'comment_created': datetime.datetime(2021, 7, 9, 4, 12, 6, tzinfo=datetime.timezone.utc), 'commenter': 'peterbarker', 'type': 'User'}, {'comment_id': 666658419, 'comment_body': 'This doesn\'t read right to me.  Your lost action is ""init""?!\r\n', 'comment_created': datetime.datetime(2021, 7, 9, 4, 14, 34, tzinfo=datetime.timezone.utc), 'commenter': 'peterbarker', 'type': 'User'}, {'comment_id': 666658562, 'comment_body': '```suggestion\r\n// Run Prec Land State Machine. During Prec Landing, we might encounter four scenarios:\r\n```', 'comment_created': datetime.datetime(2021, 7, 9, 4, 14, 57, tzinfo=datetime.timezone.utc), 'commenter': 'peterbarker', 'type': 'User'}, {'comment_id': 666658714, 'comment_body': '```suggestion\r\n    switch (current_state) {\r\n```', 'comment_created': datetime.datetime(2021, 7, 9, 4, 15, 25, tzinfo=datetime.timezone.utc), 'commenter': 'peterbarker', 'type': 'User'}, {'comment_id': 666659078, 'comment_body': 'Perhaps `AC_Precland::PldState` should actually be `Mode::PreclandStateMachine::State`\r\n\r\nThis this would be\r\n```suggestion\r\n    case State::TARGET_RECENTLY_LOST:\r\n```', 'comment_created': datetime.datetime(2021, 7, 9, 4, 16, 49, tzinfo=datetime.timezone.utc), 'commenter': 'peterbarker', 'type': 'User'}, {'comment_id': 666659164, 'comment_body': '```suggestion\r\n        // we have lost the target but had it in sight at least once recently\r\n```', 'comment_created': datetime.datetime(2021, 7, 9, 4, 17, 10, tzinfo=datetime.timezone.utc), 'commenter': 'peterbarker', 'type': 'User'}, {'comment_id': 666659830, 'comment_body': 'Lost infers we once knew where it was - which might not be the case, right?\r\n', 'comment_created': datetime.datetime(2021, 7, 9, 4, 19, 37, tzinfo=datetime.timezone.utc), 'commenter': 'peterbarker', 'type': 'User'}, {'comment_id': 666660008, 'comment_body': ""`default:` should definitely not be required.  If we ever need it it's a flow_of_control error and we should move straight back to non-precision landing and preclude it from being entered again.  Or we could trust that insane things are not going to happen and just omit `default:`\r\n\r\n\r\n"", 'comment_created': datetime.datetime(2021, 7, 9, 4, 20, 12, tzinfo=datetime.timezone.utc), 'commenter': 'peterbarker', 'type': 'User'}, {'comment_id': 666660332, 'comment_body': '```suggestion\r\n    switch (landing_target_lost_action) {\r\n```', 'comment_created': datetime.datetime(2021, 7, 9, 4, 21, 39, tzinfo=datetime.timezone.utc), 'commenter': 'peterbarker', 'type': 'User'}, {'comment_id': 666660706, 'comment_body': '```suggestion\r\n    case TargetLostAction::INIT: {\r\n```\r\n\r\nUnderscores are definitely not typical (similarly elsewhere).\r\n\r\n`Landing` is kind of redundant in the enum name :-)\r\n', 'comment_created': datetime.datetime(2021, 7, 9, 4, 23, 3, tzinfo=datetime.timezone.utc), 'commenter': 'peterbarker', 'type': 'User'}, {'comment_id': 666660839, 'comment_body': 'Change this to a switch\r\n', 'comment_created': datetime.datetime(2021, 7, 9, 4, 23, 34, tzinfo=datetime.timezone.utc), 'commenter': 'peterbarker', 'type': 'User'}, {'comment_id': 666660883, 'comment_body': '```suggestion\r\n            // We eventually want to retry landing, but lets descend for some time and hope the target gets in sight\r\n```', 'comment_created': datetime.datetime(2021, 7, 9, 4, 23, 43, tzinfo=datetime.timezone.utc), 'commenter': 'peterbarker', 'type': 'User'}, {'comment_id': 666661194, 'comment_body': 'Something wrong with the formatting here\r\n', 'comment_created': datetime.datetime(2021, 7, 9, 4, 24, 44, tzinfo=datetime.timezone.utc), 'commenter': 'peterbarker', 'type': 'User'}, {'comment_id': 666661408, 'comment_body': '`default:` is almost always wrong when switching on an enum\r\n', 'comment_created': datetime.datetime(2021, 7, 9, 4, 25, 41, tzinfo=datetime.timezone.utc), 'commenter': 'peterbarker', 'type': 'User'}, {'comment_id': 666661601, 'comment_body': '```suggestion\r\n    switch (retry_status) {\r\n```\r\n\r\nsimilarly elsewhere\r\n', 'comment_created': datetime.datetime(2021, 7, 9, 4, 26, 25, tzinfo=datetime.timezone.utc), 'commenter': 'peterbarker', 'type': 'User'}, {'comment_id': 666662065, 'comment_body': ""This pre-supposes some state.  It's reasonable based on the method name and the description, bit I think it would be a reasonable precaution to make `get_last_detected_landing_location()` boolean and check it here.  Implications of something going wrong are pretty dire.\r\n\r\nPotentially the caller could pass the location in if they have it handy and verified (but I don't think that's the case)\r\n"", 'comment_created': datetime.datetime(2021, 7, 9, 4, 28, 14, tzinfo=datetime.timezone.utc), 'commenter': 'peterbarker', 'type': 'User'}, {'comment_id': 666663063, 'comment_body': 'Slight problem with the message in that you\'d consider your ""landing try"" completed if you actually landed, so by extension your ""landing retry"" would be complete if you actually landed.  This is more ""landing retry reset complete""\r\n\r\nWould be interesting to lint our code for tense here - statement of current state or statement of accomplishment.\r\n', 'comment_created': datetime.datetime(2021, 7, 9, 4, 31, 42, tzinfo=datetime.timezone.utc), 'commenter': 'peterbarker', 'type': 'User'}, {'comment_id': 666663188, 'comment_body': 'Well, competed the reset portion of the retry.\r\n', 'comment_created': datetime.datetime(2021, 7, 9, 4, 32, 8, tzinfo=datetime.timezone.utc), 'commenter': 'peterbarker', 'type': 'User'}, {'comment_id': 666663428, 'comment_body': '```suggestion\r\n```', 'comment_created': datetime.datetime(2021, 7, 9, 4, 33, 2, tzinfo=datetime.timezone.utc), 'commenter': 'peterbarker', 'type': 'User'}, {'comment_id': 666663622, 'comment_body': '```suggestion\r\n    // @Description: PrecLand Maximum number of retries for a failed landing. Set to zero to disable landing retry.\r\n```\r\n', 'comment_created': datetime.datetime(2021, 7, 9, 4, 33, 47, tzinfo=datetime.timezone.utc), 'commenter': 'peterbarker', 'type': 'User'}, {'comment_id': 666663879, 'comment_body': 'Why is the rangefinder strictly required?\r\n', 'comment_created': datetime.datetime(2021, 7, 9, 4, 34, 46, tzinfo=datetime.timezone.utc), 'commenter': 'peterbarker', 'type': 'User'}, {'comment_id': 666664037, 'comment_body': '```suggestion\r\n    // @Description: Vehicle will continue landing vertically until this height if target is not found. Below this height if landing target is not found, landing retry/failsafe might be attempted. This needs a rangefinder to work. Set 0 to disable this.\r\n```', 'comment_created': datetime.datetime(2021, 7, 9, 4, 35, 20, tzinfo=datetime.timezone.utc), 'commenter': 'peterbarker', 'type': 'User'}, {'comment_id': 666664294, 'comment_body': '```suggestion\r\n    _current_status = PldState::TARGET_NEVER_SEEN;\r\n```\r\n', 'comment_created': datetime.datetime(2021, 7, 9, 4, 36, 11, tzinfo=datetime.timezone.utc), 'commenter': 'peterbarker', 'type': 'User'}, {'comment_id': 666664567, 'comment_body': '```suggestion\r\n    }\r\n    if (_current_status == PldState::TARGET_FOUND || _current_status == PldState::TARGET_RECENTLY_LOST) {\r\n```', 'comment_created': datetime.datetime(2021, 7, 9, 4, 37, 10, tzinfo=datetime.timezone.utc), 'commenter': 'peterbarker', 'type': 'User'}, {'comment_id': 666664750, 'comment_body': 'With a new ""never_seen"" this might need updating\r\n', 'comment_created': datetime.datetime(2021, 7, 9, 4, 37, 44, tzinfo=datetime.timezone.utc), 'commenter': 'peterbarker', 'type': 'User'}, {'comment_id': 666664829, 'comment_body': '```suggestion\r\n    // We definitely do not have the target in sight.\r\n```', 'comment_created': datetime.datetime(2021, 7, 9, 4, 38, 1, tzinfo=datetime.timezone.utc), 'commenter': 'peterbarker', 'type': 'User'}, {'comment_id': 666664951, 'comment_body': '```suggestion\r\n        // check if it\'s nearby/found recently, else the status will be demoted to ""TARGET_LOST""\r\n```', 'comment_created': datetime.datetime(2021, 7, 9, 4, 38, 30, tzinfo=datetime.timezone.utc), 'commenter': 'peterbarker', 'type': 'User'}, {'comment_id': 666665049, 'comment_body': ""And if we don't get this?\r\n"", 'comment_created': datetime.datetime(2021, 7, 9, 4, 38, 55, tzinfo=datetime.timezone.utc), 'commenter': 'peterbarker', 'type': 'User'}, {'comment_id': 666665240, 'comment_body': ""Couldn't we use the height-above-terrain call instead?\r\n"", 'comment_created': datetime.datetime(2021, 7, 9, 4, 39, 33, tzinfo=datetime.timezone.utc), 'commenter': 'peterbarker', 'type': 'User'}, {'comment_id': 666665299, 'comment_body': '```suggestion\r\n    }\r\n    \r\n    if (rangefinder_alt_m < _sensor_min_alt && !is_zero(_sensor_min_alt)) {\r\n```', 'comment_created': datetime.datetime(2021, 7, 9, 4, 39, 49, tzinfo=datetime.timezone.utc), 'commenter': 'peterbarker', 'type': 'User'}, {'comment_id': 666666863, 'comment_body': ""I wonder if we should be using NED - we want to move all of ArduPilot to NED - this isn't going to help\r\n"", 'comment_created': datetime.datetime(2021, 7, 9, 4, 44, 54, tzinfo=datetime.timezone.utc), 'commenter': 'peterbarker', 'type': 'User'}, {'comment_id': 667299953, 'comment_body': 'this is wrong as a soon as the use will release the land repositioning, the drone will go back to the retry_loc ...', 'comment_created': datetime.datetime(2021, 7, 10, 6, 37, 57, tzinfo=datetime.timezone.utc), 'commenter': 'khancyr', 'type': 'User'}, {'comment_id': 667301295, 'comment_body': ""Yes, you are absolutely right, I didn't think about this. I am not confident about how I have been using the position controller. It will need some changes and advice from others"", 'comment_created': datetime.datetime(2021, 7, 10, 6, 51, 36, tzinfo=datetime.timezone.utc), 'commenter': 'rishabsingh3003', 'type': 'User'}, {'comment_id': 667313690, 'comment_body': ""IMHO, don't give the hand to the user. Like on normal precland, if the user want to use the joystick, it switch to normal LAND, mixing auto and manual feature is rarely a good thing"", 'comment_created': datetime.datetime(2021, 7, 10, 9, 0, 19, tzinfo=datetime.timezone.utc), 'commenter': 'khancyr', 'type': 'User'}, {'comment_id': 667314778, 'comment_body': 'hello world ?', 'comment_created': datetime.datetime(2021, 7, 10, 9, 11, 43, tzinfo=datetime.timezone.utc), 'commenter': 'khancyr', 'type': 'User'}, {'comment_id': 667519628, 'comment_body': 'A poor case of debug code pushed to commit. My bad!', 'comment_created': datetime.datetime(2021, 7, 11, 18, 33, 38, tzinfo=datetime.timezone.utc), 'commenter': 'rishabsingh3003', 'type': 'User'}, {'comment_id': 667519789, 'comment_body': '100% agreed, removed the manual takeovers inside autonomous retries. The new logic is, if during a retry, user gives rc command, retry is cancelled and it proceeds to failsafe measure.', 'comment_created': datetime.datetime(2021, 7, 11, 18, 35, 4, tzinfo=datetime.timezone.utc), 'commenter': 'rishabsingh3003', 'type': 'User'}, {'comment_id': 667626881, 'comment_body': 'Let\'s stick with ""PrecLand"" as a prefix instead of ""Pld"" or just remove the prefix', 'comment_created': datetime.datetime(2021, 7, 12, 5, 6, 8, tzinfo=datetime.timezone.utc), 'commenter': 'rmackay9', 'type': 'User'}, {'comment_id': 667627683, 'comment_body': ""I'd put this bracket on line higher.."", 'comment_created': datetime.datetime(2021, 7, 12, 5, 8, 28, tzinfo=datetime.timezone.utc), 'commenter': 'rmackay9', 'type': 'User'}, {'comment_id': 667642303, 'comment_body': 'ALT_MIN', 'comment_created': datetime.datetime(2021, 7, 12, 5, 53, 11, tzinfo=datetime.timezone.utc), 'commenter': 'rishabsingh3003', 'type': 'User'}, {'comment_id': 667642462, 'comment_body': 'TIMEOUT', 'comment_created': datetime.datetime(2021, 7, 12, 5, 53, 31, tzinfo=datetime.timezone.utc), 'commenter': 'rishabsingh3003', 'type': 'User'}, {'comment_id': 667642552, 'comment_body': 'RET_', 'comment_created': datetime.datetime(2021, 7, 12, 5, 53, 45, tzinfo=datetime.timezone.utc), 'commenter': 'rishabsingh3003', 'type': 'User'}, {'comment_id': 677125926, 'comment_body': 'Change to ""update"", return enum, not separate bool\'s', 'comment_created': datetime.datetime(2021, 7, 27, 5, 19, 33, tzinfo=datetime.timezone.utc), 'commenter': 'rishabsingh3003', 'type': 'User'}, {'comment_id': 677127302, 'comment_body': 'retry_loc rename to retry_pos_cm', 'comment_created': datetime.datetime(2021, 7, 27, 5, 23, 18, tzinfo=datetime.timezone.utc), 'commenter': 'rishabsingh3003', 'type': 'User'}, {'comment_id': 680622473, 'comment_body': 'let\'s rename, ""update_precland_state_machine"" to just ""update"".', 'comment_created': datetime.datetime(2021, 8, 2, 2, 55, 47, tzinfo=datetime.timezone.utc), 'commenter': 'rmackay9', 'type': 'User'}, {'comment_id': 680623047, 'comment_body': 'you could raise an internal error here to make the problem more visible in SITL and to increase the chance that users will report the issue so we can resolve it.', 'comment_created': datetime.datetime(2021, 8, 2, 2, 57, 54, tzinfo=datetime.timezone.utc), 'commenter': 'rmackay9', 'type': 'User'}, {'comment_id': 680623853, 'comment_body': 'I think ""State"" is perhaps too general and we should call this ""TargetState"" or ""LandingTargetState"".  If we agree this name is better let\'s also rename, ""get_plnd_target_state()"" to ""get_landing_target_state()"".\r\n\r\n.. let\'s also change the comment above to ""state of the landing target"".\r\n\r\nLet\'s consistently use ""Target"" or ""Landing Target"".  Either is fine but let\'s not mix ""Landing Target"" and ""Target"".', 'comment_created': datetime.datetime(2021, 8, 2, 3, 1, 8, tzinfo=datetime.timezone.utc), 'commenter': 'rmackay9', 'type': 'User'}, {'comment_id': 680625456, 'comment_body': 'How about calling this ""get_last_valid_target_ms()"" or ""get_last_valid_location_target_ms""?  This new name is not fantastic because some may think that it should return the actual target instead of the time of the last estimate..\r\n\r\nMaybe we can rename the ""precland_output"" part of this name.  The problem with ""output"" is that it depends upon your point of view.  One subsystem\'s ""output"" is another subsystems ""input""... and everything in this library is ""precland"" so it\'s not adding value.', 'comment_created': datetime.datetime(2021, 8, 2, 3, 7, 40, tzinfo=datetime.timezone.utc), 'commenter': 'rmackay9', 'type': 'User'}, {'comment_id': 680626028, 'comment_body': 'let\'s rename this to ""get_last_detected_landing_position()"" because it returns a Vector3f instead of a Location. the argument should also be renamed from ""loc"" to ""pos"".', 'comment_created': datetime.datetime(2021, 8, 2, 3, 9, 36, tzinfo=datetime.timezone.utc), 'commenter': 'rmackay9', 'type': 'User'}, {'comment_id': 680626096, 'comment_body': 'NED cm is very odd.. is that correct?  normally it is NED m or NEU cm.', 'comment_created': datetime.datetime(2021, 8, 2, 3, 9, 55, tzinfo=datetime.timezone.utc), 'commenter': 'rmackay9', 'type': 'User'}, {'comment_id': 680626320, 'comment_body': 'let\'s add ""vehicle"" into this method\'s name to make it more clear.  Also same things as above re ""loc"" vs ""pos""', 'comment_created': datetime.datetime(2021, 8, 2, 3, 10, 48, tzinfo=datetime.timezone.utc), 'commenter': 'rmackay9', 'type': 'User'}, {'comment_id': 680626483, 'comment_body': 'Let\'s lose the ""plnd"" part of this and can we return the enum instead of a uint8_t?', 'comment_created': datetime.datetime(2021, 8, 2, 3, 11, 27, tzinfo=datetime.timezone.utc), 'commenter': 'rmackay9', 'type': 'User'}, {'comment_id': 680626637, 'comment_body': 'Let\'s rename ""_max_retry_num"" to ""_retry_max""', 'comment_created': datetime.datetime(2021, 8, 2, 3, 12, 3, tzinfo=datetime.timezone.utc), 'commenter': 'rmackay9', 'type': 'User'}, {'comment_id': 680626914, 'comment_body': 'let\'s remove this ""plnd"" as well and might as well return the enum and keep the names consistent.. so always use ""retry_behave""... e..g. ""get_retry_behave()"" or ""get_retry_behaviour()""', 'comment_created': datetime.datetime(2021, 8, 2, 3, 13, 21, tzinfo=datetime.timezone.utc), 'commenter': 'rmackay9', 'type': 'User'}, {'comment_id': 680627347, 'comment_body': 'sorry for repeating myself but just to be sure, let\'s replace the ""loc"" with ""pos"" in this member\'s name.', 'comment_created': datetime.datetime(2021, 8, 2, 3, 15, 9, tzinfo=datetime.timezone.utc), 'commenter': 'rmackay9', 'type': 'User'}, {'comment_id': 680627538, 'comment_body': 'I think we should add ""_cm"" to _last_vehicle_pos_NED or we should store it in meters.  It\'ll be too easy for future developers to get confused about the units.', 'comment_created': datetime.datetime(2021, 8, 2, 3, 16, 1, tzinfo=datetime.timezone.utc), 'commenter': 'rmackay9', 'type': 'User'}, {'comment_id': 680628195, 'comment_body': 'maybe remove the ""s"" at the end?  I think there\'s is only one state machine.. there are multiple bits of state but there is only one state machine..', 'comment_created': datetime.datetime(2021, 8, 2, 3, 18, 27, tzinfo=datetime.timezone.utc), 'commenter': 'rmackay9', 'type': 'User'}, {'comment_id': 680628420, 'comment_body': ""let's be consistent about whether we use the underscore prefix for the member names.  Either having them or not having them is fine but let's be consistent."", 'comment_created': datetime.datetime(2021, 8, 2, 3, 19, 33, tzinfo=datetime.timezone.utc), 'commenter': 'rmackay9', 'type': 'User'}, {'comment_id': 680629368, 'comment_body': '""Unknown"" (missing ""n"")', 'comment_created': datetime.datetime(2021, 8, 2, 3, 23, 22, tzinfo=datetime.timezone.utc), 'commenter': 'rmackay9', 'type': 'User'}, {'comment_id': 680629841, 'comment_body': 'I think ""do_failsafe_actions()"" might be better off called ""get_failsafe_action"".\r\nIn the comments we should make it clear that this should only be called if update_precland_state_machine() returns FAILSAFE.  I just want the users of this library to understand that this method doesn\'t actually ""do"" anything.. instead it tells the vehicle code what it should do.', 'comment_created': datetime.datetime(2021, 8, 2, 3, 25, 26, tzinfo=datetime.timezone.utc), 'commenter': 'rmackay9', 'type': 'User'}, {'comment_id': 680629923, 'comment_body': 'nitpick: this bracket should be on the previous line I think', 'comment_created': datetime.datetime(2021, 8, 2, 3, 25, 51, tzinfo=datetime.timezone.utc), 'commenter': 'rmackay9', 'type': 'User'}, {'comment_id': 680630030, 'comment_body': 'nitpick: no space between ""DESCEND"" and the "":""', 'comment_created': datetime.datetime(2021, 8, 2, 3, 26, 15, tzinfo=datetime.timezone.utc), 'commenter': 'rmackay9', 'type': 'User'}, {'comment_id': 680631247, 'comment_body': 'maybe we should move ""run_land_controllers("" up to line 115 so that it is with land_run_horizontal_control() and land_run_vertical_control().  Maybe land_repo_active should move up there too.', 'comment_created': datetime.datetime(2021, 8, 2, 3, 30, 59, tzinfo=datetime.timezone.utc), 'commenter': 'rmackay9', 'type': 'User'}, {'comment_id': 680631688, 'comment_body': 'let\'s save some bytes and rename this to ""PrecLand: Init Failed""', 'comment_created': datetime.datetime(2021, 8, 2, 3, 32, 59, tzinfo=datetime.timezone.utc), 'commenter': 'rmackay9', 'type': 'User'}, {'comment_id': 680632084, 'comment_body': 'we could also save some bytes by defining a const char* precland_prefix = ""PrecLand: "" and then \r\n\r\n>> gcs().send_text(MAV_SEVERITY_CRITICAL, ""%sInit Failed"", precland_prefix);\r\n\r\nnot a blocker though', 'comment_created': datetime.datetime(2021, 8, 2, 3, 34, 41, tzinfo=datetime.timezone.utc), 'commenter': 'rmackay9', 'type': 'User'}, {'comment_id': 680633007, 'comment_body': 'might want to rename this to precland_retry_position() but just a suggestion.. not at all a requirement.', 'comment_created': datetime.datetime(2021, 8, 2, 3, 38, 16, tzinfo=datetime.timezone.utc), 'commenter': 'rmackay9', 'type': 'User'}, {'comment_id': 680634614, 'comment_body': ""I guess that we've lost the pause before landing because it isn't sent into run_precland()?"", 'comment_created': datetime.datetime(2021, 8, 2, 3, 44, 36, tzinfo=datetime.timezone.utc), 'commenter': 'rmackay9', 'type': 'User'}, {'comment_id': 690041042, 'comment_body': 'I think we can remove land_repo_active().', 'comment_created': datetime.datetime(2021, 8, 17, 5, 15, 47, tzinfo=datetime.timezone.utc), 'commenter': 'rmackay9', 'type': 'User'}, {'comment_id': 690047782, 'comment_body': '```suggestion\r\n            switch (copter.precland_statemachine.get_failsafe_action()) {\r\n```', 'comment_created': datetime.datetime(2021, 8, 17, 5, 33, 37, tzinfo=datetime.timezone.utc), 'commenter': 'peterbarker', 'type': 'User'}, {'comment_id': 690048303, 'comment_body': '```suggestion\r\n        switch (copter.precland_statemachine.update(retry_pos)) {\r\n```', 'comment_created': datetime.datetime(2021, 8, 17, 5, 34, 43, tzinfo=datetime.timezone.utc), 'commenter': 'peterbarker', 'type': 'User'}, {'comment_id': 690049523, 'comment_body': ""```suggestion\r\n    // returns true if pilot is repositioning the vehicle manually in landing modes\r\n```\r\n\r\n... but we proabbly don't need this"", 'comment_created': datetime.datetime(2021, 8, 17, 5, 37, 37, tzinfo=datetime.timezone.utc), 'commenter': 'peterbarker', 'type': 'User'}, {'comment_id': 690050433, 'comment_body': '```suggestion\r\n    // Run precland statemachine. This function should be called from any mode that wants to do precision landing.\r\n```', 'comment_created': datetime.datetime(2021, 8, 17, 5, 40, 6, tzinfo=datetime.timezone.utc), 'commenter': 'peterbarker', 'type': 'User'}, {'comment_id': 690051901, 'comment_body': '```suggestion\r\n        // the state machine takes care of the entire landing procedure.  Except for land_pause.\r\n```', 'comment_created': datetime.datetime(2021, 8, 17, 5, 43, 54, tzinfo=datetime.timezone.utc), 'commenter': 'peterbarker', 'type': 'User'}, {'comment_id': 690053404, 'comment_body': '```suggestion\r\n    // @Values: 0: Land Vertically (Not strict), 1: Retry Landing(Normal Strictness), 2: Do not land (just Hover) (Very Strict)\r\n```', 'comment_created': datetime.datetime(2021, 8, 17, 5, 47, 48, tzinfo=datetime.timezone.utc), 'commenter': 'peterbarker', 'type': 'User'}, {'comment_id': 690054341, 'comment_body': '```suggestion\r\n    // init as target-never-seen, we will update this later\r\n```', 'comment_created': datetime.datetime(2021, 8, 17, 5, 50, 3, tzinfo=datetime.timezone.utc), 'commenter': 'peterbarker', 'type': 'User'}, {'comment_id': 690055408, 'comment_body': '```suggestion\r\n    }\r\n\r\n    if (_current_target_state == TargetState::TARGET_FOUND ||\r\n```', 'comment_created': datetime.datetime(2021, 8, 17, 5, 52, 29, tzinfo=datetime.timezone.utc), 'commenter': 'peterbarker', 'type': 'User'}, {'comment_id': 690055612, 'comment_body': 'Let\'s add a comment above this line to say something like, ""// allow user to take control during repositining.  Note: copied from land_run_horizontal_control()""', 'comment_created': datetime.datetime(2021, 8, 17, 5, 53, 5, tzinfo=datetime.timezone.utc), 'commenter': 'rmackay9', 'type': 'User'}, {'comment_id': 690055926, 'comment_body': '```suggestion\r\n    // We definitely do not have the target in sight\r\n```', 'comment_created': datetime.datetime(2021, 8, 17, 5, 53, 52, tzinfo=datetime.timezone.utc), 'commenter': 'peterbarker', 'type': 'User'}, {'comment_id': 690058451, 'comment_body': '```suggestion\r\n    // check if the precision landing sensor is supposed to be in range\r\n```', 'comment_created': datetime.datetime(2021, 8, 17, 5, 59, 56, tzinfo=datetime.timezone.utc), 'commenter': 'peterbarker', 'type': 'User'}, {'comment_id': 690059279, 'comment_body': '```suggestion\r\n```', 'comment_created': datetime.datetime(2021, 8, 17, 6, 1, 52, tzinfo=datetime.timezone.utc), 'commenter': 'peterbarker', 'type': 'User'}, {'comment_id': 690061788, 'comment_body': 'Can this be const?\r\n', 'comment_created': datetime.datetime(2021, 8, 17, 6, 7, 42, tzinfo=datetime.timezone.utc), 'commenter': 'peterbarker', 'type': 'User'}]","[{'commit_sha': '3c66f227db87953f5b27f0039b6f6df62aaa936d', 'committer_username': 'rishabsingh3003', 'committer_name': 'Rishabh Singh', 'committer_email': 'f20171602@hyderabad.bits-pilani.ac.in', 'commit_date': datetime.datetime(2018, 3, 1, 20, 17, 10, tzinfo=datetime.timezone.utc)}, {'commit_sha': 'fe9a206db41ce337926e04c9156824b805d7bf72', 'committer_username': 'rishabsingh3003', 'committer_name': 'Rishabh Singh', 'committer_email': 'f20171602@hyderabad.bits-pilani.ac.in', 'commit_date': datetime.datetime(2018, 3, 1, 20, 17, 10, tzinfo=datetime.timezone.utc)}, {'commit_sha': 'fda009cfcbf73caa4a3234159ac5573711159e61', 'committer_username': 'rishabsingh3003', 'committer_name': 'Rishabh Singh', 'committer_email': 'f20171602@hyderabad.bits-pilani.ac.in', 'commit_date': datetime.datetime(2018, 3, 1, 20, 17, 10, tzinfo=datetime.timezone.utc)}]",Rishabh Singh,36970042,f20171602@hyderabad.bits-pilani.ac.in,User,,17,,6,80
