Id,Title,Description,Contributor,Mentor,Organization,Archive,Github
1, Built-In Reports for Reference Application ,Create new reports which are out of the box for currently available reports. This would be shipped with the reference application of OpenMRS as a..., M. A. Jude Niroshan , Mentor  Rafal Korytkowski , Organization  OpenMRS ,/archive/2017/projects/6268985536413696,https://medium.com/@jude.niroshan11/google-summer-of-code-with-openmrs-76ecb476f9d0
2, Long term analysis ,Integrating the existing Longcuckoo into the latest version of Cuckoo Sandbox so that Cuckoo Sandbox long term analysis will be available to all..., Ricardo van Zutphen ," Mentor  Jurriaan Bremer, Alessandro Tanasi ", Organization  The Honeynet Project ,/archive/2017/projects/6271040409829376,https://gist.github.com/RicoVZ/a93639a94339a6a1e04dc223ca7c6eb9
3, CBT IntelliJ IDEA‎ plugin ,Add an IntelliJ IDEA‎ support for the CBT by writing a plugin or extending an exciting Scala plugin., Ilya Kirillov , Mentor  cvogt , Organization  Scala ,/archive/2017/projects/6272763362803712,https://github.com/cvogt/cbt/blob/master/doc/intellij-gsoc.md
4, Multi-modal Cluttered Scene Analysis in Knowledge Intensive Scenarios ,This project implements Object Segmentation approaches based on Symmetry Constraints in knowledge intensive scenarios. The final documentation..., An T. Le ," Mentor  Jan-Hendrik, Ferenc Balint-Benczedi ", Organization  Institute for Artificial Intelligence ,/archive/2017/projects/6278948115709952,https://gist.github.com/anindex/ee4b32e73973ab24d3d7a17ab6486b9d
5, Pan-Genome Module for the Genome Context Viewer ,"With the number of sequenced and annotated genomes continuously increasing, there is a need for new algorithms and tools for comparative analyses...", Alan Cleary , Mentor  adf_ncgr , Organization  Open Genome Informatics ,/archive/2017/projects/6280625434656768,https://docs.google.com/document/d/13lIITV_ND3Dj9pjvx5Q59045iSMOfF2BPZIKJQvy4RA/edit?usp=sharing
6, Adding custom features while Upgrading and updating Quiz extension ,"Quiz extension is currently used on several WMF projects, such as Wikiversity but has lot of bugs and limited features for users.The project aims to...", Harjot Singh Bhatia ," Mentor  reedy, Mvolz ", Organization  Wikimedia Foundation ,/archive/2017/projects/6281949895196672,https://gist.github.com/hsb4995/2f47e62e520bdd9365a4eeb5cef9a283
7, Proposal for Add Support for Version Control (Git) ,"Inside this proposal, I introduce my project goals of GSoC 2017 and bring out a tentative timeline to achieve them.  To make sure I can finish it in...", Xin Wen , Mentor  Urs Liska , Organization  Frescobaldi ,/archive/2017/projects/6285598469914624,https://github.com/wbsoft/frescobaldi/wiki/GSoC-2017:-Git-Support-(final-report)
8, Implement oVirt integration tests using Lago ,Complete the ovirt-system-tests with the necessary tests, Valentina Makarova , Mentor  Milan Zamazal , Organization  oVirt ,/archive/2017/projects/6285779395411968,https://gist.github.com/vmakarova/62c2941d4723bc2673427db22cf72a29
9, Pitivi - UI for the Ken-Burns effect ,The Ken Burns effect is a type of panning and zooming effect used in video production from still imagery. This project aims to provide a way to..., Stefan-Adrian Popa , Mentor  Thibault Saunier , Organization  GNOME ,/archive/2017/projects/6286742004957184,https://gist.github.com/stefanzzz22/260fa2be10bccd7404af87152ecd5a88
10, CO2 EMISSIONS API ,"This project aims to build a RESTful API , that is the one place to go to for any information that you require on Carbon Emissions . The aim is to...", Saisankar ," Mentor  Prateek Gupta, Kolya Opahle, Bruno Woltzenlogel Paleo, Chirag Arora ", Organization  AOSSIE - Australian Open Source Software Innovation and Education ,/archive/2017/projects/6288189677371392,https://gitlab.com/aossie/CarbonFootprint-API/blob/master/docs/GSoC/2017/SaiSankarGochhayat.md
11, Implementing Pop-Routing in OSPF ,"Prince is a network daemon that continuosly monitors the network topology  and  sets  the  timers  for  OLSRv2,  it  is  developed  in  C  and  we ...", Gabriele Gemmi , Mentor  Leonardo Maccari , Organization  Freifunk ,/archive/2017/projects/6288671921668096,https://blog.freifunk.net/2017/08/29/implementing-pop-routing-ospf-final-evaluation-updates/
12, Porting Terra to Android Devices ,"The main goal of the project is, which the title says, to port Terra to Android devices. 
Once I already have Terra ported to android, my intention...", Mauricio Pedro Vieira , Mentor  Adriano Branco , Organization  LabLua ,/archive/2017/projects/6289975310024704,http://afbranco.github.io/Terra/terra-gsoc.html
13, Write supports for BTRFS ,Btrfs (B-tree filesystem) is a filesystem uses Btrees as its main on-disk data structure. It is based on Copy-on-Write (CoW) principle which means it..., Hy Che ," Mentor  mmu_man, Fredrik Holmqvist ", Organization  Haiku ,/archive/2017/projects/6290091542577152,https://www.haiku-os.org/blog/hyche/2017-08-25_gsoc_2017_-_btrfs_write_supports_third_coding_period_-_final_recap/
14, Improve the on-boarding/new user experience in Zulip ,My project would be to improve the on-boarding/new user experience in Zulip, Vishnu Ks , Mentor  Rishi Gupta , Organization  Zulip ,/archive/2017/projects/6292309087879168,http://vishnuks.com/blog/event/gsoc/2017/08/27/google-summer-of-code-2017
15, Enhancing the Loklak app service and adding more apps ,The site at http://apps.loklak.org presently showcases various apps which are build with the loklak api. The aim of this project is to enhance the..., DEEPJYOTI MONDAL ," Mentor  Michael Christen, André Rebentisch, Mario Behling, Greg Austic, Damini Satya, Nicco Kunzmann, Sudheesh Singanamalla ", Organization  FOSSASIA ,/archive/2017/projects/6293649117675520,https://gist.github.com/djmgit/651cd0974956f5aafaef2122b7d008ad
16, Single Precision Support and Gaussian Process Functionality ,PyMC3 contains a rich suite of building blocks for probabilistic modeling and inference.  This proposal contains two parts:  first is finishing..., Bill Engels ," Mentor  Chris Fonnesbeck, Austin Rochford ", Organization  NumFOCUS ,/archive/2017/projects/6297500092727296,https://github.com/pymc-devs/pymc3/pull/2444/commits
17, Parallelism in Bio.jl ,Support parallelism in Bio.jl based on Dagger.jl, Kenta Sato (bicycle1885) ," Mentor  one-more-minute, Shashi Gowda ", Organization  The Julia Language ,/archive/2017/projects/6299634423037952,https://github.com/JuliaLang/julialang.github.com/pull/615
18, RISC-V Simulator for education ,This project aims to support the use of RISC-V in education by providing a simulator to step through assembly programs. This is a similar concept to..., Benjamin Landers , Mentor  Alex Bradbury , Organization  lowRISC ,/archive/2017/projects/6309390843904000,https://github.com/TheThirdOne/rars/releases/tag/v1.0
19, Smoke testing of all base utilities ,Smoke testing is a set of light tests which are done for checking basic functionalities of a software to ascertain if the crucial functions work..., Shivansh Rai ," Mentor  Alan Somers, Brooks Davis ", Organization  FreeBSD ,/archive/2017/projects/6309642233708544,https://wiki.freebsd.org/SummerOfCode2017/SmokeTestingOfBaseUtilities
20, Open Event Orga Android App Development ,"Open Event Orga App is an  Android client for the Open Event Orga API for event management. The app allows organizers to sign up and log in, view...", Areeb Jamal ," Mentor  NiranjanRajendran, Manan Wason, Harshit D (the-dagger), Aayush Arora, Mario Behling, Eden Dang ", Organization  FOSSASIA ,/archive/2017/projects/6312277061926912,https://gist.github.com/iamareebjamal/b7b1eb4c2888715617fe00c57f1978cf
21, IRIS Data Class ,"The project will enable users to use IRIS class objects IRISRaster and IRISSji and its tools to calibrate, visualise and analyse different IRIS data....", Ankit Baruah ," Mentor  Danny Ryan, Steven Christe ", Organization  OpenAstronomy ,/archive/2017/projects/6313559243882496,https://medium.com/@ankit_b/gsoc-2017-fce66e75341
22, Add Ons Enhancements ,This project aims at making certain changes to the existing OpenMRS Add Ons infrastructure thereby making it fit as a complete replacement for the..., Reuben Varghese , Mentor  Darius Jazayeri , Organization  OpenMRS ,/archive/2017/projects/6317855821791232,https://medium.com/@reubenvarghese1/gsoc-2017-add-on-index-enhancements-gist-of-work-done-33caea6c5dd9
23, Educational games add-on for gvSIG Batoví/Educa ,The main idea behind this project is to develop an add-on which allows to create/play educational games. Also generate documentation specially..., Carlos I. Colombana ," Mentor  Nadia Chaer, Francisco Puga ", Organization  OSGeo ,/archive/2017/projects/6319623737704448,https://lists.osgeo.org/pipermail/soc/2017-August/003840.html
24, Firefox Developer Tools: CSS Grid Inspector ,I will be adding and refining existing features to Firefox Devtools' CSS Grid Inspector tool. One major feature I will be working on is the grid..., Micah Tigley , Mentor  gl , Organization  Mozilla ,/archive/2017/projects/6321798064898048,https://tigleym.github.io/GSoC-Work-Submission/
25," Analysis of Scalable Solutions for UPS database with Apache Kafka, Apache Spark and HBase ","The Unified Push Server Database is currently based on MySQL/PostgreSQL, and the data is all stored in one schema. Database updates are handled by a...", Dimitra , Mentor  Massimiliano Ziccardi , Organization  JBoss Community ,/archive/2017/projects/6322957169197056,https://gist.github.com/dimitraz/042e79d712dcee71689186b4ed22bc14
26, Bridging the gap between user and VoIP calls on Riot iOS ,The aim of this project is to improve the overall user experience of using VoIP calls in Riot iOS client by adding support of CallKit framework for..., Denis Morozov , Mentor  Emmanuel ROHEE , Organization  Matrix.org ,/archive/2017/projects/6323334589448192,https://gist.github.com/morozkin/b82381b60d6b88ef2a9316ba0feac707
27, File backend for Rados Gateway ,"RGW, or Rados Gateway is a RESTful gateway that is one of the primary components of ceph, providing both S3 and SWIFT frontend as an interface for...", Pranjal Agrawal , Mentor  Ali Maredia , Organization  Ceph ,/archive/2017/projects/6325122638020608,https://gist.github.com/forumulator/cb5ee5f3ca08b9ba7ded4fe8948d5415
28, Convolutional Deep Neural Networks on GPUs for Particle Physics Applications ,"In the last few years, deep learning has led to very good performance on a variety of problems, such as visual recognition, speech recognition and...", ajatgd ," Mentor  Sergei Gleyzer, Lorenzo Moneta, Stefan Wunsch, Omar Zapata ", Organization  CERN-HSF ,/archive/2017/projects/6326594738061312,https://medium.com/@akshayvashistha1995/google-summer-of-code-summary-92ce7ca48d18
29, GitHub Integration Proposal ,"Design, develop, and implement an application that, when provided with a GitHub repository's URL, generates SPDX (https://spdx.org/) documents based...", Anna Buhman ," Mentor  Phil Ombredanne  SPDX, Gary O'Neall, Uday Korlimarla ", Organization  Software Product Data Exchange (SPDX) ,/archive/2017/projects/6328148979351552,https://github.com/spdx/spdx-github/wiki/Google-Summer-of-Code-SPDX-GitHub-Project
30, Adding support for PSIMI-TAB format to the Disease Variant Impact (DV-IMPACT) Database ,The goal of the project would be to add support for PSIMI-TAB format to the admin tools of the DV-IMPACT database and allow the upload and download..., Raghav Jajodia ," Mentor  Gary Bader, Mohamed Helmy ", Organization  National Resource for Network Biology (NRNB) ,/archive/2017/projects/6329480956084224,http://jajodiaraghav.github.io/gsoc/
31, gr-bokehgui: A Web based GUI for GNU Radio applications ,"Currently, GNU Radio works on a local system (many times connected to a hardware). The display of GNU Radio is based on QT GUI framework. In addition...", Kartik Patel , Mentor  skoslowski , Organization  GNU Radio ,/archive/2017/projects/5129007263645696,https://github.com/kartikp1995/gr-bokehgui/blob/master/README.md
32, Enabling LTE CA handover to secondary cell ,"The goal of my project is implementation of handover to secondary cell in LTE with Carrier Aggregation.
To make it possible I plan to:

Improve...", ilabdsf , Mentor  Biljana Bojovic , Organization  The ns-3 Network Simulator Project ,/archive/2017/projects/5130326087041024,https://www.nsnam.org/wiki/GSOC2017Lte#Project_summary
33, Router Factory for Design Driven Web API Development ,The main objective of my project is to expose functions that generate a Router from an API specification (based on an API specification standard like..., Francesco Guardiani , Mentor  Paulo Lopes , Organization  Eclipse Vert.x ,/archive/2017/projects/5131880328331264,https://gist.github.com/slinkydeveloper/25e4f5543755480635b4dddc449dcf53
34, Open Event Organizer Android Application ,Open Event Organizer is an Android Application for Event Organizers and Entry Managers. It is a client side application for another project under..., mejariamol ," Mentor  NiranjanRajendran, championswimmer, Nayana Adassuriya, Harshit D (the-dagger), Manan Wason, Mario Behling, Victoria Bondarchuk ", Organization  FOSSASIA ,/archive/2017/projects/5132564838744064,https://gist.github.com/mejariamol/9ca7464eb4a977499a04bb0a185303c5
35, Implement Connected Components Algorithms for pgRouting by the Boost Graph Library ,Connected components algorithms are used to analyze graph and solve problems (like 2-satisfiability problem). There are three parts of connected..., Maoguang Wang ," Mentor  cvvergara, Daniel Kastl ", Organization  OSGeo ,/archive/2017/projects/5135673321324544,https://lists.osgeo.org/pipermail/soc/2017-August/003843.html
36, Improving unMessage's Code Quality ,"unMessage is a privacy
enhanced instant messenger that uses its own end-to-end encrypted
protocol to maintain conversations, not depending on...", dau ," Mentor  meejah, David Stainton ", Organization  Tor ,/archive/2017/projects/5136415813795840,https://gist.github.com/felipedau/86045f6ca7e11c81b4373af9d3db811e
37, Port brew audit rules to RuboCop ,brew audit command now runs RuboCop custom cops to enforce and automatically fix Homebrew coding style guidelines within supported editors and using..., Gautham Goli ," Mentor  JCount, Mike McQuaid ", Organization  Homebrew ,/archive/2017/projects/5140405569978368,https://gauthamgoli.github.io/blog/2017/08/16/GSoC-report.html
38, cyTRON: a Cytoscape app for the visualization of evolutionary trajectories in cancer progression ,TRONCO is an R package that implements state-of-the-art algorithms for the inference of cancer progressions with the ultimate goal of understanding..., Edoardo Galimberti ," Mentor  Daniele Ramazzotti, Marco Antoniotti, Vishwesh Kulkarni ", Organization  National Resource for Network Biology (NRNB) ,/archive/2017/projects/5141157457690624,https://github.com/BIMIB-DISCo/cyTRON/blob/master/README.md
39, OpenMRS OWA Generator Improvement ,OWA generator is a tool that uses Yeoman to scaffold an OpenMRS webapp. Scaffolding here represents almost the same meaning as it does in case of..., Ankitkumar94 , Mentor  Pascal Brandt , Organization  OpenMRS ,/archive/2017/projects/5141664800702464,http://techvenomgsoc.blogspot.in/2017/08/week-12-gsoc-final-evaluations.html
40, Visualization Dashboard for Empa-NEST using node-red ,The aim of this project is to develop a visualization dashboard based on node-red and javascript charting library Highcharts which will have a..., Arushee Garg ," Mentor  Reto Fricker, Philipp Heer "," Organization  Urban Energy Systems Laboratory, Empa ",/archive/2017/projects/5143085629571072,https://github.com/arugarg/GSOC2017-VisualizationDashboard-EmpaNest
41, Environment Support for API Manager ,Building capability in the user interfaces of WSO2 API Manager version 3.0.0 (SNAPSHOT version as of now) to switch between different environments..., Ravindu Perera ," Mentor  Kasun Thennakoon, Pubudu Gunatilaka, Thilini Shanika, Nuwan Dias ", Organization  WSO2 ,/archive/2017/projects/5145140502986752,http://ravindublog.tk/gsoc-2017-environment-support-for-wso2-api-manager/
42, Safe Return-To-Launch for ArduPilot ,"This project aims to develop a ""safe"" return-to-launch feature for ArduCopter. This feature allows a copter to autonomously return to its home...", Sebastian Quilter ," Mentor  Randy Mackay, Olivier Brousse ", Organization  ArduPilot ,/archive/2017/projects/5146863455961088,https://discuss.ardupilot.org/t/safertl-mode-for-copter/20486?u=squilter
43, Extending LoxiGen and ONOS to enable SDN control of wireless switches via OpenFlow ,LoxiGen is a tool by the Floodlight project to generate OpenFlow libraries for several programming languages including Java and C. The goal of this..., Arne Kappen , Mentor  Julius Schulz-Zander , Organization  Freifunk ,/archive/2017/projects/5150861667860480,https://blog.freifunk.net/2017/08/26/gsoc-2017-final-milestone/
44, Auto-removal of dead code through vulture ,"vulture is a tool which detects and reports dead (unused) code and coala is an automatic linter.
The motivation of this proposal is to:

Extend...", Rahul Jha [:RJ722] , Mentor  Jendrik , Organization  coala ,/archive/2017/projects/5154725527814144,http://projects.coala.io/GSoC/2017/StatusReport/RahulJha
45, IoT: Android Things Integration on the MIT App Inventor ,"Internet of Things (IoT) is a fast growing field of where sensors are monitoring appliances, actuators, and machines, as well as controlling them...", Thilanka Munasinghe , Mentor  Andrew McKinney , Organization  MIT App Inventor ,/archive/2017/projects/5159698563072000,http://thilankam.github.io/android-things/
46, Making the current browser extension more powerful using REST API. ,This proposal is regarding my ideas on the API for showing results on various carbon emission sources and also enhancing the current browser..., Vaibhav Sharma ," Mentor  Prateek Gupta, Kolya Opahle, Bruno Woltzenlogel Paleo, Chirag Arora ", Organization  AOSSIE - Australian Open Source Software Innovation and Education ,/archive/2017/projects/5159879488569344,https://gitlab.com/aossie/CarbonFootprint/blob/master/doc/GSoC/2017/vaibsharma.md
47, RetroShare Improvements ,"The aim of this proposal is to improve RetroShare incrementally during the summer in the following work lines:

Semi-automatic RetroShare friendship...", ange ," Mentor  Gioacchino Mazzurco, Ál ", Organization  Freifunk ,/archive/2017/projects/5162289770528768,https://gitlab.com/angesoc/RetroShare-GSoC-2017-Report/uploads/a393c3361ebbcdea4dc5a736f2ed8ec6/GSoC_2017_RetroShare_Report-RC3.pdf
48, Add more harvester to loklak server ,"'LOKLAK SERVER' is a distributed message search server to anonymously collect, share, dump and index social media search results.
CURRENTLY...", Vibhor Verma ," Mentor  Mario Behling, Nicco Kunzmann, Michael Christen, Marc Nause ", Organization  FOSSASIA ,/archive/2017/projects/5162772014825472,https://gist.github.com/vibhcool/e7722cbb2196cdeceacfd9e319bd2eb6
49, Rework and fix WebOb’s handling of HTTP Accept headers ,"This is a proposal to rework and fix WebOb's handling of HTTP Accept,
Accept-Language, and (if necessary) Accept-Charset and Accept-Encoding
headers;...", Ira Lun ," Mentor  Michael Merickel, Bert JW Regeer, Steve Piercy ", Organization  Python Software Foundation ,/archive/2017/projects/5164075403182080,https://github.com/whiteroses/gsoc-2017/blob/master/index.md
50," Launching Wagon, a WebAssembly interpreter in Go ","WebAssembly (wasm) is a low level bytecode binary file format made for execution on the Web, designed as a compilation target for various programming...", Vibhav Pant ," Mentor  Sebastien Binet, Alexandre Claude ", Organization  CERN-HSF ,/archive/2017/projects/5164191635734528,https://gist.github.com/vibhavp/f6041cf6e21c2b2285f4056b3230a2b8
