pr_id,pr_title,pr_body,is_merged,pr_number,pr_url,pr_html_url,pr_state,additions,deletions,pr_changed_files,pr_commits_count,pr_comments_count,pr_review_comments_count,pr_labels_count,pr_assignees_count,pr_labels,pr_created_at,pr_closed_at,time_taken,time_delta,pr_review_comments,pr_commits,contributor,contributor_id,contributor_email,contributor_type,contributions,contributor_public_repos,contributor_private_repos,contributor_followings,contributor_followers
657702206,Added Binder setup files,"I'm just opening this pull request draft to get the ball rolling for my Google Summer of Code project. As part of the GRASS and Jupyter Notebook project, we discussed adding setup files to run binder.",True,1603,https://api.github.com/repos/OSGeo/grass/pulls/1603,https://github.com/OSGeo/grass/pull/1603,closed,102,0,4,11,6,11,2,0,"[{'name': 'enhancement'}, {'name': 'gsoc'}]",2021-05-30 13:36:23+00:00,2021-06-10 03:31:00+00:00,914077.0,"10 days, 13:54:37","[{'comment_id': 642126090, 'comment_body': 'This seems to allway build the official master branch. So, it wil not work for testing PRs, right?\r\n\r\nI tried to find some info on how to solve this but did not come across a solution that is known to work, but you could try if it is possible in the postbuild script to:\r\n\r\n1 fetch the url of the current repo:\r\n`git config --get remote.origin.url`\r\n\r\nand\r\n2. use that to clone the code from which GRASS is supposed to be compiled...\r\n\r\nBut maybe @wenzeslaus has some more clear ideas about this...\r\n', 'comment_created': datetime.datetime(2021, 5, 30, 20, 43, 4, tzinfo=datetime.timezone.utc), 'commenter': 'ninsbl', 'type': 'User'}, {'comment_id': 642183951, 'comment_body': ""Just removing all the `cd`s, `mkdir`s and clone should be enough. Binder actually puts the repo content to what is the current directory when the Docker container starts. This makes it simply use always the current code whatever is the the current one, master branch in upstream, branch on a fork, ...\r\n\r\nYou can test that by going to Binder, the URL is (obtained by filling out mybinder.org):\r\n\r\n<https://mybinder.org/v2/gh/chaedri/grass/binder>\r\n\r\n@ninsbl I'm not sure what you are aiming at, but if I understand correctly, if you can do `git config --get remote.origin.url`, you probably have the repo clone already, so you don't need to do it at all."", 'comment_created': datetime.datetime(2021, 5, 31, 3, 8, 15, tzinfo=datetime.timezone.utc), 'commenter': 'wenzeslaus', 'type': 'User'}, {'comment_id': 642186445, 'comment_body': 'As GitHub Changes view says, no new line at the end of file.', 'comment_created': datetime.datetime(2021, 5, 31, 3, 19, 18, tzinfo=datetime.timezone.utc), 'commenter': 'wenzeslaus', 'type': 'User'}, {'comment_id': 642187884, 'comment_body': 'Move the pil and ply dependencies here from the apt file. Delete numpy there. Test if the packages are there, e.g., with (in the notebook):\r\n\r\n```\r\n!grass --tmp-location XY --exec python -c ""import matplotlib""\r\n```', 'comment_created': datetime.datetime(2021, 5, 31, 3, 25, 57, tzinfo=datetime.timezone.utc), 'commenter': 'wenzeslaus', 'type': 'User'}, {'comment_id': 642342167, 'comment_body': '@wenzeslaus , thanks great, I was not aware of how this is handled in binder. I just saw the line that clones the official repo which whould not result in the behavior we discused. So, if compiling from current directory works, that is great and please disregard my suggestion of `git config`...', 'comment_created': datetime.datetime(2021, 5, 31, 9, 14, 30, tzinfo=datetime.timezone.utc), 'commenter': 'ninsbl', 'type': 'User'}, {'comment_id': 642610256, 'comment_body': ""When I try to move the pil and ply dependencies, I get an error when I try to build binder:\r\n\r\n'''\r\nERROR: Could not find a version that satisfies the requirement pil\r\nERROR: No matching distribution found for pil\r\n'''\r\n\r\nFrom my googling, it seems like PIL has to be installed first. Should it remain in the apt file?"", 'comment_created': datetime.datetime(2021, 5, 31, 17, 21, 54, tzinfo=datetime.timezone.utc), 'commenter': 'chaedri', 'type': 'User'}, {'comment_id': 642622639, 'comment_body': '```suggestion\r\nln -s $HOME/grass/bin.*/grass* $HOME/.local/bin/grass\r\n```', 'comment_created': datetime.datetime(2021, 5, 31, 18, 0, 44, tzinfo=datetime.timezone.utc), 'commenter': 'ninsbl', 'type': 'User'}, {'comment_id': 642653880, 'comment_body': ""What is in the apt file goes to system Python and is not available in the notebook or GRASS when I test in the notebook using the above (which is using conda in this default Binder setup). You can try to confirm it. If that holds, apt file is not useful for Python packages. And python and python-dev should not be there either (I'm not even sure how python-dev got there, maybe to compile numpy or something).\r\n\r\nWhat you import as pil, is installed with its proper name PIL. The requirements file goes to this repo: https://pypi.org/project/PIL/. So try PIL."", 'comment_created': datetime.datetime(2021, 5, 31, 19, 42, 20, tzinfo=datetime.timezone.utc), 'commenter': 'wenzeslaus', 'type': 'User'}, {'comment_id': 642654511, 'comment_body': '@chaedri to test this use `!grass --version` in the notebook or `grass --version` in a shell you get in the JupyterLab.', 'comment_created': datetime.datetime(2021, 5, 31, 19, 44, 47, tzinfo=datetime.timezone.utc), 'commenter': 'wenzeslaus', 'type': 'User'}, {'comment_id': 647929990, 'comment_body': 'The source code is directly in $HOME and the `bin...` directory resulting from the build is in the source code.\r\n\r\n```suggestion\r\nln -s $HOME/bin.*/grass* $HOME/.local/bin/grass\r\n```', 'comment_created': datetime.datetime(2021, 6, 9, 2, 59, 50, tzinfo=datetime.timezone.utc), 'commenter': 'wenzeslaus', 'type': 'User'}, {'comment_id': 647930727, 'comment_body': 'The first `grass` part is still one dir extra here even in the suggestion.', 'comment_created': datetime.datetime(2021, 6, 9, 3, 2, 8, tzinfo=datetime.timezone.utc), 'commenter': 'wenzeslaus', 'type': 'User'}]","[{'commit_sha': '4b6db7dafe4d063a5c39c7ce7fa140c316e05d6d', 'committer_username': 'chaedri', 'committer_name': 'Caitlin Haedrich', 'committer_email': None, 'commit_date': datetime.datetime(2020, 8, 18, 13, 41, 56, tzinfo=datetime.timezone.utc)}, {'commit_sha': 'f041567b0266111fd53c3fccc08a0ef23f38c580', 'committer_username': 'chaedri', 'committer_name': 'Caitlin Haedrich', 'committer_email': None, 'commit_date': datetime.datetime(2020, 8, 18, 13, 41, 56, tzinfo=datetime.timezone.utc)}, {'commit_sha': '0f77e8554a5df77a7b7a0d672f03b0ddf5d2d7e0', 'committer_username': 'chaedri', 'committer_name': 'Caitlin Haedrich', 'committer_email': None, 'commit_date': datetime.datetime(2020, 8, 18, 13, 41, 56, tzinfo=datetime.timezone.utc)}, {'commit_sha': 'acb88cc429aa12912da0b1eff696e8f28a135a19', 'committer_username': 'chaedri', 'committer_name': 'Caitlin Haedrich', 'committer_email': None, 'commit_date': datetime.datetime(2020, 8, 18, 13, 41, 56, tzinfo=datetime.timezone.utc)}, {'commit_sha': '271d50d9c1434c25ccbd7c0b99236822c5949f08', 'committer_username': 'chaedri', 'committer_name': 'Caitlin Haedrich', 'committer_email': None, 'commit_date': datetime.datetime(2020, 8, 18, 13, 41, 56, tzinfo=datetime.timezone.utc)}, {'commit_sha': '92e9cc91521f4de6c1f8103fb2ec29bdb6c9d9a3', 'committer_username': 'chaedri', 'committer_name': 'Caitlin Haedrich', 'committer_email': None, 'commit_date': datetime.datetime(2020, 8, 18, 13, 41, 56, tzinfo=datetime.timezone.utc)}, {'commit_sha': 'ca0dbe91b145657ca996d8b3434df1f552c685ac', 'committer_username': 'chaedri', 'committer_name': 'Caitlin Haedrich', 'committer_email': None, 'commit_date': datetime.datetime(2020, 8, 18, 13, 41, 56, tzinfo=datetime.timezone.utc)}, {'commit_sha': '86cc233cf34e0e8e80b28fbe7ae022ee21a23c00', 'committer_username': 'chaedri', 'committer_name': 'Caitlin Haedrich', 'committer_email': None, 'commit_date': datetime.datetime(2020, 8, 18, 13, 41, 56, tzinfo=datetime.timezone.utc)}, {'commit_sha': 'b410973e50c9a3122d8ed6935d104a0a531b47cf', 'committer_username': 'chaedri', 'committer_name': 'Caitlin Haedrich', 'committer_email': None, 'commit_date': datetime.datetime(2020, 8, 18, 13, 41, 56, tzinfo=datetime.timezone.utc)}, {'commit_sha': '55e70b85bfa05d1cc8482c349a587ea79c2866b0', 'committer_username': 'chaedri', 'committer_name': 'Caitlin Haedrich', 'committer_email': None, 'commit_date': datetime.datetime(2020, 8, 18, 13, 41, 56, tzinfo=datetime.timezone.utc)}, {'commit_sha': '1119c24f9fe0dc6834029e0de84f65d9dcce5c89', 'committer_username': 'chaedri', 'committer_name': 'Caitlin Haedrich', 'committer_email': None, 'commit_date': datetime.datetime(2020, 8, 18, 13, 41, 56, tzinfo=datetime.timezone.utc)}]",Caitlin Haedrich,69856275,,User,,31,,5,13
657702206,Added Binder setup files,"I'm just opening this pull request draft to get the ball rolling for my Google Summer of Code project. As part of the GRASS and Jupyter Notebook project, we discussed adding setup files to run binder.",True,1603,https://api.github.com/repos/OSGeo/grass/pulls/1603,https://github.com/OSGeo/grass/pull/1603,closed,102,0,4,11,6,11,2,0,"[{'name': 'enhancement'}, {'name': 'gsoc'}]",2021-05-30 13:36:23+00:00,2021-06-10 03:31:00+00:00,914077.0,"10 days, 13:54:37","[{'comment_id': 642126090, 'comment_body': 'This seems to allway build the official master branch. So, it wil not work for testing PRs, right?\r\n\r\nI tried to find some info on how to solve this but did not come across a solution that is known to work, but you could try if it is possible in the postbuild script to:\r\n\r\n1 fetch the url of the current repo:\r\n`git config --get remote.origin.url`\r\n\r\nand\r\n2. use that to clone the code from which GRASS is supposed to be compiled...\r\n\r\nBut maybe @wenzeslaus has some more clear ideas about this...\r\n', 'comment_created': datetime.datetime(2021, 5, 30, 20, 43, 4, tzinfo=datetime.timezone.utc), 'commenter': 'ninsbl', 'type': 'User'}, {'comment_id': 642183951, 'comment_body': ""Just removing all the `cd`s, `mkdir`s and clone should be enough. Binder actually puts the repo content to what is the current directory when the Docker container starts. This makes it simply use always the current code whatever is the the current one, master branch in upstream, branch on a fork, ...\r\n\r\nYou can test that by going to Binder, the URL is (obtained by filling out mybinder.org):\r\n\r\n<https://mybinder.org/v2/gh/chaedri/grass/binder>\r\n\r\n@ninsbl I'm not sure what you are aiming at, but if I understand correctly, if you can do `git config --get remote.origin.url`, you probably have the repo clone already, so you don't need to do it at all."", 'comment_created': datetime.datetime(2021, 5, 31, 3, 8, 15, tzinfo=datetime.timezone.utc), 'commenter': 'wenzeslaus', 'type': 'User'}, {'comment_id': 642186445, 'comment_body': 'As GitHub Changes view says, no new line at the end of file.', 'comment_created': datetime.datetime(2021, 5, 31, 3, 19, 18, tzinfo=datetime.timezone.utc), 'commenter': 'wenzeslaus', 'type': 'User'}, {'comment_id': 642187884, 'comment_body': 'Move the pil and ply dependencies here from the apt file. Delete numpy there. Test if the packages are there, e.g., with (in the notebook):\r\n\r\n```\r\n!grass --tmp-location XY --exec python -c ""import matplotlib""\r\n```', 'comment_created': datetime.datetime(2021, 5, 31, 3, 25, 57, tzinfo=datetime.timezone.utc), 'commenter': 'wenzeslaus', 'type': 'User'}, {'comment_id': 642342167, 'comment_body': '@wenzeslaus , thanks great, I was not aware of how this is handled in binder. I just saw the line that clones the official repo which whould not result in the behavior we discused. So, if compiling from current directory works, that is great and please disregard my suggestion of `git config`...', 'comment_created': datetime.datetime(2021, 5, 31, 9, 14, 30, tzinfo=datetime.timezone.utc), 'commenter': 'ninsbl', 'type': 'User'}, {'comment_id': 642610256, 'comment_body': ""When I try to move the pil and ply dependencies, I get an error when I try to build binder:\r\n\r\n'''\r\nERROR: Could not find a version that satisfies the requirement pil\r\nERROR: No matching distribution found for pil\r\n'''\r\n\r\nFrom my googling, it seems like PIL has to be installed first. Should it remain in the apt file?"", 'comment_created': datetime.datetime(2021, 5, 31, 17, 21, 54, tzinfo=datetime.timezone.utc), 'commenter': 'chaedri', 'type': 'User'}, {'comment_id': 642622639, 'comment_body': '```suggestion\r\nln -s $HOME/grass/bin.*/grass* $HOME/.local/bin/grass\r\n```', 'comment_created': datetime.datetime(2021, 5, 31, 18, 0, 44, tzinfo=datetime.timezone.utc), 'commenter': 'ninsbl', 'type': 'User'}, {'comment_id': 642653880, 'comment_body': ""What is in the apt file goes to system Python and is not available in the notebook or GRASS when I test in the notebook using the above (which is using conda in this default Binder setup). You can try to confirm it. If that holds, apt file is not useful for Python packages. And python and python-dev should not be there either (I'm not even sure how python-dev got there, maybe to compile numpy or something).\r\n\r\nWhat you import as pil, is installed with its proper name PIL. The requirements file goes to this repo: https://pypi.org/project/PIL/. So try PIL."", 'comment_created': datetime.datetime(2021, 5, 31, 19, 42, 20, tzinfo=datetime.timezone.utc), 'commenter': 'wenzeslaus', 'type': 'User'}, {'comment_id': 642654511, 'comment_body': '@chaedri to test this use `!grass --version` in the notebook or `grass --version` in a shell you get in the JupyterLab.', 'comment_created': datetime.datetime(2021, 5, 31, 19, 44, 47, tzinfo=datetime.timezone.utc), 'commenter': 'wenzeslaus', 'type': 'User'}, {'comment_id': 647929990, 'comment_body': 'The source code is directly in $HOME and the `bin...` directory resulting from the build is in the source code.\r\n\r\n```suggestion\r\nln -s $HOME/bin.*/grass* $HOME/.local/bin/grass\r\n```', 'comment_created': datetime.datetime(2021, 6, 9, 2, 59, 50, tzinfo=datetime.timezone.utc), 'commenter': 'wenzeslaus', 'type': 'User'}, {'comment_id': 647930727, 'comment_body': 'The first `grass` part is still one dir extra here even in the suggestion.', 'comment_created': datetime.datetime(2021, 6, 9, 3, 2, 8, tzinfo=datetime.timezone.utc), 'commenter': 'wenzeslaus', 'type': 'User'}]","[{'commit_sha': '4b6db7dafe4d063a5c39c7ce7fa140c316e05d6d', 'committer_username': 'chaedri', 'committer_name': 'Caitlin Haedrich', 'committer_email': None, 'commit_date': datetime.datetime(2020, 8, 18, 13, 41, 56, tzinfo=datetime.timezone.utc)}, {'commit_sha': 'f041567b0266111fd53c3fccc08a0ef23f38c580', 'committer_username': 'chaedri', 'committer_name': 'Caitlin Haedrich', 'committer_email': None, 'commit_date': datetime.datetime(2020, 8, 18, 13, 41, 56, tzinfo=datetime.timezone.utc)}, {'commit_sha': '0f77e8554a5df77a7b7a0d672f03b0ddf5d2d7e0', 'committer_username': 'chaedri', 'committer_name': 'Caitlin Haedrich', 'committer_email': None, 'commit_date': datetime.datetime(2020, 8, 18, 13, 41, 56, tzinfo=datetime.timezone.utc)}, {'commit_sha': 'acb88cc429aa12912da0b1eff696e8f28a135a19', 'committer_username': 'chaedri', 'committer_name': 'Caitlin Haedrich', 'committer_email': None, 'commit_date': datetime.datetime(2020, 8, 18, 13, 41, 56, tzinfo=datetime.timezone.utc)}, {'commit_sha': '271d50d9c1434c25ccbd7c0b99236822c5949f08', 'committer_username': 'chaedri', 'committer_name': 'Caitlin Haedrich', 'committer_email': None, 'commit_date': datetime.datetime(2020, 8, 18, 13, 41, 56, tzinfo=datetime.timezone.utc)}, {'commit_sha': '92e9cc91521f4de6c1f8103fb2ec29bdb6c9d9a3', 'committer_username': 'chaedri', 'committer_name': 'Caitlin Haedrich', 'committer_email': None, 'commit_date': datetime.datetime(2020, 8, 18, 13, 41, 56, tzinfo=datetime.timezone.utc)}, {'commit_sha': 'ca0dbe91b145657ca996d8b3434df1f552c685ac', 'committer_username': 'chaedri', 'committer_name': 'Caitlin Haedrich', 'committer_email': None, 'commit_date': datetime.datetime(2020, 8, 18, 13, 41, 56, tzinfo=datetime.timezone.utc)}, {'commit_sha': '86cc233cf34e0e8e80b28fbe7ae022ee21a23c00', 'committer_username': 'chaedri', 'committer_name': 'Caitlin Haedrich', 'committer_email': None, 'commit_date': datetime.datetime(2020, 8, 18, 13, 41, 56, tzinfo=datetime.timezone.utc)}, {'commit_sha': 'b410973e50c9a3122d8ed6935d104a0a531b47cf', 'committer_username': 'chaedri', 'committer_name': 'Caitlin Haedrich', 'committer_email': None, 'commit_date': datetime.datetime(2020, 8, 18, 13, 41, 56, tzinfo=datetime.timezone.utc)}, {'commit_sha': '55e70b85bfa05d1cc8482c349a587ea79c2866b0', 'committer_username': 'chaedri', 'committer_name': 'Caitlin Haedrich', 'committer_email': None, 'commit_date': datetime.datetime(2020, 8, 18, 13, 41, 56, tzinfo=datetime.timezone.utc)}, {'commit_sha': '1119c24f9fe0dc6834029e0de84f65d9dcce5c89', 'committer_username': 'chaedri', 'committer_name': 'Caitlin Haedrich', 'committer_email': None, 'commit_date': datetime.datetime(2020, 8, 18, 13, 41, 56, tzinfo=datetime.timezone.utc)}]",Caitlin Haedrich,69856275,,User,,31,,5,13
