pr_id,pr_title,pr_body,is_merged,pr_number,pr_url,pr_html_url,pr_state,additions,deletions,pr_changed_files,pr_commits_count,pr_comments_count,pr_review_comments_count,pr_labels_count,pr_assignees_count,pr_labels,pr_created_at,pr_closed_at,time_taken,time_delta,pr_review_comments,pr_commits,contributor,contributor_id,contributor_email,contributor_type,contributions,contributor_public_repos,contributor_private_repos,contributor_followings,contributor_followers
676945422,Optimization of DAG,"1. Added optimize method for Real number, which user can call. Its implemented by traversal on shared pointers rather than reals, as traversal on real requires typecasting of shared pointers to real.
2. Added 2 variables - optimize_freq which denotes number of nodes after which every time we optimize. num_nodes maintain the number of nodes added in tree after last optimization. They are used in set_optimize_freq method. num_nodes is updated every time there is an operation like +=, -=, *=, /=.
3. Added method to find number of nodes, for it is required for finding num_nodes in real operation. 
4. Modified the print_tree method by traversing on shared pointers rather than reals, as traversal on real requires typecasting of shared pointers to real. Tested it and gave a huge improvement.
5. Corrected some typo's in check and distribute function. Also made the reals one and two in this function as static, so that they have the same address. Having same address will help us optimize such cases also.
6. Added two more variables - use_prev and prev_top which stores the result of previous optimization for next. This way we can simplify further two calls of optimization. 
7. Added tests for optimize() and set_optimize_freq() methods.",True,9,https://api.github.com/repos/BoostGSoC21/Real/pulls/9,https://github.com/BoostGSoC21/Real/pull/9,closed,775,33,3,5,1,19,0,0,[],2021-06-24 09:28:44+00:00,2021-07-26 12:44:05+00:00,2776521.0,"32 days, 3:15:21","[{'comment_id': 669698242, 'comment_body': ""shouldn't you also set the optimize_freq, use_prev and prev_top private attributes as well?\r\n"", 'comment_created': datetime.datetime(2021, 7, 14, 15, 0, 4, tzinfo=datetime.timezone.utc), 'commenter': 'Laouen', 'type': 'User'}, {'comment_id': 669716246, 'comment_body': '1. Why not to define these private atributes inside the real_data structure so you have no need to maintain them separately. It seems that if these optimizations are part of real numbers, then it make sens to store the optimization attributes inside the real_data structure. Maybe, it can be even better to store these variables in a real_optimizer_data structure inside the real_data.\r\n2. Just for consistency, if there is a reason to not encapsulate  the attributes of the optimizer, put them before the private constructor to have a consistent declaration order attributes then constructors.', 'comment_created': datetime.datetime(2021, 7, 14, 15, 20, 46, tzinfo=datetime.timezone.utc), 'commenter': 'Laouen', 'type': 'User'}, {'comment_id': 669718958, 'comment_body': 'You use this pattern in multiple places, why not to declare a single function to encapsulate this behavior.\r\n\r\n```\r\nincrement_and_check_if_optimize(int num_nodes) {\r\n    this->num_nodes = num_nodes;\r\n    this->check_if_optimize();\r\n}\r\n```', 'comment_created': datetime.datetime(2021, 7, 14, 15, 23, 57, tzinfo=datetime.timezone.utc), 'commenter': 'Laouen', 'type': 'User'}, {'comment_id': 669724818, 'comment_body': ""In operation nodes shuldn''t this->num_nodes be 3 instead of 2? you have two children and a parent node."", 'comment_created': datetime.datetime(2021, 7, 14, 15, 30, 50, tzinfo=datetime.timezone.utc), 'commenter': 'Laouen', 'type': 'User'}, {'comment_id': 669751831, 'comment_body': 'because `num_nodes` is a counter from the last optimization I suggest using a more descriptive name even if it ends up longer. When I read `num_nodes` I spect having stored in the variable the total number of nodes within the tree, but this is not the case. A better name can be something like `num_nodes_without_optimization` or something describing the fact that the counter is reseated after each optimization. ', 'comment_created': datetime.datetime(2021, 7, 14, 16, 2, 23, tzinfo=datetime.timezone.utc), 'commenter': 'Laouen', 'type': 'User'}, {'comment_id': 669755912, 'comment_body': ""find_num_nodes shouldn't be 5? 3 leaf nodes (b, 5 and a) and 2 operation nodes (+ and *).\r\n\r\nI think this question also answers my previous question about setting num_nodes = 2 in operations. "", 'comment_created': datetime.datetime(2021, 7, 14, 16, 7, 41, tzinfo=datetime.timezone.utc), 'commenter': 'Laouen', 'type': 'User'}, {'comment_id': 669766164, 'comment_body': '1. Why is this break here? It seems you are looking for the first positive count. Is this correct? Why? and if so, why not to use a std::find function for it? I understand that you are first looking the first positive count and then looping to process all counts? what is the role of the `first` boolean variable? \r\n', 'comment_created': datetime.datetime(2021, 7, 14, 16, 20, 51, tzinfo=datetime.timezone.utc), 'commenter': 'Laouen', 'type': 'User'}, {'comment_id': 669787810, 'comment_body': 'Here num_nodes refer to the number of variables in expression. Here it would be 2, as the parent node is an operation number. It makes sense to be the number of variables, which the user can understand.', 'comment_created': datetime.datetime(2021, 7, 14, 16, 50, 9, tzinfo=datetime.timezone.utc), 'commenter': 'div5252', 'type': 'User'}, {'comment_id': 669788699, 'comment_body': 'As I have answered above, it will have 3 variables - a, b and 5.', 'comment_created': datetime.datetime(2021, 7, 14, 16, 51, 29, tzinfo=datetime.timezone.utc), 'commenter': 'div5252', 'type': 'User'}, {'comment_id': 669804732, 'comment_body': ""Let us take an example, 5\\*a+3\\*b-4\\*c. Now first the optimized tree would consist of multiplication of 5 and a, after that we also need to join 3\\*b by + and 4\\*c by -. If first expression is constructed, others need to be joined by +/-. Now it is also not necessary that first should be the first element of map, for in case if the count of element is 0, we don't add to our new tree. If first doesn't occur, that means the number is 0, which I have taken care of at the end.\r\n\r\nTake another example, -a+b-c = (-1) \\* a + b + (-1) \\* c. Here number of nodes is 5. If we write it as b - a - c, number of nodes would be 3. In case it was all negative counts, i.e. -a-b-c, then there is no option but to simplify it as (-1) \\* a - b - c.\r\nYes, I can use std::find_if, if required."", 'comment_created': datetime.datetime(2021, 7, 14, 17, 14, 45, tzinfo=datetime.timezone.utc), 'commenter': 'div5252', 'type': 'User'}, {'comment_id': 669807013, 'comment_body': 'How does `num_variables_after_last_optimize` sound?', 'comment_created': datetime.datetime(2021, 7, 14, 17, 18, 2, tzinfo=datetime.timezone.utc), 'commenter': 'div5252', 'type': 'User'}, {'comment_id': 669829827, 'comment_body': 'Do you think it is better if the optimization attributes are also transferred to the copies? If yes, then I will correct it.', 'comment_created': datetime.datetime(2021, 7, 14, 17, 51, 11, tzinfo=datetime.timezone.utc), 'commenter': 'div5252', 'type': 'User'}, {'comment_id': 669929777, 'comment_body': 'I think yes. If you do a copy of an element, then, you want something exactly like that element, including his state. The optimization state is part or the element state.', 'comment_created': datetime.datetime(2021, 7, 14, 20, 27, 8, tzinfo=datetime.timezone.utc), 'commenter': 'Laouen', 'type': 'User'}, {'comment_id': 669931494, 'comment_body': ""Ok, perfect, but maybe the name num_nodes can be misunderstood as the number of nodes instead of the number of variables. Don't you think? maybe should be called num_vars? "", 'comment_created': datetime.datetime(2021, 7, 14, 20, 29, 33, tzinfo=datetime.timezone.utc), 'commenter': 'Laouen', 'type': 'User'}, {'comment_id': 669932979, 'comment_body': 'Ok, that name sound mutch better. It\'\'s kind of too long thought, but if there is no descriptive shorter name, then it is better to have a long descriptive name than a short confusing name.  There is that saying ""written once and reader million times"" ', 'comment_created': datetime.datetime(2021, 7, 14, 20, 32, 4, tzinfo=datetime.timezone.utc), 'commenter': 'Laouen', 'type': 'User'}, {'comment_id': 669942107, 'comment_body': 'not sure to fully understand this. We will discuss it in the call this friday', 'comment_created': datetime.datetime(2021, 7, 14, 20, 47, 8, tzinfo=datetime.timezone.utc), 'commenter': 'Laouen', 'type': 'User'}, {'comment_id': 671798971, 'comment_body': ""@Laouen I don't think we can keep them in a new file or real_data because of this attribute - \r\n`std::pair<std::shared_ptr<real_data<T>>, std::map<std::shared_ptr<real_data<T>>, int>> prev_top;`\r\nMaybe I will encapsulate all those 4 variables in a structure in real.hpp file.\r\nWhat do you say?"", 'comment_created': datetime.datetime(2021, 7, 18, 7, 38, 39, tzinfo=datetime.timezone.utc), 'commenter': 'div5252', 'type': 'User'}, {'comment_id': 671804575, 'comment_body': 'Or I can make a structure in a new file `real_optimization_data.hpp` containing `real_data.hpp` file. And then include `real_optimization_data.hpp` in `real.hpp`. ', 'comment_created': datetime.datetime(2021, 7, 18, 8, 21, 54, tzinfo=datetime.timezone.utc), 'commenter': 'div5252', 'type': 'User'}, {'comment_id': 673108202, 'comment_body': 'Ok, definitively having a new file `real_optimizacion_data.hpp`  containing `real_data.hpp` is not a good idea from a semantical point of view because a real number is not in essence an optimized real number. But I think you can create the new file you suggested `real_optimization_data.hpp` with a structure containing the 4 optimization variables and then import that file from the `real.hpp` file to use it in the same way as the real_data.hpp file is been used. Because there is no circular dependencies between the new `real_optimization_data.hpp` and the existing `real_data.hpp` you are able to import `real_data.hpp` in the new `real_optimiation_data.hpp` file in order to declare the `std::pair<std::shared_ptr<real_data<T>>, std::map<std::shared_ptr<real_data<T>>, int>> prev_top;` attribute.', 'comment_created': datetime.datetime(2021, 7, 20, 13, 11, 17, tzinfo=datetime.timezone.utc), 'commenter': 'Laouen', 'type': 'User'}]","[{'commit_sha': 'a3e0b4a5f1a3e25f7d9f753d0575c775c338a7c0', 'committer_username': 'div5252', 'committer_name': 'Divyam Singal', 'committer_email': 'divyamsingal01@gmail.com', 'commit_date': datetime.datetime(2019, 8, 31, 6, 47, tzinfo=datetime.timezone.utc)}, {'commit_sha': 'bea27a853d0e95bf220deaa49247905f3e1abf69', 'committer_username': 'div5252', 'committer_name': 'Divyam Singal', 'committer_email': 'divyamsingal01@gmail.com', 'commit_date': datetime.datetime(2019, 8, 31, 6, 47, tzinfo=datetime.timezone.utc)}, {'commit_sha': '257a32791414e18f8569ce13212db2536dcbee5a', 'committer_username': 'div5252', 'committer_name': 'Divyam Singal', 'committer_email': 'divyamsingal01@gmail.com', 'commit_date': datetime.datetime(2019, 8, 31, 6, 47, tzinfo=datetime.timezone.utc)}, {'commit_sha': '42b70b423e21f012c4a9ac09d9cef659f181f376', 'committer_username': 'div5252', 'committer_name': 'Divyam Singal', 'committer_email': 'divyamsingal01@gmail.com', 'commit_date': datetime.datetime(2019, 8, 31, 6, 47, tzinfo=datetime.timezone.utc)}, {'commit_sha': '466041bbb7cf4ca9eb075aa136ecd7384b3b73ac', 'committer_username': 'div5252', 'committer_name': 'Divyam Singal', 'committer_email': 'divyamsingal01@gmail.com', 'commit_date': datetime.datetime(2019, 8, 31, 6, 47, tzinfo=datetime.timezone.utc)}]",Divyam Singal,54735797,divyamsingal01@gmail.com,User,,29,,8,28
667638144,Corrected champernowne & added its optimized binary digit generator,"I have modified the champernowne function to output digits in base (std::numeric_limits<T>::max() / 4) * 2, as required by real_algorithm number.

I have also kept the optimized champernowne function to output digits in base 2, if some user wants digit in base 2.

I have also added a test for it, comparing with hardcoded digits.

",True,4,https://api.github.com/repos/BoostGSoC21/Real/pulls/4,https://github.com/BoostGSoC21/Real/pull/4,closed,351,263,5,1,0,0,0,0,[],2021-06-11 03:47:33+00:00,2021-07-26 12:47:17+00:00,3920384.0,"45 days, 8:59:44",[],"[{'commit_sha': 'b9de9e3a3869af0b1d8e98d6544095e8273094fa', 'committer_username': 'div5252', 'committer_name': 'Divyam Singal', 'committer_email': 'divyamsingal01@gmail.com', 'commit_date': datetime.datetime(2019, 8, 31, 6, 47, tzinfo=datetime.timezone.utc)}]",Divyam Singal,54735797,divyamsingal01@gmail.com,User,,29,,8,28
672728846,Improvements in exact arithmetic operations,"I made the following changes - 
1.  Replaced the insert() function in add and subtract vectors by push_back() function, and then reversed the digits.
2.  Preventing overflow in mul_mod() and mult_div() functions. Handled this by careful addition by taking modulus when required. This will come to use if we change our library to a larger base in future.",True,7,https://api.github.com/repos/BoostGSoC21/Real/pulls/7,https://github.com/BoostGSoC21/Real/pull/7,closed,52,13,1,1,0,0,0,0,[],2021-06-17 15:07:58+00:00,2021-07-26 12:46:32+00:00,3361114.0,"38 days, 21:38:34",[],"[{'commit_sha': 'bb9ec6631b53b845a2b8f2c4d02d79002f8e64dc', 'committer_username': 'div5252', 'committer_name': 'Divyam Singal', 'committer_email': 'divyamsingal01@gmail.com', 'commit_date': datetime.datetime(2019, 8, 31, 6, 47, tzinfo=datetime.timezone.utc)}]",Divyam Singal,54735797,divyamsingal01@gmail.com,User,,29,,8,28
667226217,Corrected carryover case in add_vector function,"In the carry-over scenario, digit=max+min-base-1. As division a/b means floor(a/b), we use the identity that base=floor(base/2)+floor((base-1)/2)+1.
(Here we take (base-1)/2 to avoid overflow.)
So instead of subtracting base/2 from max, we should rather subtract (base-1)/2-1 from max, otherwise it would lead to an incorrect result for even bases.",True,1,https://api.github.com/repos/BoostGSoC21/Real/pulls/1,https://github.com/BoostGSoC21/Real/pull/1,closed,2,2,1,2,0,0,0,0,[],2021-06-10 18:59:52+00:00,2021-06-11 14:13:13+00:00,69201.0,19:13:21,[],"[{'commit_sha': 'a504865ffd12bf1b9066e76027453e7d6155ce6a', 'committer_username': '', 'committer_name': '', 'committer_email': '', 'commit_date': ''}, {'commit_sha': '97b93c2ee2e5e29723c59836fd546185412c3c50', 'committer_username': '', 'committer_name': '', 'committer_email': '', 'commit_date': ''}]",Divyam Singal,54735797,divyamsingal01@gmail.com,User,,29,,8,28
