pr_id,pr_title,pr_body,is_merged,pr_number,pr_url,pr_html_url,pr_state,additions,deletions,pr_changed_files,pr_commits_count,pr_comments_count,pr_review_comments_count,pr_labels_count,pr_assignees_count,pr_labels,pr_created_at,pr_closed_at,time_taken,time_delta,pr_review_comments,pr_commits,contributor,contributor_id,contributor_email,contributor_type,contributions,contributor_public_repos,contributor_private_repos,contributor_followings,contributor_followers
380414511,Unified output,"Fixes #409 

This PR unify the output generation and also adds the functionality to generate a CSV file as the output.

Currently, we can only generate single type at once and that also CSV. 
In Future, we can add functionality to drop a list or tuple of output types. Unification will also help in maintaining and upgrading the code faster and easier.

@terriko I've implemented this approach. But I'm a little nervous and need your guidance to know that is this a right approach?",True,410,https://api.github.com/repos/intel/cve-bin-tool/pulls/410,https://github.com/intel/cve-bin-tool/pull/410,closed,108,14,2,65,7,5,0,0,[],2020-02-26 17:34:42+00:00,2020-02-29 00:09:53+00:00,196511.0,"2 days, 6:35:11","[{'comment_id': 384839893, 'comment_body': ""Do we *want* this directory in git? I don't think we need it in version control unless we're storing contents, and I can't imagine that we'd want to store output in the repo.  I'm guessing you did it to avoid having to have directory-making code in output_engine.py but I think we could just prefix the default filename instead of using a directory and more or less achieve the same effect. "", 'comment_created': datetime.datetime(2020, 2, 27, 0, 0, 24, tzinfo=datetime.timezone.utc), 'commenter': 'terriko', 'type': 'User'}, {'comment_id': 384841245, 'comment_body': ""I know the tests are like this, with the filename and the class name similar-but-different, but we already have VersionSignature.py, so it's not a big deal to have OutputEngine.py."", 'comment_created': datetime.datetime(2020, 2, 27, 0, 4, 43, tzinfo=datetime.timezone.utc), 'commenter': 'terriko', 'type': 'User'}, {'comment_id': 384848911, 'comment_body': 'I\'m guessing the point of this to generate a somewhat-unique filename to avoid likely file collisions, but if we never tell the user what output we just wrote, I\'m not sure if a `{lengthy numeric string}.csv` is going to be helpful, especially since once you run this more than once you\'re going to have a series of them.  \r\n\r\nSome possible options:\r\n1. Force the user to provide a filename and error if one is not provided (make it the user\'s problem)\r\n2. Write an info level message so the user at least knows what filename was written\r\n3. Add a prefix to the name so at least it\'s `output.cve-bin-tool.{numbers}.csv`\r\n4. Use datetime to make a filename that gives you the date/time so at least the latest version is pretty obvious.\r\n\r\nI\'m thinking maybe 2, 3 *and* 4 would be a good combo here?\r\n```python\r\nself.filename = f""output.cve-bin-tool.{datetime.now().strftime(\'%Y-%m-%d.%H:%m:%S:%f\')}.csv""\r\n```\r\nI can\'t decide if it\'s worth keeping the miliseconds (%f) in there for slightly reduced collision chance at expense of even longer filename.  We could add a short hash instead, but maybe that\'s over-thinking it.  I\'m guessing if you have filename collisions at this level you should probably be generating your own filenames, so seconds is plenty for a default.', 'comment_created': datetime.datetime(2020, 2, 27, 0, 29, 33, tzinfo=datetime.timezone.utc), 'commenter': 'terriko', 'type': 'User'}, {'comment_id': 384851239, 'comment_body': ""Add a log call here to tell the user what the filename was in case it was auto-generated.  You can set something in `__init__` so you know when you generated one and only print it there.  Or equally, you could move the code out of `__init__` and into this function (which might make more sense).\r\n\r\nAnd as I said above, I think we should skip the directory and just make a bare file.  \r\n\r\nWe might need a check in case the user specifies a file that they can't write to/directory that doesn't exist here.  Python's error should be pretty obvious if it can't open the file, but if we have a check then we can revert to console output or just terminate more nicely."", 'comment_created': datetime.datetime(2020, 2, 27, 0, 37, 16, tzinfo=datetime.timezone.utc), 'commenter': 'terriko', 'type': 'User'}, {'comment_id': 384851711, 'comment_body': ""Other than this line, the output in output_cves and output_csv is the same.  What about if we put this line into output_cves and have output_csv call output_cves with an argument?  I don't think anyone will mind having an explanatory line added to the console output here."", 'comment_created': datetime.datetime(2020, 2, 27, 0, 38, 48, tzinfo=datetime.timezone.utc), 'commenter': 'terriko', 'type': 'User'}]","[{'commit_sha': 'c50dcfa98cc945dbad8605421cff981a4a61afda', 'committer_username': 'SinghHrmn', 'committer_name': 'Harmandeep Singh', 'committer_email': 'harmandeep_singh@statusbrew.com', 'commit_date': datetime.datetime(2017, 7, 5, 5, 34, 11, tzinfo=datetime.timezone.utc)}, {'commit_sha': 'fbd59da79d3b11faaf38fe53b7c6ec0f25471752', 'committer_username': 'SinghHrmn', 'committer_name': 'Harmandeep Singh', 'committer_email': 'harmandeep_singh@statusbrew.com', 'commit_date': datetime.datetime(2017, 7, 5, 5, 34, 11, tzinfo=datetime.timezone.utc)}, {'commit_sha': '3e15d7ba2d44eb23d6c695890ef774e8361a348f', 'committer_username': 'SinghHrmn', 'committer_name': 'Harmandeep Singh', 'committer_email': 'harmandeep_singh@statusbrew.com', 'commit_date': datetime.datetime(2017, 7, 5, 5, 34, 11, tzinfo=datetime.timezone.utc)}, {'commit_sha': '26b5f5d393f0cd4e5c7dceb61da85ad2e72f10d6', 'committer_username': 'SinghHrmn', 'committer_name': 'Harmandeep Singh', 'committer_email': 'harmandeep_singh@statusbrew.com', 'commit_date': datetime.datetime(2017, 7, 5, 5, 34, 11, tzinfo=datetime.timezone.utc)}, {'commit_sha': '8fcb64d2728943b4757be8cb5214a32b3f622665', 'committer_username': 'SinghHrmn', 'committer_name': 'Harmandeep Singh', 'committer_email': 'harmandeep_singh@statusbrew.com', 'commit_date': datetime.datetime(2017, 7, 5, 5, 34, 11, tzinfo=datetime.timezone.utc)}, {'commit_sha': '8bcd84e1e4a3102d4554a4e206594a1e702ebb4f', 'committer_username': 'SinghHrmn', 'committer_name': 'Harmandeep Singh', 'committer_email': 'harmandeep_singh@statusbrew.com', 'commit_date': datetime.datetime(2017, 7, 5, 5, 34, 11, tzinfo=datetime.timezone.utc)}, {'commit_sha': '14781205c27b29676983b3a4d7c309e6b68d925c', 'committer_username': 'SinghHrmn', 'committer_name': 'Harmandeep Singh', 'committer_email': 'harmandeep_singh@statusbrew.com', 'commit_date': datetime.datetime(2017, 7, 5, 5, 34, 11, tzinfo=datetime.timezone.utc)}, {'commit_sha': 'bf5a596acbaf35dd998922b1ccd59898432620cb', 'committer_username': 'SinghHrmn', 'committer_name': 'Harmandeep Singh', 'committer_email': 'harmandeep_singh@statusbrew.com', 'commit_date': datetime.datetime(2017, 7, 5, 5, 34, 11, tzinfo=datetime.timezone.utc)}, {'commit_sha': 'ec95f463a00e3c62b6d519835799bb361968ff12', 'committer_username': 'SinghHrmn', 'committer_name': 'Harmandeep Singh', 'committer_email': 'harmandeep_singh@statusbrew.com', 'commit_date': datetime.datetime(2017, 7, 5, 5, 34, 11, tzinfo=datetime.timezone.utc)}, {'commit_sha': 'fdc4db57b743a9d54039da05222bd3c35ab4178e', 'committer_username': 'SinghHrmn', 'committer_name': 'Harmandeep Singh', 'committer_email': 'harmandeep_singh@statusbrew.com', 'commit_date': datetime.datetime(2017, 7, 5, 5, 34, 11, tzinfo=datetime.timezone.utc)}, {'commit_sha': '4b6a40128728ab907f320edec2bd2a27d918f6c6', 'committer_username': 'SinghHrmn', 'committer_name': 'Harmandeep Singh', 'committer_email': 'harmandeep_singh@statusbrew.com', 'commit_date': datetime.datetime(2017, 7, 5, 5, 34, 11, tzinfo=datetime.timezone.utc)}, {'commit_sha': 'e4cbf5736140da2fca934f7ff4ed6e55793d18ba', 'committer_username': 'SinghHrmn', 'committer_name': 'Harmandeep Singh', 'committer_email': 'harmandeep_singh@statusbrew.com', 'commit_date': datetime.datetime(2017, 7, 5, 5, 34, 11, tzinfo=datetime.timezone.utc)}, {'commit_sha': 'e535cb9ca11189ea6c6d8c582e661d27c198169d', 'committer_username': 'SinghHrmn', 'committer_name': 'Harmandeep Singh', 'committer_email': 'harmandeep_singh@statusbrew.com', 'commit_date': datetime.datetime(2017, 7, 5, 5, 34, 11, tzinfo=datetime.timezone.utc)}, {'commit_sha': '79e8cc427b4eeb58b80d1f7df3f7b7dcbcfef70e', 'committer_username': 'SinghHrmn', 'committer_name': 'Harmandeep Singh', 'committer_email': 'harmandeep_singh@statusbrew.com', 'commit_date': datetime.datetime(2017, 7, 5, 5, 34, 11, tzinfo=datetime.timezone.utc)}, {'commit_sha': 'dfa7b3d0df5fac2cd123f6ec704671b86d9af976', 'committer_username': 'SinghHrmn', 'committer_name': 'Harmandeep Singh', 'committer_email': 'harmandeep_singh@statusbrew.com', 'commit_date': datetime.datetime(2017, 7, 5, 5, 34, 11, tzinfo=datetime.timezone.utc)}, {'commit_sha': 'a2ff873bf6381b6afeb5fc97b266ab7d16470a08', 'committer_username': 'SinghHrmn', 'committer_name': 'Harmandeep Singh', 'committer_email': 'harmandeep_singh@statusbrew.com', 'commit_date': datetime.datetime(2017, 7, 5, 5, 34, 11, tzinfo=datetime.timezone.utc)}, {'commit_sha': 'ff06a3b1c7b9703fd006310abf7b4125c029ea09', 'committer_username': 'SinghHrmn', 'committer_name': 'Harmandeep Singh', 'committer_email': 'harmandeep_singh@statusbrew.com', 'commit_date': datetime.datetime(2017, 7, 5, 5, 34, 11, tzinfo=datetime.timezone.utc)}, {'commit_sha': '07fda5591c61404f8dcf5d5b4631a05902fc6294', 'committer_username': 'SinghHrmn', 'committer_name': 'Harmandeep Singh', 'committer_email': 'harmandeep_singh@statusbrew.com', 'commit_date': datetime.datetime(2017, 7, 5, 5, 34, 11, tzinfo=datetime.timezone.utc)}, {'commit_sha': '31b67bc939baa7de15d1fff416b1ae5a1bb0173c', 'committer_username': 'SinghHrmn', 'committer_name': 'Harmandeep Singh', 'committer_email': 'harmandeep_singh@statusbrew.com', 'commit_date': datetime.datetime(2017, 7, 5, 5, 34, 11, tzinfo=datetime.timezone.utc)}, {'commit_sha': '0a84fbcbcebf016a1fa1b0ce457eb2924f8d2688', 'committer_username': 'SinghHrmn', 'committer_name': 'Harmandeep Singh', 'committer_email': 'harmandeep_singh@statusbrew.com', 'commit_date': datetime.datetime(2017, 7, 5, 5, 34, 11, tzinfo=datetime.timezone.utc)}, {'commit_sha': '32b24e626eb64fdd29938cbe8e70ae9efa2b0ef4', 'committer_username': 'SinghHrmn', 'committer_name': 'Harmandeep Singh', 'committer_email': 'harmandeep_singh@statusbrew.com', 'commit_date': datetime.datetime(2017, 7, 5, 5, 34, 11, tzinfo=datetime.timezone.utc)}, {'commit_sha': '7f9972836f0cadd4f5ce538c63708a360a188461', 'committer_username': 'SinghHrmn', 'committer_name': 'Harmandeep Singh', 'committer_email': 'harmandeep_singh@statusbrew.com', 'commit_date': datetime.datetime(2017, 7, 5, 5, 34, 11, tzinfo=datetime.timezone.utc)}, {'commit_sha': '5f406760ffd3df1132347f8b5b988c4fa366d2a1', 'committer_username': 'SinghHrmn', 'committer_name': 'Harmandeep Singh', 'committer_email': 'harmandeep_singh@statusbrew.com', 'commit_date': datetime.datetime(2017, 7, 5, 5, 34, 11, tzinfo=datetime.timezone.utc)}, {'commit_sha': '66f7600a7f9b5508044621320b555b8d027298c2', 'committer_username': 'SinghHrmn', 'committer_name': 'Harmandeep Singh', 'committer_email': 'harmandeep_singh@statusbrew.com', 'commit_date': datetime.datetime(2017, 7, 5, 5, 34, 11, tzinfo=datetime.timezone.utc)}, {'commit_sha': '30a3b101ee072ee0327992c3babf33fd3e8d1ffa', 'committer_username': 'PrajwalM2212', 'committer_name': 'PRAJWAL M', 'committer_email': None, 'commit_date': datetime.datetime(2017, 8, 4, 18, 9, 37, tzinfo=datetime.timezone.utc)}, {'commit_sha': '9708cdc0580cc1c220384007981a3d7020491547', 'committer_username': 'terriko', 'committer_name': 'Terri Oda', 'committer_email': 'terri.oda@intel.com', 'commit_date': datetime.datetime(2012, 2, 15, 8, 43, 56, tzinfo=datetime.timezone.utc)}, {'commit_sha': '14127fd911338dccb01ca5ef7f4307d0d45130fa', 'committer_username': 'terriko', 'committer_name': 'Terri Oda', 'committer_email': 'terri.oda@intel.com', 'commit_date': datetime.datetime(2012, 2, 15, 8, 43, 56, tzinfo=datetime.timezone.utc)}, {'commit_sha': '4028f27a987877d266aebd6fbe1d6ab89494666a', 'committer_username': 'terriko', 'committer_name': 'Terri Oda', 'committer_email': 'terri.oda@intel.com', 'commit_date': datetime.datetime(2012, 2, 15, 8, 43, 56, tzinfo=datetime.timezone.utc)}, {'commit_sha': '090696d0dac2af54321a64c389549a6e904f161f', 'committer_username': 'terriko', 'committer_name': 'Terri Oda', 'committer_email': 'terri.oda@intel.com', 'commit_date': datetime.datetime(2012, 2, 15, 8, 43, 56, tzinfo=datetime.timezone.utc)}, {'commit_sha': '442432efbf2193471f9129697d5ccb5306980241', 'committer_username': 'terriko', 'committer_name': 'Terri Oda', 'committer_email': 'terri.oda@intel.com', 'commit_date': datetime.datetime(2012, 2, 15, 8, 43, 56, tzinfo=datetime.timezone.utc)}, {'commit_sha': '284da613f4bc9f4ebd3df315642ea4fb25ba2667', 'committer_username': 'PrajwalM2212', 'committer_name': 'PRAJWAL M', 'committer_email': None, 'commit_date': datetime.datetime(2017, 8, 4, 18, 9, 37, tzinfo=datetime.timezone.utc)}, {'commit_sha': 'c55164079258bd657cdde6cd6102735ba2169771', 'committer_username': 'pdxjohnny', 'committer_name': 'John Andersen', 'committer_email': 'john.s.andersen@intel.com', 'commit_date': datetime.datetime(2013, 11, 15, 18, 35, 37, tzinfo=datetime.timezone.utc)}, {'commit_sha': '4a9d72600c7002a1e545f449441cda7d0aa03b02', 'committer_username': 'SaurabhK122', 'committer_name': 'Saurabh Khandelwal', 'committer_email': 'khandelwal.saurabh31@gmail.com', 'commit_date': datetime.datetime(2019, 5, 12, 8, 11, 14, tzinfo=datetime.timezone.utc)}, {'commit_sha': '50fd4abe87de396a8f78bd36a574f98583326422', 'committer_username': 'param211', 'committer_name': 'Param Chauhan', 'committer_email': 'paramc.it18@nsut.ac.in', 'commit_date': datetime.datetime(2016, 7, 10, 8, 39, 47, tzinfo=datetime.timezone.utc)}, {'commit_sha': '38d1a8139ac9657b1523839641934310fd70769d', 'committer_username': 'PrajwalM2212', 'committer_name': 'PRAJWAL M', 'committer_email': None, 'commit_date': datetime.datetime(2017, 8, 4, 18, 9, 37, tzinfo=datetime.timezone.utc)}, {'commit_sha': 'dead5917e56576185ee8b41e5514685b02a3a251', 'committer_username': 'terriko', 'committer_name': 'Terri Oda', 'committer_email': 'terri.oda@intel.com', 'commit_date': datetime.datetime(2012, 2, 15, 8, 43, 56, tzinfo=datetime.timezone.utc)}, {'commit_sha': '42e2ef90c41bc8f079521c615f1f1797f57174e5', 'committer_username': 'SinghHrmn', 'committer_name': 'Harmandeep Singh', 'committer_email': 'harmandeep_singh@statusbrew.com', 'commit_date': datetime.datetime(2017, 7, 5, 5, 34, 11, tzinfo=datetime.timezone.utc)}, {'commit_sha': 'daafcdfd3d29d473646e6c9991b4d91cff78b64b', 'committer_username': 'terriko', 'committer_name': 'Terri Oda', 'committer_email': 'terri.oda@intel.com', 'commit_date': datetime.datetime(2012, 2, 15, 8, 43, 56, tzinfo=datetime.timezone.utc)}, {'commit_sha': '8406c1e30394491519a68544262214e50f8f3055', 'committer_username': 'terriko', 'committer_name': 'Terri Oda', 'committer_email': 'terri.oda@intel.com', 'commit_date': datetime.datetime(2012, 2, 15, 8, 43, 56, tzinfo=datetime.timezone.utc)}, {'commit_sha': '082454044eea9b922644c62b076a7acdbf4c9f6a', 'committer_username': 'Niraj-Kamdar', 'committer_name': 'Niraj Kamdar', 'committer_email': None, 'commit_date': datetime.datetime(2019, 6, 4, 23, 36, 32, tzinfo=datetime.timezone.utc)}, {'commit_sha': 'cb53531c91bbea0bfd7db3506c75de62c1962656', 'committer_username': 'param211', 'committer_name': 'Param Chauhan', 'committer_email': 'paramc.it18@nsut.ac.in', 'commit_date': datetime.datetime(2016, 7, 10, 8, 39, 47, tzinfo=datetime.timezone.utc)}, {'commit_sha': 'ebfbb428bf6570f35229d9fc7633defe8694abf5', 'committer_username': 'terriko', 'committer_name': 'Terri Oda', 'committer_email': 'terri.oda@intel.com', 'commit_date': datetime.datetime(2012, 2, 15, 8, 43, 56, tzinfo=datetime.timezone.utc)}, {'commit_sha': 'ebb21f9c743ccef0ce4262a0560da089850aacc1', 'committer_username': 'terriko', 'committer_name': 'Terri Oda', 'committer_email': 'terri.oda@intel.com', 'commit_date': datetime.datetime(2012, 2, 15, 8, 43, 56, tzinfo=datetime.timezone.utc)}, {'commit_sha': '561b69b264dd203ca115b2bc7048b50c23991df9', 'committer_username': 'terriko', 'committer_name': 'Terri Oda', 'committer_email': 'terri.oda@intel.com', 'commit_date': datetime.datetime(2012, 2, 15, 8, 43, 56, tzinfo=datetime.timezone.utc)}, {'commit_sha': 'd236711203f1c099447732f6edc80e01e0e5f82a', 'committer_username': 'terriko', 'committer_name': 'Terri Oda', 'committer_email': 'terri.oda@intel.com', 'commit_date': datetime.datetime(2012, 2, 15, 8, 43, 56, tzinfo=datetime.timezone.utc)}, {'commit_sha': '00fd049b5f93b1e613d667fdef97ddb98bb37be4', 'committer_username': 'terriko', 'committer_name': 'Terri Oda', 'committer_email': 'terri.oda@intel.com', 'commit_date': datetime.datetime(2012, 2, 15, 8, 43, 56, tzinfo=datetime.timezone.utc)}, {'commit_sha': 'a74986fe2662444116a1decf081c32b729daebad', 'committer_username': 'terriko', 'committer_name': 'Terri Oda', 'committer_email': 'terri.oda@intel.com', 'commit_date': datetime.datetime(2012, 2, 15, 8, 43, 56, tzinfo=datetime.timezone.utc)}, {'commit_sha': 'f7dd510ff187e088ae35b8f7a63b7307e454ed1b', 'committer_username': 'pdxjohnny', 'committer_name': 'John Andersen', 'committer_email': 'john.s.andersen@intel.com', 'commit_date': datetime.datetime(2013, 11, 15, 18, 35, 37, tzinfo=datetime.timezone.utc)}, {'commit_sha': '8e6b04240f306b7d28dd95fd5a24dd548c225cd0', 'committer_username': 'SinghHrmn', 'committer_name': 'Harmandeep Singh', 'committer_email': 'harmandeep_singh@statusbrew.com', 'commit_date': datetime.datetime(2017, 7, 5, 5, 34, 11, tzinfo=datetime.timezone.utc)}, {'commit_sha': '3f98ff5aa0459c56010f0cdbc8b67e1071722a61', 'committer_username': 'SinghHrmn', 'committer_name': 'Harmandeep Singh', 'committer_email': 'harmandeep_singh@statusbrew.com', 'commit_date': datetime.datetime(2017, 7, 5, 5, 34, 11, tzinfo=datetime.timezone.utc)}, {'commit_sha': 'e5c65bfe86597bfe86790abe5b155f330d52fed6', 'committer_username': 'PrajwalM2212', 'committer_name': 'PRAJWAL M', 'committer_email': None, 'commit_date': datetime.datetime(2017, 8, 4, 18, 9, 37, tzinfo=datetime.timezone.utc)}, {'commit_sha': '95d6decc4b706644b5e207958e1cd23a2cf594ef', 'committer_username': 'terriko', 'committer_name': 'Terri Oda', 'committer_email': 'terri.oda@intel.com', 'commit_date': datetime.datetime(2012, 2, 15, 8, 43, 56, tzinfo=datetime.timezone.utc)}, {'commit_sha': '9765481ee8969736d6b37ebaee141bc9e105e8ce', 'committer_username': 'terriko', 'committer_name': 'Terri Oda', 'committer_email': 'terri.oda@intel.com', 'commit_date': datetime.datetime(2012, 2, 15, 8, 43, 56, tzinfo=datetime.timezone.utc)}, {'commit_sha': '6adf9988710c4379167c16f2a7e2fc8d2518d4dd', 'committer_username': 'shreyamalviya', 'committer_name': 'Shreya Malviya', 'committer_email': None, 'commit_date': datetime.datetime(2018, 11, 5, 10, 15, 11, tzinfo=datetime.timezone.utc)}, {'commit_sha': '8c0ca2876489f8549a7940e71ffdb6bb17b71ee4', 'committer_username': 'terriko', 'committer_name': 'Terri Oda', 'committer_email': 'terri.oda@intel.com', 'commit_date': datetime.datetime(2012, 2, 15, 8, 43, 56, tzinfo=datetime.timezone.utc)}, {'commit_sha': '0509abb9521b2357d8897067516d0941c9bd6a9d', 'committer_username': 'SinghHrmn', 'committer_name': 'Harmandeep Singh', 'committer_email': 'harmandeep_singh@statusbrew.com', 'commit_date': datetime.datetime(2017, 7, 5, 5, 34, 11, tzinfo=datetime.timezone.utc)}, {'commit_sha': '905362f6a237df5b851c6bb61547d86cec533ba0', 'committer_username': 'SinghHrmn', 'committer_name': 'Harmandeep Singh', 'committer_email': 'harmandeep_singh@statusbrew.com', 'commit_date': datetime.datetime(2017, 7, 5, 5, 34, 11, tzinfo=datetime.timezone.utc)}, {'commit_sha': 'e0b8b7379dd2ab4b7c971e7e3a20040e4705f490', 'committer_username': 'SinghHrmn', 'committer_name': 'Harmandeep Singh', 'committer_email': 'harmandeep_singh@statusbrew.com', 'commit_date': datetime.datetime(2017, 7, 5, 5, 34, 11, tzinfo=datetime.timezone.utc)}, {'commit_sha': '87590be9b265c3cac316b39c1a5376d1e37ae930', 'committer_username': 'SinghHrmn', 'committer_name': 'Harmandeep Singh', 'committer_email': 'harmandeep_singh@statusbrew.com', 'commit_date': datetime.datetime(2017, 7, 5, 5, 34, 11, tzinfo=datetime.timezone.utc)}, {'commit_sha': '75c8a7debf67dca7d62d6258c47b71e059e62822', 'committer_username': 'SinghHrmn', 'committer_name': 'Harmandeep Singh', 'committer_email': 'harmandeep_singh@statusbrew.com', 'commit_date': datetime.datetime(2017, 7, 5, 5, 34, 11, tzinfo=datetime.timezone.utc)}, {'commit_sha': 'f93693ae468b808395800caaa1808eda8f045f60', 'committer_username': 'SinghHrmn', 'committer_name': 'Harmandeep Singh', 'committer_email': 'harmandeep_singh@statusbrew.com', 'commit_date': datetime.datetime(2017, 7, 5, 5, 34, 11, tzinfo=datetime.timezone.utc)}, {'commit_sha': '29ce47ba78529496d1ec38ea045855cef2faa769', 'committer_username': 'SinghHrmn', 'committer_name': 'Harmandeep Singh', 'committer_email': 'harmandeep_singh@statusbrew.com', 'commit_date': datetime.datetime(2017, 7, 5, 5, 34, 11, tzinfo=datetime.timezone.utc)}, {'commit_sha': '6f32f92eda6cf4e9bfcad3192ef4bf5c1301c8d7', 'committer_username': 'SinghHrmn', 'committer_name': 'Harmandeep Singh', 'committer_email': 'harmandeep_singh@statusbrew.com', 'commit_date': datetime.datetime(2017, 7, 5, 5, 34, 11, tzinfo=datetime.timezone.utc)}, {'commit_sha': 'f1d3f245a108ea3ddca3874b798afe88349208b9', 'committer_username': 'SinghHrmn', 'committer_name': 'Harmandeep Singh', 'committer_email': 'harmandeep_singh@statusbrew.com', 'commit_date': datetime.datetime(2017, 7, 5, 5, 34, 11, tzinfo=datetime.timezone.utc)}, {'commit_sha': 'c87347ff05901363895e2018d623201213d29af8', 'committer_username': 'SinghHrmn', 'committer_name': 'Harmandeep Singh', 'committer_email': 'harmandeep_singh@statusbrew.com', 'commit_date': datetime.datetime(2017, 7, 5, 5, 34, 11, tzinfo=datetime.timezone.utc)}]",Harmandeep Singh,29910324,harmandeep_singh@statusbrew.com,User,,43,,29,26
