pr_id,pr_title,pr_body,is_merged,pr_number,pr_url,pr_html_url,pr_state,additions,deletions,pr_changed_files,pr_commits_count,pr_comments_count,pr_review_comments_count,pr_labels_count,pr_assignees_count,pr_labels,pr_created_at,pr_closed_at,time_taken,time_delta,pr_review_comments,pr_commits,contributor,contributor_id,contributor_email,contributor_type,contributions,contributor_public_repos,contributor_private_repos,contributor_followings,contributor_followers
823952390,shared-state: provide compressed cgi-bin endpoints,"Add compression support to the public synchronization endpoints so that the data is transmitted and received using gzip when `gzip` is part of the URL query-string. 

Why? mainly to help shared-state syncing when there is a bad quality link (low signal, too crowded airspace, etc) reducing the amount of packets that have to be transmitted. Also this leads to reduced bandwidth usage.

This change in its own does not change the current behaviour (uncompressed) but allows to use this feature in the future. There are two main possible mechanisms with different backwards compatibility policy:
1. Provide a backwards compatible mechanism that allows a node to know if the other node supports gzip or not and use the new endpoint in that case. There are many options to do this but all add complexity.
2. Add it in a backward incompatible way but with an upgrade path: provide compression support in the next libremesh release, with compression unused when syncing,  and then in a future release switch to ""always"" compress. 

I am more inclined to do the 2nd option as the first option not only adds code complexity but also runtime overhead and/or runtime complexity. What do you think?",True,911,https://api.github.com/repos/libremesh/lime-packages/pulls/911,https://github.com/libremesh/lime-packages/pull/911,closed,16,2,2,1,9,4,0,0,[],2022-01-16 17:25:24+00:00,2022-04-23 14:48:41+00:00,8371397.0,"96 days, 21:23:17","[{'comment_id': 785693358, 'comment_body': ""shouldn't this line go away?"", 'comment_created': datetime.datetime(2022, 1, 17, 7, 22, 55, tzinfo=datetime.timezone.utc), 'commenter': 'G10h4ck', 'type': 'User'}, {'comment_id': 785693419, 'comment_body': ""shouldn't this line go away?"", 'comment_created': datetime.datetime(2022, 1, 17, 7, 23, 1, tzinfo=datetime.timezone.utc), 'commenter': 'G10h4ck', 'type': 'User'}, {'comment_id': 792002726, 'comment_body': 'Yes, sorry, problem arised when I lost the change and then copy pasted a diff I had and then I did not retested ... ', 'comment_created': datetime.datetime(2022, 1, 25, 18, 23, 41, tzinfo=datetime.timezone.utc), 'commenter': 'spiccinini', 'type': 'User'}, {'comment_id': 819781411, 'comment_body': 'Done! Sorry for the delay, I  though that I already did it', 'comment_created': datetime.datetime(2022, 3, 4, 17, 44, 14, tzinfo=datetime.timezone.utc), 'commenter': 'spiccinini', 'type': 'User'}]","[{'commit_sha': '75b53d5ada7ee22ee9a495c3dc6b5e78ddebebc1', 'committer_username': 'spiccinini', 'committer_name': 'Santiago Piccinini', 'committer_email': 'spiccinini@altermundi.net', 'commit_date': datetime.datetime(2010, 11, 28, 23, 40, 18, tzinfo=datetime.timezone.utc)}]",Santiago Piccinini,500841,spiccinini@altermundi.net,User,,47,,21,35

Project_ID,Name,Full_name,Language,Forks,Stars,Watchers,contributors,commits,issues,branches,PRs_count,contributor pullrequests
