pr_id,pr_title,pr_body,is_merged,pr_number,pr_url,pr_html_url,pr_state,additions,deletions,pr_changed_files,pr_commits_count,pr_comments_count,pr_review_comments_count,pr_labels_count,pr_assignees_count,pr_labels,pr_created_at,pr_closed_at,time_taken,time_delta,pr_review_comments,pr_commits,contributor,contributor_id,contributor_email,contributor_type,contributions,contributor_public_repos,contributor_private_repos,contributor_followings,contributor_followers
440374308,Add PCL driver,,True,32,https://api.github.com/repos/michaelrsweet/pappl/pulls/32,https://github.com/michaelrsweet/pappl/pull/32,closed,1056,1,3,2,3,32,0,0,[],2020-06-26 04:30:02+00:00,2020-07-05 19:49:12+00:00,832750.0,"9 days, 15:19:10","[{'comment_id': 446460631, 'comment_body': 'This should be a *separate* program from the testmainloop code...', 'comment_created': datetime.datetime(2020, 6, 27, 0, 29, 30, tzinfo=datetime.timezone.utc), 'commenter': 'michaelrsweet', 'type': 'User'}, {'comment_id': 446460788, 'comment_body': 'This should be separate from the testpappl program.', 'comment_created': datetime.datetime(2020, 6, 27, 0, 30, 31, tzinfo=datetime.timezone.utc), 'commenter': 'michaelrsweet', 'type': 'User'}, {'comment_id': 446461966, 'comment_body': 'The example should not include private headers. The point is to provide an example of how to use PAPPL to make a printer application using just the public API headers.', 'comment_created': datetime.datetime(2020, 6, 27, 0, 38, 49, tzinfo=datetime.timezone.utc), 'commenter': 'michaelrsweet', 'type': 'User'}, {'comment_id': 446641781, 'comment_body': 'Add black toner for grayscale printer.', 'comment_created': datetime.datetime(2020, 6, 28, 12, 0, 33, tzinfo=datetime.timezone.utc), 'commenter': 'michaelrsweet', 'type': 'User'}, {'comment_id': 446641972, 'comment_body': 'I would just make the version number ""1.0"" for this.', 'comment_created': datetime.datetime(2020, 6, 28, 12, 2, 16, tzinfo=datetime.timezone.utc), 'commenter': 'michaelrsweet', 'type': 'User'}, {'comment_id': 446642043, 'comment_body': ""This part isn't necessary for the example; we have it for the unit test in order to make sure the context pointer comes through..."", 'comment_created': datetime.datetime(2020, 6, 28, 12, 3, 1, tzinfo=datetime.timezone.utc), 'commenter': 'michaelrsweet', 'type': 'User'}, {'comment_id': 446643121, 'comment_body': 'I\'m thinking we want to encourage developers to store their printer application state in a more stable, per-user location... I hesitate to use something like ""~/.hp_printer_app.state"", since both Linux and macOS have different conventions to avoid polluting the home directory... I\'ll add papplSystemGet/SetStateDirectory functions (which will use the right default locations per platform/user) and then you can just pass the relative path (""hp_printer_app.state"") here and in the load call below to get the desired behavior without special-casing.\r\n', 'comment_created': datetime.datetime(2020, 6, 28, 12, 14, 24, tzinfo=datetime.timezone.utc), 'commenter': 'michaelrsweet', 'type': 'User'}, {'comment_id': 446643257, 'comment_body': 'I think you can just use the model names in the lists and not bother with the resolution/colorspace information.', 'comment_created': datetime.datetime(2020, 6, 28, 12, 15, 28, tzinfo=datetime.timezone.utc), 'commenter': 'michaelrsweet', 'type': 'User'}, {'comment_id': 446643379, 'comment_body': ""Not sure we need to log this here since PAPPL logs it already, and many of the values won't be set anyways...\r\n"", 'comment_created': datetime.datetime(2020, 6, 28, 12, 16, 43, tzinfo=datetime.timezone.utc), 'commenter': 'michaelrsweet', 'type': 'User'}, {'comment_id': 446643571, 'comment_body': 'As I mention in a later comment, don\'t use the ""-NNNdpi"" and ""-colorspace"" convention from the PWG unit tests. Just compare model names and add all of the applicable resolutions/colorspaces.', 'comment_created': datetime.datetime(2020, 6, 28, 12, 18, 27, tzinfo=datetime.timezone.utc), 'commenter': 'michaelrsweet', 'type': 'User'}, {'comment_id': 446643606, 'comment_body': 'The deskjet model does color, the rest are just grayscale...\r\n', 'comment_created': datetime.datetime(2020, 6, 28, 12, 18, 53, tzinfo=datetime.timezone.utc), 'commenter': 'michaelrsweet', 'type': 'User'}, {'comment_id': 446644277, 'comment_body': ""I don't think you've initialized the ready media size_name fields... Here I would default the paper trays to US Letter (north america) or A4 (everywhere else) and the envelope tray to #10 (north america) or DL (everywhere else). Seems like I should add API for getting these sorts of defaults:\r\n\r\n```\r\nextern pwg_media_t *papplGetDefaultDocumentSize(void);\r\nextern pwg_media_t *papplGetDefaultEnvelopeSize(void);\r\n```\r\n\r\n"", 'comment_created': datetime.datetime(2020, 6, 28, 12, 24, 52, tzinfo=datetime.timezone.utc), 'commenter': 'michaelrsweet', 'type': 'User'}, {'comment_id': 446644382, 'comment_body': 'Use `strlcpy(driver_data->make_and_model, ""bla bla bla"", sizeof(driver_data->make_and_model));` instead of snprintf.', 'comment_created': datetime.datetime(2020, 6, 28, 12, 25, 50, tzinfo=datetime.timezone.utc), 'commenter': 'michaelrsweet', 'type': 'User'}, {'comment_id': 446644404, 'comment_body': 'Use `strlcpy(driver_data->make_and_model, ""bla bla bla"", sizeof(driver_data->make_and_model));` instead of snprintf.', 'comment_created': datetime.datetime(2020, 6, 28, 12, 26, 8, tzinfo=datetime.timezone.utc), 'commenter': 'michaelrsweet', 'type': 'User'}, {'comment_id': 446644412, 'comment_body': 'Use `strlcpy(driver_data->make_and_model, ""bla bla bla"", sizeof(driver_data->make_and_model));` instead of snprintf.', 'comment_created': datetime.datetime(2020, 6, 28, 12, 26, 15, tzinfo=datetime.timezone.utc), 'commenter': 'michaelrsweet', 'type': 'User'}, {'comment_id': 446644675, 'comment_body': ""This will need some work - the B&W modes are fine since PAPPL will dither grayscale to B&W for you, but the DeskJet driver asks for grayscale or RGB so you'll need to do the dithering here...\r\n"", 'comment_created': datetime.datetime(2020, 6, 28, 12, 28, 50, tzinfo=datetime.timezone.utc), 'commenter': 'michaelrsweet', 'type': 'User'}, {'comment_id': 446644739, 'comment_body': ""You won't get CMY data from PAPPL..."", 'comment_created': datetime.datetime(2020, 6, 28, 12, 29, 18, tzinfo=datetime.timezone.utc), 'commenter': 'michaelrsweet', 'type': 'User'}, {'comment_id': 446644947, 'comment_body': ""Probably don't want to do anything here, just include comments about what could be done.\r\n"", 'comment_created': datetime.datetime(2020, 6, 28, 12, 30, 52, tzinfo=datetime.timezone.utc), 'commenter': 'michaelrsweet', 'type': 'User'}, {'comment_id': 447721090, 'comment_body': '@michaelrsweet I looked at dithering in rastertopclx filter from cups-filters. Would that work or we need something different?', 'comment_created': datetime.datetime(2020, 6, 30, 14, 20, 20, tzinfo=datetime.timezone.utc), 'commenter': 'JaiLuthra1', 'type': 'User'}, {'comment_id': 447743911, 'comment_body': 'Yes that would work, as would adapting the simple ordered dither matrix in the options structure.', 'comment_created': datetime.datetime(2020, 6, 30, 14, 49, 19, tzinfo=datetime.timezone.utc), 'commenter': 'michaelrsweet', 'type': 'User'}, {'comment_id': 449246915, 'comment_body': 'In this case, you need to dither each color component (RGB) separately to produce bitmaps for CMY, and then use an AND mask of the CMY bytes to create K (black). It would also be better to allocate the line buffer in the start page function and make it part of the pcl data struct.\r\n', 'comment_created': datetime.datetime(2020, 7, 2, 20, 19, 57, tzinfo=datetime.timezone.utc), 'commenter': 'michaelrsweet', 'type': 'User'}, {'comment_id': 449247150, 'comment_body': 'This code can be removed - there is no 2-bit per component mode supported by PAPPL.', 'comment_created': datetime.datetime(2020, 7, 2, 20, 20, 27, tzinfo=datetime.timezone.utc), 'commenter': 'michaelrsweet', 'type': 'User'}, {'comment_id': 449680041, 'comment_body': '@michaelrsweet So, does this mean `pixels` has data of the form RGBRGBRGBRGB... and we need to separately dither the R,G and B parts into say, rline, bline and gline respectively and then create `line`, rather pcl->line using an AND mask of these?', 'comment_created': datetime.datetime(2020, 7, 3, 18, 40, 3, tzinfo=datetime.timezone.utc), 'commenter': 'JaiLuthra1', 'type': 'User'}, {'comment_id': 449694965, 'comment_body': 'Yes, RGBRGBRGB..., which can be directly dithered to CMY. Then the K plane can be generated by AND\'ing the CMY planes (and you then bitwise AND the CMY planes by the ones-complement of the K plane, e.g. ""CMY &= ~K"").\r\n', 'comment_created': datetime.datetime(2020, 7, 3, 20, 8, 47, tzinfo=datetime.timezone.utc), 'commenter': 'michaelrsweet', 'type': 'User'}, {'comment_id': 449788476, 'comment_body': 'OK, this actually needs to be CUPS_CSPACE_SRGB since that is the color space being advertised in the setup callback. Also, there is no need to have a separate set of CMYK buffers since planes[] contains the necessary buffers.', 'comment_created': datetime.datetime(2020, 7, 4, 16, 57, 23, tzinfo=datetime.timezone.utc), 'commenter': 'michaelrsweet', 'type': 'User'}, {'comment_id': 449788719, 'comment_body': 'cupsBytesPerLine is the source size. The output planes will be 1-bit per component, so you want to calculate the byte length of a line, e.g., `length = (header->cupsWidth + 7) / 8;`.\r\n', 'comment_created': datetime.datetime(2020, 7, 4, 17, 0, 53, tzinfo=datetime.timezone.utc), 'commenter': 'michaelrsweet', 'type': 'User'}, {'comment_id': 449788887, 'comment_body': 'and then use the same length here to calculate the offset.', 'comment_created': datetime.datetime(2020, 7, 4, 17, 2, 51, tzinfo=datetime.timezone.utc), 'commenter': 'michaelrsweet', 'type': 'User'}, {'comment_id': 449788920, 'comment_body': 'OK, so you need to dither for both RGB and 8-bit gray/black - only the 1-bit black raster data can be sent directly.', 'comment_created': datetime.datetime(2020, 7, 4, 17, 3, 31, tzinfo=datetime.timezone.utc), 'commenter': 'michaelrsweet', 'type': 'User'}, {'comment_id': 449788941, 'comment_body': 'You can dither all three colors in one loop....', 'comment_created': datetime.datetime(2020, 7, 4, 17, 3, 52, tzinfo=datetime.timezone.utc), 'commenter': 'michaelrsweet', 'type': 'User'}, {'comment_id': 449789174, 'comment_body': ""Minor optimization - save a copy of ~K in the 'byte' variable, then you can mask using the variable. Compilers aren't always smart enough to optimize away the `~*kptr`.\r\n\r\nAlso, if you dither all three colors above, then you can generate K in the same loop as well..."", 'comment_created': datetime.datetime(2020, 7, 4, 17, 6, 53, tzinfo=datetime.timezone.utc), 'commenter': 'michaelrsweet', 'type': 'User'}, {'comment_id': 449789261, 'comment_body': ""and you don't need to copy to a separate line buffer..."", 'comment_created': datetime.datetime(2020, 7, 4, 17, 8, 19, tzinfo=datetime.timezone.utc), 'commenter': 'michaelrsweet', 'type': 'User'}, {'comment_id': 449789508, 'comment_body': 'This should be toner, not ink.', 'comment_created': datetime.datetime(2020, 7, 4, 17, 11, 43, tzinfo=datetime.timezone.utc), 'commenter': 'michaelrsweet', 'type': 'User'}]","[{'commit_sha': '16d8d95394d787c4411adab86374989bcb8e326f', 'committer_username': 'JaiLuthra1', 'committer_name': 'Jai Luthra', 'committer_email': None, 'commit_date': datetime.datetime(2018, 9, 9, 13, 17, 26, tzinfo=datetime.timezone.utc)}, {'commit_sha': '091f6d24e091eb0febe356e29505a4e40deaabfe', 'committer_username': 'JaiLuthra1', 'committer_name': 'Jai Luthra', 'committer_email': None, 'commit_date': datetime.datetime(2018, 9, 9, 13, 17, 26, tzinfo=datetime.timezone.utc)}]",Jai Luthra,43112385,,User,,24,,16,36
448092281,Add snapcraft.yaml and systemd support.,,True,1,https://api.github.com/repos/michaelrsweet/hp-printer-app/pulls/1,https://github.com/michaelrsweet/hp-printer-app/pull/1,closed,53,0,3,1,0,0,1,0,[{'name': 'enhancement'}],2020-07-13 08:30:02+00:00,2020-07-13 13:50:20+00:00,19218.0,5:20:18,[],"[{'commit_sha': 'caf803624fb0b91285d77765c9cf306d8c218f21', 'committer_username': 'JaiLuthra1', 'committer_name': 'Jai Luthra', 'committer_email': None, 'commit_date': datetime.datetime(2018, 9, 9, 13, 17, 26, tzinfo=datetime.timezone.utc)}]",Jai Luthra,43112385,,User,,24,,16,36
449534925,Add design and man page content,,True,2,https://api.github.com/repos/michaelrsweet/hp-printer-app/pulls/2,https://github.com/michaelrsweet/hp-printer-app/pull/2,closed,139,1,2,2,0,0,0,0,[],2020-07-15 14:52:04+00:00,2020-07-15 14:56:03+00:00,239.0,0:03:59,[],"[{'commit_sha': '47fbb6c50350b0cd424d448757041372fead2197', 'committer_username': 'JaiLuthra1', 'committer_name': 'Jai Luthra', 'committer_email': None, 'commit_date': datetime.datetime(2018, 9, 9, 13, 17, 26, tzinfo=datetime.timezone.utc)}, {'commit_sha': '7b8b81bc993e67f481b07a5215e4f86e8bb3f8e2', 'committer_username': 'JaiLuthra1', 'committer_name': 'Jai Luthra', 'committer_email': None, 'commit_date': datetime.datetime(2018, 9, 9, 13, 17, 26, tzinfo=datetime.timezone.utc)}]",Jai Luthra,43112385,,User,,24,,16,36
455575087,Add device auto-setup,,False,36,https://api.github.com/repos/michaelrsweet/pappl/pulls/36,https://github.com/michaelrsweet/pappl/pull/36,closed,432,14,11,2,20,13,2,1,"[{'name': 'enhancement'}, {'name': 'priority-low'}]",2020-07-23 09:10:50+00:00,2023-02-28 20:44:05+00:00,82121595.0,"950 days, 11:33:15","[{'comment_id': 459620526, 'comment_body': ""OK, forking like this won't work on all platforms... If you want to run this in the background, put it in a thread instead with pthread_create()."", 'comment_created': datetime.datetime(2020, 7, 23, 17, 43, 34, tzinfo=datetime.timezone.utc), 'commenter': 'michaelrsweet', 'type': 'User'}, {'comment_id': 459621061, 'comment_body': '... and closing stdin/out/err is generally frowned upon since you might have random IO getting sent over whatever files end up on descriptors 0-2.', 'comment_created': datetime.datetime(2020, 7, 23, 17, 44, 30, tzinfo=datetime.timezone.utc), 'commenter': 'michaelrsweet', 'type': 'User'}, {'comment_id': 459622962, 'comment_body': 'In general, printers should not be automatically deleted when they are ""off-line"" or not connected, since that is likely a temporary situation. Better to just set the printer state to ""stopped"" and add the ""offline"" state reason keyword. (both of these things would need to be added to PAPPL...)\r\n', 'comment_created': datetime.datetime(2020, 7, 23, 17, 47, 43, tzinfo=datetime.timezone.utc), 'commenter': 'michaelrsweet', 'type': 'User'}, {'comment_id': 459624590, 'comment_body': 'That won\'t work when printing from stdin... Maybe add an ""auto-add"" subcommand?', 'comment_created': datetime.datetime(2020, 7, 23, 17, 50, 33, tzinfo=datetime.timezone.utc), 'commenter': 'michaelrsweet', 'type': 'User'}, {'comment_id': 459625264, 'comment_body': 'Maybe just ""pappl_ml_driver_cb_t""?\r\n', 'comment_created': datetime.datetime(2020, 7, 23, 17, 51, 45, tzinfo=datetime.timezone.utc), 'commenter': 'michaelrsweet', 'type': 'User'}, {'comment_id': 463969051, 'comment_body': 'OK, we can\'t extend Pause-Printer this way. The ""printer-state-reasons"" attribute is a status attribute, so there is no way to directly manipulate its values like this.\r\n\r\nI\'ll think about this some more, but for now let\'s not worry about setting the ""offline"" value. If we do, it should be an automatic thing where we call papplDeviceList to see if the USB printer is still there.', 'comment_created': datetime.datetime(2020, 8, 1, 14, 50, 20, tzinfo=datetime.timezone.utc), 'commenter': 'michaelrsweet', 'type': 'User'}, {'comment_id': 463969081, 'comment_body': ""Same here, you can't extend Resume-Printer this way..."", 'comment_created': datetime.datetime(2020, 8, 1, 14, 50, 35, tzinfo=datetime.timezone.utc), 'commenter': 'michaelrsweet', 'type': 'User'}, {'comment_id': 463969265, 'comment_body': 'I am really uncomfortable adding libusb-specific code here, particularly when it makes the auto-add command stick around forever...\r\n', 'comment_created': datetime.datetime(2020, 8, 1, 14, 53, 7, tzinfo=datetime.timezone.utc), 'commenter': 'michaelrsweet', 'type': 'User'}, {'comment_id': 463969483, 'comment_body': ""Probably also a good idea to add the smi2699-device-command attribute - I'm surprised I hadn't added them already...\r\n"", 'comment_created': datetime.datetime(2020, 8, 1, 14, 55, 45, tzinfo=datetime.timezone.utc), 'commenter': 'michaelrsweet', 'type': 'User'}, {'comment_id': 468057813, 'comment_body': ""Why don't you do a papplSystemFindPrinter with the device URI string in the device_autoadd_cb function instead? This makes the complexity O(n^2) and will be really slow with large numbers of printers and devices."", 'comment_created': datetime.datetime(2020, 8, 10, 17, 17, 56, tzinfo=datetime.timezone.utc), 'commenter': 'michaelrsweet', 'type': 'User'}, {'comment_id': 468058367, 'comment_body': 'papplSystemFindPrinter supports lookup by device URI.', 'comment_created': datetime.datetime(2020, 8, 10, 17, 18, 59, tzinfo=datetime.timezone.utc), 'commenter': 'michaelrsweet', 'type': 'User'}, {'comment_id': 468059002, 'comment_body': 'or if you sort the devices array by device URI, you can do a cupsArrayFind on the device URI (which is significantly faster).\r\n', 'comment_created': datetime.datetime(2020, 8, 10, 17, 20, 6, tzinfo=datetime.timezone.utc), 'commenter': 'michaelrsweet', 'type': 'User'}, {'comment_id': 468060182, 'comment_body': 'How do you stop monitoring?', 'comment_created': datetime.datetime(2020, 8, 10, 17, 22, 21, tzinfo=datetime.timezone.utc), 'commenter': 'michaelrsweet', 'type': 'User'}]","[{'commit_sha': '04abc46fa757cd257ae9e053685786d497b57a8d', 'committer_username': 'JaiLuthra1', 'committer_name': 'Jai Luthra', 'committer_email': None, 'commit_date': datetime.datetime(2018, 9, 9, 13, 17, 26, tzinfo=datetime.timezone.utc)}, {'commit_sha': 'dfc6c6d6e05ca9c72792b6d4696600e7161ef416', 'committer_username': 'JaiLuthra1', 'committer_name': 'Jai Luthra', 'committer_email': None, 'commit_date': datetime.datetime(2018, 9, 9, 13, 17, 26, tzinfo=datetime.timezone.utc)}]",Jai Luthra,43112385,,User,,24,,16,36
469255973,Introduced rastertops filter function,,True,282,https://api.github.com/repos/OpenPrinting/cups-filters/pulls/282,https://github.com/OpenPrinting/cups-filters/pull/282,closed,544,461,4,1,2,1,0,0,[],2020-08-18 07:15:06+00:00,2020-08-19 07:57:45+00:00,88959.0,"1 day, 0:42:39","[{'comment_id': 472489266, 'comment_body': 'When logging, please start the log messages with ""rastertops: "", for example here do\r\n```\r\nif (doc->logfunc) doc->logfunc(doc->logdata, FILTER_LOGLEVEL_ERROR,\r\n￼\t\t  ""rastertops: out of memory\\n"");\r\n```\r\nThis makes it easier to see from which filter function a log message comes, especially when calling a chain of filters.\r\nSee also the other filter functions.\r\nCould you correct this with all log messages? Thanks.', 'comment_created': datetime.datetime(2020, 8, 18, 20, 58, 34, tzinfo=datetime.timezone.utc), 'commenter': 'tillkamppeter', 'type': 'User'}]","[{'commit_sha': 'aab0624d62cdbf8721dc1ea8d098f815fc763dde', 'committer_username': 'JaiLuthra1', 'committer_name': 'Jai Luthra', 'committer_email': None, 'commit_date': datetime.datetime(2018, 9, 9, 13, 17, 26, tzinfo=datetime.timezone.utc)}]",Jai Luthra,43112385,,User,,24,,16,36
471797083,Introduced rastertopdf filter function,,True,288,https://api.github.com/repos/OpenPrinting/cups-filters/pulls/288,https://github.com/OpenPrinting/cups-filters/pull/288,closed,481,355,7,1,2,4,0,0,[],2020-08-21 18:43:25+00:00,2020-08-22 06:53:59+00:00,43834.0,12:10:34,"[{'comment_id': 474977556, 'comment_body': 'The output format should not be determined by an environment variable within a filter function. Generally filter functions should not be controlled by environment variables.\r\nTo run filters in different modes, or generally to pass control parameters to them, the filter call scheme contains:\r\n```\r\n                  void *parameters);\r\n```\r\nSo for this filter the user supplies the output mode through the filter parameters.\r\nSimply do right in the beginning of the main function:\r\n```\r\nif (parameters)\r\n  outformat = (OutFormatType)(*parameters);\r\nelse\r\n  outformat = OUTPUT_FORMAT_PDF;\r\n```\r\nThe filter function has to be called with the parameters pointer pointing to a variable of the type `OutFormatType`, set to the desired output type. If it is set to an invalid type or if NULL is supplied as parameters pointer, the output typr defaults to standard PDF.\r\nIn the wrapper program to get a CUPS filter from this you call:\r\nIn `rastertopdf`\r\n```\r\noutformat = OUTPUT_FORMAT_PDF;\r\nret = filterCUPSWrapper(argc, argv, rastertopdf, &outformat, &JobCanceled);\r\n```\r\nIn `rastertopclm`\r\n```\r\noutformat = OUTPUT_FORMAT_PCLM;\r\nret = filterCUPSWrapper(argc, argv, rastertopdf, &outformat, &JobCanceled);\r\n```\r\nWrapper scripts are then not needed any more.', 'comment_created': datetime.datetime(2020, 8, 21, 21, 27, 51, tzinfo=datetime.timezone.utc), 'commenter': 'tillkamppeter', 'type': 'User'}, {'comment_id': 475052266, 'comment_body': '@tillkamppeter Done. Also the filterCupsWrapper needed a fix to pass the parameters. Done that too.', 'comment_created': datetime.datetime(2020, 8, 22, 6, 7, 17, tzinfo=datetime.timezone.utc), 'commenter': 'JaiLuthra1', 'type': 'User'}, {'comment_id': 475055802, 'comment_body': 'Now it is all correct. Thank you.', 'comment_created': datetime.datetime(2020, 8, 22, 6, 51, 52, tzinfo=datetime.timezone.utc), 'commenter': 'tillkamppeter', 'type': 'User'}, {'comment_id': 475055859, 'comment_body': 'And also thanks for fixing my little oversight in filterCupsWrapper().', 'comment_created': datetime.datetime(2020, 8, 22, 6, 52, 36, tzinfo=datetime.timezone.utc), 'commenter': 'tillkamppeter', 'type': 'User'}]","[{'commit_sha': '1b782558360f0b91f7af4c3baa07ebea8c6c3180', 'committer_username': 'JaiLuthra1', 'committer_name': 'Jai Luthra', 'committer_email': None, 'commit_date': datetime.datetime(2018, 9, 9, 13, 17, 26, tzinfo=datetime.timezone.utc)}]",Jai Luthra,43112385,,User,,24,,16,36
471953938,Add cancel job function,#288.,True,289,https://api.github.com/repos/OpenPrinting/cups-filters/pulls/289,https://github.com/OpenPrinting/cups-filters/pull/289,closed,90,8,2,1,0,0,0,0,[],2020-08-22 07:43:57+00:00,2020-08-22 07:48:48+00:00,291.0,0:04:51,[],"[{'commit_sha': 'ee1600b727b6bab2e20219ed76d8f1c55107d3fb', 'committer_username': 'JaiLuthra1', 'committer_name': 'Jai Luthra', 'committer_email': None, 'commit_date': datetime.datetime(2018, 9, 9, 13, 17, 26, tzinfo=datetime.timezone.utc)}]",Jai Luthra,43112385,,User,,24,,16,36

Project_ID,Name,Full_name,Language,Forks,Stars,Watchers,contributors,commits,issues,branches,PRs_count,contributor pullrequests
243025018,pappl,michaelrsweet/pappl,C,48,306,25,18,1584,27,11,8,"[{'id': 455575087, 'number': 36, 'closed': datetime.datetime(2023, 2, 28, 20, 44, 5, tzinfo=datetime.timezone.utc), 'created': datetime.datetime(2020, 7, 23, 9, 10, 50, tzinfo=datetime.timezone.utc), 'time_taken': 82121595.0, 'time_delta': '950 days, 11:33:15', 'additions': 432, 'deletions': 14, 'state': 'closed'}, {'id': 447250172, 'number': 34, 'closed': datetime.datetime(2020, 7, 13, 8, 35, 53, tzinfo=datetime.timezone.utc), 'created': datetime.datetime(2020, 7, 10, 6, 21, 12, tzinfo=datetime.timezone.utc), 'time_taken': 267281.0, 'time_delta': '3 days, 2:14:41', 'additions': 52, 'deletions': 1, 'state': 'closed'}, {'id': 440374308, 'number': 32, 'closed': datetime.datetime(2020, 7, 5, 19, 49, 12, tzinfo=datetime.timezone.utc), 'created': datetime.datetime(2020, 6, 26, 4, 30, 2, tzinfo=datetime.timezone.utc), 'time_taken': 832750.0, 'time_delta': '9 days, 15:19:10', 'additions': 1056, 'deletions': 1, 'state': 'closed'}, {'id': 435691403, 'number': 31, 'closed': datetime.datetime(2020, 6, 23, 12, 20, tzinfo=datetime.timezone.utc), 'created': datetime.datetime(2020, 6, 17, 8, 33, 30, tzinfo=datetime.timezone.utc), 'time_taken': 531990.0, 'time_delta': '6 days, 3:46:30', 'additions': 413, 'deletions': 3, 'state': 'closed'}, {'id': 433808716, 'number': 29, 'closed': datetime.datetime(2020, 6, 14, 13, 59, 33, tzinfo=datetime.timezone.utc), 'created': datetime.datetime(2020, 6, 12, 17, 41, 46, tzinfo=datetime.timezone.utc), 'time_taken': 159467.0, 'time_delta': '1 day, 20:17:47', 'additions': 140, 'deletions': 1, 'state': 'closed'}, {'id': 422386883, 'number': 26, 'closed': datetime.datetime(2020, 6, 12, 15, 29, 45, tzinfo=datetime.timezone.utc), 'created': datetime.datetime(2020, 5, 24, 9, 27, 39, tzinfo=datetime.timezone.utc), 'time_taken': 1663326.0, 'time_delta': '19 days, 6:02:06', 'additions': 2276, 'deletions': 7, 'state': 'closed'}, {'id': 418559886, 'number': 24, 'closed': datetime.datetime(2020, 5, 18, 13, 7, 59, tzinfo=datetime.timezone.utc), 'created': datetime.datetime(2020, 5, 15, 12, 20, 26, tzinfo=datetime.timezone.utc), 'time_taken': 262053.0, 'time_delta': '3 days, 0:47:33', 'additions': 241, 'deletions': 0, 'state': 'closed'}]"
278658296,hp-printer-app,michaelrsweet/hp-printer-app,C,6,31,7,4,79,2,1,0,"[{'id': 449534925, 'number': 2, 'closed': datetime.datetime(2020, 7, 15, 14, 56, 3, tzinfo=datetime.timezone.utc), 'created': datetime.datetime(2020, 7, 15, 14, 52, 4, tzinfo=datetime.timezone.utc), 'time_taken': 239.0, 'time_delta': '0:03:59', 'additions': 139, 'deletions': 1, 'state': 'closed'}, {'id': 448092281, 'number': 1, 'closed': datetime.datetime(2020, 7, 13, 13, 50, 20, tzinfo=datetime.timezone.utc), 'created': datetime.datetime(2020, 7, 13, 8, 30, 2, tzinfo=datetime.timezone.utc), 'time_taken': 19218.0, 'time_delta': '5:20:18', 'additions': 53, 'deletions': 0, 'state': 'closed'}]"
