pr_id,pr_title,pr_body,is_merged,pr_number,pr_url,pr_html_url,pr_state,additions,deletions,pr_changed_files,pr_commits_count,pr_comments_count,pr_review_comments_count,pr_labels_count,pr_assignees_count,pr_labels,pr_created_at,pr_closed_at,time_taken,time_delta,pr_review_comments,pr_commits,contributor,contributor_id,contributor_email,contributor_type,contributions,contributor_public_repos,contributor_private_repos,contributor_followings,contributor_followers
418559886,Add DNS SD discovery support,,True,24,https://api.github.com/repos/michaelrsweet/pappl/pulls/24,https://github.com/michaelrsweet/pappl/pull/24,closed,241,0,1,1,0,1,0,0,[],2020-05-15 12:20:26+00:00,2020-05-18 13:07:59+00:00,262053.0,"3 days, 0:47:33","[{'comment_id': 426610767, 'comment_body': ""Minor nit - keep preprocessor directives at the left margin. Some compilers don't like the indentation."", 'comment_created': datetime.datetime(2020, 5, 18, 13, 5, 39, tzinfo=datetime.timezone.utc), 'commenter': 'michaelrsweet', 'type': 'User'}]","[{'commit_sha': '319447928da5fa46929cd9fedb1d86e62c2e8ce0', 'committer_username': 'JaiLuthra1', 'committer_name': 'Jai Luthra', 'committer_email': None, 'commit_date': datetime.datetime(2018, 9, 9, 13, 17, 26, tzinfo=datetime.timezone.utc)}]",Jai Luthra,43112385,,User,,24,,16,36
433808716,Support papplDeviceOpen for socket URI,,True,29,https://api.github.com/repos/michaelrsweet/pappl/pulls/29,https://github.com/michaelrsweet/pappl/pull/29,closed,140,1,1,1,1,5,0,0,[],2020-06-12 17:41:46+00:00,2020-06-14 13:59:33+00:00,159467.0,"1 day, 20:17:47","[{'comment_id': 439620726, 'comment_body': 'Need the port number from the resolve as well.', 'comment_created': datetime.datetime(2020, 6, 12, 20, 9, 40, tzinfo=datetime.timezone.utc), 'commenter': 'michaelrsweet', 'type': 'User'}, {'comment_id': 439621035, 'comment_body': 'Also save port number.', 'comment_created': datetime.datetime(2020, 6, 12, 20, 10, 27, tzinfo=datetime.timezone.utc), 'commenter': 'michaelrsweet', 'type': 'User'}, {'comment_id': 439621135, 'comment_body': 'Also save port number.', 'comment_created': datetime.datetime(2020, 6, 12, 20, 10, 42, tzinfo=datetime.timezone.utc), 'commenter': 'michaelrsweet', 'type': 'User'}, {'comment_id': 439623000, 'comment_body': 'You need to look at the device URI. Something of the form ""socket://blabla._pdl-datastream._tcp.domain"" needs to be resolved, while ""socket://hostname-or-ip"" or ""socket://hostname-or-ip:port"". In CUPS, looked for ""._tcp"" in the host field and did a resolve if I found that string.\r\n', 'comment_created': datetime.datetime(2020, 6, 12, 20, 15, 33, tzinfo=datetime.timezone.utc), 'commenter': 'michaelrsweet', 'type': 'User'}, {'comment_id': 439828950, 'comment_body': 'Maybe look for ""._tcp."" to make sure you have a period after the ""._tcp""', 'comment_created': datetime.datetime(2020, 6, 14, 13, 15, 15, tzinfo=datetime.timezone.utc), 'commenter': 'michaelrsweet', 'type': 'User'}]","[{'commit_sha': '03ebb80d92e69b714a7af61b61fb45d94a60221a', 'committer_username': 'JaiLuthra1', 'committer_name': 'Jai Luthra', 'committer_email': None, 'commit_date': datetime.datetime(2018, 9, 9, 13, 17, 26, tzinfo=datetime.timezone.utc)}]",Jai Luthra,43112385,,User,,24,,16,36
435691403,Add SNMP support,,True,31,https://api.github.com/repos/michaelrsweet/pappl/pulls/31,https://github.com/michaelrsweet/pappl/pull/31,closed,413,3,1,1,5,20,0,0,[],2020-06-17 08:33:30+00:00,2020-06-23 12:20:00+00:00,531990.0,"6 days, 3:46:30","[{'comment_id': 441482157, 'comment_body': ""Can't use `alarm` for a variety of reasons. Make a dummy http_addrlist_t (with a single IPv4 address) and use httpAddrConnect instead.\r\n"", 'comment_created': datetime.datetime(2020, 6, 17, 11, 42, 15, tzinfo=datetime.timezone.utc), 'commenter': 'michaelrsweet', 'type': 'User'}, {'comment_id': 441482597, 'comment_body': 'Need to use device error callback.\r\n', 'comment_created': datetime.datetime(2020, 6, 17, 11, 43, 6, tzinfo=datetime.timezone.utc), 'commenter': 'michaelrsweet', 'type': 'User'}, {'comment_id': 441484233, 'comment_body': ""Should use `_PAPPL_` prefix, and probably `_PAPPL_SNMP_QUERY_foo` to make the meaning clear (SNMP-specific, and what we're using the request ID for...)\r\n"", 'comment_created': datetime.datetime(2020, 6, 17, 11, 46, 26, tzinfo=datetime.timezone.utc), 'commenter': 'michaelrsweet', 'type': 'User'}, {'comment_id': 441485293, 'comment_body': ""This seems non-optimal to me to convert the OID array to a string and then compare strings? Wouldn't it be better to compare the int arrays?\r\n"", 'comment_created': datetime.datetime(2020, 6, 17, 11, 48, 39, tzinfo=datetime.timezone.utc), 'commenter': 'michaelrsweet', 'type': 'User'}, {'comment_id': 441486604, 'comment_body': ""I don't think we need the make and model here; the PAPPL device interface just deals with device URIs and 1284 IDs..."", 'comment_created': datetime.datetime(2020, 6, 17, 11, 51, 9, tzinfo=datetime.timezone.utc), 'commenter': 'michaelrsweet', 'type': 'User'}, {'comment_id': 441487789, 'comment_body': ""You really don't want to connect to the device when discovering - that will wake it up fully (as opposed to just waking up the NIC) and is something we want to avoid.\r\n\r\nIf you want to confirm port 9100 support, look for the corresponding Printer/Host/PWG MIB OIDs that tell you what ports the printer is listening on."", 'comment_created': datetime.datetime(2020, 6, 17, 11, 53, 28, tzinfo=datetime.timezone.utc), 'commenter': 'michaelrsweet', 'type': 'User'}, {'comment_id': 441488224, 'comment_body': 'Use a single ""last_count"" and ""timeout"" variable for both DNS-SD and SNMP.', 'comment_created': datetime.datetime(2020, 6, 17, 11, 54, 29, tzinfo=datetime.timezone.utc), 'commenter': 'michaelrsweet', 'type': 'User'}, {'comment_id': 441488412, 'comment_body': 'How about `snmp_sock` or something more descriptive?\r\n', 'comment_created': datetime.datetime(2020, 6, 17, 11, 54, 52, tzinfo=datetime.timezone.utc), 'commenter': 'michaelrsweet', 'type': 'User'}, {'comment_id': 441488809, 'comment_body': 'Why do we care about the make and model here?\r\n', 'comment_created': datetime.datetime(2020, 6, 17, 11, 55, 35, tzinfo=datetime.timezone.utc), 'commenter': 'michaelrsweet', 'type': 'User'}, {'comment_id': 441489241, 'comment_body': '`sysname` if you are using the SYSNAME property to populate this...', 'comment_created': datetime.datetime(2020, 6, 17, 11, 56, 21, tzinfo=datetime.timezone.utc), 'commenter': 'michaelrsweet', 'type': 'User'}, {'comment_id': 441490367, 'comment_body': 'In keeping with the naming scheme we have going, maybe call this `_pappl_snmp_dev_s` and `_pappl_snmp_dev_t`?\r\n', 'comment_created': datetime.datetime(2020, 6, 17, 11, 58, 26, tzinfo=datetime.timezone.utc), 'commenter': 'michaelrsweet', 'type': 'User'}, {'comment_id': 442213726, 'comment_body': 'If you are going to allocate this, you need to free it. But you can just have this as a local variable instead with no allocation...\r\n', 'comment_created': datetime.datetime(2020, 6, 18, 13, 11, 3, tzinfo=datetime.timezone.utc), 'commenter': 'michaelrsweet', 'type': 'User'}, {'comment_id': 442214293, 'comment_body': 'You can also do ""addrlist.addr = addr"" since C supports copying of structs in assignments (gets internally mapped to a memcpy equivalent...)\r\n', 'comment_created': datetime.datetime(2020, 6, 18, 13, 12, tzinfo=datetime.timezone.utc), 'commenter': 'michaelrsweet', 'type': 'User'}, {'comment_id': 442230725, 'comment_body': ""I don't see this OID listed by any of my network printers...\r\n\r\n.1.3.6.1.4.1.2699.1.2.1.3.1.1.6.1.1 is the PWG Printer Port Monitor MIB version.\r\n\r\n.1.3.6.1.4.1.641.1.5.7.11.0 is a Lexmark-specific version.\r\n\r\n.1.3.6.1.4.1.10642.20.10.20.15.2.1.10.1 is a Zebra-specific version.\r\n\r\n.1.3.6.1.4.1.683.6.3.1.4.17.0 (SNMPv2-SMI::enterprises.683.6.3.1.4.17.0) appears to be a common OID for the TCP/IP raw port number with network label printers. See <http://oid-info.com/get/1.3.6.1.4.1.683.6.3.1.4.17>.\r\n"", 'comment_created': datetime.datetime(2020, 6, 18, 13, 36, 11, tzinfo=datetime.timezone.utc), 'commenter': 'michaelrsweet', 'type': 'User'}, {'comment_id': 442232786, 'comment_body': 'These are specific to the device code, so the enum should be defined there...', 'comment_created': datetime.datetime(2020, 6, 18, 13, 39, 14, tzinfo=datetime.timezone.utc), 'commenter': 'michaelrsweet', 'type': 'User'}, {'comment_id': 442808163, 'comment_body': 'Port number is an integer in the MIBs. I guess you could check the type and convert as needed, just in case, but you definitely need to handle integers...\r\n', 'comment_created': datetime.datetime(2020, 6, 19, 12, 22, 2, tzinfo=datetime.timezone.utc), 'commenter': 'michaelrsweet', 'type': 'User'}, {'comment_id': 443760086, 'comment_body': 'Just noticed this - it should be the port number you discovered via SNMP, so pass it in as an argument here I guess?\r\n', 'comment_created': datetime.datetime(2020, 6, 22, 18, 51, 42, tzinfo=datetime.timezone.utc), 'commenter': 'michaelrsweet', 'type': 'User'}, {'comment_id': 443760642, 'comment_body': ""Port number can be different than 9100. You don't want to use port 515 or 631, but anything else should be a valid raw socket port number."", 'comment_created': datetime.datetime(2020, 6, 22, 18, 52, 47, tzinfo=datetime.timezone.utc), 'commenter': 'michaelrsweet', 'type': 'User'}, {'comment_id': 443760826, 'comment_body': 'Pass in the port number here...', 'comment_created': datetime.datetime(2020, 6, 22, 18, 53, 11, tzinfo=datetime.timezone.utc), 'commenter': 'michaelrsweet', 'type': 'User'}, {'comment_id': 443761470, 'comment_body': 'Probably set the default port value to 9100 here...', 'comment_created': datetime.datetime(2020, 6, 22, 18, 54, 25, tzinfo=datetime.timezone.utc), 'commenter': 'michaelrsweet', 'type': 'User'}]","[{'commit_sha': 'c5a5ea112b6b1b3c220c715c946ff13f116a1cbc', 'committer_username': 'JaiLuthra1', 'committer_name': 'Jai Luthra', 'committer_email': None, 'commit_date': datetime.datetime(2018, 9, 9, 13, 17, 26, tzinfo=datetime.timezone.utc)}]",Jai Luthra,43112385,,User,,24,,16,36
422386883,Added papplMain feature,"`delete` and `default`(set) respond successful-ok but fail to make changes.
Also, to allow a server to run, the system needs the driver callback to exist so had to use testpappl/pwg driver to fix it.
@michaelrsweet Could you suggest changes, if any?",True,26,https://api.github.com/repos/michaelrsweet/pappl/pulls/26,https://github.com/michaelrsweet/pappl/pull/26,closed,2276,7,13,4,4,33,0,0,[],2020-05-24 09:27:39+00:00,2020-06-12 15:29:45+00:00,1663326.0,"19 days, 6:02:06","[{'comment_id': 429638698, 'comment_body': 'Good catch on this one!', 'comment_created': datetime.datetime(2020, 5, 24, 13, 49, 5, tzinfo=datetime.timezone.utc), 'commenter': 'michaelrsweet', 'type': 'User'}, {'comment_id': 429638824, 'comment_body': 'Except for the main ""pappl.h"" and ""pappl-private.h"" headers, header files should be named without the prefix because they\'ll get installed under a ""pappl"" directory.', 'comment_created': datetime.datetime(2020, 5, 24, 13, 50, 3, tzinfo=datetime.timezone.utc), 'commenter': 'michaelrsweet', 'type': 'User'}, {'comment_id': 429638912, 'comment_body': 'Should just be ""main.o"" or several ""main-FOO.o"" files. No need for a ""pappl-"" prefix.', 'comment_created': datetime.datetime(2020, 5, 24, 13, 51, 2, tzinfo=datetime.timezone.utc), 'commenter': 'michaelrsweet', 'type': 'User'}, {'comment_id': 429639013, 'comment_body': 'Not sure that all of the entry points need to be public API.', 'comment_created': datetime.datetime(2020, 5, 24, 13, 52, 17, tzinfo=datetime.timezone.utc), 'commenter': 'michaelrsweet', 'type': 'User'}, {'comment_id': 429639192, 'comment_body': 'Hmm, we need to think about how we want to configure the defaults for the server, probably passed to papplMain()...\r\n', 'comment_created': datetime.datetime(2020, 5, 24, 13, 54, 23, tzinfo=datetime.timezone.utc), 'commenter': 'michaelrsweet', 'type': 'User'}, {'comment_id': 429639509, 'comment_body': ""We need to do something different for that. The idea is that a printer application would initialize default settings and then run papplMain() (or maybe pass those defaults to papplMain), so we need to support arbitrary drivers from those printer applications. Plus, the testsuite directory isn't public API...\r\n"", 'comment_created': datetime.datetime(2020, 5, 24, 13, 57, 30, tzinfo=datetime.timezone.utc), 'commenter': 'michaelrsweet', 'type': 'User'}, {'comment_id': 429639767, 'comment_body': 'If ""pappl-main.h"" (renamed to ""main.h"") is a public header, it needs to include ""pappl.h"", not ""pappl-private.h"". Private definitions go in a header named ""xxx-private.h"" which will include ""xxx.h"" and potentially ""pappl-private.h"" or ""base-private.h"" as appropriate.\r\n\r\nSince ""<spawn.h>"" is needed for the internal implementation of the code and not for the public API, that include belongs either in the private header (common to all of the main functions) or in the source file that uses it.\r\n', 'comment_created': datetime.datetime(2020, 5, 24, 14, 0, 14, tzinfo=datetime.timezone.utc), 'commenter': 'michaelrsweet', 'type': 'User'}, {'comment_id': 429640080, 'comment_body': 'Library globals are generally a no-no. *if* you need this put is in a private header file, add ""extern"", prefix it with an underscore, use TitleCase naming (per the ""CONTRIBUTING.md"" file), annotate the visibility as private the the shared library, and place the descriptive comment *after* the definition for the code documentation tool. For example:\r\n\r\n```\r\nextern char *_papplPath _PAPPL_PRIVATE;  // Path to self\r\n```\r\n', 'comment_created': datetime.datetime(2020, 5, 24, 14, 3, 47, tzinfo=datetime.timezone.utc), 'commenter': 'michaelrsweet', 'type': 'User'}, {'comment_id': 429640248, 'comment_body': 'As I mentioned in a previous comment, I think the sub-commands should all be private API (starting with an underscore and using _PAPPL_PRIVATE for visibility). For example:\r\n\r\n```\r\nextern int _papplMainAdd(int num_options, cups_option_t *options) _PAPPL_PRIVATE;\r\n```\r\n', 'comment_created': datetime.datetime(2020, 5, 24, 14, 5, 31, tzinfo=datetime.timezone.utc), 'commenter': 'michaelrsweet', 'type': 'User'}, {'comment_id': 429640396, 'comment_body': 'These functions should be static to the source file using them or properly named as private API, e.g., ""_papplCopyStdin"", although I don\'t think copy_stdin needs to be available outside a single source file.', 'comment_created': datetime.datetime(2020, 5, 24, 14, 6, 53, tzinfo=datetime.timezone.utc), 'commenter': 'michaelrsweet', 'type': 'User'}, {'comment_id': 429640463, 'comment_body': 'This should be configurable, perhaps as an argument to the papplMain function.', 'comment_created': datetime.datetime(2020, 5, 24, 14, 7, 28, tzinfo=datetime.timezone.utc), 'commenter': 'michaelrsweet', 'type': 'User'}, {'comment_id': 429640559, 'comment_body': 'Again, thanks for catching this!\r\n', 'comment_created': datetime.datetime(2020, 5, 24, 14, 8, 23, tzinfo=datetime.timezone.utc), 'commenter': 'michaelrsweet', 'type': 'User'}, {'comment_id': 429640861, 'comment_body': 'Make a separate test program that uses the PWG test driver with papplMain. testpappl will eventually include a lot more unit test functionality beyond what papplMain offers.', 'comment_created': datetime.datetime(2020, 5, 24, 14, 11, 48, tzinfo=datetime.timezone.utc), 'commenter': 'michaelrsweet', 'type': 'User'}, {'comment_id': 430336183, 'comment_body': ""I've been making obviously boolean arguments/return values use the `bool` type in PAPPL (a bit of an upgrade to the original LPrint code...)"", 'comment_created': datetime.datetime(2020, 5, 26, 11, 15, 15, tzinfo=datetime.timezone.utc), 'commenter': 'michaelrsweet', 'type': 'User'}, {'comment_id': 430337827, 'comment_body': ""(Global comment) We need to pass in `basename(argv[0])` for all of the error messages, so that the printer application's name is used as the prefix instead of 'papplMain'. I suggest updating the prototypes for all of the sub-commands to accept a program name that papplMain() gets from basename(argv[0])...\r\n"", 'comment_created': datetime.datetime(2020, 5, 26, 11, 18, 36, tzinfo=datetime.timezone.utc), 'commenter': 'michaelrsweet', 'type': 'User'}, {'comment_id': 430338840, 'comment_body': 'I think we should get the device ID from papplDeviceList instead of needing it from the command-line. An empty/NULL device ID string is also OK for papplPrinterCreate.\r\n', 'comment_created': datetime.datetime(2020, 5, 26, 11, 20, 37, tzinfo=datetime.timezone.utc), 'commenter': 'michaelrsweet', 'type': 'User'}, {'comment_id': 430340257, 'comment_body': ""This needs to be configurable, and the default shouldn't be a PAPPL copyright otherwise we'll get lots of support requests in the future for somebody else's printer application that uses PAPPL... (speaking from experience on past projects...)  "", 'comment_created': datetime.datetime(2020, 5, 26, 11, 23, 28, tzinfo=datetime.timezone.utc), 'commenter': 'michaelrsweet', 'type': 'User'}, {'comment_id': 430340409, 'comment_body': 'This also needs to be configurable.', 'comment_created': datetime.datetime(2020, 5, 26, 11, 23, 46, tzinfo=datetime.timezone.utc), 'commenter': 'michaelrsweet', 'type': 'User'}, {'comment_id': 430341024, 'comment_body': 'I don\'t think we need an option for this - it\'s useful for the test framework but a deployed printer application will likely have another way to ""reset"" the configuration with suitable warnings to the user.\r\n', 'comment_created': datetime.datetime(2020, 5, 26, 11, 24, 59, tzinfo=datetime.timezone.utc), 'commenter': 'michaelrsweet', 'type': 'User'}, {'comment_id': 430341672, 'comment_body': 'Maybe this can be passed to papplMain instead?\r\n', 'comment_created': datetime.datetime(2020, 5, 26, 11, 26, 21, tzinfo=datetime.timezone.utc), 'commenter': 'michaelrsweet', 'type': 'User'}, {'comment_id': 430344293, 'comment_body': ""Should have a way to pass in server options, software name/version (which gets copied to the system version number info), a callback for unknown sub-commands (to allow for expansion), a callback to show program usage, the name of the state file, and the driver callback data pointer. Maybe more - think about what you'd need when writing a printer application, what things you are likely to customize or would be unique to each printer application.\r\n "", 'comment_created': datetime.datetime(2020, 5, 26, 11, 31, 49, tzinfo=datetime.timezone.utc), 'commenter': 'michaelrsweet', 'type': 'User'}, {'comment_id': 430345163, 'comment_body': ""This needs to use a unique base name for each printer application, probably based on the printer application name (back to that `basename(argv[0])` I've been talking about...)\r\n"", 'comment_created': datetime.datetime(2020, 5, 26, 11, 33, 34, tzinfo=datetime.timezone.utc), 'commenter': 'michaelrsweet', 'type': 'User'}, {'comment_id': 430345723, 'comment_body': 'This needs to be a callback, or perhaps this calls the callback to add application-specific sub-commands and options?\r\n', 'comment_created': datetime.datetime(2020, 5, 26, 11, 34, 42, tzinfo=datetime.timezone.utc), 'commenter': 'michaelrsweet', 'type': 'User'}, {'comment_id': 433178964, 'comment_body': 'I think like the _papplMainActionTarget convention best, so can you update these to be consistent throughout?\r\n', 'comment_created': datetime.datetime(2020, 6, 1, 11, 22, 9, tzinfo=datetime.timezone.utc), 'commenter': 'michaelrsweet', 'type': 'User'}, {'comment_id': 433180613, 'comment_body': '""auto_start"" should be type `bool`.', 'comment_created': datetime.datetime(2020, 6, 1, 11, 26, 16, tzinfo=datetime.timezone.utc), 'commenter': 'michaelrsweet', 'type': 'User'}, {'comment_id': 433182208, 'comment_body': ""This should already be defined in system.h, so it shouldn't be redefined here (particularly with a different prototype...)\r\n"", 'comment_created': datetime.datetime(2020, 6, 1, 11, 30, 12, tzinfo=datetime.timezone.utc), 'commenter': 'michaelrsweet', 'type': 'User'}, {'comment_id': 433182956, 'comment_body': 'What\'s the difference between a usage callback and an error callback in this context?\r\n\r\nAlso, these need ""void *data"" arguments (at least) to provide a way for the caller to provide additional context.\r\n\r\nFinally, if they are specific to the papplMain interface, use ""pappl_main_foo_cb_t"".', 'comment_created': datetime.datetime(2020, 6, 1, 11, 32, 5, tzinfo=datetime.timezone.utc), 'commenter': 'michaelrsweet', 'type': 'User'}, {'comment_id': 433185184, 'comment_body': 'There needs to be a better way to initialize the system object, when needed. Perhaps a callback for creating the system object and setting values prior to the papplSystemRun call? Something like:\r\n\r\n    typedef pappl_system_t *(*pappl_main_system_cb_t)(int num_options, cups_option_t *options, void *data);\r\n\r\n', 'comment_created': datetime.datetime(2020, 6, 1, 11, 37, 51, tzinfo=datetime.timezone.utc), 'commenter': 'michaelrsweet', 'type': 'User'}, {'comment_id': 433438323, 'comment_body': 'I just kept the two for expansion as you mentioned earlier.\r\nShould I remove one?', 'comment_created': datetime.datetime(2020, 6, 1, 19, 21, 16, tzinfo=datetime.timezone.utc), 'commenter': 'JaiLuthra1', 'type': 'User'}, {'comment_id': 436407758, 'comment_body': 'Not sure about the subcommand_cb argument - if it is meant to be a callback for other sub-commands then it needs to get the options, files, and sub-command in addition to a void * data parameter.\r\n\r\nAlso, you need to provide the data point in papplMain, otherwise how does papplMain know what value to send to the callbacks?\r\n', 'comment_created': datetime.datetime(2020, 6, 7, 22, 27, 52, tzinfo=datetime.timezone.utc), 'commenter': 'michaelrsweet', 'type': 'User'}, {'comment_id': 436407824, 'comment_body': 'ShowJobs -> ListJobs or ListPrinters -> ShowPrinters for consistency.\r\n\r\nAlso, what about a ShowDevices command?\r\n', 'comment_created': datetime.datetime(2020, 6, 7, 22, 28, 56, tzinfo=datetime.timezone.utc), 'commenter': 'michaelrsweet', 'type': 'User'}, {'comment_id': 436407856, 'comment_body': 'Probably this should be named _papplMainGetSetDefaultPrinter since it gets or sets the default printer, right?\r\n', 'comment_created': datetime.datetime(2020, 6, 7, 22, 29, 27, tzinfo=datetime.timezone.utc), 'commenter': 'michaelrsweet', 'type': 'User'}, {'comment_id': 436910184, 'comment_body': 'Sub-commands should not use -- option prefix. Think git and other one-executable utilities.\r\n', 'comment_created': datetime.datetime(2020, 6, 8, 18, 31, 23, tzinfo=datetime.timezone.utc), 'commenter': 'michaelrsweet', 'type': 'User'}]","[{'commit_sha': '309527a0a3820bbe16dab76a93a6776fb4061291', 'committer_username': 'JaiLuthra1', 'committer_name': 'Jai Luthra', 'committer_email': None, 'commit_date': datetime.datetime(2018, 9, 9, 13, 17, 26, tzinfo=datetime.timezone.utc)}, {'commit_sha': '3029669dc6682a309916a0d8cc2c66231f55905a', 'committer_username': 'JaiLuthra1', 'committer_name': 'Jai Luthra', 'committer_email': None, 'commit_date': datetime.datetime(2018, 9, 9, 13, 17, 26, tzinfo=datetime.timezone.utc)}, {'commit_sha': 'a0eee1e9912a24b3281630024153955dfe21e8a6', 'committer_username': 'JaiLuthra1', 'committer_name': 'Jai Luthra', 'committer_email': None, 'commit_date': datetime.datetime(2018, 9, 9, 13, 17, 26, tzinfo=datetime.timezone.utc)}, {'commit_sha': '72b97493bf1aa14a1a734770a78e9ea28b17517a', 'committer_username': 'JaiLuthra1', 'committer_name': 'Jai Luthra', 'committer_email': None, 'commit_date': datetime.datetime(2018, 9, 9, 13, 17, 26, tzinfo=datetime.timezone.utc)}]",Jai Luthra,43112385,,User,,24,,16,36
