pr_id,pr_title,pr_body,is_merged,pr_number,pr_url,pr_html_url,pr_state,additions,deletions,pr_changed_files,pr_commits_count,pr_comments_count,pr_review_comments_count,pr_labels_count,pr_assignees_count,pr_labels,pr_created_at,pr_closed_at,time_taken,time_delta,pr_review_comments,pr_commits,contributor,contributor_id,contributor_email,contributor_type,contributions,contributor_public_repos,contributor_private_repos,contributor_followings,contributor_followers
436754366,Toggle stream settings,"This PR adds checkboxes to `StreamInfoView` for toggling muted and pinned settings for streams.

There are two parts to this PR and a bunch of minor refactors:
**1. Add support for muting** - We already handle mute events, so all we have to do here is add a checkbox that will toggle mute status.
**2. Add support for pinning** - First support for pinning events are added, then a checkbox is added to `StreamInfoView`.
",True,695,https://api.github.com/repos/zulip/zulip-terminal/pulls/695,https://github.com/zulip/zulip-terminal/pull/695,closed,248,48,8,7,4,64,1,0,[{'name': 'size: XL'}],2020-06-18 20:46:19+00:00,2020-07-27 06:06:52+00:00,3316833.0,"38 days, 9:20:33","[{'comment_id': 443004509, 'comment_body': ""I know this is the label used in the webapp, but it does read a bit strangely to me for some reason. Consistency with the webapp may be important, but this seems like an 'action' rather than a status. Maybe something to think about for a v2, or discuss with frontend.\r\n\r\nOne idea would be 'muted', which leaves out 'Stream', but perhaps we want a 'Title' above the checkboxes in any case, ie. something like 'Stream settings'?"", 'comment_created': datetime.datetime(2020, 6, 19, 19, 11, 51, tzinfo=datetime.timezone.utc), 'commenter': 'neiljp', 'type': 'User'}, {'comment_id': 443005323, 'comment_body': ""I'm not sure how you plan to develop this further, but it may be useful to simply extract the label text used later and place a `len` expression in here, so the code will express what is happening rather than needing another comment."", 'comment_created': datetime.datetime(2020, 6, 19, 19, 14, 4, tzinfo=datetime.timezone.utc), 'commenter': 'neiljp', 'type': 'User'}, {'comment_id': 443007448, 'comment_body': ""I like this, though this may be something we want to standardize on throughout rather than hard-coding. You might like to include that change in a commit with things like extracting the stream 'triangle' and a few other things we've discussed? Maybe in a file in `config`?"", 'comment_created': datetime.datetime(2020, 6, 19, 19, 19, 56, tzinfo=datetime.timezone.utc), 'commenter': 'neiljp', 'type': 'User'}, {'comment_id': 443008154, 'comment_body': 'Do we need this `self`?', 'comment_created': datetime.datetime(2020, 6, 19, 19, 21, 53, tzinfo=datetime.timezone.utc), 'commenter': 'neiljp', 'type': 'User'}, {'comment_id': 443009316, 'comment_body': ""Possibly for a separate refactor later (or before this), we could consider just passing in the `stream_id`, since we're already calling into the `model` to activate the muting, so could call in to fetch whatever details are required. We don't actually use the color right now."", 'comment_created': datetime.datetime(2020, 6, 19, 19, 25, 10, tzinfo=datetime.timezone.utc), 'commenter': 'neiljp', 'type': 'User'}, {'comment_id': 443010005, 'comment_body': ""`new_state` is unused; did this code come from somewhere else? Should we name it accordingly or elide it, if it's unused?"", 'comment_created': datetime.datetime(2020, 6, 19, 19, 27, 1, tzinfo=datetime.timezone.utc), 'commenter': 'neiljp', 'type': 'User'}, {'comment_id': 443011578, 'comment_body': 'Blank lines around this line, ideally.', 'comment_created': datetime.datetime(2020, 6, 19, 19, 31, 18, tzinfo=datetime.timezone.utc), 'commenter': 'neiljp', 'type': 'User'}, {'comment_id': 443237090, 'comment_body': 'Yes, a status message would be more appropriate in case of a checkbox.', 'comment_created': datetime.datetime(2020, 6, 21, 16, 48, 18, tzinfo=datetime.timezone.utc), 'commenter': 'kaustubh-nair', 'type': 'User'}, {'comment_id': 443241342, 'comment_body': ""It's urwids default function signature for callback functions"", 'comment_created': datetime.datetime(2020, 6, 21, 17, 45, 9, tzinfo=datetime.timezone.utc), 'commenter': 'kaustubh-nair', 'type': 'User'}, {'comment_id': 443241663, 'comment_body': ""Hmm, I still need a comment to explain why I'm adding 4"", 'comment_created': datetime.datetime(2020, 6, 21, 17, 49, 47, tzinfo=datetime.timezone.utc), 'commenter': 'kaustubh-nair', 'type': 'User'}, {'comment_id': 443241912, 'comment_body': 'I need it while testing', 'comment_created': datetime.datetime(2020, 6, 21, 17, 53, 19, tzinfo=datetime.timezone.utc), 'commenter': 'kaustubh-nair', 'type': 'User'}, {'comment_id': 443249489, 'comment_body': ""Added stream header indicator for now, I'll make a new issue for moving the rest of them"", 'comment_created': datetime.datetime(2020, 6, 21, 19, 28, 8, tzinfo=datetime.timezone.utc), 'commenter': 'kaustubh-nair', 'type': 'User'}, {'comment_id': 443708748, 'comment_body': ""I didn't use `model.is_muted_stream()` because I can't figure out a way to mock it during testing, without rewriting the whole test."", 'comment_created': datetime.datetime(2020, 6, 22, 17, 13, 31, tzinfo=datetime.timezone.utc), 'commenter': 'kaustubh-nair', 'type': 'User'}, {'comment_id': 443709072, 'comment_body': ""I'm not sure why this works, but `mocker.patch('controller', 'model.is_muted', return_value=False)` doesn't."", 'comment_created': datetime.datetime(2020, 6, 22, 17, 14, 9, tzinfo=datetime.timezone.utc), 'commenter': 'kaustubh-nair', 'type': 'User'}, {'comment_id': 444310266, 'comment_body': 'We may want to use names that are more descriptive so that it is easier for our end-users to depict what modifies which UI element.\r\n\r\nSee also [#zulip-terminal > Unicode characters](https://chat.zulip.org/#narrow/stream/206-zulip-terminal/topic/Unicode.20characters/near/862659).', 'comment_created': datetime.datetime(2020, 6, 23, 15, 24, 26, tzinfo=datetime.timezone.utc), 'commenter': 'preetmishra', 'type': 'User'}, {'comment_id': 444319460, 'comment_body': '@kaustubh-nair Which 4?', 'comment_created': datetime.datetime(2020, 6, 23, 15, 37, 26, tzinfo=datetime.timezone.utc), 'commenter': 'preetmishra', 'type': 'User'}, {'comment_id': 444352283, 'comment_body': ""Ah, sorry this is outdated\r\nThis is what I'm referring to\r\n```python3\r\n        # Add 4 to stream settings label for accomodating checkbox.\r\n        width = max(len(desc) + 2, len(title) + 4,\r\n                    len(muted_setting.label) + 4)\r\n```"", 'comment_created': datetime.datetime(2020, 6, 23, 16, 26, 11, tzinfo=datetime.timezone.utc), 'commenter': 'kaustubh-nair', 'type': 'User'}, {'comment_id': 444353348, 'comment_body': '@preetmishra We could do that but I thought it would be better to stick to standard names from wikipedia?\r\nThe problem with names related to UI elements is that the same characters may be reused in a lot of places, for e.g. lineboxes.', 'comment_created': datetime.datetime(2020, 6, 23, 16, 27, 51, tzinfo=datetime.timezone.utc), 'commenter': 'kaustubh-nair', 'type': 'User'}, {'comment_id': 444593250, 'comment_body': ""@kaustubh-nair There are quite a few cases not included in commit - I thought you were going to put this into a separate PR/issue?\r\n\r\nI agree with @preetmishra that we probably want semantic names rather than direct ones, ie. here the equivalent of 'stream-topic-separator' rather than the currently-used version. That would mean we could change in one place and all the code+tests should update, and ZT run with different characters."", 'comment_created': datetime.datetime(2020, 6, 24, 1, 25, 26, tzinfo=datetime.timezone.utc), 'commenter': 'neiljp', 'type': 'User'}, {'comment_id': 444597085, 'comment_body': ""If this works, that's fine for now. Mocks can be mysterious ;)"", 'comment_created': datetime.datetime(2020, 6, 24, 1, 41, 4, tzinfo=datetime.timezone.utc), 'commenter': 'neiljp', 'type': 'User'}, {'comment_id': 444598904, 'comment_body': 'Is this necessary?', 'comment_created': datetime.datetime(2020, 6, 24, 1, 47, 39, tzinfo=datetime.timezone.utc), 'commenter': 'neiljp', 'type': 'User'}, {'comment_id': 444599250, 'comment_body': ""These both use the same common prefix, so let's introduce a variable for all that common prefix to improve the readability."", 'comment_created': datetime.datetime(2020, 6, 24, 1, 49, 10, tzinfo=datetime.timezone.utc), 'commenter': 'neiljp', 'type': 'User'}, {'comment_id': 444600678, 'comment_body': 'Same for self.stream_id? (re for debugging? If so, maybe keep a do-not-merge commit holding those changes separate?)', 'comment_created': datetime.datetime(2020, 6, 24, 1, 54, 39, tzinfo=datetime.timezone.utc), 'commenter': 'neiljp', 'type': 'User'}, {'comment_id': 444601617, 'comment_body': 'Ah, I see you add more during this PR; I had expected the others we already have first, though.', 'comment_created': datetime.datetime(2020, 6, 24, 1, 58, 18, tzinfo=datetime.timezone.utc), 'commenter': 'neiljp', 'type': 'User'}, {'comment_id': 444604678, 'comment_body': 'If these two values vary, is this really a bugfix rather than refactor?', 'comment_created': datetime.datetime(2020, 6, 24, 2, 10, 25, tzinfo=datetime.timezone.utc), 'commenter': 'neiljp', 'type': 'User'}, {'comment_id': 444605060, 'comment_body': 'As per another comment, is this a bugfix for muted streams?', 'comment_created': datetime.datetime(2020, 6, 24, 2, 11, 41, tzinfo=datetime.timezone.utc), 'commenter': 'neiljp', 'type': 'User'}, {'comment_id': 444605745, 'comment_body': ""Did the model changes expose something different here?\r\n\r\nLooking at the unread counts handling being here, I'd love to move that into a model method to mark a stream/topic muted; it's rather hacky being in UI code."", 'comment_created': datetime.datetime(2020, 6, 24, 2, 14, 9, tzinfo=datetime.timezone.utc), 'commenter': 'neiljp', 'type': 'User'}, {'comment_id': 444807816, 'comment_body': 'There are a lot of unicode characters in lineboxes so it will be a little time-consuming, hence a new PR would be better.\r\n\r\n', 'comment_created': datetime.datetime(2020, 6, 24, 10, 48, 6, tzinfo=datetime.timezone.utc), 'commenter': 'kaustubh-nair', 'type': 'User'}, {'comment_id': 444808643, 'comment_body': '@neiljp How would you specify semantic names for lines in lineboxes that uses a different style in each corner?\r\nAlso the same lines are used as pane seperators, hence I thought a general name would be better.', 'comment_created': datetime.datetime(2020, 6, 24, 10, 49, 55, tzinfo=datetime.timezone.utc), 'commenter': 'kaustubh-nair', 'type': 'User'}, {'comment_id': 444810679, 'comment_body': 'To clarify, I meant while writing the tests.\r\nI need a way to obtain the checkbox object while testing it\r\n\r\nRefer to tests above in the same commit\r\n```python3\r\nmute_checkbox = self.stream_info_view.stream_info_content[4]\r\n```', 'comment_created': datetime.datetime(2020, 6, 24, 10, 54, 4, tzinfo=datetime.timezone.utc), 'commenter': 'kaustubh-nair', 'type': 'User'}, {'comment_id': 444814173, 'comment_body': ""This is testing `classify_unread_counts`, which as per old behavior, did not update `all_msgs` for muted streams. This was done instead in the UI while generating stream buttons. \r\nThis commit moved that part into `classify_unread_counts`, hence there's a change in the values returned.\r\nThe overall external behavior did not change, so I'm not sure if it's correct to call it a bugfix"", 'comment_created': datetime.datetime(2020, 6, 24, 11, 1, 3, tzinfo=datetime.timezone.utc), 'commenter': 'kaustubh-nair', 'type': 'User'}, {'comment_id': 444814558, 'comment_body': 'Yeah, that seems like a useful refactor too.', 'comment_created': datetime.datetime(2020, 6, 24, 11, 1, 50, tzinfo=datetime.timezone.utc), 'commenter': 'kaustubh-nair', 'type': 'User'}, {'comment_id': 444902944, 'comment_body': 'The +4 is `len([UNICODE]SPACE)`.\r\n\r\nAlso, there is a typo in the comment.', 'comment_created': datetime.datetime(2020, 6, 24, 13, 43, tzinfo=datetime.timezone.utc), 'commenter': 'preetmishra', 'type': 'User'}, {'comment_id': 446197964, 'comment_body': 'Used in the callback, moved to next commit.', 'comment_created': datetime.datetime(2020, 6, 26, 13, 53, 15, tzinfo=datetime.timezone.utc), 'commenter': 'kaustubh-nair', 'type': 'User'}, {'comment_id': 448065968, 'comment_body': ""If parametrizing with one value, it's clearer to put it as the default parameter in the test function signature."", 'comment_created': datetime.datetime(2020, 7, 1, 1, 27, 48, tzinfo=datetime.timezone.utc), 'commenter': 'neiljp', 'type': 'User'}, {'comment_id': 448072683, 'comment_body': 'Add blank lines around? :)', 'comment_created': datetime.datetime(2020, 7, 1, 1, 55, 16, tzinfo=datetime.timezone.utc), 'commenter': 'neiljp', 'type': 'User'}, {'comment_id': 448072814, 'comment_body': ""You're not noting the multiple areas that are affected in commit titles - it can be a little work to update that, but it makes it more obvious when multiple files are updated and even hint whether changes might be split into multiple commits."", 'comment_created': datetime.datetime(2020, 7, 1, 1, 55, 40, tzinfo=datetime.timezone.utc), 'commenter': 'neiljp', 'type': 'User'}, {'comment_id': 448073622, 'comment_body': ""As elsewhere, if there is just one value, it's more obvious when it's just default values in the test function list, though this could also be unpacked in the function - it'd also avoid the need to deepcopy?\r\n\r\nminor: these might also be clearer with `initial_` prefixes."", 'comment_created': datetime.datetime(2020, 7, 1, 1, 59, 8, tzinfo=datetime.timezone.utc), 'commenter': 'neiljp', 'type': 'User'}, {'comment_id': 448079160, 'comment_body': ""It would be useful to have this as common code with the initial sorting? To ensure we don't have any differences given the duplication. "", 'comment_created': datetime.datetime(2020, 7, 1, 2, 21, 19, tzinfo=datetime.timezone.utc), 'commenter': 'neiljp', 'type': 'User'}, {'comment_id': 448086397, 'comment_body': ""I'd prefer to avoid this, particularly outside the `Model`; maybe just a nested function? In closer context I'm not sure we'd need the detailed docstring, of course.\r\n\r\nIn a broader sense, this suggests - along with the is-pinned method - that we could consider a different data structure here? I haven't examined every use though. This could be a later change."", 'comment_created': datetime.datetime(2020, 7, 1, 2, 51, 1, tzinfo=datetime.timezone.utc), 'commenter': 'neiljp', 'type': 'User'}, {'comment_id': 448089207, 'comment_body': ""Isn't it going to be bad if we return an empty list, too?"", 'comment_created': datetime.datetime(2020, 7, 1, 3, 3, 56, tzinfo=datetime.timezone.utc), 'commenter': 'neiljp', 'type': 'User'}, {'comment_id': 451024484, 'comment_body': ""This differs from Preet's commit slightly; it would be good to indicate something like 'Adjusted by *Kaustubh* to retain custom popup width for now because...'\r\n\r\nAlso, the commit title indicates 'core' is affected, when it's not."", 'comment_created': datetime.datetime(2020, 7, 7, 17, 21, 58, tzinfo=datetime.timezone.utc), 'commenter': 'neiljp', 'type': 'User'}, {'comment_id': 451027183, 'comment_body': ""Do you still intend to break out the unicode characters into a separate PR?\r\n\r\nWe can discuss whether we want to isolate line-box specializations; for isolating the characters I would suggest focusing on the others first, though we can certainly discuss those first too, or brainstorm a list (in that topic above?).\r\n\r\nWhile unicode does describe what these are, I'd propose something more specific if we can (all my review is unicode!), though my first thought of 'symbols' isn't necessarily much better."", 'comment_created': datetime.datetime(2020, 7, 7, 17, 26, 31, tzinfo=datetime.timezone.utc), 'commenter': 'neiljp', 'type': 'User'}, {'comment_id': 452573009, 'comment_body': ""It's not just `views.py` that you've edited here; it'd be good to see that in the commit area."", 'comment_created': datetime.datetime(2020, 7, 10, 1, 21, 22, tzinfo=datetime.timezone.utc), 'commenter': 'neiljp', 'type': 'User'}, {'comment_id': 452574685, 'comment_body': 'Again, this is a refactor which involves `buttons` too.', 'comment_created': datetime.datetime(2020, 7, 10, 1, 27, 59, tzinfo=datetime.timezone.utc), 'commenter': 'neiljp', 'type': 'User'}, {'comment_id': 452576724, 'comment_body': 'Is this connected/relevant? Do you use an auto-formatter?', 'comment_created': datetime.datetime(2020, 7, 10, 1, 36, 26, tzinfo=datetime.timezone.utc), 'commenter': 'neiljp', 'type': 'User'}, {'comment_id': 452581195, 'comment_body': ""This doesn't depend upon whether the left panel is showing the topics, so forcibly switches out of topic view. I tested this by having two ZT sessions side by side."", 'comment_created': datetime.datetime(2020, 7, 10, 1, 55, 50, tzinfo=datetime.timezone.utc), 'commenter': 'neiljp', 'type': 'User'}, {'comment_id': 452610828, 'comment_body': 'Ah, my bad. I am fixing that (area in the commit title) in my WIP PR.', 'comment_created': datetime.datetime(2020, 7, 10, 4, 4, 27, tzinfo=datetime.timezone.utc), 'commenter': 'preetmishra', 'type': 'User'}, {'comment_id': 454612326, 'comment_body': 'I intend to remove this commit, opened #717 ', 'comment_created': datetime.datetime(2020, 7, 14, 20, 5, 51, tzinfo=datetime.timezone.utc), 'commenter': 'kaustubh-nair', 'type': 'User'}, {'comment_id': 456346344, 'comment_body': 'Unrelated, so opened #722', 'comment_created': datetime.datetime(2020, 7, 17, 10, 0, 59, tzinfo=datetime.timezone.utc), 'commenter': 'kaustubh-nair', 'type': 'User'}, {'comment_id': 456355356, 'comment_body': 'When I add all of them, I usually exceed the line limit so I just add the file with the major changes.', 'comment_created': datetime.datetime(2020, 7, 17, 10, 19, 55, tzinfo=datetime.timezone.utc), 'commenter': 'kaustubh-nair', 'type': 'User'}, {'comment_id': 456788818, 'comment_body': ""@kaustubh-nair Note that the +2 is extra width which we had was for the center alignment. We might want to remove it as we're not using the alignment with `Text`."", 'comment_created': datetime.datetime(2020, 7, 18, 13, 10, 55, tzinfo=datetime.timezone.utc), 'commenter': 'preetmishra', 'type': 'User'}, {'comment_id': 456789654, 'comment_body': ""Could we accept the `popup_width` from here and compare other widths with it later in the subsequent commits? That would avoid the calculation that you're doing in https://github.com/zulip/zulip-terminal/pull/695/commits/89e53d41bc190524e256aeac06fffed1446a4842#diff-5b93264509b3ec67b9370b2bcbaa7798R1002."", 'comment_created': datetime.datetime(2020, 7, 18, 13, 21, tzinfo=datetime.timezone.utc), 'commenter': 'preetmishra', 'type': 'User'}, {'comment_id': 456789818, 'comment_body': '(See also https://github.com/zulip/zulip-terminal/pull/695#discussion_r456789654.)', 'comment_created': datetime.datetime(2020, 7, 18, 13, 23, 2, tzinfo=datetime.timezone.utc), 'commenter': 'preetmishra', 'type': 'User'}, {'comment_id': 456808041, 'comment_body': 'Yeah, that sounds like a good idea, updated :+1: ', 'comment_created': datetime.datetime(2020, 7, 18, 16, 59, 26, tzinfo=datetime.timezone.utc), 'commenter': 'kaustubh-nair', 'type': 'User'}, {'comment_id': 460372164, 'comment_body': ""Note that you can save a few characters with `file/file/file:` vs `file: file: file:`, which we should note in a 'commit style' guide somewhere (and/or update gitlint rules) as we seem to have settled on something like that now."", 'comment_created': datetime.datetime(2020, 7, 25, 6, 25, 28, tzinfo=datetime.timezone.utc), 'commenter': 'neiljp', 'type': 'User'}, {'comment_id': 460372501, 'comment_body': ""This resolves the situation of it being in topic view when it's updated, but the view doesn't update when you toggle back into stream view."", 'comment_created': datetime.datetime(2020, 7, 25, 6, 29, 50, tzinfo=datetime.timezone.utc), 'commenter': 'neiljp', 'type': 'User'}, {'comment_id': 460423176, 'comment_body': ""If this is not used anywhere other than model, let's place it in `model.py` somewhere?"", 'comment_created': datetime.datetime(2020, 7, 25, 16, 56, 10, tzinfo=datetime.timezone.utc), 'commenter': 'neiljp', 'type': 'User'}, {'comment_id': 460423497, 'comment_body': 'These sizes are quite different - thoughts on which one we should really use?', 'comment_created': datetime.datetime(2020, 7, 25, 17, 0, 7, tzinfo=datetime.timezone.utc), 'commenter': 'neiljp', 'type': 'User'}, {'comment_id': 460549822, 'comment_body': 'Fixed', 'comment_created': datetime.datetime(2020, 7, 26, 16, 58, 34, tzinfo=datetime.timezone.utc), 'commenter': 'kaustubh-nair', 'type': 'User'}, {'comment_id': 460550104, 'comment_body': ""I hope it is okay to put it here because I can't make it a class method. I don't see a reason to make this a static method, so this was the only choice.\r\nAlso, I don't think I understand why `_stream_info_from_subscriptions()` is a static method? Why would you need static methods at all when there is only one `Model` instance?"", 'comment_created': datetime.datetime(2020, 7, 26, 17, 1, 38, tzinfo=datetime.timezone.utc), 'commenter': 'kaustubh-nair', 'type': 'User'}, {'comment_id': 460551538, 'comment_body': 'Yes, these should be the same - checkbox is a box widget here. Updated.', 'comment_created': datetime.datetime(2020, 7, 26, 17, 15, 56, tzinfo=datetime.timezone.utc), 'commenter': 'kaustubh-nair', 'type': 'User'}, {'comment_id': 460605237, 'comment_body': 'Could we retain focus on that stream too?', 'comment_created': datetime.datetime(2020, 7, 27, 1, 37, 25, tzinfo=datetime.timezone.utc), 'commenter': 'neiljp', 'type': 'User'}, {'comment_id': 460660251, 'comment_body': ""This is fine here for now. I'm expecting there may be more refactoring of stream data in the near future, so just having it local to the model is sufficient.\r\n\r\nA static method is just in a different namespace. I think the only difference we could make would be to have it with a leading underscore, but we're not really consistent otherwise right now.\r\n\r\nI think `_stream_info_from_subscriptions` might be inlined in future. The advantage is that the individual functions can be tested, and static methods are guaranteed not to modify any data in an object, except potentially that passed in - which can be caught with a type checker, ideally."", 'comment_created': datetime.datetime(2020, 7, 27, 5, 51, 8, tzinfo=datetime.timezone.utc), 'commenter': 'neiljp', 'type': 'User'}]","[{'commit_sha': '788762feb9b5ac0e02c281ea2fee75bbb31d385f', 'committer_username': 'preetmishra', 'committer_name': 'Preet Mishra', 'committer_email': 'ipreetmishra@gmail.com', 'commit_date': datetime.datetime(2018, 9, 26, 17, 5, 44, tzinfo=datetime.timezone.utc)}, {'commit_sha': 'be92d52cb102abdb591d56f3fe25cdee30e93d78', 'committer_username': 'kaustubh-nair', 'committer_name': 'Kaustubh Nair', 'committer_email': 'kaustubh.nair108@gmail.com', 'commit_date': datetime.datetime(2017, 7, 15, 13, 2, 30, tzinfo=datetime.timezone.utc)}, {'commit_sha': '1f2f183a7a3d3cd0e082dc25911d194a47b64e2c', 'committer_username': 'kaustubh-nair', 'committer_name': 'Kaustubh Nair', 'committer_email': 'kaustubh.nair108@gmail.com', 'commit_date': datetime.datetime(2017, 7, 15, 13, 2, 30, tzinfo=datetime.timezone.utc)}, {'commit_sha': '740a2e477bfb0f8b906b5b310282e8f699af82be', 'committer_username': 'kaustubh-nair', 'committer_name': 'Kaustubh Nair', 'committer_email': 'kaustubh.nair108@gmail.com', 'commit_date': datetime.datetime(2017, 7, 15, 13, 2, 30, tzinfo=datetime.timezone.utc)}, {'commit_sha': '344769e095e0aee3ba8e57f6956238d4b6aa6dd0', 'committer_username': 'kaustubh-nair', 'committer_name': 'Kaustubh Nair', 'committer_email': 'kaustubh.nair108@gmail.com', 'commit_date': datetime.datetime(2017, 7, 15, 13, 2, 30, tzinfo=datetime.timezone.utc)}, {'commit_sha': '34ddadae3a1a288189e479252bb3c92b714a9247', 'committer_username': 'kaustubh-nair', 'committer_name': 'Kaustubh Nair', 'committer_email': 'kaustubh.nair108@gmail.com', 'commit_date': datetime.datetime(2017, 7, 15, 13, 2, 30, tzinfo=datetime.timezone.utc)}, {'commit_sha': '32a2a21e8cc4fbf0227a9740e1d82c1259c1c6ab', 'committer_username': 'kaustubh-nair', 'committer_name': 'Kaustubh Nair', 'committer_email': 'kaustubh.nair108@gmail.com', 'commit_date': datetime.datetime(2017, 7, 15, 13, 2, 30, tzinfo=datetime.timezone.utc)}]",Kaustubh Nair,30197132,kaustubh.nair108@gmail.com,User,,48,,71,79
