pr_id,pr_title,pr_body,is_merged,pr_number,pr_url,pr_html_url,pr_state,additions,deletions,pr_changed_files,pr_commits_count,pr_comments_count,pr_review_comments_count,pr_labels_count,pr_assignees_count,pr_labels,pr_created_at,pr_closed_at,time_taken,time_delta,pr_review_comments,pr_commits,contributor,contributor_id,contributor_email,contributor_type,contributions,contributor_public_repos,contributor_private_repos,contributor_followings,contributor_followers
444943115,Emoji data storage improvements and custom emoji support,"The main points of this PR are:
* Currently emoji data only has emoji names. This PR makes the emoji data more complete, by storing other properties like emoji code, and emoji type. They are necessary for sending emoji data while adding reactions to messages. Additionally, a distinction between default and custom emojis would be nice, in case we'd want this data in the future.
* Adds support for custom emojis by fetching them from the server and storing them in the model. Since custom emojis are stored in the model, we might as well store the default ones too - instead of fetching emojis from two different places.
* A bunch of variable/filename renaming commits to facilitate this change.
* Adding zulip_extra_emoji to list of emojis",False,710,https://api.github.com/repos/zulip/zulip-terminal/pulls/710,https://github.com/zulip/zulip-terminal/pull/710,closed,1736,1620,13,7,5,37,3,0,"[{'name': 'size: XL'}, {'name': 'PR blocks other PR'}, {'name': 'PR ready to be merged'}]",2020-07-06 18:47:33+00:00,2020-10-16 17:42:00+00:00,8808867.0,"101 days, 22:54:27","[{'comment_id': 466667653, 'comment_body': 'Use a different quote style to avoid all the escaping here?', 'comment_created': datetime.datetime(2020, 8, 6, 20, 28, 24, tzinfo=datetime.timezone.utc), 'commenter': 'neiljp', 'type': 'User'}, {'comment_id': 466668490, 'comment_body': 'Is this newline necessary here? Having them on one line would be clearer - does this make them that long?', 'comment_created': datetime.datetime(2020, 8, 6, 20, 30, 3, tzinfo=datetime.timezone.utc), 'commenter': 'neiljp', 'type': 'User'}, {'comment_id': 466684082, 'comment_body': 'These appear to be user ids. If so, we could correlate these to ones we use in other fixtures?\r\n\r\nWe may want to take into account the variation between 2.1 and 3+ here due to https://www.zulipchat.com/api/get-custom-emoji', 'comment_created': datetime.datetime(2020, 8, 6, 21, 1, 32, tzinfo=datetime.timezone.utc), 'commenter': 'neiljp', 'type': 'User'}, {'comment_id': 466686924, 'comment_body': ""It's worth noting that this is deactivated in a comment - that's why this doesn't correlate to the `custom_emojis` fixture, presumably."", 'comment_created': datetime.datetime(2020, 8, 6, 21, 7, 29, tzinfo=datetime.timezone.utc), 'commenter': 'neiljp', 'type': 'User'}, {'comment_id': 466687854, 'comment_body': 'Typo in your commit summary.', 'comment_created': datetime.datetime(2020, 8, 6, 21, 9, 37, tzinfo=datetime.timezone.utc), 'commenter': 'neiljp', 'type': 'User'}, {'comment_id': 466692588, 'comment_body': ""We could `TypedDict` the emoji types? There's even scope for using `Literal` here given the limited set of emoji-types, though we need to understand the realm vs custom vs zulip-extra."", 'comment_created': datetime.datetime(2020, 8, 6, 21, 20, 20, tzinfo=datetime.timezone.utc), 'commenter': 'neiljp', 'type': 'User'}, {'comment_id': 466692982, 'comment_body': 'This looks like it would be cleaner as a comprehension?', 'comment_created': datetime.datetime(2020, 8, 6, 21, 21, 14, tzinfo=datetime.timezone.utc), 'commenter': 'neiljp', 'type': 'User'}, {'comment_id': 466694486, 'comment_body': ':fearful: ', 'comment_created': datetime.datetime(2020, 8, 6, 21, 24, 33, tzinfo=datetime.timezone.utc), 'commenter': 'neiljp', 'type': 'User'}, {'comment_id': 466695721, 'comment_body': 'What are you trying to state by this?', 'comment_created': datetime.datetime(2020, 8, 6, 21, 27, 18, tzinfo=datetime.timezone.utc), 'commenter': 'neiljp', 'type': 'User'}, {'comment_id': 466696205, 'comment_body': 'Is this really `active_emoji_data`, given the qualifier on the custom emojis?', 'comment_created': datetime.datetime(2020, 8, 6, 21, 28, 28, tzinfo=datetime.timezone.utc), 'commenter': 'neiljp', 'type': 'User'}, {'comment_id': 466698454, 'comment_body': 'Are these all `realm_emoji`? In reactions we have unicode/realm/zulip_extra?', 'comment_created': datetime.datetime(2020, 8, 6, 21, 33, 48, tzinfo=datetime.timezone.utc), 'commenter': 'neiljp', 'type': 'User'}, {'comment_id': 466701721, 'comment_body': ""Can we end up with duplicates here? Is that OK? Custom emoji can override unicode ones, I believe, but I'm not sure how we want to handle that situation."", 'comment_created': datetime.datetime(2020, 8, 6, 21, 41, 41, tzinfo=datetime.timezone.utc), 'commenter': 'neiljp', 'type': 'User'}, {'comment_id': 467009257, 'comment_body': 'Yeah, the line becomes too long for `mypy`.', 'comment_created': datetime.datetime(2020, 8, 7, 12, 29, 12, tzinfo=datetime.timezone.utc), 'commenter': 'kaustubh-nair', 'type': 'User'}, {'comment_id': 467011227, 'comment_body': 'Makes sure that `model.emoji_data` contains both `unicode_emoji` and `custom_emoji`', 'comment_created': datetime.datetime(2020, 8, 7, 12, 33, 24, tzinfo=datetime.timezone.utc), 'commenter': 'kaustubh-nair', 'type': 'User'}, {'comment_id': 467015159, 'comment_body': 'Custom emojis are all `realm_emoji`', 'comment_created': datetime.datetime(2020, 8, 7, 12, 41, 44, tzinfo=datetime.timezone.utc), 'commenter': 'kaustubh-nair', 'type': 'User'}, {'comment_id': 467017436, 'comment_body': 'The active qualifier is only on custom emoji, but this contains `unicode_emoji` too?', 'comment_created': datetime.datetime(2020, 8, 7, 12, 46, 19, tzinfo=datetime.timezone.utc), 'commenter': 'kaustubh-nair', 'type': 'User'}, {'comment_id': 467017837, 'comment_body': 'Do we consider `unicode_emojis` active by default?', 'comment_created': datetime.datetime(2020, 8, 7, 12, 47, 9, tzinfo=datetime.timezone.utc), 'commenter': 'kaustubh-nair', 'type': 'User'}, {'comment_id': 467025516, 'comment_body': ""I didn't consider this. The dictionary has emoji name as keys so it cannot have duplicates.\r\nSince custom emojis are added later, the unicode ones with the same names are quietly removed. This does seem to achieve what we want - the overriding is taken care of automatically - but is it okay to achieve it this way?"", 'comment_created': datetime.datetime(2020, 8, 7, 13, 1, 47, tzinfo=datetime.timezone.utc), 'commenter': 'kaustubh-nair', 'type': 'User'}, {'comment_id': 467026299, 'comment_body': 'Fixed', 'comment_created': datetime.datetime(2020, 8, 7, 13, 3, 26, tzinfo=datetime.timezone.utc), 'commenter': 'kaustubh-nair', 'type': 'User'}, {'comment_id': 467027809, 'comment_body': ""We're not using this right now, it would be simpler if I just remove the attribute?"", 'comment_created': datetime.datetime(2020, 8, 7, 13, 6, 24, tzinfo=datetime.timezone.utc), 'commenter': 'kaustubh-nair', 'type': 'User'}, {'comment_id': 467128277, 'comment_body': '`set` logic seems appropriate for this, perhaps?', 'comment_created': datetime.datetime(2020, 8, 7, 15, 58, 17, tzinfo=datetime.timezone.utc), 'commenter': 'neiljp', 'type': 'User'}, {'comment_id': 467130052, 'comment_body': ""I'm not sure we can deactivate unicode emoji, though I see what you mean. At least partially I was trying to make the variable name obvious in the sense that if a custom emoji was deactivated subsequent to this point, then we might think to check - in the same way that `stream_dict` doesn't really describe `active_stream_subscriptions`."", 'comment_created': datetime.datetime(2020, 8, 7, 16, 1, 23, tzinfo=datetime.timezone.utc), 'commenter': 'neiljp', 'type': 'User'}, {'comment_id': 468093122, 'comment_body': '`response` is not typed so it cannot determine `custom_emojis` automatically.', 'comment_created': datetime.datetime(2020, 8, 10, 18, 21, 24, tzinfo=datetime.timezone.utc), 'commenter': 'kaustubh-nair', 'type': 'User'}, {'comment_id': 468165264, 'comment_body': 'This rename commit makes various changes, but is fairly easy to read. However, it would be useful to see the changes listed in the commit summary.\r\n\r\n(you also have a typo in the summary)', 'comment_created': datetime.datetime(2020, 8, 10, 20, 24, 35, tzinfo=datetime.timezone.utc), 'commenter': 'neiljp', 'type': 'User'}, {'comment_id': 468165606, 'comment_body': 'minor: the file is `emoji_names`, so that would be better in the commit title.', 'comment_created': datetime.datetime(2020, 8, 10, 20, 25, 11, tzinfo=datetime.timezone.utc), 'commenter': 'neiljp', 'type': 'User'}, {'comment_id': 468169322, 'comment_body': ""minor: my remaining thought here regarding the 'type' is that this data is *all* unicode_emoji, so we could add the type when we use it from the file - balanced against this being in the exact format we need already, of course! Of course, this file is generated, though it adds ~1500 lines with the identical text on individual lines."", 'comment_created': datetime.datetime(2020, 8, 10, 20, 32, 47, tzinfo=datetime.timezone.utc), 'commenter': 'neiljp', 'type': 'User'}, {'comment_id': 468170984, 'comment_body': ""What is `emoji_data`? (you've changed to 'active_' below)"", 'comment_created': datetime.datetime(2020, 8, 10, 20, 36, 5, tzinfo=datetime.timezone.utc), 'commenter': 'neiljp', 'type': 'User'}, {'comment_id': 468180634, 'comment_body': ""If you're leaving some data out, I'd consider adding a comment that this isn't the full response format, but is missing parts x or y as of versions A or B (as per api changelog)"", 'comment_created': datetime.datetime(2020, 8, 10, 20, 55, 40, tzinfo=datetime.timezone.utc), 'commenter': 'neiljp', 'type': 'User'}, {'comment_id': 468195518, 'comment_body': ""If this handles the 'custom emoji can replace unicode emoji' case, then can we add a test case for it?"", 'comment_created': datetime.datetime(2020, 8, 10, 21, 26, 57, tzinfo=datetime.timezone.utc), 'commenter': 'neiljp', 'type': 'User'}, {'comment_id': 472385357, 'comment_body': ""This can't be done inline right?"", 'comment_created': datetime.datetime(2020, 8, 18, 18, 6, 9, tzinfo=datetime.timezone.utc), 'commenter': 'kaustubh-nair', 'type': 'User'}, {'comment_id': 472492844, 'comment_body': 'Fixed', 'comment_created': datetime.datetime(2020, 8, 18, 21, 5, 57, tzinfo=datetime.timezone.utc), 'commenter': 'kaustubh-nair', 'type': 'User'}, {'comment_id': 472503539, 'comment_body': 'Fixed.', 'comment_created': datetime.datetime(2020, 8, 18, 21, 28, 18, tzinfo=datetime.timezone.utc), 'commenter': 'kaustubh-nair', 'type': 'User'}, {'comment_id': 472503588, 'comment_body': 'Fixed.', 'comment_created': datetime.datetime(2020, 8, 18, 21, 28, 24, tzinfo=datetime.timezone.utc), 'commenter': 'kaustubh-nair', 'type': 'User'}, {'comment_id': 472503718, 'comment_body': 'Fixed. Missed this between commits', 'comment_created': datetime.datetime(2020, 8, 18, 21, 28, 39, tzinfo=datetime.timezone.utc), 'commenter': 'kaustubh-nair', 'type': 'User'}, {'comment_id': 472503777, 'comment_body': 'Added.', 'comment_created': datetime.datetime(2020, 8, 18, 21, 28, 47, tzinfo=datetime.timezone.utc), 'commenter': 'kaustubh-nair', 'type': 'User'}, {'comment_id': 472503824, 'comment_body': 'Added.', 'comment_created': datetime.datetime(2020, 8, 18, 21, 28, 52, tzinfo=datetime.timezone.utc), 'commenter': 'kaustubh-nair', 'type': 'User'}, {'comment_id': 479607279, 'comment_body': ""You've modified the original, so this seems reasonable :+1:"", 'comment_created': datetime.datetime(2020, 8, 29, 4, 46, 19, tzinfo=datetime.timezone.utc), 'commenter': 'neiljp', 'type': 'User'}]","[{'commit_sha': '9402272f38676fc6eb7f09c0e169edbe955c1d28', 'committer_username': 'kaustubh-nair', 'committer_name': 'Kaustubh Nair', 'committer_email': 'kaustubh.nair108@gmail.com', 'commit_date': datetime.datetime(2017, 7, 15, 13, 2, 30, tzinfo=datetime.timezone.utc)}, {'commit_sha': 'e6b0e4f5b4d97c5fcf93187567641ec0f9458254', 'committer_username': 'kaustubh-nair', 'committer_name': 'Kaustubh Nair', 'committer_email': 'kaustubh.nair108@gmail.com', 'commit_date': datetime.datetime(2017, 7, 15, 13, 2, 30, tzinfo=datetime.timezone.utc)}, {'commit_sha': '750da44a498109070c5e6986e5c1262abe8a1cde', 'committer_username': 'kaustubh-nair', 'committer_name': 'Kaustubh Nair', 'committer_email': 'kaustubh.nair108@gmail.com', 'commit_date': datetime.datetime(2017, 7, 15, 13, 2, 30, tzinfo=datetime.timezone.utc)}, {'commit_sha': '1348ff756673f2180dfd1f8236aa4799f2e905a6', 'committer_username': 'kaustubh-nair', 'committer_name': 'Kaustubh Nair', 'committer_email': 'kaustubh.nair108@gmail.com', 'commit_date': datetime.datetime(2017, 7, 15, 13, 2, 30, tzinfo=datetime.timezone.utc)}, {'commit_sha': '746db1827102a440f2896aea24329b30c2cd7061', 'committer_username': 'kaustubh-nair', 'committer_name': 'Kaustubh Nair', 'committer_email': 'kaustubh.nair108@gmail.com', 'commit_date': datetime.datetime(2017, 7, 15, 13, 2, 30, tzinfo=datetime.timezone.utc)}, {'commit_sha': 'ee19a8ebc1d628c67aa55aca224ad86ad4cb8631', 'committer_username': 'kaustubh-nair', 'committer_name': 'Kaustubh Nair', 'committer_email': 'kaustubh.nair108@gmail.com', 'commit_date': datetime.datetime(2017, 7, 15, 13, 2, 30, tzinfo=datetime.timezone.utc)}, {'commit_sha': '644618c33bba3135ef3781ee5a0c716332af3338', 'committer_username': 'kaustubh-nair', 'committer_name': 'Kaustubh Nair', 'committer_email': 'kaustubh.nair108@gmail.com', 'commit_date': datetime.datetime(2017, 7, 15, 13, 2, 30, tzinfo=datetime.timezone.utc)}]",Kaustubh Nair,30197132,kaustubh.nair108@gmail.com,User,,48,,71,79
447393100,model: Notify user if a request fails.,"This commit displays an error message in the footer for server requests
involving user interactions. By this the user can be notified for
different failures like:
* Hitting API rate limits.
* Posting in streams where user doesn't have the required permissions.
* Message sending/editing errors.
* Toggling reaction errors.
* etc.

Error responses from some requests are not displayed, since they are not
triggered directly by a user action. Example of these include event
polling requests, event registration, and updating presence.

Fixes #427.",False,714,https://api.github.com/repos/zulip/zulip-terminal/pulls/714,https://github.com/zulip/zulip-terminal/pull/714,closed,64,10,4,3,6,3,3,0,"[{'name': 'enhancement'}, {'name': 'size: L'}, {'name': 'PR needs review'}]",2020-07-10 11:44:25+00:00,2020-07-30 21:39:50+00:00,1763725.0,"20 days, 9:55:25","[{'comment_id': 453273399, 'comment_body': 'Given the apparent similarity in all this error handling, please use a new method for this.\r\n\r\nPutting this in a function should make testing simple?', 'comment_created': datetime.datetime(2020, 7, 12, 6, 14, 15, tzinfo=datetime.timezone.utc), 'commenter': 'neiljp', 'type': 'User'}, {'comment_id': 455106666, 'comment_body': ""Is this to overcome pytest's caching issue or just to reuse the `dict`?"", 'comment_created': datetime.datetime(2020, 7, 15, 14, 43, 24, tzinfo=datetime.timezone.utc), 'commenter': 'preetmishra', 'type': 'User'}, {'comment_id': 455150990, 'comment_body': 'Just for reuse', 'comment_created': datetime.datetime(2020, 7, 15, 15, 43, 38, tzinfo=datetime.timezone.utc), 'commenter': 'kaustubh-nair', 'type': 'User'}]","[{'commit_sha': '33c2be35105c7aae24f6c2fbc09273fdf564f09c', 'committer_username': 'kaustubh-nair', 'committer_name': 'Kaustubh Nair', 'committer_email': 'kaustubh.nair108@gmail.com', 'commit_date': datetime.datetime(2017, 7, 15, 13, 2, 30, tzinfo=datetime.timezone.utc)}, {'commit_sha': '3460187a58e4bf295009bccbe782f23a41f37b86', 'committer_username': 'kaustubh-nair', 'committer_name': 'Kaustubh Nair', 'committer_email': 'kaustubh.nair108@gmail.com', 'commit_date': datetime.datetime(2017, 7, 15, 13, 2, 30, tzinfo=datetime.timezone.utc)}, {'commit_sha': 'f1e98f5b3117a657c49d6a00e0c89605cf6288e7', 'committer_username': 'kaustubh-nair', 'committer_name': 'Kaustubh Nair', 'committer_email': 'kaustubh.nair108@gmail.com', 'commit_date': datetime.datetime(2017, 7, 15, 13, 2, 30, tzinfo=datetime.timezone.utc)}]",Kaustubh Nair,30197132,kaustubh.nair108@gmail.com,User,,48,,71,79
445474104,Fix message updating bugs due to found_newest,"This PR fixes an update message bug which is caused by two different sources.
1. When a stream is not fully loaded, `Model.found_newest` is set to`False`. Now if a message is received on other streams which are fully loaded, it won't be appended to the view due to `found_newest` state. This is fixed by maintaining found_newest for each narrow.
2. On switching between narrows, `found_newest` is set to `False` in the `Controller`. This obviously prevents appending of new  messagea in the narrow, unless `down` is pressed.

Similar bugs are present (now fixed) for sending messages, since they too use the same `Model._handle_message_event` for adding messages to the view.",True,711,https://api.github.com/repos/zulip/zulip-terminal/pulls/711,https://github.com/zulip/zulip-terminal/pull/711,closed,22,21,3,4,3,19,2,0,"[{'name': 'size: M'}, {'name': 'PR needs review'}]",2020-07-07 15:04:15+00:00,2020-07-15 22:23:06+00:00,717531.0,"8 days, 7:18:51","[{'comment_id': 451162200, 'comment_body': 'I can see the advantage of this change, but this would be better supported with an example for this particular code in the commit text.', 'comment_created': datetime.datetime(2020, 7, 7, 21, 46, 1, tzinfo=datetime.timezone.utc), 'commenter': 'neiljp', 'type': 'User'}, {'comment_id': 451164544, 'comment_body': 'Spacing?\r\n\r\nYou did this elsewhere; are you trying to avoid the condition and code block aligning?', 'comment_created': datetime.datetime(2020, 7, 7, 21, 51, 14, tzinfo=datetime.timezone.utc), 'commenter': 'neiljp', 'type': 'User'}, {'comment_id': 451170846, 'comment_body': ""I understand this is just an update to existing code, but it would be great if we could treat `found_newest` as an attribute private to the Model; if we could do that refactor first, this commit would also be smaller and cleaner.\r\n\r\nDirectly setting data in another class like this is something I'm always open to removing, as it typically leads to simplification and removes the need to check between classes when updating code - and this is a small repo! "", 'comment_created': datetime.datetime(2020, 7, 7, 22, 6, tzinfo=datetime.timezone.utc), 'commenter': 'neiljp', 'type': 'User'}, {'comment_id': 451523710, 'comment_body': 'I forgot the spacing.\r\nCode block aligning?', 'comment_created': datetime.datetime(2020, 7, 8, 12, 57, 53, tzinfo=datetime.timezone.utc), 'commenter': 'kaustubh-nair', 'type': 'User'}, {'comment_id': 451540687, 'comment_body': ""See how `and` and `if` get aligned if you add the space.\r\n```python3\r\n        if (hasattr(self.controller, 'view')\r\n            and self.found_newest[repr(self.narrow)]):\r\n            if self.msg_list.log:\r\n```\r\nThe alignment triggers a linting error which could be fixed with either:\r\n```python3\r\n        if (hasattr(self.controller, 'view')\r\n                and self.found_newest[repr(self.narrow)]):\r\n            if self.msg_list.log:\r\n```\r\nor:\r\n```python3\r\n        if (\r\n            hasattr(self.controller, 'view')\r\n            and self.found_newest[repr(self.narrow)]\r\n           ):\r\n            if self.msg_list.log:\r\n```"", 'comment_created': datetime.datetime(2020, 7, 8, 13, 24, 7, tzinfo=datetime.timezone.utc), 'commenter': 'preetmishra', 'type': 'User'}, {'comment_id': 451567065, 'comment_body': ""Ah, I didn't know that thanks :+1:"", 'comment_created': datetime.datetime(2020, 7, 8, 13, 59, 56, tzinfo=datetime.timezone.utc), 'commenter': 'kaustubh-nair', 'type': 'User'}, {'comment_id': 451633929, 'comment_body': 'Added, is this what you were referring to?', 'comment_created': datetime.datetime(2020, 7, 8, 15, 29, 24, tzinfo=datetime.timezone.utc), 'commenter': 'kaustubh-nair', 'type': 'User'}, {'comment_id': 451635091, 'comment_body': 'Is this name okay? I think its implicitly understood that found_newest is updated per narrow. Or should I name this `set_found_newest_for_current_narrow()`?', 'comment_created': datetime.datetime(2020, 7, 8, 15, 30, 59, tzinfo=datetime.timezone.utc), 'commenter': 'kaustubh-nair', 'type': 'User'}, {'comment_id': 451854442, 'comment_body': ""That should be sufficient, though 'kind of guarantees' is not as helpful as it could be, if perhaps just in phrasing."", 'comment_created': datetime.datetime(2020, 7, 8, 22, 13, 46, tzinfo=datetime.timezone.utc), 'commenter': 'neiljp', 'type': 'User'}, {'comment_id': 451866049, 'comment_body': ""While I'm replying here to the naming issue, note that the only places in code outside of the `Model` where this is being called (and where the value was previously set), are in the narrowing methods, if we definitely change narrow; can you see that? Given that, I think this can just be a private helper function used by other model methods, or even just set directly, given this is so simple."", 'comment_created': datetime.datetime(2020, 7, 8, 22, 46, 13, tzinfo=datetime.timezone.utc), 'commenter': 'neiljp', 'type': 'User'}, {'comment_id': 451871523, 'comment_body': 'Note my other comment about whether we need this function, but it may be worth investigating clarifying these tests, perhaps adding notes why these are set, or changing the test names to be clearer.', 'comment_created': datetime.datetime(2020, 7, 8, 23, 2, 42, tzinfo=datetime.timezone.utc), 'commenter': 'neiljp', 'type': 'User'}, {'comment_id': 451882813, 'comment_body': ""When requiring a method to access data, or just hiding it in an object/class, I find it useful to have an underscore prefix. That both gives a visual indication elsewhere if we're touching something we shouldn't be (ie. potentially hacky code), but also in making this kind of transition it's a variable rename, so anything that depended upon `Model.found_newest` would fail with a name error."", 'comment_created': datetime.datetime(2020, 7, 8, 23, 38, 21, tzinfo=datetime.timezone.utc), 'commenter': 'neiljp', 'type': 'User'}, {'comment_id': 453318599, 'comment_body': 'Instead of checking its `type`, could we do just an empty dictionary check?\r\n```\r\nassert model._have_last_message == {}\r\n```', 'comment_created': datetime.datetime(2020, 7, 12, 13, 45, 17, tzinfo=datetime.timezone.utc), 'commenter': 'sumanthvrao', 'type': 'User'}, {'comment_id': 453319991, 'comment_body': ""FWIW, moving it to the next line could avoid line length issue and avoid the extra variable.\r\n```\r\nself._have_last_message[narrow_str] = (\r\n                    len(response['messages']) < query_range)\r\n```"", 'comment_created': datetime.datetime(2020, 7, 12, 13, 58, 28, tzinfo=datetime.timezone.utc), 'commenter': 'sumanthvrao', 'type': 'User'}, {'comment_id': 453341227, 'comment_body': ""It's working now but wasn't in a previous version and I forgot why :sweat_smile: \r\nUpdated :+1: "", 'comment_created': datetime.datetime(2020, 7, 12, 17, 15, 4, tzinfo=datetime.timezone.utc), 'commenter': 'kaustubh-nair', 'type': 'User'}, {'comment_id': 453341261, 'comment_body': 'Yes that would be better :+1: ', 'comment_created': datetime.datetime(2020, 7, 12, 17, 15, 16, tzinfo=datetime.timezone.utc), 'commenter': 'kaustubh-nair', 'type': 'User'}, {'comment_id': 454739846, 'comment_body': ""This commit claims just to be `model`, but it also affects `core`... however if you switch the order of the next commit and this one, you'll remove the `core` lines first and this commit will be just fine (and smaller)"", 'comment_created': datetime.datetime(2020, 7, 15, 1, 41, 4, tzinfo=datetime.timezone.utc), 'commenter': 'neiljp', 'type': 'User'}, {'comment_id': 454740101, 'comment_body': ""See my related comment, but you didn't update the commit title here either - though if you reorder this will become just `core:`"", 'comment_created': datetime.datetime(2020, 7, 15, 1, 42, 4, tzinfo=datetime.timezone.utc), 'commenter': 'neiljp', 'type': 'User'}, {'comment_id': 454745373, 'comment_body': ""Maybe add 'go to stream A' to the reproduce instructions in the commit text?"", 'comment_created': datetime.datetime(2020, 7, 15, 2, 1, 20, tzinfo=datetime.timezone.utc), 'commenter': 'neiljp', 'type': 'User'}]","[{'commit_sha': '5755f3a8926b5a692263604bdf13521a02f579ae', 'committer_username': 'kaustubh-nair', 'committer_name': 'Kaustubh Nair', 'committer_email': 'kaustubh.nair108@gmail.com', 'commit_date': datetime.datetime(2017, 7, 15, 13, 2, 30, tzinfo=datetime.timezone.utc)}, {'commit_sha': '84f974671a46864175c20406a0fd71d2150343e2', 'committer_username': 'kaustubh-nair', 'committer_name': 'Kaustubh Nair', 'committer_email': 'kaustubh.nair108@gmail.com', 'commit_date': datetime.datetime(2017, 7, 15, 13, 2, 30, tzinfo=datetime.timezone.utc)}, {'commit_sha': 'd01ec4392dd49a48645ff1b5e46a7fea969a50e5', 'committer_username': 'kaustubh-nair', 'committer_name': 'Kaustubh Nair', 'committer_email': 'kaustubh.nair108@gmail.com', 'commit_date': datetime.datetime(2017, 7, 15, 13, 2, 30, tzinfo=datetime.timezone.utc)}, {'commit_sha': '541dc69d321c4f6601fa2e578a60803a9722049f', 'committer_username': 'kaustubh-nair', 'committer_name': 'Kaustubh Nair', 'committer_email': 'kaustubh.nair108@gmail.com', 'commit_date': datetime.datetime(2017, 7, 15, 13, 2, 30, tzinfo=datetime.timezone.utc)}]",Kaustubh Nair,30197132,kaustubh.nair108@gmail.com,User,,48,,71,79
