pr_id,pr_title,pr_body,is_merged,pr_number,pr_url,pr_html_url,pr_state,additions,deletions,pr_changed_files,pr_commits_count,pr_comments_count,pr_review_comments_count,pr_labels_count,pr_assignees_count,pr_labels,pr_created_at,pr_closed_at,time_taken,time_delta,pr_review_comments,pr_commits,contributor,contributor_id,contributor_email,contributor_type,contributions,contributor_public_repos,contributor_private_repos,contributor_followings,contributor_followers
457981987,Recipient box typeahead for streams and topics,,False,746,https://api.github.com/repos/zulip/zulip-terminal/pulls/746,https://github.com/zulip/zulip-terminal/pull/746,closed,210,32,6,5,3,43,1,0,[{'name': 'size: XL'}],2020-07-28 18:37:54+00:00,2020-08-18 17:18:32+00:00,1809638.0,"20 days, 22:40:38","[{'comment_id': 461794042, 'comment_body': ""There are no pinned stream considerations here - I'm not using the existing function.\r\nRefactoring `match_streams` looks a little hard, and pinning order is not super important to this PR - so I'd like to deal with this in a follow-up."", 'comment_created': datetime.datetime(2020, 7, 28, 18, 42, 22, tzinfo=datetime.timezone.utc), 'commenter': 'kaustubh-nair', 'type': 'User'}, {'comment_id': 461801212, 'comment_body': 'Though one hacky way to use the current `match_streams` would be to pass `[(stream_name, stream_name)..]` in `data`.', 'comment_created': datetime.datetime(2020, 7, 28, 18, 54, 59, tzinfo=datetime.timezone.utc), 'commenter': 'kaustubh-nair', 'type': 'User'}, {'comment_id': 463850878, 'comment_body': ""Don't you think pinning preferences should be relevant here?"", 'comment_created': datetime.datetime(2020, 7, 31, 21, 19, 19, tzinfo=datetime.timezone.utc), 'commenter': 'neiljp', 'type': 'User'}, {'comment_id': 463866015, 'comment_body': 'This gets set only on set-up, so if the stream is changed before the message is sent, the topic autocomplete uses the stream used at initialization. This is the same issue present with another PR, maybe?', 'comment_created': datetime.datetime(2020, 7, 31, 22, 4, 17, tzinfo=datetime.timezone.utc), 'commenter': 'neiljp', 'type': 'User'}, {'comment_id': 464970607, 'comment_body': ""They are certainly an improvement, but I don't see it as being a necessity for this particular feature. I'll make a temp fix but open an issue and make a follow-up PR for refactoring `match_stream`"", 'comment_created': datetime.datetime(2020, 8, 4, 11, 3, tzinfo=datetime.timezone.utc), 'commenter': 'kaustubh-nair', 'type': 'User'}, {'comment_id': 464988261, 'comment_body': 'Yes, I can fix it now that #738 is merged', 'comment_created': datetime.datetime(2020, 8, 4, 11, 40, 18, tzinfo=datetime.timezone.utc), 'commenter': 'kaustubh-nair', 'type': 'User'}, {'comment_id': 466450087, 'comment_body': ""This method name doesn't describe what it's getting it from at the call site (`stream_name` is not required), and in python we can often avoid needing a `get_` prefix (unlike other languages) - though I know other methods don't all follow that pattern right now. What do you think about something like `stream_id_from_name`?"", 'comment_created': datetime.datetime(2020, 8, 6, 14, 23, 33, tzinfo=datetime.timezone.utc), 'commenter': 'neiljp', 'type': 'User'}, {'comment_id': 466495911, 'comment_body': ""Is this change necessary, given the next commit? Aren't you moving it back?"", 'comment_created': datetime.datetime(2020, 8, 6, 15, 27, 55, tzinfo=datetime.timezone.utc), 'commenter': 'neiljp', 'type': 'User'}, {'comment_id': 467196723, 'comment_body': 'The git diff is a bit weird so it looks a little strange, but this statement stays in the same method. ', 'comment_created': datetime.datetime(2020, 8, 7, 18, 15, 10, tzinfo=datetime.timezone.utc), 'commenter': 'kaustubh-nair', 'type': 'User'}, {'comment_id': 467198239, 'comment_body': ""I'm not sure what to do about the existing `generic_autocomplete` tests now, since now they span two different methods. Changing them to check for `_process_typeaheads` would be hard because the parameters would get complex. (Because we'd have to create lists of suggestions)"", 'comment_created': datetime.datetime(2020, 8, 7, 18, 18, 31, tzinfo=datetime.timezone.utc), 'commenter': 'kaustubh-nair', 'type': 'User'}, {'comment_id': 467225788, 'comment_body': 'Is this okay, or should `match_stream` be refactored?', 'comment_created': datetime.datetime(2020, 8, 7, 19, 19, 12, tzinfo=datetime.timezone.utc), 'commenter': 'kaustubh-nair', 'type': 'User'}, {'comment_id': 467226135, 'comment_body': ""`matched_stream[0]` and `matched_stream[1]` have the same data, but I've used both of them for the sake of consistency."", 'comment_created': datetime.datetime(2020, 8, 7, 19, 19, 59, tzinfo=datetime.timezone.utc), 'commenter': 'kaustubh-nair', 'type': 'User'}, {'comment_id': 469626564, 'comment_body': ""I'm glad to have this marked, but this case does not actually seem to fail? (the other one too)"", 'comment_created': datetime.datetime(2020, 8, 13, 0, 37, 2, tzinfo=datetime.timezone.utc), 'commenter': 'neiljp', 'type': 'User'}, {'comment_id': 469633297, 'comment_body': 'This is ok to leave for now, but we should likely add a comment since it looks a little strange.', 'comment_created': datetime.datetime(2020, 8, 13, 0, 58, 50, tzinfo=datetime.timezone.utc), 'commenter': 'neiljp', 'type': 'User'}, {'comment_id': 469633369, 'comment_body': ""Again, worth another comment. When this is refactored, we'd likely change the name too, so that comment should be noticed/updated then. Meanwhile it should explain the strange calling behavior.\r\n\r\nThis also looks strange for the topic case, so perhaps another comment there?"", 'comment_created': datetime.datetime(2020, 8, 13, 0, 59, 3, tzinfo=datetime.timezone.utc), 'commenter': 'neiljp', 'type': 'User'}, {'comment_id': 469634134, 'comment_body': ""This only returns one stream id? The name implies otherwise.\r\n\r\nThis method or something like it is used/introduced in #772 now, right? Is this a dependency one way or another between PRs? A tidied version of that commit would be OK to include here as it indicates it maintains the stream id, separately from the topic-matching logic in this commit. It'd be a bonus to include in it any other places we either do something similar (name -> id) or should be keeping it synchronized and currently aren't, though the latter may be too much for one commit, and we don't want to hold this up."", 'comment_created': datetime.datetime(2020, 8, 13, 1, 1, 9, tzinfo=datetime.timezone.utc), 'commenter': 'neiljp', 'type': 'User'}, {'comment_id': 469645670, 'comment_body': 'This seems fine for now, but in future we may end up with stream names changing, so this may be a valid response, not an error in the application.', 'comment_created': datetime.datetime(2020, 8, 13, 1, 33, 19, tzinfo=datetime.timezone.utc), 'commenter': 'neiljp', 'type': 'User'}, {'comment_id': 469647473, 'comment_body': 'It would be good to have similar names for these two methods - they do a similar purpose, right?', 'comment_created': datetime.datetime(2020, 8, 13, 1, 39, 52, tzinfo=datetime.timezone.utc), 'commenter': 'neiljp', 'type': 'User'}, {'comment_id': 469649804, 'comment_body': 'I think we could mention both keys here.\r\n\r\nTypo in commit text.', 'comment_created': datetime.datetime(2020, 8, 13, 1, 49, 3, tzinfo=datetime.timezone.utc), 'commenter': 'neiljp', 'type': 'User'}, {'comment_id': 469652917, 'comment_body': 'This is resolved by the change at the end  of this commit?', 'comment_created': datetime.datetime(2020, 8, 13, 2, 0, 55, tzinfo=datetime.timezone.utc), 'commenter': 'neiljp', 'type': 'User'}, {'comment_id': 469654133, 'comment_body': 'This is a very general method name - is there anything more specific we could use?', 'comment_created': datetime.datetime(2020, 8, 13, 2, 5, 49, tzinfo=datetime.timezone.utc), 'commenter': 'neiljp', 'type': 'User'}, {'comment_id': 469654476, 'comment_body': ""minor: These are 'countable', so 'fewer' would be more accurate than 'less'"", 'comment_created': datetime.datetime(2020, 8, 13, 2, 7, 5, tzinfo=datetime.timezone.utc), 'commenter': 'neiljp', 'type': 'User'}, {'comment_id': 469656156, 'comment_body': ""While accurate, are these literally invalid state? Do they represent internal state that should not happen? If we're testing the range of inputs, should we cover those that the typeahead footer understands/expects?\r\n\r\nIt's also difficult knowing whether to test this method directly, rather than just cases where it's used, which I think you're getting the feeling of from your other review comment."", 'comment_created': datetime.datetime(2020, 8, 13, 2, 13, 53, tzinfo=datetime.timezone.utc), 'commenter': 'neiljp', 'type': 'User'}, {'comment_id': 469660582, 'comment_body': 'This is an example formatting rather than specific, right? If so, worth a comment.', 'comment_created': datetime.datetime(2020, 8, 13, 2, 30, 33, tzinfo=datetime.timezone.utc), 'commenter': 'neiljp', 'type': 'User'}, {'comment_id': 469836081, 'comment_body': ""I'm using this just to deal with the mypy error of the method not having a return value. Do I return something like `''` instead?"", 'comment_created': datetime.datetime(2020, 8, 13, 9, 54, 40, tzinfo=datetime.timezone.utc), 'commenter': 'kaustubh-nair', 'type': 'User'}, {'comment_id': 470025614, 'comment_body': 'Well, we could do various things in case of error (empty string, `None`, custom exception, general exception), as long as we ""handle"" them somehow. mypy only knows return types, so exceptions act as a fix for this at some level from its perspective - and not always in a wrong way. As I said, having this exception is fine as long as we expect all stream names to be valid and otherwise it being an internal error - so here we don\'t expect to handle it. Later we might change it to be something that callers are expected to handle.', 'comment_created': datetime.datetime(2020, 8, 13, 15, 11, 29, tzinfo=datetime.timezone.utc), 'commenter': 'neiljp', 'type': 'User'}, {'comment_id': 470065024, 'comment_body': 'Okay, this should be fine for now because the recipient validity check ensures that stream names are always valid.', 'comment_created': datetime.datetime(2020, 8, 13, 16, 10, 20, tzinfo=datetime.timezone.utc), 'commenter': 'kaustubh-nair', 'type': 'User'}, {'comment_id': 470070055, 'comment_body': 'Yes that should keep `stream_id` in sync', 'comment_created': datetime.datetime(2020, 8, 13, 16, 18, 42, tzinfo=datetime.timezone.utc), 'commenter': 'kaustubh-nair', 'type': 'User'}, {'comment_id': 470196953, 'comment_body': ""@neiljp I'm not sure whose internal state you're referring to - is that zt or readline? They are invalid, in the sense that they are indexes that do not exist for the array under consideration.\r\n\r\nWe don't have to cover all cases for footer since it is tested completely in `test_ui`?\r\n\r\nI think it is okay to test method in isolation, as long as we cover all the cases for invalid states. This would mean that other tests for autocomplete methods will require fewer test parameters, but they would be difficult to write because we'd have to use lists instead, unless of course we use really small lists."", 'comment_created': datetime.datetime(2020, 8, 13, 19, 29, 15, tzinfo=datetime.timezone.utc), 'commenter': 'kaustubh-nair', 'type': 'User'}, {'comment_id': 470275584, 'comment_body': 'This was merged via the commit in #772, so this should be good for now.', 'comment_created': datetime.datetime(2020, 8, 13, 22, 7, 12, tzinfo=datetime.timezone.utc), 'commenter': 'neiljp', 'type': 'User'}, {'comment_id': 471113992, 'comment_body': 'Fixed', 'comment_created': datetime.datetime(2020, 8, 16, 13, 35, 11, tzinfo=datetime.timezone.utc), 'commenter': 'kaustubh-nair', 'type': 'User'}, {'comment_id': 471115732, 'comment_body': 'Added', 'comment_created': datetime.datetime(2020, 8, 16, 13, 52, 31, tzinfo=datetime.timezone.utc), 'commenter': 'kaustubh-nair', 'type': 'User'}, {'comment_id': 471117347, 'comment_body': 'I kept it general because there are multiple things happening here - returning typeahead after checking for state constraints, and setting suggestions to footer.', 'comment_created': datetime.datetime(2020, 8, 16, 14, 8, 19, tzinfo=datetime.timezone.utc), 'commenter': 'kaustubh-nair', 'type': 'User'}, {'comment_id': 471120214, 'comment_body': ""Ohh, since this is a readline problem, we'd have to test for the actual writebox contents instead of testing the autocomplete methods."", 'comment_created': datetime.datetime(2020, 8, 16, 14, 35, 27, tzinfo=datetime.timezone.utc), 'commenter': 'kaustubh-nair', 'type': 'User'}, {'comment_id': 471130389, 'comment_body': 'Added', 'comment_created': datetime.datetime(2020, 8, 16, 16, 13, 13, tzinfo=datetime.timezone.utc), 'commenter': 'kaustubh-nair', 'type': 'User'}, {'comment_id': 471130396, 'comment_body': 'Added', 'comment_created': datetime.datetime(2020, 8, 16, 16, 13, 18, tzinfo=datetime.timezone.utc), 'commenter': 'kaustubh-nair', 'type': 'User'}, {'comment_id': 471130554, 'comment_body': 'FIxed', 'comment_created': datetime.datetime(2020, 8, 16, 16, 14, 53, tzinfo=datetime.timezone.utc), 'commenter': 'kaustubh-nair', 'type': 'User'}, {'comment_id': 471130814, 'comment_body': 'Fixed', 'comment_created': datetime.datetime(2020, 8, 16, 16, 17, 12, tzinfo=datetime.timezone.utc), 'commenter': 'kaustubh-nair', 'type': 'User'}, {'comment_id': 471131318, 'comment_body': 'Added a normal case to make sure test works properly', 'comment_created': datetime.datetime(2020, 8, 16, 16, 23, 3, tzinfo=datetime.timezone.utc), 'commenter': 'kaustubh-nair', 'type': 'User'}, {'comment_id': 471134757, 'comment_body': ""I hope this is okay, we don't have wrapping text for topics, nor do we support typeahead for it in message box"", 'comment_created': datetime.datetime(2020, 8, 16, 16, 58, 42, tzinfo=datetime.timezone.utc), 'commenter': 'kaustubh-nair', 'type': 'User'}, {'comment_id': 472309784, 'comment_body': ""By invalid, I meant whether these are states that we shouldn't reach inside ZT when we call this method. If so, how much of them should we test? If they can be reached, then of course we could test them, but there may be something more meaningful than 'invalid' to describe them.\r\n\r\nThe challenge here is that these methods are quite internal to all the typeahead and have been changing around recently with all the development of this area!\r\n\r\nSome of this is tested elsewhere - we certainly should consider whether we're over-testing the autocomplete to some degree?"", 'comment_created': datetime.datetime(2020, 8, 18, 16, 4, 11, tzinfo=datetime.timezone.utc), 'commenter': 'neiljp', 'type': 'User'}, {'comment_id': 472312736, 'comment_body': ""minor: 2nd commit title: While 'move into new method' is fine, you might consider 'Extract (into) method' in future, in line with the refactoring terminology?\r\n(eg. https://refactoring.guru/extract-method)"", 'comment_created': datetime.datetime(2020, 8, 18, 16, 8, 54, tzinfo=datetime.timezone.utc), 'commenter': 'neiljp', 'type': 'User'}, {'comment_id': 472336787, 'comment_body': 'Not yet! ;)', 'comment_created': datetime.datetime(2020, 8, 18, 16, 46, 19, tzinfo=datetime.timezone.utc), 'commenter': 'neiljp', 'type': 'User'}]","[{'commit_sha': 'd5878b7b6ead46b5195bbc3b9cbd23554aa72537', 'committer_username': 'kaustubh-nair', 'committer_name': 'Kaustubh Nair', 'committer_email': 'kaustubh.nair108@gmail.com', 'commit_date': datetime.datetime(2017, 7, 15, 13, 2, 30, tzinfo=datetime.timezone.utc)}, {'commit_sha': 'e204e433095dffcf6ff3fa9a6376d43b01625feb', 'committer_username': 'kaustubh-nair', 'committer_name': 'Kaustubh Nair', 'committer_email': 'kaustubh.nair108@gmail.com', 'commit_date': datetime.datetime(2017, 7, 15, 13, 2, 30, tzinfo=datetime.timezone.utc)}, {'commit_sha': 'bd64930e03df2190cf871eb0c220cf4ddc155499', 'committer_username': 'kaustubh-nair', 'committer_name': 'Kaustubh Nair', 'committer_email': 'kaustubh.nair108@gmail.com', 'commit_date': datetime.datetime(2017, 7, 15, 13, 2, 30, tzinfo=datetime.timezone.utc)}, {'commit_sha': '1e076baff19b351c1823e86f68ea52e7b8b5e24a', 'committer_username': 'kaustubh-nair', 'committer_name': 'Kaustubh Nair', 'committer_email': 'kaustubh.nair108@gmail.com', 'commit_date': datetime.datetime(2017, 7, 15, 13, 2, 30, tzinfo=datetime.timezone.utc)}, {'commit_sha': '64ce68407cd0b198100432b0e9ab626024b9ee46', 'committer_username': 'kaustubh-nair', 'committer_name': 'Kaustubh Nair', 'committer_email': 'kaustubh.nair108@gmail.com', 'commit_date': datetime.datetime(2017, 7, 15, 13, 2, 30, tzinfo=datetime.timezone.utc)}]",Kaustubh Nair,30197132,kaustubh.nair108@gmail.com,User,,48,,71,79
