pr_id,pr_title,pr_body,is_merged,pr_number,pr_url,pr_html_url,pr_state,additions,deletions,pr_changed_files,pr_commits_count,pr_comments_count,pr_review_comments_count,pr_labels_count,pr_assignees_count,pr_labels,pr_created_at,pr_closed_at,time_taken,time_delta,pr_review_comments,pr_commits,contributor,contributor_id,contributor_email,contributor_type,contributions,contributor_public_repos,contributor_private_repos,contributor_followings,contributor_followers
1012915181,Keyframe animations and interpolators,"Hello @filipinascimento, @skoudoro,
As you suggested, in this PR, I restructured the interpolator classes to functions using closures.
Could you review it and let me know if I should document it and merge it into the main PR of animation?",True,647,https://api.github.com/repos/fury-gl/fury/pulls/647,https://github.com/fury-gl/fury/pull/647,closed,4267,7,22,156,5,27,0,0,[],2022-07-30 23:43:17+00:00,2022-08-19 14:21:33+00:00,1694296.0,"19 days, 14:38:16","[{'comment_id': 936638191, 'comment_body': '`scene` instead of `ren`', 'comment_created': datetime.datetime(2022, 8, 3, 13, 4, 53, tzinfo=datetime.timezone.utc), 'commenter': 'skoudoro', 'type': 'User'}, {'comment_id': 936679481, 'comment_body': '`Return` no `s`.  it should be in imperative mode. For more information : https://peps.python.org/pep-0257/\r\n\r\nPlease, update the whole PR.', 'comment_created': datetime.datetime(2022, 8, 3, 13, 42, 4, tzinfo=datetime.timezone.utc), 'commenter': 'skoudoro', 'type': 'User'}, {'comment_id': 936680224, 'comment_body': 'typo with the quote', 'comment_created': datetime.datetime(2022, 8, 3, 13, 42, 41, tzinfo=datetime.timezone.utc), 'commenter': 'skoudoro', 'type': 'User'}, {'comment_id': 936682145, 'comment_body': 'same comment as above for the imperative mood', 'comment_created': datetime.datetime(2022, 8, 3, 13, 44, 19, tzinfo=datetime.timezone.utc), 'commenter': 'skoudoro', 'type': 'User'}, {'comment_id': 936682460, 'comment_body': 'same comment as above for the quotes', 'comment_created': datetime.datetime(2022, 8, 3, 13, 44, 36, tzinfo=datetime.timezone.utc), 'commenter': 'skoudoro', 'type': 'User'}, {'comment_id': 936700418, 'comment_body': ""to protect yourself against typo or key missing, I recommend adding default value  `keyframes.get(t, {}).get('value', '')`"", 'comment_created': datetime.datetime(2022, 8, 3, 13, 58, 4, tzinfo=datetime.timezone.utc), 'commenter': 'skoudoro', 'type': 'User'}, {'comment_id': 936703096, 'comment_body': '`euclidean_distances` instead', 'comment_created': datetime.datetime(2022, 8, 3, 14, 0, 19, tzinfo=datetime.timezone.utc), 'commenter': 'skoudoro', 'type': 'User'}, {'comment_id': 936704554, 'comment_body': 'use a list of comprehension:  `distances = [np.linalg.norm(x - y) for x, y in zip(points, points[1:])]`', 'comment_created': datetime.datetime(2022, 8, 3, 14, 1, 29, tzinfo=datetime.timezone.utc), 'commenter': 'skoudoro', 'type': 'User'}, {'comment_id': 936706730, 'comment_body': 'Never `import *` in FURY! \r\n\r\n`import fury.testing as ft`  ', 'comment_created': datetime.datetime(2022, 8, 3, 14, 3, 21, tzinfo=datetime.timezone.utc), 'commenter': 'skoudoro', 'type': 'User'}, {'comment_id': 936848654, 'comment_body': 'split the tests into smaller tests as we discuss recently', 'comment_created': datetime.datetime(2022, 8, 3, 16, 4, 48, tzinfo=datetime.timezone.utc), 'commenter': 'skoudoro', 'type': 'User'}, {'comment_id': 936849341, 'comment_body': 'same comment as above, never', 'comment_created': datetime.datetime(2022, 8, 3, 16, 5, 21, tzinfo=datetime.timezone.utc), 'commenter': 'skoudoro', 'type': 'User'}, {'comment_id': 936850684, 'comment_body': 'great ! you should do the same for test_helpers.py\r\n\r\nalso, check errors!  \r\n- empty keyframes,  \r\n- wrong key (not value)\r\n- list instead of np.array, \r\n- etc...', 'comment_created': datetime.datetime(2022, 8, 3, 16, 6, 17, tzinfo=datetime.timezone.utc), 'commenter': 'skoudoro', 'type': 'User'}, {'comment_id': 937333235, 'comment_body': 'docstring order: `t`should be at the end', 'comment_created': datetime.datetime(2022, 8, 4, 4, 21, 48, tzinfo=datetime.timezone.utc), 'commenter': 'skoudoro', 'type': 'User'}, {'comment_id': 938977175, 'comment_body': 'Why Timeline is passed to playback_panel? It expect a boolean, right?', 'comment_created': datetime.datetime(2022, 8, 5, 16, 27, 18, tzinfo=datetime.timezone.utc), 'commenter': 'filipinascimento', 'type': 'User'}, {'comment_id': 938980538, 'comment_body': 'This is the same as add_author with the flag static=True. I like specific functions such as this one because it makes the code more readeable, however it also adds a new function that does the same thing. Most of the FURY functionality is done using more general functions with parameters and not having multiple functions for the same procedure, so maybe remove it? @skoudoro any thoughts? ', 'comment_created': datetime.datetime(2022, 8, 5, 16, 31, 38, tzinfo=datetime.timezone.utc), 'commenter': 'filipinascimento', 'type': 'User'}, {'comment_id': 939683975, 'comment_body': 'Maybe raise a NotImplementedError for now, while this is not implemented.', 'comment_created': datetime.datetime(2022, 8, 7, 15, 21, 17, tzinfo=datetime.timezone.utc), 'commenter': 'filipinascimento', 'type': 'User'}, {'comment_id': 939684548, 'comment_body': ""If an evaluator is used to set the values of actor's properties...\nthathas -> with"", 'comment_created': datetime.datetime(2022, 8, 7, 15, 25, 43, tzinfo=datetime.timezone.utc), 'commenter': 'filipinascimento', 'type': 'User'}, {'comment_id': 939726127, 'comment_body': 'since these methods override methods on the UI class, and the UI requires these methods, I just want them to do nothing for now.', 'comment_created': datetime.datetime(2022, 8, 7, 21, 45, 2, tzinfo=datetime.timezone.utc), 'commenter': 'm-agour', 'type': 'User'}, {'comment_id': 949348862, 'comment_body': 'pep8: not used\r\n\r\nyou are using numpy instead', 'comment_created': datetime.datetime(2022, 8, 18, 16, 15, 26, tzinfo=datetime.timezone.utc), 'commenter': 'skoudoro', 'type': 'User'}, {'comment_id': 949359032, 'comment_body': 'Minimal tutorial: Please, explain what is a keyframe. How do you build a keyframe, What is a timeline, etc...\r\n\r\nA beginner need to know all the basic concept', 'comment_created': datetime.datetime(2022, 8, 18, 16, 25, 57, tzinfo=datetime.timezone.utc), 'commenter': 'skoudoro', 'type': 'User'}, {'comment_id': 949361961, 'comment_body': 'need more explanation, this is a beginner tutorial. what are 0, 2, 5, 9 ? What are all this numpy arrray? \r\nis it 1 or multiple keyframes? ', 'comment_created': datetime.datetime(2022, 8, 18, 16, 28, 53, tzinfo=datetime.timezone.utc), 'commenter': 'skoudoro', 'type': 'User'}, {'comment_id': 949362957, 'comment_body': 'what does this interpolator do? please, explain the basic concept. Explain the link between keyframes and interpolator', 'comment_created': datetime.datetime(2022, 8, 18, 16, 29, 56, tzinfo=datetime.timezone.utc), 'commenter': 'skoudoro', 'type': 'User'}, {'comment_id': 950223466, 'comment_body': 'this block needs more explanation. It seems obvious to you but it is clearly hard to understand for a researcher who starts with FURY.\r\n\r\nAlso, if `is_evaluator=False`, it does not work but the window appears. You should raise an error to explain. It is not the expected input set is_evalutor to True or something like that.\r\n\r\nCurrently, it is a bit too much magical without explanation.', 'comment_created': datetime.datetime(2022, 8, 19, 14, 2, 32, tzinfo=datetime.timezone.utc), 'commenter': 'skoudoro', 'type': 'User'}, {'comment_id': 950225791, 'comment_body': 'this line is not needed', 'comment_created': datetime.datetime(2022, 8, 19, 14, 4, 58, tzinfo=datetime.timezone.utc), 'commenter': 'skoudoro', 'type': 'User'}, {'comment_id': 950228688, 'comment_body': 'The first animation is working.\r\n\r\nThe second animation generate a `Segmentation fault: 11`', 'comment_created': datetime.datetime(2022, 8, 19, 14, 7, 55, tzinfo=datetime.timezone.utc), 'commenter': 'skoudoro', 'type': 'User'}, {'comment_id': 950230961, 'comment_body': 'This animation is really cool!', 'comment_created': datetime.datetime(2022, 8, 19, 14, 10, 19, tzinfo=datetime.timezone.utc), 'commenter': 'skoudoro', 'type': 'User'}, {'comment_id': 950231459, 'comment_body': 'need more explanation. too brief', 'comment_created': datetime.datetime(2022, 8, 19, 14, 10, 48, tzinfo=datetime.timezone.utc), 'commenter': 'skoudoro', 'type': 'User'}]","[{'commit_sha': '52713d9b37820b8b9c3d661204d5dc6ed5ed56e2', 'committer_username': 'm-agour', 'committer_name': 'Mohamed Abouagour', 'committer_email': None, 'commit_date': datetime.datetime(2020, 4, 4, 21, 51, 25, tzinfo=datetime.timezone.utc)}, {'commit_sha': '8b86c861478cbdef7dc21fe4689190d2f201618a', 'committer_username': 'm-agour', 'committer_name': 'Mohamed Abouagour', 'committer_email': None, 'commit_date': datetime.datetime(2020, 4, 4, 21, 51, 25, tzinfo=datetime.timezone.utc)}, {'commit_sha': 'c32ee09bd63e3ec977f43194a2f62777d8ca5ec9', 'committer_username': 'm-agour', 'committer_name': 'Mohamed Abouagour', 'committer_email': None, 'commit_date': datetime.datetime(2020, 4, 4, 21, 51, 25, tzinfo=datetime.timezone.utc)}, {'commit_sha': '6c068516b52158b951ffeae3c1bd0e50dfa43205', 'committer_username': 'm-agour', 'committer_name': 'Mohamed Abouagour', 'committer_email': None, 'commit_date': datetime.datetime(2020, 4, 4, 21, 51, 25, tzinfo=datetime.timezone.utc)}, {'commit_sha': '8d18ae9b16bdff6e824d6b8354ba9bf1bd0c49e3', 'committer_username': 'm-agour', 'committer_name': 'Mohamed Abouagour', 'committer_email': None, 'commit_date': datetime.datetime(2020, 4, 4, 21, 51, 25, tzinfo=datetime.timezone.utc)}, {'commit_sha': '47386e1df8769189577c48eaf7d15cb57d1e00fc', 'committer_username': 'm-agour', 'committer_name': 'Mohamed Abouagour', 'committer_email': None, 'commit_date': datetime.datetime(2020, 4, 4, 21, 51, 25, tzinfo=datetime.timezone.utc)}, {'commit_sha': 'dbe57f3e1b994716c2780d6addc1aff7f1e527bc', 'committer_username': 'm-agour', 'committer_name': 'Mohamed Abouagour', 'committer_email': None, 'commit_date': datetime.datetime(2020, 4, 4, 21, 51, 25, tzinfo=datetime.timezone.utc)}, {'commit_sha': 'd676b48e598c325a8928fbfbb6041144ec2263d3', 'committer_username': 'm-agour', 'committer_name': 'Mohamed Abouagour', 'committer_email': None, 'commit_date': datetime.datetime(2020, 4, 4, 21, 51, 25, tzinfo=datetime.timezone.utc)}, {'commit_sha': '18eb3efc773130ae75efb965421337f099ae56dd', 'committer_username': 'm-agour', 'committer_name': 'Mohamed Abouagour', 'committer_email': None, 'commit_date': datetime.datetime(2020, 4, 4, 21, 51, 25, tzinfo=datetime.timezone.utc)}, {'commit_sha': '6ca1dbfc01c00418afaf2d9bb64ebf721388df68', 'committer_username': 'm-agour', 'committer_name': 'Mohamed Abouagour', 'committer_email': None, 'commit_date': datetime.datetime(2020, 4, 4, 21, 51, 25, tzinfo=datetime.timezone.utc)}, {'commit_sha': 'e2a4741ee38ef46816341db6dfa8ed55c4a2f653', 'committer_username': 'm-agour', 'committer_name': 'Mohamed Abouagour', 'committer_email': None, 'commit_date': datetime.datetime(2020, 4, 4, 21, 51, 25, tzinfo=datetime.timezone.utc)}, {'commit_sha': 'e460886e4c2aacba1ab9baed2e05b972a039e795', 'committer_username': 'm-agour', 'committer_name': 'Mohamed Abouagour', 'committer_email': None, 'commit_date': datetime.datetime(2020, 4, 4, 21, 51, 25, tzinfo=datetime.timezone.utc)}, {'commit_sha': '1328ae36bf59d76a678bf71315727abcc11aacdc', 'committer_username': 'm-agour', 'committer_name': 'Mohamed Abouagour', 'committer_email': None, 'commit_date': datetime.datetime(2020, 4, 4, 21, 51, 25, tzinfo=datetime.timezone.utc)}, {'commit_sha': 'ccfa931e0c03253aecd26d212d5d238281020810', 'committer_username': 'm-agour', 'committer_name': 'Mohamed Abouagour', 'committer_email': None, 'commit_date': datetime.datetime(2020, 4, 4, 21, 51, 25, tzinfo=datetime.timezone.utc)}, {'commit_sha': '10577cb2938bfa02bddcecdeeb5a02dff2561c5e', 'committer_username': 'm-agour', 'committer_name': 'Mohamed Abouagour', 'committer_email': None, 'commit_date': datetime.datetime(2020, 4, 4, 21, 51, 25, tzinfo=datetime.timezone.utc)}, {'commit_sha': '217114ecc3423756c75fe713eaf8a2981d86b999', 'committer_username': 'm-agour', 'committer_name': 'Mohamed Abouagour', 'committer_email': None, 'commit_date': datetime.datetime(2020, 4, 4, 21, 51, 25, tzinfo=datetime.timezone.utc)}, {'commit_sha': 'e90c3adf5d7f50da11a96495cb28d71e3de7e015', 'committer_username': 'm-agour', 'committer_name': 'Mohamed Abouagour', 'committer_email': None, 'commit_date': datetime.datetime(2020, 4, 4, 21, 51, 25, tzinfo=datetime.timezone.utc)}, {'commit_sha': 'fef4cd30f5e37736738ef8754a5abed73195c87d', 'committer_username': 'm-agour', 'committer_name': 'Mohamed Abouagour', 'committer_email': None, 'commit_date': datetime.datetime(2020, 4, 4, 21, 51, 25, tzinfo=datetime.timezone.utc)}, {'commit_sha': '8bc70354cd726d05ebf1073339de62e38b0149ff', 'committer_username': 'm-agour', 'committer_name': 'Mohamed Abouagour', 'committer_email': None, 'commit_date': datetime.datetime(2020, 4, 4, 21, 51, 25, tzinfo=datetime.timezone.utc)}, {'commit_sha': '6ca2b5afffe164dd56f62c47705a0276764319d9', 'committer_username': 'm-agour', 'committer_name': 'Mohamed Abouagour', 'committer_email': None, 'commit_date': datetime.datetime(2020, 4, 4, 21, 51, 25, tzinfo=datetime.timezone.utc)}, {'commit_sha': '7a081cfae3816853dcefcc0fbcd7b074d9623ba7', 'committer_username': 'm-agour', 'committer_name': 'Mohamed Abouagour', 'committer_email': None, 'commit_date': datetime.datetime(2020, 4, 4, 21, 51, 25, tzinfo=datetime.timezone.utc)}, {'commit_sha': '5781d07ad5459eefd57ce785334d2ff1e4a3e605', 'committer_username': 'm-agour', 'committer_name': 'Mohamed Abouagour', 'committer_email': None, 'commit_date': datetime.datetime(2020, 4, 4, 21, 51, 25, tzinfo=datetime.timezone.utc)}, {'commit_sha': 'a3e33979ab4682c2e6bc5b13b4f2253f859b2e0e', 'committer_username': 'm-agour', 'committer_name': 'Mohamed Abouagour', 'committer_email': None, 'commit_date': datetime.datetime(2020, 4, 4, 21, 51, 25, tzinfo=datetime.timezone.utc)}, {'commit_sha': '23e8e9f5b3e8a7d6cb0ce6281cbe24eb35e03de2', 'committer_username': 'm-agour', 'committer_name': 'Mohamed Abouagour', 'committer_email': None, 'commit_date': datetime.datetime(2020, 4, 4, 21, 51, 25, tzinfo=datetime.timezone.utc)}, {'commit_sha': '959fb2fccebd664bc592592c88ae4b7fcb90ec2b', 'committer_username': 'm-agour', 'committer_name': 'Mohamed Abouagour', 'committer_email': None, 'commit_date': datetime.datetime(2020, 4, 4, 21, 51, 25, tzinfo=datetime.timezone.utc)}, {'commit_sha': '8985284afa308f1faa0c75fa7a5141d7c67f8f30', 'committer_username': 'm-agour', 'committer_name': 'Mohamed Abouagour', 'committer_email': None, 'commit_date': datetime.datetime(2020, 4, 4, 21, 51, 25, tzinfo=datetime.timezone.utc)}, {'commit_sha': 'c1185e94628cde06cbd019de0f90dbe7cdebacac', 'committer_username': 'm-agour', 'committer_name': 'Mohamed Abouagour', 'committer_email': None, 'commit_date': datetime.datetime(2020, 4, 4, 21, 51, 25, tzinfo=datetime.timezone.utc)}, {'commit_sha': '046ef51c69044118911dfbef8c91d2340b6c8dad', 'committer_username': 'm-agour', 'committer_name': 'Mohamed Abouagour', 'committer_email': None, 'commit_date': datetime.datetime(2020, 4, 4, 21, 51, 25, tzinfo=datetime.timezone.utc)}, {'commit_sha': 'f402528267204947e0029af43e9962b27fbd6943', 'committer_username': 'm-agour', 'committer_name': 'Mohamed Abouagour', 'committer_email': None, 'commit_date': datetime.datetime(2020, 4, 4, 21, 51, 25, tzinfo=datetime.timezone.utc)}, {'commit_sha': '66dee14f17de994e14bbf6f29a3808b81b00280a', 'committer_username': 'm-agour', 'committer_name': 'Mohamed Abouagour', 'committer_email': None, 'commit_date': datetime.datetime(2020, 4, 4, 21, 51, 25, tzinfo=datetime.timezone.utc)}, {'commit_sha': '7c1230ab1a90f232b6f27df32767b0025a1ed492', 'committer_username': 'm-agour', 'committer_name': 'Mohamed Abouagour', 'committer_email': None, 'commit_date': datetime.datetime(2020, 4, 4, 21, 51, 25, tzinfo=datetime.timezone.utc)}, {'commit_sha': '6cb156708ca7ff5bc1b9a3273753d3297c70e10f', 'committer_username': 'm-agour', 'committer_name': 'Mohamed Abouagour', 'committer_email': None, 'commit_date': datetime.datetime(2020, 4, 4, 21, 51, 25, tzinfo=datetime.timezone.utc)}, {'commit_sha': 'be2d51174a261c6827ac4c2c2b7c7a33e2833cee', 'committer_username': 'm-agour', 'committer_name': 'Mohamed Abouagour', 'committer_email': None, 'commit_date': datetime.datetime(2020, 4, 4, 21, 51, 25, tzinfo=datetime.timezone.utc)}, {'commit_sha': 'e3eb08bc800f94e99a6e14733cb366eb4a65e675', 'committer_username': 'm-agour', 'committer_name': 'Mohamed Abouagour', 'committer_email': None, 'commit_date': datetime.datetime(2020, 4, 4, 21, 51, 25, tzinfo=datetime.timezone.utc)}, {'commit_sha': '4fe6b3a8979df859081b3c08b3f157ee3acfc4fb', 'committer_username': 'm-agour', 'committer_name': 'Mohamed Abouagour', 'committer_email': None, 'commit_date': datetime.datetime(2020, 4, 4, 21, 51, 25, tzinfo=datetime.timezone.utc)}, {'commit_sha': '07be60516f7a2cbade3601f9538359b5d00b1419', 'committer_username': 'm-agour', 'committer_name': 'Mohamed Abouagour', 'committer_email': None, 'commit_date': datetime.datetime(2020, 4, 4, 21, 51, 25, tzinfo=datetime.timezone.utc)}, {'commit_sha': 'fa2bb270577f62f86addd638b955cca4c4512306', 'committer_username': 'm-agour', 'committer_name': 'Mohamed Abouagour', 'committer_email': None, 'commit_date': datetime.datetime(2020, 4, 4, 21, 51, 25, tzinfo=datetime.timezone.utc)}, {'commit_sha': '1826b56d5f07549f69703d66cdd7d1f96de91ce1', 'committer_username': 'm-agour', 'committer_name': 'Mohamed Abouagour', 'committer_email': None, 'commit_date': datetime.datetime(2020, 4, 4, 21, 51, 25, tzinfo=datetime.timezone.utc)}, {'commit_sha': '88a082b1b850516bf10d021ad14402d92b30126e', 'committer_username': 'm-agour', 'committer_name': 'Mohamed Abouagour', 'committer_email': None, 'commit_date': datetime.datetime(2020, 4, 4, 21, 51, 25, tzinfo=datetime.timezone.utc)}, {'commit_sha': '127e14bb99439a1680d0d6cab005e056de2c1c24', 'committer_username': 'm-agour', 'committer_name': 'Mohamed Abouagour', 'committer_email': None, 'commit_date': datetime.datetime(2020, 4, 4, 21, 51, 25, tzinfo=datetime.timezone.utc)}, {'commit_sha': '945652e1da97cc977f331f1c582bfe3b4edd7d04', 'committer_username': 'm-agour', 'committer_name': 'Mohamed Abouagour', 'committer_email': None, 'commit_date': datetime.datetime(2020, 4, 4, 21, 51, 25, tzinfo=datetime.timezone.utc)}, {'commit_sha': '850df844b5cce642c22c61b861027449c75b0b67', 'committer_username': 'm-agour', 'committer_name': 'Mohamed Abouagour', 'committer_email': None, 'commit_date': datetime.datetime(2020, 4, 4, 21, 51, 25, tzinfo=datetime.timezone.utc)}, {'commit_sha': '2fb9dcc216503f288d2fe62ac10ffe9ac10cc2e3', 'committer_username': 'm-agour', 'committer_name': 'Mohamed Abouagour', 'committer_email': None, 'commit_date': datetime.datetime(2020, 4, 4, 21, 51, 25, tzinfo=datetime.timezone.utc)}, {'commit_sha': '8e50fca0b6c523918faa1a6e05e34a8f7cd32adf', 'committer_username': 'm-agour', 'committer_name': 'Mohamed Abouagour', 'committer_email': None, 'commit_date': datetime.datetime(2020, 4, 4, 21, 51, 25, tzinfo=datetime.timezone.utc)}, {'commit_sha': 'b4b2293f2cb0097326f79b026fca77b948b5193e', 'committer_username': 'm-agour', 'committer_name': 'Mohamed Abouagour', 'committer_email': None, 'commit_date': datetime.datetime(2020, 4, 4, 21, 51, 25, tzinfo=datetime.timezone.utc)}, {'commit_sha': '878dd7a16dda58b7df78670c8901e4a5d62465a1', 'committer_username': 'm-agour', 'committer_name': 'Mohamed Abouagour', 'committer_email': None, 'commit_date': datetime.datetime(2020, 4, 4, 21, 51, 25, tzinfo=datetime.timezone.utc)}, {'commit_sha': 'a600f7b89ab9a2bff66b670f775a22aabb5020db', 'committer_username': 'm-agour', 'committer_name': 'Mohamed Abouagour', 'committer_email': None, 'commit_date': datetime.datetime(2020, 4, 4, 21, 51, 25, tzinfo=datetime.timezone.utc)}, {'commit_sha': 'f02eb28346b22f102454b22f81e6c9ff4346fba3', 'committer_username': 'm-agour', 'committer_name': 'Mohamed Abouagour', 'committer_email': None, 'commit_date': datetime.datetime(2020, 4, 4, 21, 51, 25, tzinfo=datetime.timezone.utc)}, {'commit_sha': '6ccef08e2237fc9d412fee412ebb6882bfffeafd', 'committer_username': 'm-agour', 'committer_name': 'Mohamed Abouagour', 'committer_email': None, 'commit_date': datetime.datetime(2020, 4, 4, 21, 51, 25, tzinfo=datetime.timezone.utc)}, {'commit_sha': '16088eec3f126cf6f2dd4856b1effe38e3b0567f', 'committer_username': 'm-agour', 'committer_name': 'Mohamed Abouagour', 'committer_email': None, 'commit_date': datetime.datetime(2020, 4, 4, 21, 51, 25, tzinfo=datetime.timezone.utc)}, {'commit_sha': 'a9c9af2e4d96ba6089e91dd8d65355ad5ae92563', 'committer_username': 'm-agour', 'committer_name': 'Mohamed Abouagour', 'committer_email': None, 'commit_date': datetime.datetime(2020, 4, 4, 21, 51, 25, tzinfo=datetime.timezone.utc)}, {'commit_sha': '0d146961633e53983725764ea8ab6e6d65df97e3', 'committer_username': 'm-agour', 'committer_name': 'Mohamed Abouagour', 'committer_email': None, 'commit_date': datetime.datetime(2020, 4, 4, 21, 51, 25, tzinfo=datetime.timezone.utc)}, {'commit_sha': 'a8c6b3813bbfef64b2f6f5106d2903c3579755c7', 'committer_username': 'm-agour', 'committer_name': 'Mohamed Abouagour', 'committer_email': None, 'commit_date': datetime.datetime(2020, 4, 4, 21, 51, 25, tzinfo=datetime.timezone.utc)}, {'commit_sha': '5ad5802089eb451eb647aa5ea6f50c34ebc15051', 'committer_username': 'm-agour', 'committer_name': 'Mohamed Abouagour', 'committer_email': None, 'commit_date': datetime.datetime(2020, 4, 4, 21, 51, 25, tzinfo=datetime.timezone.utc)}, {'commit_sha': '0d93d92ec005b2ed3f8af07c0968aee1e469d62a', 'committer_username': 'm-agour', 'committer_name': 'Mohamed Abouagour', 'committer_email': None, 'commit_date': datetime.datetime(2020, 4, 4, 21, 51, 25, tzinfo=datetime.timezone.utc)}, {'commit_sha': '9c22d97e73b0285cf6111a055bab3b76b2cb7ed3', 'committer_username': 'm-agour', 'committer_name': 'Mohamed Abouagour', 'committer_email': None, 'commit_date': datetime.datetime(2020, 4, 4, 21, 51, 25, tzinfo=datetime.timezone.utc)}, {'commit_sha': 'beeaeb4956225d343dc5b3d2b4a43bc417554bb0', 'committer_username': 'm-agour', 'committer_name': 'Mohamed Abouagour', 'committer_email': None, 'commit_date': datetime.datetime(2020, 4, 4, 21, 51, 25, tzinfo=datetime.timezone.utc)}, {'commit_sha': '0cb693c837720f8e57f474d4cb71698ca8159838', 'committer_username': 'm-agour', 'committer_name': 'Mohamed Abouagour', 'committer_email': None, 'commit_date': datetime.datetime(2020, 4, 4, 21, 51, 25, tzinfo=datetime.timezone.utc)}, {'commit_sha': 'eb118b9e5434f6fc74253fdb60d85075a3dd9b1b', 'committer_username': 'm-agour', 'committer_name': 'Mohamed Abouagour', 'committer_email': None, 'commit_date': datetime.datetime(2020, 4, 4, 21, 51, 25, tzinfo=datetime.timezone.utc)}, {'commit_sha': '357b93d59184ad7518d03142f07f49260c615407', 'committer_username': 'm-agour', 'committer_name': 'Mohamed Abouagour', 'committer_email': None, 'commit_date': datetime.datetime(2020, 4, 4, 21, 51, 25, tzinfo=datetime.timezone.utc)}, {'commit_sha': 'b0fac6836e86ce3fe51561e7386b5e9f3b1d2a6e', 'committer_username': 'm-agour', 'committer_name': 'Mohamed Abouagour', 'committer_email': None, 'commit_date': datetime.datetime(2020, 4, 4, 21, 51, 25, tzinfo=datetime.timezone.utc)}, {'commit_sha': '8757a4e7490cd9e9a13f5c93c5925e08c6e94e09', 'committer_username': 'm-agour', 'committer_name': 'Mohamed Abouagour', 'committer_email': None, 'commit_date': datetime.datetime(2020, 4, 4, 21, 51, 25, tzinfo=datetime.timezone.utc)}, {'commit_sha': '7f8f6afd48de6e298c0a0f7c124a5fa6c80c8bd3', 'committer_username': 'm-agour', 'committer_name': 'Mohamed Abouagour', 'committer_email': None, 'commit_date': datetime.datetime(2020, 4, 4, 21, 51, 25, tzinfo=datetime.timezone.utc)}, {'commit_sha': 'cbe3280ab05e90b40f7ee08ba35e88ba5849a55b', 'committer_username': 'm-agour', 'committer_name': 'Mohamed Abouagour', 'committer_email': None, 'commit_date': datetime.datetime(2020, 4, 4, 21, 51, 25, tzinfo=datetime.timezone.utc)}, {'commit_sha': '7c5bdb8b9f092089c54e9aeba52a7440253c862e', 'committer_username': 'm-agour', 'committer_name': 'Mohamed Abouagour', 'committer_email': None, 'commit_date': datetime.datetime(2020, 4, 4, 21, 51, 25, tzinfo=datetime.timezone.utc)}, {'commit_sha': 'ba028fcd48f550197492efa1a3f39adbeab64a88', 'committer_username': 'm-agour', 'committer_name': 'Mohamed Abouagour', 'committer_email': None, 'commit_date': datetime.datetime(2020, 4, 4, 21, 51, 25, tzinfo=datetime.timezone.utc)}, {'commit_sha': 'af262a02459ec3863dade5c78a2c27ef0c453e0f', 'committer_username': 'm-agour', 'committer_name': 'Mohamed Abouagour', 'committer_email': None, 'commit_date': datetime.datetime(2020, 4, 4, 21, 51, 25, tzinfo=datetime.timezone.utc)}, {'commit_sha': '33cc27a5d1df7c52eb15f99428ad7ede555810d8', 'committer_username': 'm-agour', 'committer_name': 'Mohamed Abouagour', 'committer_email': None, 'commit_date': datetime.datetime(2020, 4, 4, 21, 51, 25, tzinfo=datetime.timezone.utc)}, {'commit_sha': '5648e5a07bb7d7cdfbc05edc146da081b3eeab71', 'committer_username': 'm-agour', 'committer_name': 'Mohamed Abouagour', 'committer_email': None, 'commit_date': datetime.datetime(2020, 4, 4, 21, 51, 25, tzinfo=datetime.timezone.utc)}, {'commit_sha': 'b8ba99df00d05f31eb1eb8c0f695c8d67c0ca291', 'committer_username': 'm-agour', 'committer_name': 'Mohamed Abouagour', 'committer_email': None, 'commit_date': datetime.datetime(2020, 4, 4, 21, 51, 25, tzinfo=datetime.timezone.utc)}, {'commit_sha': '82fa03fd10492ce9695f936f139e9512340170e5', 'committer_username': 'm-agour', 'committer_name': 'Mohamed Abouagour', 'committer_email': None, 'commit_date': datetime.datetime(2020, 4, 4, 21, 51, 25, tzinfo=datetime.timezone.utc)}, {'commit_sha': '7a8339418d3b0eb8ca6a66dd6e50c1c6c2725e62', 'committer_username': 'm-agour', 'committer_name': 'Mohamed Abouagour', 'committer_email': None, 'commit_date': datetime.datetime(2020, 4, 4, 21, 51, 25, tzinfo=datetime.timezone.utc)}, {'commit_sha': 'cf4de8cbcd1ce2cc46c249942aa34bb961e25c97', 'committer_username': 'm-agour', 'committer_name': 'Mohamed Abouagour', 'committer_email': None, 'commit_date': datetime.datetime(2020, 4, 4, 21, 51, 25, tzinfo=datetime.timezone.utc)}, {'commit_sha': '6650803016aae78d6eed8b74f47df2fc85530b13', 'committer_username': 'm-agour', 'committer_name': 'Mohamed Abouagour', 'committer_email': None, 'commit_date': datetime.datetime(2020, 4, 4, 21, 51, 25, tzinfo=datetime.timezone.utc)}, {'commit_sha': '7faaca7c616f24f630f0e0e1bc4edd75e0465cde', 'committer_username': 'm-agour', 'committer_name': 'Mohamed Abouagour', 'committer_email': None, 'commit_date': datetime.datetime(2020, 4, 4, 21, 51, 25, tzinfo=datetime.timezone.utc)}, {'commit_sha': 'bc18057c76122716fe3d9107185519938ef7e1e9', 'committer_username': 'm-agour', 'committer_name': 'Mohamed Abouagour', 'committer_email': None, 'commit_date': datetime.datetime(2020, 4, 4, 21, 51, 25, tzinfo=datetime.timezone.utc)}, {'commit_sha': '67c9005aeda32799b1e4b5af530bdac2315333e1', 'committer_username': 'm-agour', 'committer_name': 'Mohamed Abouagour', 'committer_email': None, 'commit_date': datetime.datetime(2020, 4, 4, 21, 51, 25, tzinfo=datetime.timezone.utc)}, {'commit_sha': 'd721aa895390a91ea063a430b530e84d931905ea', 'committer_username': 'm-agour', 'committer_name': 'Mohamed Abouagour', 'committer_email': None, 'commit_date': datetime.datetime(2020, 4, 4, 21, 51, 25, tzinfo=datetime.timezone.utc)}, {'commit_sha': 'a281a6f73bb93ab3fe7ef14d648d5a5d7d8d9e9c', 'committer_username': 'm-agour', 'committer_name': 'Mohamed Abouagour', 'committer_email': None, 'commit_date': datetime.datetime(2020, 4, 4, 21, 51, 25, tzinfo=datetime.timezone.utc)}, {'commit_sha': '933de7cd4713c3fadda16a9c7cc0495d36a80154', 'committer_username': 'm-agour', 'committer_name': 'Mohamed Abouagour', 'committer_email': None, 'commit_date': datetime.datetime(2020, 4, 4, 21, 51, 25, tzinfo=datetime.timezone.utc)}, {'commit_sha': '7b98cc1d4b0903c70225ef5c8a57e6f05d402799', 'committer_username': 'm-agour', 'committer_name': 'Mohamed Abouagour', 'committer_email': None, 'commit_date': datetime.datetime(2020, 4, 4, 21, 51, 25, tzinfo=datetime.timezone.utc)}, {'commit_sha': 'e97491974b18c096138266f83efa185ac699a4a9', 'committer_username': 'm-agour', 'committer_name': 'Mohamed Abouagour', 'committer_email': None, 'commit_date': datetime.datetime(2020, 4, 4, 21, 51, 25, tzinfo=datetime.timezone.utc)}, {'commit_sha': '8135557e8e15cdf1b7f398db9fd83e77fff78f17', 'committer_username': 'm-agour', 'committer_name': 'Mohamed Abouagour', 'committer_email': None, 'commit_date': datetime.datetime(2020, 4, 4, 21, 51, 25, tzinfo=datetime.timezone.utc)}, {'commit_sha': '17642f235ebec2c17371fe12320e3138ebf7c9de', 'committer_username': 'm-agour', 'committer_name': 'Mohamed Abouagour', 'committer_email': None, 'commit_date': datetime.datetime(2020, 4, 4, 21, 51, 25, tzinfo=datetime.timezone.utc)}, {'commit_sha': '7d6999303ff4c620c23f7f7f78401f0ba79062fe', 'committer_username': 'm-agour', 'committer_name': 'Mohamed Abouagour', 'committer_email': None, 'commit_date': datetime.datetime(2020, 4, 4, 21, 51, 25, tzinfo=datetime.timezone.utc)}, {'commit_sha': '241d090fca9b3d0e4c35e3dff37533ec0de1cec6', 'committer_username': 'm-agour', 'committer_name': 'Mohamed Abouagour', 'committer_email': None, 'commit_date': datetime.datetime(2020, 4, 4, 21, 51, 25, tzinfo=datetime.timezone.utc)}, {'commit_sha': 'f293eea0dcf6f4076a84bfab0f8672450ee40028', 'committer_username': 'm-agour', 'committer_name': 'Mohamed Abouagour', 'committer_email': None, 'commit_date': datetime.datetime(2020, 4, 4, 21, 51, 25, tzinfo=datetime.timezone.utc)}, {'commit_sha': '0f38fcf9f42dba13a384584a9ce1546192080927', 'committer_username': 'm-agour', 'committer_name': 'Mohamed Abouagour', 'committer_email': None, 'commit_date': datetime.datetime(2020, 4, 4, 21, 51, 25, tzinfo=datetime.timezone.utc)}, {'commit_sha': 'b884337bebd853de73cebf7742947d451ac7bc2e', 'committer_username': 'm-agour', 'committer_name': 'Mohamed Abouagour', 'committer_email': None, 'commit_date': datetime.datetime(2020, 4, 4, 21, 51, 25, tzinfo=datetime.timezone.utc)}, {'commit_sha': 'efd181395c29b4be2a72583eb8e91d2467d9ff7f', 'committer_username': 'm-agour', 'committer_name': 'Mohamed Abouagour', 'committer_email': None, 'commit_date': datetime.datetime(2020, 4, 4, 21, 51, 25, tzinfo=datetime.timezone.utc)}, {'commit_sha': '0f1fb270cdbf4b820b8b6a14a543bbede704465b', 'committer_username': 'm-agour', 'committer_name': 'Mohamed Abouagour', 'committer_email': None, 'commit_date': datetime.datetime(2020, 4, 4, 21, 51, 25, tzinfo=datetime.timezone.utc)}, {'commit_sha': 'efd5a1e9c208bdff897b681117ed69942b8175c5', 'committer_username': 'm-agour', 'committer_name': 'Mohamed Abouagour', 'committer_email': None, 'commit_date': datetime.datetime(2020, 4, 4, 21, 51, 25, tzinfo=datetime.timezone.utc)}, {'commit_sha': 'dadef6a89f77daf5be5fa71da24931d473e51e0e', 'committer_username': 'm-agour', 'committer_name': 'Mohamed Abouagour', 'committer_email': None, 'commit_date': datetime.datetime(2020, 4, 4, 21, 51, 25, tzinfo=datetime.timezone.utc)}, {'commit_sha': 'ca26187c4f2a81ebffd3b77b4bf75ac6fe9eab04', 'committer_username': 'm-agour', 'committer_name': 'Mohamed Abouagour', 'committer_email': None, 'commit_date': datetime.datetime(2020, 4, 4, 21, 51, 25, tzinfo=datetime.timezone.utc)}, {'commit_sha': '2682574dad5c3a9a9148884497d2d15b4dd2b0ef', 'committer_username': 'm-agour', 'committer_name': 'Mohamed Abouagour', 'committer_email': None, 'commit_date': datetime.datetime(2020, 4, 4, 21, 51, 25, tzinfo=datetime.timezone.utc)}, {'commit_sha': '3d8764bbb31111930822089d32b33df9ff0155dc', 'committer_username': 'm-agour', 'committer_name': 'Mohamed Abouagour', 'committer_email': None, 'commit_date': datetime.datetime(2020, 4, 4, 21, 51, 25, tzinfo=datetime.timezone.utc)}, {'commit_sha': '8b49c41c067f8d46f84de37814353c29edb99a5d', 'committer_username': 'm-agour', 'committer_name': 'Mohamed Abouagour', 'committer_email': None, 'commit_date': datetime.datetime(2020, 4, 4, 21, 51, 25, tzinfo=datetime.timezone.utc)}, {'commit_sha': '370bf84d9fb296947200a40ecdc1fbf74c6a2e74', 'committer_username': 'm-agour', 'committer_name': 'Mohamed Abouagour', 'committer_email': None, 'commit_date': datetime.datetime(2020, 4, 4, 21, 51, 25, tzinfo=datetime.timezone.utc)}, {'commit_sha': '15abab1c753393ffdd8859da4aa2167dcb21c533', 'committer_username': 'm-agour', 'committer_name': 'Mohamed Abouagour', 'committer_email': None, 'commit_date': datetime.datetime(2020, 4, 4, 21, 51, 25, tzinfo=datetime.timezone.utc)}, {'commit_sha': '7925c70c0d192d6804634d81827fc3056e988478', 'committer_username': 'm-agour', 'committer_name': 'Mohamed Abouagour', 'committer_email': None, 'commit_date': datetime.datetime(2020, 4, 4, 21, 51, 25, tzinfo=datetime.timezone.utc)}, {'commit_sha': 'b6db1b3fcf15146c1afc0f58b5f008aaafba3f9b', 'committer_username': 'm-agour', 'committer_name': 'Mohamed Abouagour', 'committer_email': None, 'commit_date': datetime.datetime(2020, 4, 4, 21, 51, 25, tzinfo=datetime.timezone.utc)}, {'commit_sha': '8cc3a81faacf50e09ade425399ab5e075859afd8', 'committer_username': 'm-agour', 'committer_name': 'Mohamed Abouagour', 'committer_email': None, 'commit_date': datetime.datetime(2020, 4, 4, 21, 51, 25, tzinfo=datetime.timezone.utc)}, {'commit_sha': '5bf532fca34922e9ec4c7721cf37189cc29a2e08', 'committer_username': 'm-agour', 'committer_name': 'Mohamed Abouagour', 'committer_email': None, 'commit_date': datetime.datetime(2020, 4, 4, 21, 51, 25, tzinfo=datetime.timezone.utc)}, {'commit_sha': '0aa1b87e18ce734715d769bf1d5bcf5ecfa64e63', 'committer_username': 'm-agour', 'committer_name': 'Mohamed Abouagour', 'committer_email': None, 'commit_date': datetime.datetime(2020, 4, 4, 21, 51, 25, tzinfo=datetime.timezone.utc)}, {'commit_sha': '59818bb1054ddca58651999202a15ef0c19d1b42', 'committer_username': 'm-agour', 'committer_name': 'Mohamed Abouagour', 'committer_email': None, 'commit_date': datetime.datetime(2020, 4, 4, 21, 51, 25, tzinfo=datetime.timezone.utc)}, {'commit_sha': 'defb0b54f6d8acaca886bb29b0e0821e5c999d83', 'committer_username': 'm-agour', 'committer_name': 'Mohamed Abouagour', 'committer_email': None, 'commit_date': datetime.datetime(2020, 4, 4, 21, 51, 25, tzinfo=datetime.timezone.utc)}, {'commit_sha': 'd9abaa075b5a138782600149d380f945473d6f73', 'committer_username': 'm-agour', 'committer_name': 'Mohamed Abouagour', 'committer_email': None, 'commit_date': datetime.datetime(2020, 4, 4, 21, 51, 25, tzinfo=datetime.timezone.utc)}, {'commit_sha': '9bed58be4d9ef02b408e2364ade93e45e3d88e48', 'committer_username': 'm-agour', 'committer_name': 'Mohamed Abouagour', 'committer_email': None, 'commit_date': datetime.datetime(2020, 4, 4, 21, 51, 25, tzinfo=datetime.timezone.utc)}, {'commit_sha': '9fa8bef5dcf5074fd8f6cc4c16ac8f22295ba5c8', 'committer_username': 'm-agour', 'committer_name': 'Mohamed Abouagour', 'committer_email': None, 'commit_date': datetime.datetime(2020, 4, 4, 21, 51, 25, tzinfo=datetime.timezone.utc)}, {'commit_sha': 'af982c8e3610697f50d0e85fb0c8d4079214501e', 'committer_username': 'm-agour', 'committer_name': 'Mohamed Abouagour', 'committer_email': None, 'commit_date': datetime.datetime(2020, 4, 4, 21, 51, 25, tzinfo=datetime.timezone.utc)}, {'commit_sha': 'c127a954d76d7efd11bcb90519ce990471b61702', 'committer_username': 'm-agour', 'committer_name': 'Mohamed Abouagour', 'committer_email': None, 'commit_date': datetime.datetime(2020, 4, 4, 21, 51, 25, tzinfo=datetime.timezone.utc)}, {'commit_sha': '63c03cfa1ad53bde1be20bc95e2bb34a24210a4a', 'committer_username': 'm-agour', 'committer_name': 'Mohamed Abouagour', 'committer_email': None, 'commit_date': datetime.datetime(2020, 4, 4, 21, 51, 25, tzinfo=datetime.timezone.utc)}, {'commit_sha': 'e0539269adc2a51e35282f83b8b0672bbe047a39', 'committer_username': 'm-agour', 'committer_name': 'Mohamed Abouagour', 'committer_email': None, 'commit_date': datetime.datetime(2020, 4, 4, 21, 51, 25, tzinfo=datetime.timezone.utc)}, {'commit_sha': '2f6a66fc2cff5bc3f076717db1944f798415520a', 'committer_username': 'm-agour', 'committer_name': 'Mohamed Abouagour', 'committer_email': None, 'commit_date': datetime.datetime(2020, 4, 4, 21, 51, 25, tzinfo=datetime.timezone.utc)}, {'commit_sha': 'ee879095ef5dbfea1dd4cc337b6f45e9a1262f5b', 'committer_username': 'm-agour', 'committer_name': 'Mohamed Abouagour', 'committer_email': None, 'commit_date': datetime.datetime(2020, 4, 4, 21, 51, 25, tzinfo=datetime.timezone.utc)}, {'commit_sha': '0c8c4ac201a0a02af0b25826ac4a34107ead2fac', 'committer_username': 'm-agour', 'committer_name': 'Mohamed Abouagour', 'committer_email': None, 'commit_date': datetime.datetime(2020, 4, 4, 21, 51, 25, tzinfo=datetime.timezone.utc)}, {'commit_sha': 'f8d6db74fb1dd8ec456b35b07e5a82df7f9288fc', 'committer_username': 'm-agour', 'committer_name': 'Mohamed Abouagour', 'committer_email': None, 'commit_date': datetime.datetime(2020, 4, 4, 21, 51, 25, tzinfo=datetime.timezone.utc)}, {'commit_sha': '0e8bf0eb9006d48ab912c746f61219483b85864b', 'committer_username': 'm-agour', 'committer_name': 'Mohamed Abouagour', 'committer_email': None, 'commit_date': datetime.datetime(2020, 4, 4, 21, 51, 25, tzinfo=datetime.timezone.utc)}, {'commit_sha': '49a2411440fe835453cf851ddf5bc14aeaeb0dad', 'committer_username': 'm-agour', 'committer_name': 'Mohamed Abouagour', 'committer_email': None, 'commit_date': datetime.datetime(2020, 4, 4, 21, 51, 25, tzinfo=datetime.timezone.utc)}, {'commit_sha': '670d3a41645eb7bcd445a7d8ae9ddd7bebc376b7', 'committer_username': 'm-agour', 'committer_name': 'Mohamed Abouagour', 'committer_email': None, 'commit_date': datetime.datetime(2020, 4, 4, 21, 51, 25, tzinfo=datetime.timezone.utc)}, {'commit_sha': 'd3fd39db6f6bfcc6d85cf13fd3bddcc776b365ed', 'committer_username': 'm-agour', 'committer_name': 'Mohamed Abouagour', 'committer_email': None, 'commit_date': datetime.datetime(2020, 4, 4, 21, 51, 25, tzinfo=datetime.timezone.utc)}, {'commit_sha': '14d2e5d2d69d90c4d86cfeeb53dbd907acb15e84', 'committer_username': 'm-agour', 'committer_name': 'Mohamed Abouagour', 'committer_email': None, 'commit_date': datetime.datetime(2020, 4, 4, 21, 51, 25, tzinfo=datetime.timezone.utc)}, {'commit_sha': '364e386a09c8ac462cab80f2c81d06a7de587c4a', 'committer_username': 'm-agour', 'committer_name': 'Mohamed Abouagour', 'committer_email': None, 'commit_date': datetime.datetime(2020, 4, 4, 21, 51, 25, tzinfo=datetime.timezone.utc)}, {'commit_sha': 'ae336ce4b6733f64a2129524ebc107e0756774c0', 'committer_username': 'm-agour', 'committer_name': 'Mohamed Abouagour', 'committer_email': None, 'commit_date': datetime.datetime(2020, 4, 4, 21, 51, 25, tzinfo=datetime.timezone.utc)}, {'commit_sha': '71730e023ebca82baf6bf0173da42bc9a80c0277', 'committer_username': 'm-agour', 'committer_name': 'Mohamed Abouagour', 'committer_email': None, 'commit_date': datetime.datetime(2020, 4, 4, 21, 51, 25, tzinfo=datetime.timezone.utc)}, {'commit_sha': '54421d0b5cbec05b0ebd89ae4a72ec06a489889f', 'committer_username': 'm-agour', 'committer_name': 'Mohamed Abouagour', 'committer_email': None, 'commit_date': datetime.datetime(2020, 4, 4, 21, 51, 25, tzinfo=datetime.timezone.utc)}, {'commit_sha': 'a7515c36fc67f754d8b9afca97194a523c05120e', 'committer_username': 'm-agour', 'committer_name': 'Mohamed Abouagour', 'committer_email': None, 'commit_date': datetime.datetime(2020, 4, 4, 21, 51, 25, tzinfo=datetime.timezone.utc)}, {'commit_sha': 'fcceba5eeb130a0cd3085d936274f6ca9a01f40b', 'committer_username': 'm-agour', 'committer_name': 'Mohamed Abouagour', 'committer_email': None, 'commit_date': datetime.datetime(2020, 4, 4, 21, 51, 25, tzinfo=datetime.timezone.utc)}, {'commit_sha': '680c33ddb9b1f9dba346540c56222f5c1f56811c', 'committer_username': 'm-agour', 'committer_name': 'Mohamed Abouagour', 'committer_email': None, 'commit_date': datetime.datetime(2020, 4, 4, 21, 51, 25, tzinfo=datetime.timezone.utc)}, {'commit_sha': '4a1a077f3fd60da2066afc5f0bd0323112badd27', 'committer_username': 'm-agour', 'committer_name': 'Mohamed Abouagour', 'committer_email': None, 'commit_date': datetime.datetime(2020, 4, 4, 21, 51, 25, tzinfo=datetime.timezone.utc)}, {'commit_sha': 'ef64872bab833922591d4af4811c1b514a6e0eeb', 'committer_username': 'm-agour', 'committer_name': 'Mohamed Abouagour', 'committer_email': None, 'commit_date': datetime.datetime(2020, 4, 4, 21, 51, 25, tzinfo=datetime.timezone.utc)}, {'commit_sha': 'dc794bffe8d6da259781e4342b80ad88b4c9c370', 'committer_username': 'm-agour', 'committer_name': 'Mohamed Abouagour', 'committer_email': None, 'commit_date': datetime.datetime(2020, 4, 4, 21, 51, 25, tzinfo=datetime.timezone.utc)}, {'commit_sha': '8d8f3aaefdffbac61ae455dd17abd601e4bfcff6', 'committer_username': 'm-agour', 'committer_name': 'Mohamed Abouagour', 'committer_email': None, 'commit_date': datetime.datetime(2020, 4, 4, 21, 51, 25, tzinfo=datetime.timezone.utc)}, {'commit_sha': 'bc6ea908af0ede0edbfb2e2f87e64ca0cd7015ae', 'committer_username': 'm-agour', 'committer_name': 'Mohamed Abouagour', 'committer_email': None, 'commit_date': datetime.datetime(2020, 4, 4, 21, 51, 25, tzinfo=datetime.timezone.utc)}, {'commit_sha': '51f7399dd68be15fe2f214dc3ad50852005bdb7d', 'committer_username': 'm-agour', 'committer_name': 'Mohamed Abouagour', 'committer_email': None, 'commit_date': datetime.datetime(2020, 4, 4, 21, 51, 25, tzinfo=datetime.timezone.utc)}, {'commit_sha': 'e920d7a083d1c4170525cfc7bccf497cc52aa8c9', 'committer_username': 'm-agour', 'committer_name': 'Mohamed Abouagour', 'committer_email': None, 'commit_date': datetime.datetime(2020, 4, 4, 21, 51, 25, tzinfo=datetime.timezone.utc)}, {'commit_sha': '6b3b63e3e44fd214617020ae15cc7f0f86b9d2db', 'committer_username': 'm-agour', 'committer_name': 'Mohamed Abouagour', 'committer_email': None, 'commit_date': datetime.datetime(2020, 4, 4, 21, 51, 25, tzinfo=datetime.timezone.utc)}, {'commit_sha': '2601b0a1a9b553acfc8c7a676cbc7d5c6267e4a7', 'committer_username': 'm-agour', 'committer_name': 'Mohamed Abouagour', 'committer_email': None, 'commit_date': datetime.datetime(2020, 4, 4, 21, 51, 25, tzinfo=datetime.timezone.utc)}, {'commit_sha': '57953dbb2b32a8ad858239015c8ddd1ba3c59e30', 'committer_username': 'm-agour', 'committer_name': 'Mohamed Abouagour', 'committer_email': None, 'commit_date': datetime.datetime(2020, 4, 4, 21, 51, 25, tzinfo=datetime.timezone.utc)}, {'commit_sha': 'd8b5459509d80d519c356713691e127cae9698c1', 'committer_username': 'm-agour', 'committer_name': 'Mohamed Abouagour', 'committer_email': None, 'commit_date': datetime.datetime(2020, 4, 4, 21, 51, 25, tzinfo=datetime.timezone.utc)}, {'commit_sha': 'f4b47df66e76fb1e87db844436cf4a7b0e9c8f53', 'committer_username': 'm-agour', 'committer_name': 'Mohamed Abouagour', 'committer_email': None, 'commit_date': datetime.datetime(2020, 4, 4, 21, 51, 25, tzinfo=datetime.timezone.utc)}, {'commit_sha': 'cef39614d0f6558544c15ae583a60458172cea8d', 'committer_username': 'm-agour', 'committer_name': 'Mohamed Abouagour', 'committer_email': None, 'commit_date': datetime.datetime(2020, 4, 4, 21, 51, 25, tzinfo=datetime.timezone.utc)}, {'commit_sha': '62a58c81e445e83a94518835e2701cf6231402a1', 'committer_username': 'm-agour', 'committer_name': 'Mohamed Abouagour', 'committer_email': None, 'commit_date': datetime.datetime(2020, 4, 4, 21, 51, 25, tzinfo=datetime.timezone.utc)}, {'commit_sha': 'e87b0884d007afdc5c03a726fce32c38f2f11775', 'committer_username': 'm-agour', 'committer_name': 'Mohamed Abouagour', 'committer_email': None, 'commit_date': datetime.datetime(2020, 4, 4, 21, 51, 25, tzinfo=datetime.timezone.utc)}, {'commit_sha': '0539386b23d27ea6c357bacb7fa41011b798f22a', 'committer_username': 'm-agour', 'committer_name': 'Mohamed Abouagour', 'committer_email': None, 'commit_date': datetime.datetime(2020, 4, 4, 21, 51, 25, tzinfo=datetime.timezone.utc)}, {'commit_sha': 'f18eda44b5b6ef652fcc8c636b2a4aeb23f3f25b', 'committer_username': 'm-agour', 'committer_name': 'Mohamed Abouagour', 'committer_email': None, 'commit_date': datetime.datetime(2020, 4, 4, 21, 51, 25, tzinfo=datetime.timezone.utc)}, {'commit_sha': 'f03c96ac1e0453ced0a7cc1f305563d383f3de77', 'committer_username': 'm-agour', 'committer_name': 'Mohamed Abouagour', 'committer_email': None, 'commit_date': datetime.datetime(2020, 4, 4, 21, 51, 25, tzinfo=datetime.timezone.utc)}, {'commit_sha': '537d2cb21df82d1c81cfb16f697c4deedee42500', 'committer_username': 'm-agour', 'committer_name': 'Mohamed Abouagour', 'committer_email': None, 'commit_date': datetime.datetime(2020, 4, 4, 21, 51, 25, tzinfo=datetime.timezone.utc)}, {'commit_sha': '520f20cd2d42f97ae0bed7944ab43f5ee5d2303e', 'committer_username': 'm-agour', 'committer_name': 'Mohamed Abouagour', 'committer_email': None, 'commit_date': datetime.datetime(2020, 4, 4, 21, 51, 25, tzinfo=datetime.timezone.utc)}, {'commit_sha': 'a014b6eadd8e5c64aa5c417d78ffa4e83fc350bf', 'committer_username': 'm-agour', 'committer_name': 'Mohamed Abouagour', 'committer_email': None, 'commit_date': datetime.datetime(2020, 4, 4, 21, 51, 25, tzinfo=datetime.timezone.utc)}, {'commit_sha': '0c20c25b797b2086d830fb558bff56667a5a3a82', 'committer_username': 'm-agour', 'committer_name': 'Mohamed Abouagour', 'committer_email': None, 'commit_date': datetime.datetime(2020, 4, 4, 21, 51, 25, tzinfo=datetime.timezone.utc)}, {'commit_sha': '644730cbb311322145c98883e3ae6d1b6e38b15b', 'committer_username': 'm-agour', 'committer_name': 'Mohamed Abouagour', 'committer_email': None, 'commit_date': datetime.datetime(2020, 4, 4, 21, 51, 25, tzinfo=datetime.timezone.utc)}, {'commit_sha': '74080406291b7092f6290ad67ec0c973bcb32725', 'committer_username': 'm-agour', 'committer_name': 'Mohamed Abouagour', 'committer_email': None, 'commit_date': datetime.datetime(2020, 4, 4, 21, 51, 25, tzinfo=datetime.timezone.utc)}, {'commit_sha': 'bef18658f1d7b18e7e7f862019242dd32f9e6f50', 'committer_username': 'm-agour', 'committer_name': 'Mohamed Abouagour', 'committer_email': None, 'commit_date': datetime.datetime(2020, 4, 4, 21, 51, 25, tzinfo=datetime.timezone.utc)}, {'commit_sha': 'a1beb7f9d75bb7019a714699735571b967939116', 'committer_username': 'm-agour', 'committer_name': 'Mohamed Abouagour', 'committer_email': None, 'commit_date': datetime.datetime(2020, 4, 4, 21, 51, 25, tzinfo=datetime.timezone.utc)}, {'commit_sha': '2f4fa42b32c5442e3d0b8555f51d6c18b5ab1a48', 'committer_username': 'm-agour', 'committer_name': 'Mohamed Abouagour', 'committer_email': None, 'commit_date': datetime.datetime(2020, 4, 4, 21, 51, 25, tzinfo=datetime.timezone.utc)}]",Mohamed Abouagour,63170874,,User,,29,,29,25
