pr_id,pr_title,pr_body,is_merged,pr_number,pr_url,pr_html_url,pr_state,additions,deletions,pr_changed_files,pr_commits_count,pr_comments_count,pr_review_comments_count,pr_labels_count,pr_assignees_count,pr_labels,pr_created_at,pr_closed_at,time_taken,time_delta,pr_review_comments,pr_commits,contributor,contributor_id,contributor_email,contributor_type,contributions,contributor_public_repos,contributor_private_repos,contributor_followings,contributor_followers
609037447,[efi] Improve ELF to PE conversion,"As currently ELF sections rather than segments are converted to PE sections, PE section alignment is hard-coded, and some fields describing virtual properties are assigned values based on file alignment, EFI PE drivers generated by elf2efi are generally not well-aligned. This can cause issues when enforcing strict PE parsing rules (as I am currently proposing for EDK II / OVMF), or when enforcing section permissions.

This PR fixes all discovered issues regarding PE image alignment. Furthermore, the constructed debug and relocation sections are marked as discardable for security reasons. All changes made are in conformance with the PE specification.

The changes have been validated using a stricter EDK II image loader, with OVMF booting and successfully loading the appropriate EFI ROM. Images created by the old utility are rejected as expected. Please note that I have not been able to test the full functionality of the ROM image, only that it loads successfully.",True,313,https://api.github.com/repos/ipxe/ipxe/pulls/313,https://github.com/ipxe/ipxe/pull/313,closed,36,20,2,3,12,1,0,0,[],2021-04-05 15:59:36+00:00,2021-04-10 13:52:39+00:00,424383.0,"4 days, 21:53:03","[{'comment_id': 609997372, 'comment_body': 'Whitespace looks slightly off: please match the surrounding lines', 'comment_created': datetime.datetime(2021, 4, 8, 18, 43, 36, tzinfo=datetime.timezone.utc), 'commenter': 'mcb30', 'type': 'User'}]","[{'commit_sha': 'a6ebc25368141757610d4c86ebafe77a9fc5c4bc', 'committer_username': 'mhaeuser', 'committer_name': 'Marvin H채user', 'committer_email': None, 'commit_date': datetime.datetime(2014, 9, 4, 19, 2, 55, tzinfo=datetime.timezone.utc)}, {'commit_sha': '25448fcdab4ebe3a7cfaf794b7d277a098af5daf', 'committer_username': 'mhaeuser', 'committer_name': 'Marvin H채user', 'committer_email': None, 'commit_date': datetime.datetime(2014, 9, 4, 19, 2, 55, tzinfo=datetime.timezone.utc)}, {'commit_sha': '7360fe0e757993b50f25200768ca2d34572f7ff5', 'committer_username': 'mhaeuser', 'committer_name': 'Marvin H채user', 'committer_email': None, 'commit_date': datetime.datetime(2014, 9, 4, 19, 2, 55, tzinfo=datetime.timezone.utc)}]",Marvin H채user,8659494,,User,,32,,9,211

Project_ID,Name,Full_name,Language,Forks,Stars,Watchers,contributors,commits,issues,branches,PRs_count,contributor pullrequests
1532184,ipxe,ipxe/ipxe,C,633,1452,87,187,6752,135,11,47,"[{'id': 609037447, 'number': 313, 'closed': datetime.datetime(2021, 4, 10, 13, 52, 39, tzinfo=datetime.timezone.utc), 'created': datetime.datetime(2021, 4, 5, 15, 59, 36, tzinfo=datetime.timezone.utc), 'time_taken': 424383.0, 'time_delta': '4 days, 21:53:03', 'additions': 36, 'deletions': 20, 'state': 'closed'}]"
