pr_id,pr_title,pr_body,is_merged,pr_number,pr_url,pr_html_url,pr_state,additions,deletions,pr_changed_files,pr_commits_count,pr_comments_count,pr_review_comments_count,pr_labels_count,pr_assignees_count,pr_labels,pr_created_at,pr_closed_at,time_taken,time_delta,pr_review_comments,pr_commits,contributor,contributor_id,contributor_email,contributor_type,contributions,contributor_public_repos,contributor_private_repos,contributor_followings,contributor_followers
678304454,Save credentials and add remember me option,"Add Remember me option in the Login Page.
Add feature to keep user logged in.",True,66,https://api.github.com/repos/odk-x/suitcase/pulls/66,https://github.com/odk-x/suitcase/pull/66,closed,323,125,9,14,5,16,0,0,[],2021-06-26 09:05:27+00:00,2021-10-13 22:17:39+00:00,9465132.0,"109 days, 13:12:12","[{'comment_id': 659334271, 'comment_body': '`reset` was called on line 31, so this condition would always be false.', 'comment_created': datetime.datetime(2021, 6, 27, 14, 58, 49, tzinfo=datetime.timezone.utc), 'commenter': 'linl33', 'type': 'User'}, {'comment_id': 659334442, 'comment_body': 'Why was this removed?', 'comment_created': datetime.datetime(2021, 6, 27, 15, 0, 25, tzinfo=datetime.timezone.utc), 'commenter': 'linl33', 'type': 'User'}, {'comment_id': 659334587, 'comment_body': ""The logout button construction should be its own method, so it's easier to read."", 'comment_created': datetime.datetime(2021, 6, 27, 15, 1, 20, tzinfo=datetime.timezone.utc), 'commenter': 'linl33', 'type': 'User'}, {'comment_id': 659334864, 'comment_body': 'Possible NPE here. Check `PropertyChangeEvent` javadoc.', 'comment_created': datetime.datetime(2021, 6, 27, 15, 3, 27, tzinfo=datetime.timezone.utc), 'commenter': 'linl33', 'type': 'User'}, {'comment_id': 660802373, 'comment_body': 'after the init method is called it will be initialized again https://github.com/Shubhamr837/suitcase/blob/c2461b8b74378d34cb189e5f1208eecf47df9188/src/main/java/org/opendatakit/suitcase/net/SyncWrapper.java#L64\r\n', 'comment_created': datetime.datetime(2021, 6, 29, 16, 58, 5, tzinfo=datetime.timezone.utc), 'commenter': 'Shubhamr837', 'type': 'User'}, {'comment_id': 660809202, 'comment_body': 'I have removed it from here to login task. After syncWrapper is initialized we can call update table list from login task and login task will also update the status is the progress bar. This is done because after login is done from saved credentials table id list will have to be updated and user needs to know that table list is being updated as initially the table list will be blank. If saved credentials are incorrect the method would through exception, we can handle the error in login task and send user back to login page.', 'comment_created': datetime.datetime(2021, 6, 29, 17, 8, 9, tzinfo=datetime.timezone.utc), 'commenter': 'Shubhamr837', 'type': 'User'}, {'comment_id': 663590152, 'comment_body': 'You can add comments about the use of startIndex + 7, startIndex + 13, or one sample error message. So that it will be easier in the future to understand code.', 'comment_created': datetime.datetime(2021, 7, 5, 1, 35, 14, tzinfo=datetime.timezone.utc), 'commenter': 'codeknight3', 'type': 'User'}, {'comment_id': 663590623, 'comment_body': 'Add space. (syncClientError.getStatusCode() == 401)', 'comment_created': datetime.datetime(2021, 7, 5, 1, 37, 37, tzinfo=datetime.timezone.utc), 'commenter': 'codeknight3', 'type': 'User'}, {'comment_id': 663606737, 'comment_body': 'Why deleting stored data after logout? If the user logouts and closes the application after that when the user tries to log in again we still want its data to be there. Right?', 'comment_created': datetime.datetime(2021, 7, 5, 2, 47, 25, tzinfo=datetime.timezone.utc), 'commenter': 'codeknight3', 'type': 'User'}, {'comment_id': 663997800, 'comment_body': 'Yes sir I am modifying it now. Only password will be removed.', 'comment_created': datetime.datetime(2021, 7, 5, 15, 6, 56, tzinfo=datetime.timezone.utc), 'commenter': 'Shubhamr837', 'type': 'User'}, {'comment_id': 664003632, 'comment_body': 'Yes. So I think correct behavior should be like this:\r\nIf the save password box is unchecked - remove the password after logout\r\nIf the save password box is checked - No need to remove anything', 'comment_created': datetime.datetime(2021, 7, 5, 15, 16, 42, tzinfo=datetime.timezone.utc), 'commenter': 'codeknight3', 'type': 'User'}, {'comment_id': 664008110, 'comment_body': 'Sir the password is not saved in the properties file after login if save password is unchecked. So one way is: \r\n 1. checking that password field is there or not  \r\n 2.  Remove if it is there.\r\n If any other implementation would be more efficient please suggest.', 'comment_created': datetime.datetime(2021, 7, 5, 15, 23, 51, tzinfo=datetime.timezone.utc), 'commenter': 'Shubhamr837', 'type': 'User'}, {'comment_id': 664016275, 'comment_body': ""So in that case, you don't need to change the properties file at all after the user logout. \r\nIf the user checked the save password box password will be stored in the properties file and we can reuse it when the user restarts the application.\r\nIn case of save password box is unchecked, password will not be stored in the properties file which is what we want."", 'comment_created': datetime.datetime(2021, 7, 5, 15, 37, 50, tzinfo=datetime.timezone.utc), 'commenter': 'codeknight3', 'type': 'User'}, {'comment_id': 664055176, 'comment_body': 'Yes sir but this will work but only if user stays in the application after logout. Because after user opens the application again auto login logic is implemented in this way:\r\n1. If password field is present login the user\r\n2. Else if password field is absent only fill the server_url, app_id and username and leave password text field blank.', 'comment_created': datetime.datetime(2021, 7, 5, 17, 3, 30, tzinfo=datetime.timezone.utc), 'commenter': 'Shubhamr837', 'type': 'User'}, {'comment_id': 664070590, 'comment_body': 'So after we remove password it will not login the user when application is opened again.', 'comment_created': datetime.datetime(2021, 7, 5, 17, 48, 3, tzinfo=datetime.timezone.utc), 'commenter': 'Shubhamr837', 'type': 'User'}, {'comment_id': 664710664, 'comment_body': ""But we want a password to be filled in automatically when the user opens the application again and he previously had checked the save password box.  Right?\r\nA simple solution which I can think of,\r\n\r\nStart of application: If the properties file is present fill all the fields using values in the properties file, else create properties file with all the keys, and values set to an empty string. Run Auto login logic only when password is not an empty string. \r\nAfter Successful login: Change all the values in the properties file corresponding to user-provided values. If the save password box is not checked set the value of the password(in the properties file) to an empty string.\r\nAfter Logout: No need to change anything in the properties file.\r\n\r\nIt's just a suggestion. If you think there is some easier way, you can implement that."", 'comment_created': datetime.datetime(2021, 7, 6, 16, 32, 11, tzinfo=datetime.timezone.utc), 'commenter': 'codeknight3', 'type': 'User'}]","[{'commit_sha': '996f0d55be3f4d1c46ed6c69218bf6d5d6f4dcff', 'committer_username': 'Shubhamr837', 'committer_name': 'Subham raj', 'committer_email': None, 'commit_date': datetime.datetime(2018, 11, 17, 17, 45, 48, tzinfo=datetime.timezone.utc)}, {'commit_sha': '7047c5bdd219742f08d866e7c188f0758433e80c', 'committer_username': 'Shubhamr837', 'committer_name': 'Subham raj', 'committer_email': None, 'commit_date': datetime.datetime(2018, 11, 17, 17, 45, 48, tzinfo=datetime.timezone.utc)}, {'commit_sha': '9091b175a3fa3be403d8bcdb392b48b404b1c000', 'committer_username': 'Shubhamr837', 'committer_name': 'Subham raj', 'committer_email': None, 'commit_date': datetime.datetime(2018, 11, 17, 17, 45, 48, tzinfo=datetime.timezone.utc)}, {'commit_sha': 'c2461b8b74378d34cb189e5f1208eecf47df9188', 'committer_username': 'Shubhamr837', 'committer_name': 'Subham raj', 'committer_email': None, 'commit_date': datetime.datetime(2018, 11, 17, 17, 45, 48, tzinfo=datetime.timezone.utc)}, {'commit_sha': '79258a1ed59edebb36fcdab60ff6bcbdb7e9afd5', 'committer_username': 'Shubhamr837', 'committer_name': 'Subham raj', 'committer_email': None, 'commit_date': datetime.datetime(2018, 11, 17, 17, 45, 48, tzinfo=datetime.timezone.utc)}, {'commit_sha': 'ddba6ed834b9fb795a8a34a261512403ea98160d', 'committer_username': 'Shubhamr837', 'committer_name': 'Subham raj', 'committer_email': None, 'commit_date': datetime.datetime(2018, 11, 17, 17, 45, 48, tzinfo=datetime.timezone.utc)}, {'commit_sha': '582a736844d605708ff2a6dd520beac91578dc62', 'committer_username': 'Shubhamr837', 'committer_name': 'Subham raj', 'committer_email': None, 'commit_date': datetime.datetime(2018, 11, 17, 17, 45, 48, tzinfo=datetime.timezone.utc)}, {'commit_sha': 'fee333bf625b61593e8c95bae67ab01de8595534', 'committer_username': 'Shubhamr837', 'committer_name': 'Subham raj', 'committer_email': None, 'commit_date': datetime.datetime(2018, 11, 17, 17, 45, 48, tzinfo=datetime.timezone.utc)}, {'commit_sha': '22745e33da57b9084638d41a944a32a854e09626', 'committer_username': 'Shubhamr837', 'committer_name': 'Subham raj', 'committer_email': None, 'commit_date': datetime.datetime(2018, 11, 17, 17, 45, 48, tzinfo=datetime.timezone.utc)}, {'commit_sha': '9571b89bab1f4d7ed0a1044f399b487a99f256e3', 'committer_username': 'Shubhamr837', 'committer_name': 'Subham raj', 'committer_email': None, 'commit_date': datetime.datetime(2018, 11, 17, 17, 45, 48, tzinfo=datetime.timezone.utc)}, {'commit_sha': '436cfca9be99904ffc8d61ee59760c4a0163aed5', 'committer_username': 'Shubhamr837', 'committer_name': 'Subham raj', 'committer_email': None, 'commit_date': datetime.datetime(2018, 11, 17, 17, 45, 48, tzinfo=datetime.timezone.utc)}, {'commit_sha': 'a5e25ead14c0c0f3804a46e30f0f7c584a13b025', 'committer_username': 'Shubhamr837', 'committer_name': 'Subham raj', 'committer_email': None, 'commit_date': datetime.datetime(2018, 11, 17, 17, 45, 48, tzinfo=datetime.timezone.utc)}, {'commit_sha': '291a9cf6427a46aee9188dfa4b58e3827e9a37ae', 'committer_username': 'Shubhamr837', 'committer_name': 'Subham raj', 'committer_email': None, 'commit_date': datetime.datetime(2018, 11, 17, 17, 45, 48, tzinfo=datetime.timezone.utc)}, {'commit_sha': 'd10a934306961031f88cd3d4cdf179bce9ce49e4', 'committer_username': 'Shubhamr837', 'committer_name': 'Subham raj', 'committer_email': None, 'commit_date': datetime.datetime(2018, 11, 17, 17, 45, 48, tzinfo=datetime.timezone.utc)}]",Subham raj,45128519,,User,,37,,42,48
671108217,AssertJ tests,"AssertJ test to test login, update, delete, reset and upload.",True,65,https://api.github.com/repos/odk-x/suitcase/pulls/65,https://github.com/odk-x/suitcase/pull/65,closed,1088,247,13,20,5,8,0,0,[],2021-06-16 07:30:56+00:00,2021-10-28 16:37:28+00:00,11610392.0,"134 days, 9:06:32","[{'comment_id': 657622636, 'comment_body': ""Could you move the version numbers into the `properties` section? It's easier to manage the dependencies this way."", 'comment_created': datetime.datetime(2021, 6, 24, 4, 49, 53, tzinfo=datetime.timezone.utc), 'commenter': 'linl33', 'type': 'User'}, {'comment_id': 657623368, 'comment_body': ""Can you check if there's a typo? I can't find this dependency (assertj-swing-aut). "", 'comment_created': datetime.datetime(2021, 6, 24, 4, 52, 10, tzinfo=datetime.timezone.utc), 'commenter': 'linl33', 'type': 'User'}, {'comment_id': 657623517, 'comment_body': ""I don't think this is needed? We use junit and not testng."", 'comment_created': datetime.datetime(2021, 6, 24, 4, 52, 34, tzinfo=datetime.timezone.utc), 'commenter': 'linl33', 'type': 'User'}, {'comment_id': 657624547, 'comment_body': ""I'm curious why you're resizing the frame here."", 'comment_created': datetime.datetime(2021, 6, 24, 4, 55, 51, tzinfo=datetime.timezone.utc), 'commenter': 'linl33', 'type': 'User'}, {'comment_id': 657624741, 'comment_body': 'Please use a name that describes the test.', 'comment_created': datetime.datetime(2021, 6, 24, 4, 56, 23, tzinfo=datetime.timezone.utc), 'commenter': 'linl33', 'type': 'User'}, {'comment_id': 657625119, 'comment_body': 'Is there a way to check for login completion or listen for login completion instead of waiting a fixed amount of time?', 'comment_created': datetime.datetime(2021, 6, 24, 4, 57, 42, tzinfo=datetime.timezone.utc), 'commenter': 'linl33', 'type': 'User'}, {'comment_id': 660327966, 'comment_body': 'Sorry I forgot to mention this. https://github.com/assertj/assertj-examples/issues/41#issuecomment-435342612 .\r\nI added this to my local maven repository using the same commands that we use for adding sync client https://github.com/odk-x/suitcase/blob/master/dependencies/mvn_local_installs.', 'comment_created': datetime.datetime(2021, 6, 29, 6, 50, 30, tzinfo=datetime.timezone.utc), 'commenter': 'Shubhamr837', 'type': 'User'}, {'comment_id': 670401152, 'comment_body': 'One way is to get the sync wrapper and check weather it is initialized or not using the isinitialized() method which is already there. \r\nshould I implement that?', 'comment_created': datetime.datetime(2021, 7, 15, 12, 8, 38, tzinfo=datetime.timezone.utc), 'commenter': 'Shubhamr837', 'type': 'User'}]","[{'commit_sha': '3bea16dbedaaaf674ff19fac24c277f81940e941', 'committer_username': 'Shubhamr837', 'committer_name': 'Subham raj', 'committer_email': None, 'commit_date': datetime.datetime(2018, 11, 17, 17, 45, 48, tzinfo=datetime.timezone.utc)}, {'commit_sha': 'c1c7efc5da5c3314c224bec5c03ded1bba9a0c81', 'committer_username': 'Shubhamr837', 'committer_name': 'Subham raj', 'committer_email': None, 'commit_date': datetime.datetime(2018, 11, 17, 17, 45, 48, tzinfo=datetime.timezone.utc)}, {'commit_sha': 'dd84b266f2fb801f658244273fe5c8210e03a97f', 'committer_username': 'Shubhamr837', 'committer_name': 'Subham raj', 'committer_email': None, 'commit_date': datetime.datetime(2018, 11, 17, 17, 45, 48, tzinfo=datetime.timezone.utc)}, {'commit_sha': 'a6ac1768bca8686df20d8efa00fe440a6209537b', 'committer_username': 'Shubhamr837', 'committer_name': 'Subham raj', 'committer_email': None, 'commit_date': datetime.datetime(2018, 11, 17, 17, 45, 48, tzinfo=datetime.timezone.utc)}, {'commit_sha': '10f6267535daf3d2804848e3ba49e76eda91331d', 'committer_username': 'Shubhamr837', 'committer_name': 'Subham raj', 'committer_email': None, 'commit_date': datetime.datetime(2018, 11, 17, 17, 45, 48, tzinfo=datetime.timezone.utc)}, {'commit_sha': '1da37ece77e4db5cc9c34f61d46a8401912ddca5', 'committer_username': 'Shubhamr837', 'committer_name': 'Subham raj', 'committer_email': None, 'commit_date': datetime.datetime(2018, 11, 17, 17, 45, 48, tzinfo=datetime.timezone.utc)}, {'commit_sha': 'e977f003cfca96afa6d78e2d449e27f18393b919', 'committer_username': 'Shubhamr837', 'committer_name': 'Subham raj', 'committer_email': None, 'commit_date': datetime.datetime(2018, 11, 17, 17, 45, 48, tzinfo=datetime.timezone.utc)}, {'commit_sha': '6f50f2ca02707bf5feefa4106d99d9d5606d3051', 'committer_username': 'Shubhamr837', 'committer_name': 'Subham raj', 'committer_email': None, 'commit_date': datetime.datetime(2018, 11, 17, 17, 45, 48, tzinfo=datetime.timezone.utc)}, {'commit_sha': '01c50a738082cb9519e61747ef9105597c2219c9', 'committer_username': 'Shubhamr837', 'committer_name': 'Subham raj', 'committer_email': None, 'commit_date': datetime.datetime(2018, 11, 17, 17, 45, 48, tzinfo=datetime.timezone.utc)}, {'commit_sha': '746b4aadc58340d6d2ee3f8d011d9bd729ecd221', 'committer_username': 'Shubhamr837', 'committer_name': 'Subham raj', 'committer_email': None, 'commit_date': datetime.datetime(2018, 11, 17, 17, 45, 48, tzinfo=datetime.timezone.utc)}, {'commit_sha': '18d96c58c3763bb99414e31b72a7130bdc7c1e3b', 'committer_username': 'Shubhamr837', 'committer_name': 'Subham raj', 'committer_email': None, 'commit_date': datetime.datetime(2018, 11, 17, 17, 45, 48, tzinfo=datetime.timezone.utc)}, {'commit_sha': '618f93c3d06f036c29026f794c5baca4ef5cec50', 'committer_username': 'Shubhamr837', 'committer_name': 'Subham raj', 'committer_email': None, 'commit_date': datetime.datetime(2018, 11, 17, 17, 45, 48, tzinfo=datetime.timezone.utc)}, {'commit_sha': '46a461713f2947d38dfb2af67017da4b71f60890', 'committer_username': 'Shubhamr837', 'committer_name': 'Subham raj', 'committer_email': None, 'commit_date': datetime.datetime(2018, 11, 17, 17, 45, 48, tzinfo=datetime.timezone.utc)}, {'commit_sha': 'fc4f0b736dfa0b9b933fbe460a6ce66be6cd22e4', 'committer_username': 'Shubhamr837', 'committer_name': 'Subham raj', 'committer_email': None, 'commit_date': datetime.datetime(2018, 11, 17, 17, 45, 48, tzinfo=datetime.timezone.utc)}, {'commit_sha': '878f0b2cdacd944d0379e8a9a9c0f8d05fe5f3b6', 'committer_username': 'Shubhamr837', 'committer_name': 'Subham raj', 'committer_email': None, 'commit_date': datetime.datetime(2018, 11, 17, 17, 45, 48, tzinfo=datetime.timezone.utc)}, {'commit_sha': '17441bd7db2713398745206d6c54223a297e1fe8', 'committer_username': 'Shubhamr837', 'committer_name': 'Subham raj', 'committer_email': None, 'commit_date': datetime.datetime(2018, 11, 17, 17, 45, 48, tzinfo=datetime.timezone.utc)}, {'commit_sha': 'f5bb5ae6f33420465a0218741257433861d77d8d', 'committer_username': 'Shubhamr837', 'committer_name': 'Subham raj', 'committer_email': None, 'commit_date': datetime.datetime(2018, 11, 17, 17, 45, 48, tzinfo=datetime.timezone.utc)}, {'commit_sha': '196f0ccc77ad3db704f7d443573ecb8745216a86', 'committer_username': 'Shubhamr837', 'committer_name': 'Subham raj', 'committer_email': None, 'commit_date': datetime.datetime(2018, 11, 17, 17, 45, 48, tzinfo=datetime.timezone.utc)}, {'commit_sha': '5df556059bd17b8fa186591173d4b21a5dbce177', 'committer_username': 'Shubhamr837', 'committer_name': 'Subham raj', 'committer_email': None, 'commit_date': datetime.datetime(2018, 11, 17, 17, 45, 48, tzinfo=datetime.timezone.utc)}, {'commit_sha': 'c264b917b348795794683bfb367b007055797048', 'committer_username': 'Shubhamr837', 'committer_name': 'Subham raj', 'committer_email': None, 'commit_date': datetime.datetime(2018, 11, 17, 17, 45, 48, tzinfo=datetime.timezone.utc)}]",Subham raj,45128519,,User,,37,,42,48
711148065,Update suitcase-intro.rst,"Changed Instructions to download.
Added instructions to delete from CLI.
Added information about new tabs.
",True,138,https://api.github.com/repos/odk-x/docs/pulls/138,https://github.com/odk-x/docs/pull/138,closed,69,16,7,9,3,11,0,0,[],2021-08-12 15:44:35+00:00,2023-01-25 19:04:07+00:00,45890372.0,"531 days, 3:19:32","[{'comment_id': 689976092, 'comment_body': 'login and page can be lower case. ', 'comment_created': datetime.datetime(2021, 8, 17, 1, 57, 34, tzinfo=datetime.timezone.utc), 'commenter': 'elmps2018', 'type': 'User'}, {'comment_id': 689976973, 'comment_body': ""Is this the right link? It's the download_tab rather than the login file name. "", 'comment_created': datetime.datetime(2021, 8, 17, 1, 59, 44, tzinfo=datetime.timezone.utc), 'commenter': 'elmps2018', 'type': 'User'}, {'comment_id': 689977528, 'comment_body': ""Please add a screenshot of the logout button I couldn't see it in the screenshots. Also application can be lower case"", 'comment_created': datetime.datetime(2021, 8, 17, 2, 1, 21, tzinfo=datetime.timezone.utc), 'commenter': 'elmps2018', 'type': 'User'}, {'comment_id': 689977790, 'comment_body': 'suggest using table_id here and throughout (as in line 82)', 'comment_created': datetime.datetime(2021, 8, 17, 2, 2, 3, tzinfo=datetime.timezone.utc), 'commenter': 'elmps2018', 'type': 'User'}, {'comment_id': 689977930, 'comment_body': 'tables lower case table_ids with underscore. ', 'comment_created': datetime.datetime(2021, 8, 17, 2, 2, 28, tzinfo=datetime.timezone.utc), 'commenter': 'elmps2018', 'type': 'User'}, {'comment_id': 689978292, 'comment_body': 'This seems like it is now incorrect?', 'comment_created': datetime.datetime(2021, 8, 17, 2, 3, 46, tzinfo=datetime.timezone.utc), 'commenter': 'elmps2018', 'type': 'User'}, {'comment_id': 689978519, 'comment_body': '""Clicking it"" is a bit unclear folks might worry it is the clear tab. Suggest ""Clicking \'reset\'', 'comment_created': datetime.datetime(2021, 8, 17, 2, 4, 18, tzinfo=datetime.timezone.utc), 'commenter': 'elmps2018', 'type': 'User'}, {'comment_id': 689979603, 'comment_body': 'Also should reference clear png here. Make sure all pngs are embedded. ', 'comment_created': datetime.datetime(2021, 8, 17, 2, 6, 25, tzinfo=datetime.timezone.utc), 'commenter': 'elmps2018', 'type': 'User'}, {'comment_id': 689979814, 'comment_body': 'I think this should be clear not upload', 'comment_created': datetime.datetime(2021, 8, 17, 2, 6, 41, tzinfo=datetime.timezone.utc), 'commenter': 'elmps2018', 'type': 'User'}, {'comment_id': 689980451, 'comment_body': 'does this need the table name, e.g. -delete <table_id>', 'comment_created': datetime.datetime(2021, 8, 17, 2, 7, 27, tzinfo=datetime.timezone.utc), 'commenter': 'elmps2018', 'type': 'User'}, {'comment_id': 692279951, 'comment_body': ""I think this should have the same :guilabel:'Clear' formatting. Tab should be lower case. "", 'comment_created': datetime.datetime(2021, 8, 19, 16, 14, 36, tzinfo=datetime.timezone.utc), 'commenter': 'elmps2018', 'type': 'User'}]","[{'commit_sha': '2615f1b08309cfc9ea1fcfe7b70fdb8947798945', 'committer_username': 'Shubhamr837', 'committer_name': 'Subham raj', 'committer_email': None, 'commit_date': datetime.datetime(2018, 11, 17, 17, 45, 48, tzinfo=datetime.timezone.utc)}, {'commit_sha': 'bb57149f3cf2dfcba59a17d7a9ce63eb34823ba9', 'committer_username': 'Shubhamr837', 'committer_name': 'Subham raj', 'committer_email': None, 'commit_date': datetime.datetime(2018, 11, 17, 17, 45, 48, tzinfo=datetime.timezone.utc)}, {'commit_sha': '884cb1e108f90d78ae9c4d8df225f7993d02a829', 'committer_username': 'Shubhamr837', 'committer_name': 'Subham raj', 'committer_email': None, 'commit_date': datetime.datetime(2018, 11, 17, 17, 45, 48, tzinfo=datetime.timezone.utc)}, {'commit_sha': '40beaa07cb9fc06de3f2f16f28995a59c4ccb489', 'committer_username': 'Shubhamr837', 'committer_name': 'Subham raj', 'committer_email': None, 'commit_date': datetime.datetime(2018, 11, 17, 17, 45, 48, tzinfo=datetime.timezone.utc)}, {'commit_sha': '0bb7641de48a67a0f8328d94a9553be3bf705f1f', 'committer_username': 'Shubhamr837', 'committer_name': 'Subham raj', 'committer_email': None, 'commit_date': datetime.datetime(2018, 11, 17, 17, 45, 48, tzinfo=datetime.timezone.utc)}, {'commit_sha': '6733a8fe23c82c15d9f6691d022ad850e7cca5da', 'committer_username': 'Shubhamr837', 'committer_name': 'Subham raj', 'committer_email': None, 'commit_date': datetime.datetime(2018, 11, 17, 17, 45, 48, tzinfo=datetime.timezone.utc)}, {'commit_sha': '97fcb51a8be502956abb090e1df9f043986bbcd1', 'committer_username': 'Shubhamr837', 'committer_name': 'Subham raj', 'committer_email': None, 'commit_date': datetime.datetime(2018, 11, 17, 17, 45, 48, tzinfo=datetime.timezone.utc)}, {'commit_sha': 'cd68e4a2c619a3dab9d2be184e5c115cc1e42aec', 'committer_username': 'Shubhamr837', 'committer_name': 'Subham raj', 'committer_email': None, 'commit_date': datetime.datetime(2018, 11, 17, 17, 45, 48, tzinfo=datetime.timezone.utc)}, {'commit_sha': '29bd2b93c629d75f1574aac8ec214c9231fa3b0d', 'committer_username': 'Shubhamr837', 'committer_name': 'Subham raj', 'committer_email': None, 'commit_date': datetime.datetime(2018, 11, 17, 17, 45, 48, tzinfo=datetime.timezone.utc)}]",Subham raj,45128519,,User,,37,,42,48
684567172,Add html response as message to JsonException.,HTML is added as message to the thrown json exception for passing error message along with the exception.,True,47,https://api.github.com/repos/odk-x/sync-client/pulls/47,https://github.com/odk-x/sync-client/pull/47,closed,8,1,1,1,0,0,0,0,[],2021-07-06 17:49:29+00:00,2021-10-06 22:29:59+00:00,7965630.0,"92 days, 4:40:30",[],"[{'commit_sha': 'eb033ba6e8a9bbef1dd089fa8ebfe90d33cad5dd', 'committer_username': 'Shubhamr837', 'committer_name': 'Subham raj', 'committer_email': None, 'commit_date': datetime.datetime(2018, 11, 17, 17, 45, 48, tzinfo=datetime.timezone.utc)}]",Subham raj,45128519,,User,,37,,42,48
