pr_id,pr_title,pr_body,is_merged,pr_number,pr_url,pr_html_url,pr_state,additions,deletions,pr_changed_files,pr_commits_count,pr_comments_count,pr_review_comments_count,pr_labels_count,pr_assignees_count,pr_labels,pr_created_at,pr_closed_at,time_taken,time_delta,pr_review_comments,pr_commits,contributor,contributor_id,contributor_email,contributor_type,contributions,contributor_public_repos,contributor_private_repos,contributor_followings,contributor_followers
663277975,"Table id drop down, multiple table selection and new Tabs","whats included in this PR?
Changed the title of the application.
Added drop down for table id.
IoPanel variable in main panel is made accessible by a public method to add pull panel as a property change listener to login task.",True,62,https://api.github.com/repos/odk-x/suitcase/pulls/62,https://github.com/odk-x/suitcase/pull/62,closed,1500,398,32,87,11,34,0,0,[],2021-06-07 07:28:07+00:00,2021-10-13 22:17:38+00:00,11112571.0,"128 days, 14:49:31","[{'comment_id': 647116764, 'comment_body': 'Could you introduce a constant for this and put it in `SuitcaseConst`.', 'comment_created': datetime.datetime(2021, 6, 8, 5, 16, 14, tzinfo=datetime.timezone.utc), 'commenter': 'linl33', 'type': 'User'}, {'comment_id': 647117025, 'comment_body': 'Could be a local variable.', 'comment_created': datetime.datetime(2021, 6, 8, 5, 16, 57, tzinfo=datetime.timezone.utc), 'commenter': 'linl33', 'type': 'User'}, {'comment_id': 647117082, 'comment_body': 'Could be a local variable.', 'comment_created': datetime.datetime(2021, 6, 8, 5, 17, 6, tzinfo=datetime.timezone.utc), 'commenter': 'linl33', 'type': 'User'}, {'comment_id': 647117258, 'comment_body': '`gbc` is unused.', 'comment_created': datetime.datetime(2021, 6, 8, 5, 17, 37, tzinfo=datetime.timezone.utc), 'commenter': 'linl33', 'type': 'User'}, {'comment_id': 647117336, 'comment_body': 'This method could be private.', 'comment_created': datetime.datetime(2021, 6, 8, 5, 17, 52, tzinfo=datetime.timezone.utc), 'commenter': 'linl33', 'type': 'User'}, {'comment_id': 647117557, 'comment_body': '`JComboBox` should be `JComboBox<String>`', 'comment_created': datetime.datetime(2021, 6, 8, 5, 18, 30, tzinfo=datetime.timezone.utc), 'commenter': 'linl33', 'type': 'User'}, {'comment_id': 647119399, 'comment_body': 'Replace with diamond `ArrayList<>`', 'comment_created': datetime.datetime(2021, 6, 8, 5, 23, 44, tzinfo=datetime.timezone.utc), 'commenter': 'linl33', 'type': 'User'}, {'comment_id': 647119513, 'comment_body': 'Replace with diamond `DefaultComboBoxModel<>`', 'comment_created': datetime.datetime(2021, 6, 8, 5, 24, 2, tzinfo=datetime.timezone.utc), 'commenter': 'linl33', 'type': 'User'}, {'comment_id': 647120237, 'comment_body': 'Populating the model here is redundant. There is a `PropertyChangeListener` already.', 'comment_created': datetime.datetime(2021, 6, 8, 5, 26, 15, tzinfo=datetime.timezone.utc), 'commenter': 'linl33', 'type': 'User'}, {'comment_id': 647120678, 'comment_body': 'This could be static.', 'comment_created': datetime.datetime(2021, 6, 8, 5, 27, 23, tzinfo=datetime.timezone.utc), 'commenter': 'linl33', 'type': 'User'}, {'comment_id': 647120954, 'comment_body': '`{` should be on the method signature line.', 'comment_created': datetime.datetime(2021, 6, 8, 5, 27, 58, tzinfo=datetime.timezone.utc), 'commenter': 'linl33', 'type': 'User'}, {'comment_id': 647121279, 'comment_body': '`action` could be final.', 'comment_created': datetime.datetime(2021, 6, 8, 5, 28, 50, tzinfo=datetime.timezone.utc), 'commenter': 'linl33', 'type': 'User'}, {'comment_id': 647122311, 'comment_body': 'Separate the text from the command. For example, use `Add` for text and `ADD` for command. This maintains separation of UI and logic.', 'comment_created': datetime.datetime(2021, 6, 8, 5, 31, 31, tzinfo=datetime.timezone.utc), 'commenter': 'linl33', 'type': 'User'}, {'comment_id': 647122957, 'comment_body': 'This variable should be removed.', 'comment_created': datetime.datetime(2021, 6, 8, 5, 33, 11, tzinfo=datetime.timezone.utc), 'commenter': 'linl33', 'type': 'User'}, {'comment_id': 647123812, 'comment_body': 'The add table button should also be disabled.', 'comment_created': datetime.datetime(2021, 6, 8, 5, 35, 18, tzinfo=datetime.timezone.utc), 'commenter': 'linl33', 'type': 'User'}, {'comment_id': 649061252, 'comment_body': ""Please capitalize the variable name, e.g. `SUITCASE_TITLE`. It's much easier to identify constants when they have a consistent naming scheme."", 'comment_created': datetime.datetime(2021, 6, 10, 10, 34, 48, tzinfo=datetime.timezone.utc), 'commenter': 'linl33', 'type': 'User'}, {'comment_id': 649061965, 'comment_body': 'Remove this getter. Instantiate a new `AttachmentManager` for each table. The manager has states that should not be shared between tables.', 'comment_created': datetime.datetime(2021, 6, 10, 10, 35, 57, tzinfo=datetime.timezone.utc), 'commenter': 'linl33', 'type': 'User'}, {'comment_id': 649063511, 'comment_body': 'Generally interface types should be used to declare types, to keep things flexible. So use `List<String>` for `selectedTableIds` and `MutableComboBoxModel<String>` for `comboBoxModel`. You will need to replace `ArrayList` with `List` in a few other places where `selectedTableIds` is used as well.', 'comment_created': datetime.datetime(2021, 6, 10, 10, 38, 24, tzinfo=datetime.timezone.utc), 'commenter': 'linl33', 'type': 'User'}, {'comment_id': 649179365, 'comment_body': 'This listener is a bit difficult to read. Think about how to organize it better. Could you move the table removal logic into `SelectedTablesListPanel` like `addNewTableId`?', 'comment_created': datetime.datetime(2021, 6, 10, 13, 24, 18, tzinfo=datetime.timezone.utc), 'commenter': 'linl33', 'type': 'User'}, {'comment_id': 649347592, 'comment_body': ""Since the panel is inside a `JScrollPane` you shouldn't need to manually manage this panel's size."", 'comment_created': datetime.datetime(2021, 6, 10, 16, 32, 44, tzinfo=datetime.timezone.utc), 'commenter': 'linl33', 'type': 'User'}, {'comment_id': 649358411, 'comment_body': 'Is there a reason the set returned by `getAllTableId` needs to converted to an array? Is it just a defensive copy?', 'comment_created': datetime.datetime(2021, 6, 10, 16, 47, 49, tzinfo=datetime.timezone.utc), 'commenter': 'linl33', 'type': 'User'}, {'comment_id': 649358915, 'comment_body': 'call super', 'comment_created': datetime.datetime(2021, 6, 10, 16, 48, 31, tzinfo=datetime.timezone.utc), 'commenter': 'linl33', 'type': 'User'}, {'comment_id': 649359164, 'comment_body': 'Could be a local variable', 'comment_created': datetime.datetime(2021, 6, 10, 16, 48, 50, tzinfo=datetime.timezone.utc), 'commenter': 'linl33', 'type': 'User'}, {'comment_id': 649359865, 'comment_body': 'You can use a singleton list.', 'comment_created': datetime.datetime(2021, 6, 10, 16, 49, 42, tzinfo=datetime.timezone.utc), 'commenter': 'linl33', 'type': 'User'}, {'comment_id': 649361569, 'comment_body': 'This error message should include the table ID. Even though this should only happen for the CLI it is good to have the error message.', 'comment_created': datetime.datetime(2021, 6, 10, 16, 52, 6, tzinfo=datetime.timezone.utc), 'commenter': 'linl33', 'type': 'User'}, {'comment_id': 650625998, 'comment_body': 'Unused import', 'comment_created': datetime.datetime(2021, 6, 14, 3, 4, 11, tzinfo=datetime.timezone.utc), 'commenter': 'linl33', 'type': 'User'}, {'comment_id': 650627707, 'comment_body': 'The remove buttons should also be disabled.', 'comment_created': datetime.datetime(2021, 6, 14, 3, 12, 23, tzinfo=datetime.timezone.utc), 'commenter': 'linl33', 'type': 'User'}, {'comment_id': 650628698, 'comment_body': 'These 2 constants are actually in `ScrollPaneConstans`, which `JscrollPane` implements, reference the interface instead.', 'comment_created': datetime.datetime(2021, 6, 14, 3, 17, 32, tzinfo=datetime.timezone.utc), 'commenter': 'linl33', 'type': 'User'}, {'comment_id': 650628906, 'comment_body': 'Extract a variable/constant for the dimension.', 'comment_created': datetime.datetime(2021, 6, 14, 3, 18, 43, tzinfo=datetime.timezone.utc), 'commenter': 'linl33', 'type': 'User'}, {'comment_id': 650629733, 'comment_body': 'Introduce a constant so that the add and remove buttons are the same size.', 'comment_created': datetime.datetime(2021, 6, 14, 3, 22, 53, tzinfo=datetime.timezone.utc), 'commenter': 'linl33', 'type': 'User'}, {'comment_id': 652001962, 'comment_body': 'I have now created a new SelectedTableIdListItem for list items to disable remove buttons. Every new instance would now require this.', 'comment_created': datetime.datetime(2021, 6, 15, 17, 26, 48, tzinfo=datetime.timezone.utc), 'commenter': 'Shubhamr837', 'type': 'User'}, {'comment_id': 652002201, 'comment_body': 'I was confused initially about implementing the combobox thats why I implemented this method. I have removed this whole method now and all table ids will be fetched straight from cloudEndpointInfo as a set.', 'comment_created': datetime.datetime(2021, 6, 15, 17, 27, 7, tzinfo=datetime.timezone.utc), 'commenter': 'Shubhamr837', 'type': 'User'}, {'comment_id': 652004094, 'comment_body': ""I tried it before but I don't know why the panel wasn't increasing its size vertically. I tried FlowLayout.CENTER and FlowLayout.LEADING  also but its size was always increasing horizontally. On setting a size in the constructor its was adding elements to the new row but still its height was not changing once elements begun to overflow vertically. Thats why I implemented this method. If I find any alternative layout with a more simple implementation I would change it."", 'comment_created': datetime.datetime(2021, 6, 15, 17, 28, 30, tzinfo=datetime.timezone.utc), 'commenter': 'Shubhamr837', 'type': 'User'}, {'comment_id': 652005243, 'comment_body': 'I have added methods in both PullPanel and SelectedTablesListPanel to resolve this.', 'comment_created': datetime.datetime(2021, 6, 15, 17, 29, 18, tzinfo=datetime.timezone.utc), 'commenter': 'Shubhamr837', 'type': 'User'}]","[{'commit_sha': 'ef969494bf97478ec5ab0480281e35dc551050e8', 'committer_username': 'Shubhamr837', 'committer_name': 'Subham raj', 'committer_email': None, 'commit_date': datetime.datetime(2018, 11, 17, 17, 45, 48, tzinfo=datetime.timezone.utc)}, {'commit_sha': '887c74595c3671323788ac8101b9b79f1fafff03', 'committer_username': 'Shubhamr837', 'committer_name': 'Subham raj', 'committer_email': None, 'commit_date': datetime.datetime(2018, 11, 17, 17, 45, 48, tzinfo=datetime.timezone.utc)}, {'commit_sha': '4ebc2aad2c0cc076c4507eb4d8cc9edddfb7a8a2', 'committer_username': 'Shubhamr837', 'committer_name': 'Subham raj', 'committer_email': None, 'commit_date': datetime.datetime(2018, 11, 17, 17, 45, 48, tzinfo=datetime.timezone.utc)}, {'commit_sha': 'dfeafa9347790f82c5ae1890abaf7cf28ebe6e9b', 'committer_username': 'Shubhamr837', 'committer_name': 'Subham raj', 'committer_email': None, 'commit_date': datetime.datetime(2018, 11, 17, 17, 45, 48, tzinfo=datetime.timezone.utc)}, {'commit_sha': 'f587502c353f04c55cd9919d7bb7bc15e8d50829', 'committer_username': 'Shubhamr837', 'committer_name': 'Subham raj', 'committer_email': None, 'commit_date': datetime.datetime(2018, 11, 17, 17, 45, 48, tzinfo=datetime.timezone.utc)}, {'commit_sha': '82009208d0c5b2b8bdd01a9be3421b3d7c3038bd', 'committer_username': 'Shubhamr837', 'committer_name': 'Subham raj', 'committer_email': None, 'commit_date': datetime.datetime(2018, 11, 17, 17, 45, 48, tzinfo=datetime.timezone.utc)}, {'commit_sha': 'abced84ed7c53923ab161e0e244d75abca4175bb', 'committer_username': 'Shubhamr837', 'committer_name': 'Subham raj', 'committer_email': None, 'commit_date': datetime.datetime(2018, 11, 17, 17, 45, 48, tzinfo=datetime.timezone.utc)}, {'commit_sha': '68dbec05341f78d4e78b7014d402938d77d16e17', 'committer_username': 'Shubhamr837', 'committer_name': 'Subham raj', 'committer_email': None, 'commit_date': datetime.datetime(2018, 11, 17, 17, 45, 48, tzinfo=datetime.timezone.utc)}, {'commit_sha': '55707d6cd20ec0399339a8dc67a7ecea255b0164', 'committer_username': 'Shubhamr837', 'committer_name': 'Subham raj', 'committer_email': None, 'commit_date': datetime.datetime(2018, 11, 17, 17, 45, 48, tzinfo=datetime.timezone.utc)}, {'commit_sha': '4d097af869d85a981d9c69fdff8d8d3662283095', 'committer_username': 'Shubhamr837', 'committer_name': 'Subham raj', 'committer_email': None, 'commit_date': datetime.datetime(2018, 11, 17, 17, 45, 48, tzinfo=datetime.timezone.utc)}, {'commit_sha': '244f19b34513e76f2dc679239571a671d26e5740', 'committer_username': 'Shubhamr837', 'committer_name': 'Subham raj', 'committer_email': None, 'commit_date': datetime.datetime(2018, 11, 17, 17, 45, 48, tzinfo=datetime.timezone.utc)}, {'commit_sha': '07d961d10076e981f57aa034d435a990893110e8', 'committer_username': 'Shubhamr837', 'committer_name': 'Subham raj', 'committer_email': None, 'commit_date': datetime.datetime(2018, 11, 17, 17, 45, 48, tzinfo=datetime.timezone.utc)}, {'commit_sha': '2e6329b7ddbb542409074571b6d56fba3b6f292d', 'committer_username': 'Shubhamr837', 'committer_name': 'Subham raj', 'committer_email': None, 'commit_date': datetime.datetime(2018, 11, 17, 17, 45, 48, tzinfo=datetime.timezone.utc)}, {'commit_sha': '4d8d8e34ecc8032d0b16de81c8218353087c39eb', 'committer_username': 'Shubhamr837', 'committer_name': 'Subham raj', 'committer_email': None, 'commit_date': datetime.datetime(2018, 11, 17, 17, 45, 48, tzinfo=datetime.timezone.utc)}, {'commit_sha': '8f22fbb77ee472c8b094a9e33397783e44789ff4', 'committer_username': 'Shubhamr837', 'committer_name': 'Subham raj', 'committer_email': None, 'commit_date': datetime.datetime(2018, 11, 17, 17, 45, 48, tzinfo=datetime.timezone.utc)}, {'commit_sha': '19d4ff7513f22ae113ab32b8d9e85f10bc91b929', 'committer_username': 'Shubhamr837', 'committer_name': 'Subham raj', 'committer_email': None, 'commit_date': datetime.datetime(2018, 11, 17, 17, 45, 48, tzinfo=datetime.timezone.utc)}, {'commit_sha': '934874782f6f5689b3dbdb1f6c05302227f890f2', 'committer_username': 'Shubhamr837', 'committer_name': 'Subham raj', 'committer_email': None, 'commit_date': datetime.datetime(2018, 11, 17, 17, 45, 48, tzinfo=datetime.timezone.utc)}, {'commit_sha': '2f8ed6344c9d3a79d977159c11ed25d0821ce14a', 'committer_username': 'Shubhamr837', 'committer_name': 'Subham raj', 'committer_email': None, 'commit_date': datetime.datetime(2018, 11, 17, 17, 45, 48, tzinfo=datetime.timezone.utc)}, {'commit_sha': '04208a6b7a4d16f56f9c022130d8848c327d1aa1', 'committer_username': 'Shubhamr837', 'committer_name': 'Subham raj', 'committer_email': None, 'commit_date': datetime.datetime(2018, 11, 17, 17, 45, 48, tzinfo=datetime.timezone.utc)}, {'commit_sha': '34b7fa546a9849ac7ae41459a1cf6d5ca096f6ef', 'committer_username': 'Shubhamr837', 'committer_name': 'Subham raj', 'committer_email': None, 'commit_date': datetime.datetime(2018, 11, 17, 17, 45, 48, tzinfo=datetime.timezone.utc)}, {'commit_sha': '5875041d929d206a85b5be954c47ac9cacf913a6', 'committer_username': 'Shubhamr837', 'committer_name': 'Subham raj', 'committer_email': None, 'commit_date': datetime.datetime(2018, 11, 17, 17, 45, 48, tzinfo=datetime.timezone.utc)}, {'commit_sha': 'b41e2b04678c727d8c445e700a6821f7c94320c6', 'committer_username': 'Shubhamr837', 'committer_name': 'Subham raj', 'committer_email': None, 'commit_date': datetime.datetime(2018, 11, 17, 17, 45, 48, tzinfo=datetime.timezone.utc)}, {'commit_sha': 'ca1c7c091f3d4b02b9d838578562fe838a13ff1d', 'committer_username': 'Shubhamr837', 'committer_name': 'Subham raj', 'committer_email': None, 'commit_date': datetime.datetime(2018, 11, 17, 17, 45, 48, tzinfo=datetime.timezone.utc)}, {'commit_sha': '4ef99d8002753f397ae84fba886d6a74bfaddf88', 'committer_username': 'Shubhamr837', 'committer_name': 'Subham raj', 'committer_email': None, 'commit_date': datetime.datetime(2018, 11, 17, 17, 45, 48, tzinfo=datetime.timezone.utc)}, {'commit_sha': '6e09a20ea81b3ee526bb136a2efc86bec1df4c0c', 'committer_username': 'Shubhamr837', 'committer_name': 'Subham raj', 'committer_email': None, 'commit_date': datetime.datetime(2018, 11, 17, 17, 45, 48, tzinfo=datetime.timezone.utc)}, {'commit_sha': 'c1f9b0f45573571b62d939e3ce06426efba5060e', 'committer_username': 'Shubhamr837', 'committer_name': 'Subham raj', 'committer_email': None, 'commit_date': datetime.datetime(2018, 11, 17, 17, 45, 48, tzinfo=datetime.timezone.utc)}, {'commit_sha': '14af40b4ea9225b7c7851641b4ce38aca2332b74', 'committer_username': 'Shubhamr837', 'committer_name': 'Subham raj', 'committer_email': None, 'commit_date': datetime.datetime(2018, 11, 17, 17, 45, 48, tzinfo=datetime.timezone.utc)}, {'commit_sha': 'ed0944650a7dfea44bba8078cd48628c6edfe363', 'committer_username': 'Shubhamr837', 'committer_name': 'Subham raj', 'committer_email': None, 'commit_date': datetime.datetime(2018, 11, 17, 17, 45, 48, tzinfo=datetime.timezone.utc)}, {'commit_sha': '7f56f07dd3c4f581247f26eb38f1db90b02ed575', 'committer_username': 'Shubhamr837', 'committer_name': 'Subham raj', 'committer_email': None, 'commit_date': datetime.datetime(2018, 11, 17, 17, 45, 48, tzinfo=datetime.timezone.utc)}, {'commit_sha': 'f25c7fdc22c354a9421331cc7d7989d76ca9404d', 'committer_username': 'Shubhamr837', 'committer_name': 'Subham raj', 'committer_email': None, 'commit_date': datetime.datetime(2018, 11, 17, 17, 45, 48, tzinfo=datetime.timezone.utc)}, {'commit_sha': '9089ef246dc8cc1f0083d9bbc19aeb047cab9499', 'committer_username': 'Shubhamr837', 'committer_name': 'Subham raj', 'committer_email': None, 'commit_date': datetime.datetime(2018, 11, 17, 17, 45, 48, tzinfo=datetime.timezone.utc)}, {'commit_sha': '6350ab6acd752206d7a907400ebdaab5d0822f84', 'committer_username': 'Shubhamr837', 'committer_name': 'Subham raj', 'committer_email': None, 'commit_date': datetime.datetime(2018, 11, 17, 17, 45, 48, tzinfo=datetime.timezone.utc)}, {'commit_sha': '4e2bbf978201caf44df2c416660b67e2eb14f3ab', 'committer_username': 'Shubhamr837', 'committer_name': 'Subham raj', 'committer_email': None, 'commit_date': datetime.datetime(2018, 11, 17, 17, 45, 48, tzinfo=datetime.timezone.utc)}, {'commit_sha': '48a5b3b0991a6270d96bf6a3d745350136fb19d6', 'committer_username': 'Shubhamr837', 'committer_name': 'Subham raj', 'committer_email': None, 'commit_date': datetime.datetime(2018, 11, 17, 17, 45, 48, tzinfo=datetime.timezone.utc)}, {'commit_sha': 'ee721a916391b1193b0ba22cb0aa6c5365409b07', 'committer_username': 'Shubhamr837', 'committer_name': 'Subham raj', 'committer_email': None, 'commit_date': datetime.datetime(2018, 11, 17, 17, 45, 48, tzinfo=datetime.timezone.utc)}, {'commit_sha': '6f04a70fba35c171bffc77984034903cef92b11e', 'committer_username': 'Shubhamr837', 'committer_name': 'Subham raj', 'committer_email': None, 'commit_date': datetime.datetime(2018, 11, 17, 17, 45, 48, tzinfo=datetime.timezone.utc)}, {'commit_sha': 'a3f45151bd8a97b305f82b85c58c767530f3d589', 'committer_username': 'Shubhamr837', 'committer_name': 'Subham raj', 'committer_email': None, 'commit_date': datetime.datetime(2018, 11, 17, 17, 45, 48, tzinfo=datetime.timezone.utc)}, {'commit_sha': '996f0d55be3f4d1c46ed6c69218bf6d5d6f4dcff', 'committer_username': 'Shubhamr837', 'committer_name': 'Subham raj', 'committer_email': None, 'commit_date': datetime.datetime(2018, 11, 17, 17, 45, 48, tzinfo=datetime.timezone.utc)}, {'commit_sha': '7047c5bdd219742f08d866e7c188f0758433e80c', 'committer_username': 'Shubhamr837', 'committer_name': 'Subham raj', 'committer_email': None, 'commit_date': datetime.datetime(2018, 11, 17, 17, 45, 48, tzinfo=datetime.timezone.utc)}, {'commit_sha': '9091b175a3fa3be403d8bcdb392b48b404b1c000', 'committer_username': 'Shubhamr837', 'committer_name': 'Subham raj', 'committer_email': None, 'commit_date': datetime.datetime(2018, 11, 17, 17, 45, 48, tzinfo=datetime.timezone.utc)}, {'commit_sha': 'c2461b8b74378d34cb189e5f1208eecf47df9188', 'committer_username': 'Shubhamr837', 'committer_name': 'Subham raj', 'committer_email': None, 'commit_date': datetime.datetime(2018, 11, 17, 17, 45, 48, tzinfo=datetime.timezone.utc)}, {'commit_sha': '79258a1ed59edebb36fcdab60ff6bcbdb7e9afd5', 'committer_username': 'Shubhamr837', 'committer_name': 'Subham raj', 'committer_email': None, 'commit_date': datetime.datetime(2018, 11, 17, 17, 45, 48, tzinfo=datetime.timezone.utc)}, {'commit_sha': 'ddba6ed834b9fb795a8a34a261512403ea98160d', 'committer_username': 'Shubhamr837', 'committer_name': 'Subham raj', 'committer_email': None, 'commit_date': datetime.datetime(2018, 11, 17, 17, 45, 48, tzinfo=datetime.timezone.utc)}, {'commit_sha': '582a736844d605708ff2a6dd520beac91578dc62', 'committer_username': 'Shubhamr837', 'committer_name': 'Subham raj', 'committer_email': None, 'commit_date': datetime.datetime(2018, 11, 17, 17, 45, 48, tzinfo=datetime.timezone.utc)}, {'commit_sha': 'fee333bf625b61593e8c95bae67ab01de8595534', 'committer_username': 'Shubhamr837', 'committer_name': 'Subham raj', 'committer_email': None, 'commit_date': datetime.datetime(2018, 11, 17, 17, 45, 48, tzinfo=datetime.timezone.utc)}, {'commit_sha': '22745e33da57b9084638d41a944a32a854e09626', 'committer_username': 'Shubhamr837', 'committer_name': 'Subham raj', 'committer_email': None, 'commit_date': datetime.datetime(2018, 11, 17, 17, 45, 48, tzinfo=datetime.timezone.utc)}, {'commit_sha': '9571b89bab1f4d7ed0a1044f399b487a99f256e3', 'committer_username': 'Shubhamr837', 'committer_name': 'Subham raj', 'committer_email': None, 'commit_date': datetime.datetime(2018, 11, 17, 17, 45, 48, tzinfo=datetime.timezone.utc)}, {'commit_sha': '436cfca9be99904ffc8d61ee59760c4a0163aed5', 'committer_username': 'Shubhamr837', 'committer_name': 'Subham raj', 'committer_email': None, 'commit_date': datetime.datetime(2018, 11, 17, 17, 45, 48, tzinfo=datetime.timezone.utc)}, {'commit_sha': 'a5e25ead14c0c0f3804a46e30f0f7c584a13b025', 'committer_username': 'Shubhamr837', 'committer_name': 'Subham raj', 'committer_email': None, 'commit_date': datetime.datetime(2018, 11, 17, 17, 45, 48, tzinfo=datetime.timezone.utc)}, {'commit_sha': '291a9cf6427a46aee9188dfa4b58e3827e9a37ae', 'committer_username': 'Shubhamr837', 'committer_name': 'Subham raj', 'committer_email': None, 'commit_date': datetime.datetime(2018, 11, 17, 17, 45, 48, tzinfo=datetime.timezone.utc)}, {'commit_sha': 'd10a934306961031f88cd3d4cdf179bce9ce49e4', 'committer_username': 'Shubhamr837', 'committer_name': 'Subham raj', 'committer_email': None, 'commit_date': datetime.datetime(2018, 11, 17, 17, 45, 48, tzinfo=datetime.timezone.utc)}, {'commit_sha': '33e1c24348e56d3cf05992df17bd6e5caad90f4b', 'committer_username': 'Shubhamr837', 'committer_name': 'Subham raj', 'committer_email': None, 'commit_date': datetime.datetime(2018, 11, 17, 17, 45, 48, tzinfo=datetime.timezone.utc)}, {'commit_sha': 'b0246cc868f10a021045870875c10d84eb2bb685', 'committer_username': 'Shubhamr837', 'committer_name': 'Subham raj', 'committer_email': None, 'commit_date': datetime.datetime(2018, 11, 17, 17, 45, 48, tzinfo=datetime.timezone.utc)}, {'commit_sha': '5c1aa19d82611be207f4bc91aa0d6d3921f43656', 'committer_username': 'Shubhamr837', 'committer_name': 'Subham raj', 'committer_email': None, 'commit_date': datetime.datetime(2018, 11, 17, 17, 45, 48, tzinfo=datetime.timezone.utc)}, {'commit_sha': '2243b36c6269dd9b5b6abaec78e2ad64aa6acf1e', 'committer_username': 'Shubhamr837', 'committer_name': 'Subham raj', 'committer_email': None, 'commit_date': datetime.datetime(2018, 11, 17, 17, 45, 48, tzinfo=datetime.timezone.utc)}, {'commit_sha': '2fd045195506711157a16fbe8b20d6a68496ec66', 'committer_username': 'Shubhamr837', 'committer_name': 'Subham raj', 'committer_email': None, 'commit_date': datetime.datetime(2018, 11, 17, 17, 45, 48, tzinfo=datetime.timezone.utc)}, {'commit_sha': '723b855ae03f7beab3def11b3248ecd8f045ba43', 'committer_username': 'Shubhamr837', 'committer_name': 'Subham raj', 'committer_email': None, 'commit_date': datetime.datetime(2018, 11, 17, 17, 45, 48, tzinfo=datetime.timezone.utc)}, {'commit_sha': 'd8556617224b003228255a0e69968fc3eda62415', 'committer_username': 'Shubhamr837', 'committer_name': 'Subham raj', 'committer_email': None, 'commit_date': datetime.datetime(2018, 11, 17, 17, 45, 48, tzinfo=datetime.timezone.utc)}, {'commit_sha': '49fb4555b8098530a499e0d14ae303f8d2813e41', 'committer_username': 'Shubhamr837', 'committer_name': 'Subham raj', 'committer_email': None, 'commit_date': datetime.datetime(2018, 11, 17, 17, 45, 48, tzinfo=datetime.timezone.utc)}, {'commit_sha': '471f4d3178db3c6e2a888e1c0decce5f2a1b1408', 'committer_username': 'Shubhamr837', 'committer_name': 'Subham raj', 'committer_email': None, 'commit_date': datetime.datetime(2018, 11, 17, 17, 45, 48, tzinfo=datetime.timezone.utc)}, {'commit_sha': 'ec3f00d4d132e6e1f65c083634cf4b9fad050ce0', 'committer_username': 'Shubhamr837', 'committer_name': 'Subham raj', 'committer_email': None, 'commit_date': datetime.datetime(2018, 11, 17, 17, 45, 48, tzinfo=datetime.timezone.utc)}, {'commit_sha': '2539c923b5b57ac1219e125c91e10382d5c7c08a', 'committer_username': 'Shubhamr837', 'committer_name': 'Subham raj', 'committer_email': None, 'commit_date': datetime.datetime(2018, 11, 17, 17, 45, 48, tzinfo=datetime.timezone.utc)}, {'commit_sha': 'cec43a09b909760df591602b7d9a08f5bb968984', 'committer_username': 'Shubhamr837', 'committer_name': 'Subham raj', 'committer_email': None, 'commit_date': datetime.datetime(2018, 11, 17, 17, 45, 48, tzinfo=datetime.timezone.utc)}, {'commit_sha': '451cf90dd423c0ceeebe4162c15ea55111b71e43', 'committer_username': 'Shubhamr837', 'committer_name': 'Subham raj', 'committer_email': None, 'commit_date': datetime.datetime(2018, 11, 17, 17, 45, 48, tzinfo=datetime.timezone.utc)}, {'commit_sha': '43cd49228162c6d405aee9bc0b5da185f5370b92', 'committer_username': 'Shubhamr837', 'committer_name': 'Subham raj', 'committer_email': None, 'commit_date': datetime.datetime(2018, 11, 17, 17, 45, 48, tzinfo=datetime.timezone.utc)}, {'commit_sha': 'da473180c1fa857fe6d23d7d06e073ebc22418aa', 'committer_username': 'Shubhamr837', 'committer_name': 'Subham raj', 'committer_email': None, 'commit_date': datetime.datetime(2018, 11, 17, 17, 45, 48, tzinfo=datetime.timezone.utc)}, {'commit_sha': 'c08adb7774396afd2d9c6fc86540ece989e40575', 'committer_username': 'Shubhamr837', 'committer_name': 'Subham raj', 'committer_email': None, 'commit_date': datetime.datetime(2018, 11, 17, 17, 45, 48, tzinfo=datetime.timezone.utc)}, {'commit_sha': '10eaad11f4077a63677f71508f72f93aef8cbd25', 'committer_username': 'Shubhamr837', 'committer_name': 'Subham raj', 'committer_email': None, 'commit_date': datetime.datetime(2018, 11, 17, 17, 45, 48, tzinfo=datetime.timezone.utc)}, {'commit_sha': '40acc7af8d67038f87a788e350fc39fcd9763a1d', 'committer_username': 'Shubhamr837', 'committer_name': 'Subham raj', 'committer_email': None, 'commit_date': datetime.datetime(2018, 11, 17, 17, 45, 48, tzinfo=datetime.timezone.utc)}, {'commit_sha': '9e60aa115315e48b57a192ce684f40a1d26af62f', 'committer_username': 'Shubhamr837', 'committer_name': 'Subham raj', 'committer_email': None, 'commit_date': datetime.datetime(2018, 11, 17, 17, 45, 48, tzinfo=datetime.timezone.utc)}, {'commit_sha': 'b78707646b7df7145f334f8dbd031287c5df0818', 'committer_username': 'Shubhamr837', 'committer_name': 'Subham raj', 'committer_email': None, 'commit_date': datetime.datetime(2018, 11, 17, 17, 45, 48, tzinfo=datetime.timezone.utc)}, {'commit_sha': 'a8eb3ff2edab093dedbb1b58b43bbf0e65581bc6', 'committer_username': 'Shubhamr837', 'committer_name': 'Subham raj', 'committer_email': None, 'commit_date': datetime.datetime(2018, 11, 17, 17, 45, 48, tzinfo=datetime.timezone.utc)}, {'commit_sha': '32d88277834ee3263e04ad92d4cf9f69775cc124', 'committer_username': 'Shubhamr837', 'committer_name': 'Subham raj', 'committer_email': None, 'commit_date': datetime.datetime(2018, 11, 17, 17, 45, 48, tzinfo=datetime.timezone.utc)}, {'commit_sha': 'ab1d767081568a43a136891a8cde51512f300ceb', 'committer_username': 'Shubhamr837', 'committer_name': 'Subham raj', 'committer_email': None, 'commit_date': datetime.datetime(2018, 11, 17, 17, 45, 48, tzinfo=datetime.timezone.utc)}, {'commit_sha': '3eabd8e9ddfc2f8119ff1b30cf4f01d1b3bb47c4', 'committer_username': 'Shubhamr837', 'committer_name': 'Subham raj', 'committer_email': None, 'commit_date': datetime.datetime(2018, 11, 17, 17, 45, 48, tzinfo=datetime.timezone.utc)}, {'commit_sha': '882efe146ea9ff59dc914213ac0d4b78c06d29d8', 'committer_username': 'Shubhamr837', 'committer_name': 'Subham raj', 'committer_email': None, 'commit_date': datetime.datetime(2018, 11, 17, 17, 45, 48, tzinfo=datetime.timezone.utc)}, {'commit_sha': 'b8e8e2fda934e10af8e06a96df96fd60618e0a49', 'committer_username': 'Shubhamr837', 'committer_name': 'Subham raj', 'committer_email': None, 'commit_date': datetime.datetime(2018, 11, 17, 17, 45, 48, tzinfo=datetime.timezone.utc)}, {'commit_sha': '91224c5cb78fced2b1f566396f5f32f4ad163878', 'committer_username': 'Shubhamr837', 'committer_name': 'Subham raj', 'committer_email': None, 'commit_date': datetime.datetime(2018, 11, 17, 17, 45, 48, tzinfo=datetime.timezone.utc)}, {'commit_sha': '94a04318f171fb9a029df32f0c9e17e305f9043c', 'committer_username': 'Shubhamr837', 'committer_name': 'Subham raj', 'committer_email': None, 'commit_date': datetime.datetime(2018, 11, 17, 17, 45, 48, tzinfo=datetime.timezone.utc)}, {'commit_sha': '9e8839d7ecbb306c35cf58e4c2fd1a281df94584', 'committer_username': 'Shubhamr837', 'committer_name': 'Subham raj', 'committer_email': None, 'commit_date': datetime.datetime(2018, 11, 17, 17, 45, 48, tzinfo=datetime.timezone.utc)}, {'commit_sha': '614d6ad334fc5e4bbd690639f0209b1d7a700450', 'committer_username': 'Shubhamr837', 'committer_name': 'Subham raj', 'committer_email': None, 'commit_date': datetime.datetime(2018, 11, 17, 17, 45, 48, tzinfo=datetime.timezone.utc)}, {'commit_sha': 'b91a7b4387c465c779aac97b60c6906003f0f23c', 'committer_username': 'Shubhamr837', 'committer_name': 'Subham raj', 'committer_email': None, 'commit_date': datetime.datetime(2018, 11, 17, 17, 45, 48, tzinfo=datetime.timezone.utc)}, {'commit_sha': '557793c69a009fd3b82ab19dae0f5c9673a43f28', 'committer_username': 'Shubhamr837', 'committer_name': 'Subham raj', 'committer_email': None, 'commit_date': datetime.datetime(2018, 11, 17, 17, 45, 48, tzinfo=datetime.timezone.utc)}, {'commit_sha': 'bf679ae3ef5e337dee59ce153692d9608744a8b6', 'committer_username': 'Shubhamr837', 'committer_name': 'Subham raj', 'committer_email': None, 'commit_date': datetime.datetime(2018, 11, 17, 17, 45, 48, tzinfo=datetime.timezone.utc)}, {'commit_sha': '55b00d864432c32510c782cfceeba0cbdae0777e', 'committer_username': 'adi9835', 'committer_name': None, 'committer_email': None, 'commit_date': datetime.datetime(2020, 3, 25, 18, 58, 49, tzinfo=datetime.timezone.utc)}, {'commit_sha': 'bee35bfbfda816ffd7af72b31511dd0fcfc49b3d', 'committer_username': 'Shubhamr837', 'committer_name': 'Subham raj', 'committer_email': None, 'commit_date': datetime.datetime(2018, 11, 17, 17, 45, 48, tzinfo=datetime.timezone.utc)}, {'commit_sha': '682a2d0f37f58da7707fba8f175272dd5cb70771', 'committer_username': 'Shubhamr837', 'committer_name': 'Subham raj', 'committer_email': None, 'commit_date': datetime.datetime(2018, 11, 17, 17, 45, 48, tzinfo=datetime.timezone.utc)}]",Subham raj,45128519,,User,,37,,42,48
