Id,Title,Description,Contributor,Mentor,Organization,Archive,Github
1, Proposal for Auto-tune RocksDB ,Using machine learning method to tune database configurations automatically, Yuanli Wang , Mentor  Wu , Organization  Cloud Native Computing Foundation (CNCF) ,/archive/2019/projects/4737753357484032,https://github.com/pentium3/AutoTiKV
2, Deep learning based super-resolution algorithms based on OpenCV DNN ,Super Resolution is a subset of algorithms that aim to up-sample a lower quality image to a higher quality one. It’s goal is to create an up-sampled..., Fanny Monori , Mentor  Vladimir Tyan , Organization  OpenCV ,/archive/2019/projects/4738499608051712,https://gist.github.com/fannymonori/9d012e43b90e51666070b7a8a0454a5b
3, Improve back-end test coverage and upgrade it to support Python 3 ,"This project aims to improve backend test coverage to 100%, and then migrate the backend codebase to be simultaneously compatible with both Python 2...", Rishav Chakraborty , Mentor  brianrodri , Organization  Oppia Foundation ,/archive/2019/projects/4745751324786688,https://medium.com/@reshav01/google-summer-of-code-19-with-oppia-a4d4318b1808
4, Thesis Management System ,"I propose the development of a web application that will support the whole lifecycle of a thesis creation, namely, a Thesis Management System(TMS)...", Michail Chatzianastasis ," Mentor  Georgia Kapitsaki, Theodoros Karounos, Iraklis Varlamis ", Organization  Open Technologies Aliance - GFOSS ,/archive/2019/projects/4751403031986176,https://gist.github.com/MichailChatzianastasis/1768fcfcc72ad735bc42ab8456fd16d0
5, Interesting Female Teenagers in Coding Through the Use of a Well-designed Serious Game ,This game will encourage female teenagers to develop their own games in the Catrobat app. As a tutorial game it is the gateway to Catrobat and its..., Naomi Pfaff ," Mentor  Bernadette Spieler, Vesna Krnjic ", Organization  Catrobat ,/archive/2019/projects/4751654488899584,https://github.com/Catrobat/LunaAndCatTutorialGame
6, qaul.net HTTP API ,Regarding the development of an API for the qaul.net rewrite along with a configuration and message management system., Jess Rogers ," Mentor  Katharina Fey, Mathias Jud ", Organization  freifunk ,/archive/2019/projects/4752125056253952,https://blog.freifunk.net/2019/08/26/qaul-net-a-framework-a-service-a-plan/
7, Running FindSim experiments on cloud servers ,The project is about implementing the computing extensive FindSim program on a cloud server and building communication between the web server and the..., Hou Chen , Mentor  Surbhit Wagle , Organization  INCF ,/archive/2019/projects/4752794014187520,https://github.com/surbhit21/GSoC-2019
8, Improve the pdftoraster filter ,"Currently, pdftoraster uses the Poppler libraries which are unstable and change their function definition after updates due to which there are...", Tanmay Anand , Mentor  Sahil Arora , Organization  The Linux Foundation ,/archive/2019/projects/4755926370746368,https://github.com/tanmayanand44/cups-filters-gsoc19/wiki/Google-Summer-of-Code-2019-%7C-The-Linux-Foundation-%7C-Improving-pdftoraster-filter-to-use-stable-Poppler-APIs
9, Edge Animations for Large-Scale Network Graphs ,"With ccNetViz, this large graph render library using WebGL, I'll add edge animations on it. Including color animations, speed control and other fancy...", Xiaodong Zhao ," Mentor  Resa Helikar, Ales Saska ", Organization  Computational Biology @ University of Nebraska-Lincoln ,/archive/2019/projects/4756504865931264,https://brickmaker.github.io/2019/08/20/Google-Summer-of-Code-2019/
10, Port to Python 3. ,"The​ support for Python 2 will be dropped in the coming years and thus it is important to switch
to Python 3. There is a need to make sugar-toolkit...", Aniket Mathur ," Mentor  Rahul Bothra, James Cameron ", Organization  Sugar Labs ,/archive/2019/projects/4759727836233728,https://github.com/sugarlabs/GSoC/blob/master/archives/2019/student-reports/port-to-python-3-Aniket-Mathur.md
11, Improve the UI testing DSL and the log files for UI actions ,The UI testing in LibreOffice is based on introspection code in c++ interacting with a testing framework in python through a simple UNO interface. To..., Ahmed Elshreif ," Mentor  Xisco Fauli, Markus Mohrhard ", Organization  LibreOffice ,/archive/2019/projects/4762543371845632,https://ahmedelshreif.blogspot.com/2019/08/gsoc-final-report.html
12, OWASP Seraphimdroid ,"OWASP Seraphimdroid has previously applied a system, based on permissions, which is able to distinguish malicious apps from non-malicious. But it...", Junfan Huang , Mentor  Nikola Milosevic , Organization  OWASP Foundation ,/archive/2019/projects/4765892590698496,https://docs.google.com/document/d/1WzNZed2Et8eRn7xLYvWI_Wb-FUqpKK88eBp7XNqt20I/edit?usp=sharing
13, Distributed Sparse Linear Algebra Library in Chapel ,"This project includes adding BLAS, Sparse linear algebra and iterative solvers into Chapel.", Alvis Wong , Mentor  Engin Kayraklioglu , Organization  Chapel ,/archive/2019/projects/4768140871860224,https://docs.google.com/document/d/1YcvBmC-mP2dtKqV26zBlj72cESOuKOpQpa4yop64Ny4/edit?usp=sharing
14, LabelLab ,LabelLab is an image analyzing and classification platform. The web application should allow users to upload batches of images and classify them with..., Tushar Varshney ," Mentor  Sumedhe Dissanayake, Oshan Ivantha ", Organization  SCoRe Lab (Sustainable Computing Research Lab) ,/archive/2019/projects/4772875267997696,https://github.com/scorelab/GSoC/blob/master/GSoC-2019/TusharVarshney-LabelLab.md
15, K-DOP tree ,"Intersection problems are common in many engineering applications, for example, enforcement of non-penetration constraints in contact mechanics,...", Xiao Xiao , Mentor  Andreas Fabri , Organization  CGAL project ,/archive/2019/projects/4776393232089088,https://github.com/CGAL/cgal/issues/4179
16, Extending Alga ,"Alga is a library for algebraic construction and manipulation of graphs in Haskell. Currently there are two main goals, as proposed by Mr. Andrey...", O V Adithya Kumar ," Mentor  Andrey Mokhov, Jasper Van der Jeugt, Alexandre Moine ", Organization  Haskell.Org ,/archive/2019/projects/4778315028627456,https://gist.github.com/adithyaov/296dfc965f74002e8a10a8c35ee77e6e
17, IPP: ipptool test suite updates for IPP errata updates ,"I aim to develop additional IPP tool test scripts for IPP errata including IPP Document Object v1.1, IPP Job Extensions v1.1, and IPP 3D Printing...", Sharad Shukla ," Mentor  Smith Kennedy, Ira McDonald, Danny Brennan ", Organization  The Linux Foundation ,/archive/2019/projects/4783275850072064,https://github.com/Sharadd15/ippsample/wiki/Gsoc-2k19-%7C-OpenPrinting-%7C-The-Linux-Foundation-%7C-Ipptool-test-suite-updates-for-IPP-errata-updates
18, Human Centered Education of CC Licenses ,The process of licensing a creative work can be very confusing. What license is right for me? How do I formally license my work? How do I help people..., Ari Madian ," Mentor  Breno Ferreira, Alden Page ", Organization  Creative Commons ,/archive/2019/projects/4784447168184320,https://opensource.creativecommons.org/blog/entries/cc-chooser-lastweek/
19, Automating Packaging for Macports ,"While creating a Portfile for MacPorts one has to manually write the file or depending on the upstream use tools such as pypi2port, cpan2port, etc....", Karan Sheth ," Mentor  Renee, Cyril Roelandt ", Organization  MacPorts ,/archive/2019/projects/4785498831192064,https://gist.github.com/Korusuke/7b2ccf20533bc904b18ec5554d149730
20, BCF Support in BIM WB - FreeCAD ,"Collaboration is ingrained into human nature, without it we, as a species, wouldn’t be able to build astonishing buildings like we have today....", Patrick Podest ," Mentor  HSRai, Yorik van Havre ", Organization  BRL-CAD ,/archive/2019/projects/4786423121575936,https://github.com/podestplatz/BCF-plugin-FreeCAD
21, Support Source IP Based Query Block/Allow in CoreDNS ,"When CoreDNS serves DNS queries publicly or inside Kubernetes clusters, the source IP of the incoming DNS query is an important identity. For...", An Xiao , Mentor  Yong Tang , Organization  Cloud Native Computing Foundation (CNCF) ,/archive/2019/projects/4786589752885248,https://github.com/ihac/acl
22, Make pack access code thread-safe ,"As direct as possible, the goal with this project is to make more of Git’s codebase thread-safe, so that we can improve parallelism in various...", Matheus Tavares ," Mentor  telezhnaya, Christian Couder ", Organization  Git ,/archive/2019/projects/4787791739748352,https://matheustavares.gitlab.io/posts/gsoc-final-report
23, Mobile Wallet - Android App Version 3.0 ,Mobile Wallet is an Android-based framework for mobile wallets based on top of Fineract. The app follows the clean architecture and contains a core..., Shivansh Tiwari , Mentor  Naman Dwivedi , Organization  The Mifos Initiative ,/archive/2019/projects/4788226420637696,https://gist.github.com/shiv07tiwari/acb5a7266fe685e8332498fd32b00bf0
24, Symbolic PyMC and PyMC4 Integration ,"The pymc project is an open source collaboration that focuses on providing
Bayesian modeling as well as probabilistic machine learning. The current...", Joseph Willard , Mentor  Chris Fonnesbeck , Organization  NumFOCUS ,/archive/2019/projects/4788238147911680,https://josephwillard.github.io/updates-and-the-end-of-gsoc.html
25, Implementing CHAOSS Metrics with Perceval ,"The aim of this project is to create reference implementations and tests, primarily for the metrics defined by the Evolution Working Group, but also...", Aniruddha Karajgi ," Mentor  Jesus Gonzalez-Barahona, valcos, Pranjal Aswani ", Organization  CHAOSS ,/archive/2019/projects/4788572886925312,https://polaris000.github.io/blog/final_report
26, Parallelize GCC with Threads ,"GCC alone is unable to compile a single large file in parallel, causing parallelization bottlenecks in some projects such as GCC itself. Here we...", Giuliano Belinassi , Mentor  Richard Biener , Organization  GNU Compiler Collection ,/archive/2019/projects/4789348396957696,https://gcc.gnu.org/wiki/ParallelGcc
27, 7 Years Later: On vector<bool> and optimized Standard Algorithms in libstdc++ ,"With the coming revival of bit utilities paper for the C++ Standard and the potential of a new
suite of bit utilities coming from a header 
 [5], the...", ThePhD ," Mentor  Thomas Rodgers, Jonathan Wakely, Ville Voutilainen ", Organization  GNU Compiler Collection ,/archive/2019/projects/4789587371622400,https://thephd.github.io/seize-bits-production-gsoc-2019
28, TensorMap ,TensorMap is a web application that will allow users to create machine learning algorithms visually. TensorMap supports reverse engineering of the..., Suleka Helmini ," Mentor  Keshan Sodimana, Girisha De Silva, Raveen Perera, Sumedhe Dissanayake, Oshan Ivantha ", Organization  SCoRe Lab (Sustainable Computing Research Lab) ,/archive/2019/projects/4789681256923136,https://github.com/suleka96/GSoC/blob/master/GSoC-2019/Suleka-Helmini-Tensor-Map.md
29, Mifos Mobile - Android App Version 4.0 ,The Mifos mobile application is all built on top of the Apache Fineract 1.x client-facing APIs to enable self-service channels for clients to..., PRASHANT KHANDELWAL ," Mentor  Rajan Maurya, Anamika Tripathi ", Organization  The Mifos Initiative ,/archive/2019/projects/4792884983758848,https://gist.github.com/prashantkh19/ee02d6955ee17c3e44e6253c175caf97
30, XDPLua ,A version of the Linux Kernel's XDP framework which will support the execution of Lua scripts as well as eBPF programs, Victor Nogueira ," Mentor  Pedro Tammela, lneto ", Organization  LabLua ,/archive/2019/projects/4793801338519552,https://victornogueirario.github.io/xdplua/
31, New Collections for Pharo ,"The project idea is to work on the development of the Containers library and to develop, collect, clean, test and document alternate collections and...", Smiljana Knezev ," Mentor  Yurko Tymchuk, Stéphane Ducasse, Gordana Rakić, Guille Polito ", Organization  Pharo Consortium ,/archive/2019/projects/4794529150926848,https://pharokeepers.github.io/pharo/2019/08/25/Final-Report.html
32, Eclipse SWT Chart - Extending the export options ,"Eclipse SWTChart allows to create different types of charts. The API is well designed and allows to create Line, Bar and Scatter charts easily. In...", Sanatt Abrol , Mentor  Philip Wenig , Organization  The Eclipse Foundation ,/archive/2019/projects/4795697918902272,https://mavrk.github.io/gsoc2019-final/
33, PPO(Proximal Policy Optimization) ,"A new family of policy gradient methods for reinforcement learning, which alternate between sampling data through
interaction with the environment,...", xiaohong ji ," Mentor  Manish Kumar, Marcus Edel ", Organization  mlpack ,/archive/2019/projects/4796177931829248,https://github.com/mlpack/blog/blob/master/doc/tutorials/Xiaohong2019Summary.md
34, Bidirectional Integration — Paper Writing — LaTeX and JabRef 5.0 ,"The core of the proposal is a wide improvement of the LaTeX integration with JabRef, focusing on the end-user, whose characteristics have been...", David Méndez ," Mentor  Linus Dietz, Christoph S, Tobias Diez ", Organization  JabRef ,/archive/2019/projects/4799263547064320,https://gist.github.com/davidemdot/ca69c21081964d5d56cc18bae68251e3
35, Carbon-footprint Alexa ,"Carbon footprint is a project which provides the users with information related to emission of Carbon, Ethane and Nitrous Oxide when they perform...", Maandeep Singh ," Mentor  Sai Sankar Gochhayat, Thuvarakan, Bruno Woltzenlogel Paleo, Varun Chitre ", Organization  AOSSIE - Australian Open Source Software Innovation and Education ,/archive/2019/projects/4799408770646016,https://gitlab.com/aossie/carbonfootprint-alexa/blob/master/docs/GSoC/2019/Maandeep.md
36, TUI (Terminal UI) remote attachment ,Nvim works as both a server and a client. “Nvim client” can connect to any other “Nvim server” and Nvim GUIs can show the screen of a remote “Nvim..., H.L Praveen Raj , Mentor  Björn Linse , Organization  Neovim ,/archive/2019/projects/4799834828046336,https://medium.com/@hlpr98/the-final-report-of-gsoc-2019-9438df33d6a?source=friends_link&sk=e3286a1e49561f29d71322160419cece
37, PCP PMDA Agent for StatsD in C ,"StatsD is simple, text-based UDP protocol for receiving monitoring data of applications in architecture client-server. As of right now, there is no...", Miroslav Foltýn ," Mentor  Nathan Scott, lzap, Marko Myllynen ", Organization  Performance Co-Pilot ,/archive/2019/projects/4802362500186112,https://github.com/Erbenos/pmdastatsd/
38, KDE ISO Image Writer ,"KDE ISO Image Writer, which is part of the KDE neon project, is a tool to write ISO images into USB drives. It was forked from ROSA Image Writer and...", Farid Boudedja ," Mentor  Jonathan Riddell, Harald Sitter ", Organization  KDE Community ,/archive/2019/projects/4803645403561984,https://community.kde.org/GSoC/2019/StatusReports/FaridBoudedja
39, A DIY Robot kit for educators ,"Hello, my name is Christos Chronis postgraduate student of Harokopio University of Athens in Informatics and Telematics department. I have a great...", Christos Chronis ," Mentor  KONSTANTINOS KALOVREKTIS, Theodoros Karounos, Iraklis Varlamis ", Organization  Open Technologies Aliance - GFOSS ,/archive/2019/projects/4803830624026624,https://gist.github.com/chronis10/9d069c56b3df9c92693ac8d24270a62a
40, Improved Installation and Home Automation using Hass ,"I propose to implement Home Assistant and many of its apps and features in Amahi App store and try to integrate well with Amahi.
So, users can...", Sanjit Chakrabarti ," Mentor  Richard Glass, jolaca, megabitdragon, cpg ", Organization  Amahi ,/archive/2019/projects/4805016974524416,https://gist.github.com/sanjitchak/c8b8d4ae8924a038271d2932279e55f1
41, A new framework in support of multiple MPI implementations ,"There are numerous MPI implementations in the Gentoo portage tree and far more in general, but most of them can't be installed together as is. The...", Jian Cao ," Mentor  Andrew Savchenko, Justin Bronder ", Organization  Gentoo Foundation ,/archive/2019/projects/4809791166218240,https://github.com/swordencao/gentoo-mpi
42, A parameterized automata Library for VisualStates tool ,"Improving VisualStates, a great tool for easily creating complex robot behaviour, by adding parameterisation to its automatas and an online automata...", sudo-panda ," Mentor  Pushkal Katara, okanasik ", Organization  JdeRobot - Universidad Rey Juan Carlos ,/archive/2019/projects/4816984095588352,https://theroboticsclub.github.io/colab-gsoc2019-Baidyanath_Kundu/2019-08-22-thefinalreport/
43, Phase Out Xcode Dependency ,"Currently, a full Xcode installation is needed to install MacPorts. In reality this is overkill,  as most of the packages on the MacPort do not need...", Ahmad Satryaji Aulia ," Mentor  Marcus Calhoun-Lopez, Clemens Lang ", Organization  MacPorts ,/archive/2019/projects/4820962661367808,https://docs.google.com/document/d/14gNpDf468xG7kVBDn0f0VjbZ5eb0miULOZhfD1ivNy0/edit?usp=sharing
44, Parallel Coordinate Plots in ggplot2 ,We plan to create a package for parallel coordinate plots using ggplot2 based on the existing methods. We want it to make use of larger flexibility..., Yawei Ge ," Mentor  Dianne Cook, Heike Hofmann ", Organization  R project for statistical computing ,/archive/2019/projects/4823273404104704,https://github.com/yaweige/ggpcp
45, DirectDemod Automatic Picture Transmission (NOAA) – BigImage and Globe Projection ,"There are thousands of wheather satellites orbiting the Earth at each moment of time, constantly transmitting APT signals. The problem of efficient...", Vladyslav Mokrousov ," Mentor  Vinay C K, Andreas Hornig ", Organization  AerospaceResearch.net ,/archive/2019/projects/4823831749853184,https://aerospaceresearch.net/?p=1704
46, Improve article recommendation pipeline ,The article recommendation pipeline consists of many parts. The project aims to improve article recommendation pipeline by solving the various issues..., usmanmuhd ," Mentor  Bahodir Mansurov, bmansurov ", Organization  Wikimedia Foundation ,/archive/2019/projects/4824600213454848,https://usmanmuhd.com/posts/gsoc-final/
47, GNOME Music: Full stack MusicBrainz integration ,"The ultimate goal of the proposal is to provide a seamless integration between Gnome Music and 
MusicBrainz services. This integration will include...", Sumaid , Mentor  Jean Felder , Organization  GNOME ,/archive/2019/projects/4825289220161536,https://gitlab.gnome.org/GNOME/gnome-music/issues/293
48, Library to export/import public datasets to Retroshare network ,"I would to create a reference library capable to interact bidirectionally with RS and outside it, engaging people to create apps, bots, and other...", Joan Pascual Sanahuja ," Mentor  NicoEchániz, G10h4ck ", Organization  freifunk ,/archive/2019/projects/4827205262114816,https://gitlab.com/jpascualsana/gsoc-2019-report
49, Service Mesh Interface Metrics ,"SMI-Metrics aims to have a commen interface to get metrics from servish mesh implementations. Applications, Tools can be built targeting this...", Tarun Reddy , Mentor  Thomas Rampelberg , Organization  Linkerd ,/archive/2019/projects/4829112898682880,https://github.com/Pothulapati/gsoc-meta-linkerd
50, Development of LSTM and GRU layers in TMVA ,"This project is about development of Long Short Term Memory(LSTM) and Gated Recurrent Unit(GRU) layers in TMVA, both of which belong to a general...", Surya S Dwivedi ," Mentor  Lorenzo Moneta, Sitong An, Omar Andres  Zapata Mesa ", Organization  CERN-HSF ,/archive/2019/projects/4829175494475776,https://github.com/root-project/root/pull/3924
